"tweet_id","text","likes","retweets"
"tweet_id","text","likes","retweets"
"205673765181472769","barclays socialcommerce research report available online","0","4"
"208488852652949504","clearing milestone barclays us 1 trillion swaps cleared customers","0","0"
"208498008806010880","no not time fact bit charity gareth employers santander barclays bank helped donate 3k","0","0"
"208498864444026880","barclays australian dollar 120601 australian dollar 120601 utm","0","0"
"208529524806254592","weird subway stop got new name atlantic barclays center bummer pacific street","0","0"
"208593471173443586","barclays 1 year default risk 0 85 0 01 today barc l mco mhp","0","1"
"208630643184242688","proud sensation nyc brooklyn barclays center 10 26 27 12 check construction update","0","5"
"209164680856469504","got shit poppin october open barclays center brooklyn consider attending","0","0"
"209241109443002368","got spare ticket barclays atp world tour tennis 2012tweeps interested row dm details","0","0"
"209302891532525569","barclays","0","0"
"209563068412342273","think walked past us half sevenish sat barclays theatre say sat dawn huddled","0","0"
"209584527750860801","eur usd barclays expects ecb announce ltros held late june announced central bank meeting wednesday li","0","1"
"209605623812329475","tlh ishares barclays stock analysis money stock market","0","0"
"209628537316065280","barclays pestered weekend saying somebodys trying hack account go bank get money no hassle shitbank","0","0"
"209775602205589504","lmaooooo one guy going macdonalds drive barclays bicyle looooooooolllllllll lad","0","0"
"209938815157157890","mp collected ditch outside barclays eldi nethers story todays star hebu tafuta","0","0"
"209950114586951680","fiddling blog post barclays 1980 style stock market rally table","0","0"
"209969362243813376","dominga ratering liked nyse bcs 14 24 barclays capital cuts allscripts healthcare solutions equal weight mdrx","0","0"
"209976362549788672","quiet tina sort barclays","0","0"
"210136152940883970","crainsnewyork lehman loses appeal barclays ruling nyc","0","0"
"210145140763930625","barclays executives stand trial tax fraud italy","0","3"
"210205375750864898","rt barclays apple use wwdc extend ecosystem lead","0","0"
"210274019730132992","barclays absa buy edcon private label store cards gbp0 8 billion barclays plc barc ln said wednesd","0","0"
"210275080863879169","look brand new barclays features store packaged current account scheme worth","0","0"
"210319825719922688","funny martin kelly selected not rio ferdinand kelly played 1 5 matches barclays epl lol win euro","0","0"
"210320043806953472","rt interesting see tl regularly til 1 customers becoms megamillionaire","0","0"
"210329338380427264","someone take barclays bank please free hug jordy hugs","0","0"
"210345662645145601","barclays unit buy south african retail credit business 1 2 billion absa group south african subs","0","0"
"210355128606273538","0 no english manager ever won barclays premier league","11","137"
"210378852143349760","barclays unit buy south african retail credit business 1 2 billion","0","0"
"210387626639888385","barclays entitled 1 8bn related lehman bankruptcy us judge rules gt entitlement","0","0"
"210391493800763392","point maybe not vaz future portugal especially next year plays barclays","0","0"
"210453770805575680","iron springs jc flyer ipa tap barclays 3 4","0","0"
"210466324353253376","barclays spaces sport oh hello","0","0"
"210675896946917378","next season barclays premier league fixture list released monday 18th june","0","17"
"210681823494279168","barclays sees credit rating upgrade ph within 2012 via","0","5"
"210721694581657602","set stay touch folk leadership programme starts next week","1","0"
"210733393166598146","barclays premier league giants travel fir park 21st july fitting opponents stevie hammell testimonial match","3","33"
"210748403905347584","rt 8 atm barclays queensway one working useless lt lt c","0","0"
"210805123453165569","agz ishares barclays stock analysis best penny stocks buy","0","0"
"210823779742519296","barclays premier league trophy","0","1"
"210829714665902082","redundancies possibly coming barclays cash equities structured credit via","0","1"
"210990620767035392","yesterday top traded shares customers lloyds banking group lloy barclays barc rbs rbs tesco tsco aviva av","0","0"
"211032542835515392","barclays shares worth less 1952 chief exec bob diamond trousers luvly jub lee 27m","0","5"
"211074896921493504","top losers pre market today jun 8 barclays","0","0"
"211075672855162880","barclays downgrades netapp rising competition reuters share friends technology top stories n","0","0"
"211095046345330688","im overqaulified work barclays bank cool safe","0","0"
"211108581343379457","barclays downgrades netapp rising competition","0","0"
"211165118594154499","12 barclays premier league games won tackles 52 vincent kompany 51 31 games outstanding","27","571"
"211247190545408000","not tree growing bk anymore tourism barclays tallbuildings culture","0","0"
"211331395371548672","auto cli barclays","0","0"
"211341751099719681","barclays bank open today","0","0"
"211395530474004480","anatha note lucky catch glimpse urs truly today 1pm barclays sports club","0","0"
"211517878304911362","premiership sportsmail reporter steve bruce targeted return barclays premier league b ff fw","0","0"
"211725191754170369","osborne british taxpayers not stand behind ez banks uk banks r ez banks barclays etc took ecb ltro","4","12"
"211847013745176579","lool barclays advert dad looks far happy giving 200 daughter lost money","0","0"
"212103424127410177","premier league transfers summer 2012 transfers every barclays premier league side","0","0"
"212129571410149377","implemented sap portal barclays bank plc","0","0"
"212131274326937600","ordered new bank card 16 50 friday arrived morning barclays fast","0","0"
"212247594963959809","blud man see working barclays nahhhhhhh fam man not know endz booky lloyds4lyfe imonone","0","0"
"212273385701515264","barclays capital cuts netapp equalweight ntap daily political","0","0"
"212424921744289792","yeah early trains fail left barclays yet","0","0"
"212535630373208064","barclays premier league fixtures 2012 13 season announced next monday 18 june","0","4"
"212576264781955072","streetinsider barclays u software adjusting estimates slight downside adjustments uncertainty economics","0","0"
"212594510016950272","barclays manager raised complaint picked wrong guy mess ive cut teeth argueing npower bg","0","0"
"212612401152000000","fixtures 2012 13 barclays premier league season monday 9am coyw","0","2"
"212701716431372288","barclays new diy current accounts shake banking offers one bank account pi","0","0"
"212725066578935810","rt breaking bob diamond barclays ceo says expect greece stay euro watch live","1","24"
"212726145702039552","house bieber built place dwill wants no part barclays lmao j k","1","1"
"212739263828201473","barclays ceo greece stay euro via","0","0"
"212788965466583041","powell premier ambition nick powell not wait get first taste barclays premier league action","0","1"
"212794003702288384","football barclays premier league man united confirm powell signing","0","0"
"212852916900466690","yeah use barclays ltd business etc","0","0"
"212937952232353792","20 latest commodity prices fall worst recent memory barclays mineweb mineweblatest commodity prices f 20","0","0"
"213016691884560385","september 28 jay z concert barclays center website daily get tickets","0","0"
"213028196864634881","barclays bench seshh","0","0"
"213034815459557377","barclays healthcare investment banking banking","0","0"
"213037541752979457","jay z named director brooklyn barclays arena","0","0"
"213038628115451904","jay z named director brooklyn barclays arena hip hop hip hop news jay z","0","0"
"213091056894476288","wellian wiranto barclays greek elections close call high risk appetitie valuations attractive","0","0"
"213205204886237185","barclays appoints vivek gupta country head trade finance barclays appoints vivek gupta country head trade finance","0","0"
"213259923784609792","barclays bikes ones","0","0"
"213273739821977600","barclays predicting 2016 enablers place contactless habits seen infra place nfcpayeu barclay smart","0","0"
"213277263016374273","ifwt nba jay z named director brooklyn barclays arena","1","16"
"213291582378606593","jay z another high powered job add resume appointed director barclays center new york","0","0"
"213292413626761217","rt jay z 40 40 club open new location brooklyn barclays center","0","4"
"213292743659753473","trend clubs opening arenas stadiums continues jay z bringing 40 40 club barclays center brooklyn","0","36"
"213297404064186372","rt pic jay z 40 40 club inside barclays center look like","0","0"
"213341914030817280","rt get even jay z 40 40 club barclays center","0","0"
"213345953158148097","linwood barclays newest novel nicola bookshop bridgend indoor market come sells bookworms","0","0"
"213384003854667777","barclays cord cutting isn worth modest savings","0","0"
"213535335127326723","rbs lloyds barclays amongst biggest gainers europe credit moves boe government","0","7"
"213548777351548928","fixtures 2012 13 barclays premier league season published 0900 bst monday 18th june bpl","26","378"
"213552908506107904","fixtures 2012 13 barclays premier league season published 0900 bst monday 18th june","0","0"
"213645426430189568","jay z bringing 40 40 barclays center","0","0"
"213655685701959681","shy ishares barclays stock analysis day trading mentorship","0","0"
"213714699567644672","jay z open 40 40 club brooklyn barclays center jay z open restaurant chain brooklyn n","0","0"
"213757950043492353","sweden england create 3 2 blockbuster fat beard sports euro2012 jasonlacanfora barclays","0","1"
"213890902287073280","overdraft charges rising lloydstsb sure barclays already charge 6 pleasure hopefully end month green","0","0"
"213936540504698882","premiership new fixture list 2012 13 barclays premier league season released online ff fw","0","0"
"214037858116321280","jay z named director barclays center","0","0"
"214285590479388673","gbf ishares barclays stock analysis trading trends","0","0"
"214374656227028992","know jay z 40 40 club open barclays center upscale bar debut september 28","0","2"
"214627965676437505","good morning spurs lodge next season barclays premier league fixtures coming soon","2","21"
"214674905759887360","moves barclays goldman sachs man group","0","0"
"214753221812568064","barclays bank town xx","0","0"
"214793896855736322","wigan first chelsea chelsea start 2012 13 barclays premier league season trip wigan august 18","0","5"
"214831906968178690","liked video fifa12 barclays premier league 2011 12","0","0"
"214833609884962817","magpies opener spurs tottenham travel newcastle opening day 2012 13 barclays premier leagu","0","8"
"214849341091872768","early reds reunion clarke steve clarke west brom begin 2012 13 barclays premier league campaign","0","11"
"214967584322359296","sigurdsson deadline june 30 secure move barclays premier league","0","0"
"215031614575624193","barclays club house accra","0","0"
"215144000926130176","barclays field taking shape fedexcup playoffs near farmingdale ny two golf fou pga golf sc","0","0"
"215155812090380289","premiership barclays premier league released fixture list forthcoming 2012 13 seas ff fw","0","0"
"215233129886134272","rt yep yep jay z bringing 350 seat 40 40 club barclays center come september","0","0"
"215333122106077184","buying home save 200000 pounds barclays e1 news e1 newsbuying home save 200000 pounds","0","0"
"215346489336152064","rt weekend gon na epic although gutted gon na miss thorpe park barclays crew","0","0"
"215462390546964480","barclays hires goldman gattass six latin america barclays plc hired bernardo gattass head la","0","0"
"215479616549289984","barclays bike rave sgangsta","0","0"
"215482405782429699","ok jimmy carr massive hypocrite lampooning barclays tax avoidance loopholes systematically closing soon","0","0"
"215563691364585472","good day brook lopez back weightroom tour barclays center reppin nets yoga times square","0","0"
"215698362110971904","never announce speaker names no idea barclays bt speak today rolling around 0930hrs","0","0"
"215721485279571968","lfc ynwa tough start bring liverpool start 2012 13 barclays premier league season no","0","0"
"215746424640503809","barclays worst bank ever","0","0"
"215772462846197760","another barclays related tweet sitting hour achieved nothing god sake","0","0"
"215772974572253185","ridiculous constantly moaning barclays even frustrating build systems","0","0"
"215777802199367680","barclays lounge last friday wz like","0","0"
"215812925305274368","rt da12ecom barclays chaps says 900k pingit downloads date 1 5m per week p2p transfers","1","2"
"215813881602383872","hi nat based market near barclays","0","0"
"215821938860367872","haha yeah think stuck barclays x","0","0"
"215856764174868480","hope not scheme already costs us money runs loss even barclays money","0","0"
"215861604401692672","thornton holmes fight urge run cover barclays tells investors","0","0"
"215917969329487872","okay morgan stanley gets 3 notch downgrade barclays gets two notch downgrade among 9 banks","0","17"
"215923141799706624","breaking moody neg outlook jp morgan bank america citi morgan stanley goldman sachs rbs barclays hsbc credit agricole","0","61"
"216019554881634304","royal bank scotland barclays hsbc bank america goldman sachs jp morgan downgraded moody","0","1"
"216044346020073472","barclays hires goldman gattass six latin america banking finance","0","0"
"216046820667830272","town hall sydenham road barclays alarm nope going right no longer funny post ma","0","0"
"216109638775607296","credit ratings agency moody downgrades 15 global banks financial institutions including barclays hsbc goldman sachs","0","0"
"216141024748253184","barclays names chief operating officer barclays said friday named investment banking co head","0","0"
"216146070504357888","barclays rejigs investment bank ricci sole boss barclays appointed jerry del missier one two heads","0","0"
"216542410250010625","fastrack begins monday night 1 2 3 b 34th st penn station atlantic ave barclays center info","0","2"
"216561382081036288","shinarambobars make bars wit clay barclays","0","0"
"216601615321415681","barclays advertising new app fast cash transfers called pingit natwest introducing called slingit","1","14"
"216666281640861696","anyone messed around banks natwest barclays midlands lloyds manic street preachers","0","0"
"216944301081509889","wana go barclays bike ridin around london nice hot day","0","3"
"217029713892347905","west ham united barclays premier league 2012 13 face sunderland home 9 22 west ham u 3 miles stratford","0","0"
"217079101813559297","barclays premier league news facebook","0","0"
"217201588069081089","rdwr initiated overweight barclays","0","0"
"217220097520041984","barclays appoints coo responsibilities","0","0"
"217225947403911168","barclays bank generated data proves art market highly psychological social","8","16"
"217385231467020288","barclays commodity investors retreat turning stampede","0","0"
"217402826563911680","yes work barclays wtf","0","0"
"217572981117943808","bbc news still promoting corporate politicians daily digest lies deceit devious manipulation rbs lloyds barclays bribegate","0","0"
"217593123671523328","think barclays contributing alot instructed absa reshuffle operations n strategies rt","0","1"
"217628224258179072","corporate politicians 20 years failure britain skimmed system rbs lloyds barclays bribegate","0","0"
"217639368544882688","checked barclays coffee 8976 tampa ave yelp","0","0"
"217643390869839872","stuart crawford sent 11 naked cuddle payment funds paid barclays pingit account","1","0"
"217669861134958593","came home afternoon discover barclays sent toolbox house warming gift okthen randomorwhat","0","0"
"217694838206898177","silver etp holdings pace strongest month since sept barclays silver exchange traded economy etf asia","0","0"
"217711506396168193","barclays website create pics upload ur choice pic kid","0","0"
"217742980436598784","barclays credit card","0","0"
"217865256981102594","criously no lights office whl barclays plaza building nw wot doz 4 mins hoping wot gt in2 troubl","0","0"
"217929538871640064","barclays settle libor probe banks","0","0"
"217940565722009600","barclays poised settle uk u libor probes ft london reuters barclays poised announce deal w","0","0"
"217958257266929664","barclays reaches deal libor probe barclays struck deal us uk regulators settle probe","0","0"
"217960550833995776","barclays bank pay 360 million u authorities settle lending rate manipulation charges","16","106"
"217960564134117379","barclays fined 59 5m fsa attempting manipulate libor euribor rates","0","1"
"217962238697418754","barclays chief executive bob diamond forgo bonus year bank fined 290m","4","60"
"217962358251864064","details barclays traders emails extraordinary conspiracy deceive move markets boost profit","6","36"
"217962886574772224","barclays 200 million u libor settlement source","7","37"
"217963647207620608","dealbook barclays said pay big penalty regulatory deal","5","17"
"217964125131780096","record 60m fsa fine barclays financial services authority fsa fines barclays bank 59 5m miscond","0","0"
"217964141871247360","barclays fsa fine biggest city regulator ever given","0","0"
"217966369059254273","headlines record 60m fsa fine barclays financial services authority fsa fines barclays follow warren","0","0"
"217967077057757184","barclays pay 454 million settlement regulators alleged manipulation interbank rates","0","8"
"217967262454398976","authorities going start arresting fraudsters barclays banks bankers","0","0"
"217968122265747456","barclays bosses give bonus 452 million fine london reuters barclays said chief executive three executive","0","0"
"217969418339233795","dealbook barclays pay 450 million regulatory deal","0","0"
"217969637227368450","correction barclays pay 454 million settlement regulators alleged manipulation interbank rates","6","75"
"217971024761851904","visit mesopotamia see cultivation bbkmegamilli","0","0"
"217971205087571970","barclays pay 454 million settlement regulators alleged manipulation interbank rates tis","0","0"
"217971553210609665","bbc news barclays fined fsa manipulating key bank rates lt lt bankers always return form","0","0"
"217972484379648000","rt not believe barclays bank lied interest rates regards borrowing ludicrous","0","0"
"217973138665910272","barclays manipulated bank rates barclays bank pays 290m penalties boss bob diamond gives bonus af","0","0"
"217974392779575296","company news barclays manipulated bank rates","0","0"
"217974912852295681","breaking barclays traders fixing inter bank lend rates worth billions upper management say not know stealing money","0","0"
"217975223230803970","barclays manipulated bank rates barclays bank pays 290m penalties boss bob diamond gives bonus","0","0"
"217976927011602432","cftc order says barclays senior mgment directed submitters lower submissions doj agreed not prosecute","0","3"
"217977541967876096","email haunt barclays trader another bank asked barclays rig interest rate reply done big boy","12","176"
"217978955431550978","wait till wakes barclays libor rigging news aloha hawaii","0","1"
"217980264805171203","barclays chief bob diamond gives 2012 bonus 290m fine","0","0"
"217980872975069186","barclays caught predicted months ago city london center world criminality libor","0","1"
"217981124280975360","rare stroke irony latest libor rate tweeted bba 0 90 not worry rang barclays traders get earlier","3","7"
"217981170267332609","little thought barclays abuse leave efficient market hypothesis","3","17"
"217983332770779138","barclays said close libor settlement fsa cftc","0","1"
"217984064823635968","money finance bob diamond gives bonus barclays fined 290m attempting rig money markets","0","0"
"217984885367910400","barclays bike oxford street livingontheedge","0","1"
"217988510806851586","ho ho ho barclays","0","0"
"217988993139216384","way say barclays gt barclays bar clays barclays bark clays barclays bar cliz barclays bar kliz","1","0"
"217989152539541504","barclays hit huge fine lending rate manipulation bob diamond gives year bonus hurt","0","2"
"217989525824208897","barclays libor settlement u uk regulators","0","0"
"217990083670847488","barclays fined 59 5m fsa full report uk financial services authority imposed largest ever pe","0","0"
"217990813584605184","barclays attempted manipulate interest rates","23","109"
"217991350342270977","news update bob diamond barclays done","0","0"
"217993309090619392","hyperlocal leeds barclays fined manipulation barclays bank pays 290m penalties wigan stockport 3","0","0"
"217997943804919810","barclays fined 453 2 million false libor submissions bloomberg","0","0"
"218002482004099072","bbc news barclays fined attempts manipulate key bank rates","0","0"
"218003916489633792","makes wonder barclays took money saudis not bailout fund worried close look books","0","0"
"218004101026430977","news update barclays pay 290m penalties bob diamond forgoes bonus","0","0"
"218004243615981569","everyone hustle look barclays smh","0","0"
"218006508565303297","john mann labour mp tells sky news barclays boss bob diamond forced hand back pay","0","0"
"218010116480450560","labour mp john mann skynews furious barclays bank collusion says nothing bank england fraud central banks","0","1"
"218011017425338368","experimented pingit impressed find slick usable app instant cash transfers colleague easy setup","0","0"
"218011428467113984","barclays falsified stuff hard believe bank high morals didn refuse boycott apartheid thing","0","0"
"218014544147136514","uk rioters imprisoned stealing bottles water barclays bosses slapped wrist manipulation trillion pound markets pm","99","1532"
"218015907987984385","bob diamond boss barcap period fined not not resigned barclays diamond","0","0"
"218018030314192896","yo sickest wheelies barclays bike seen thus far bmxbandit way back","0","0"
"218018277790728192","good see genuine choice banking sector incompetent rbs corrupt barclays","0","0"
"218018294551150593","barclays not careful consider moving overdraft elsewhere parasites","0","0"
"218018302134456320","labour calls possible criminal investigation barclays fine trying manipulate interest rates","17","141"
"218018449744601088","news video 3xsq barclays paying 452 mln fine libor","0","0"
"218020391715737602","barclays diamond bank involved fraud charged resign staff involved","0","0"
"218024484819582977","rt uk rioters imprisoned stealing water barclays bosses slapped wrist manipulation trillion pound markets","6","104"
"218027564499877890","rt no one risks jail barclays mega million fraud jail common scum like us neo feudalism","0","1"
"218029501735641091","rapid city journal barclays pay 450m plus settle libor charges","0","0"
"218030630003417089","phew bonus rest us fired barclays chief gives bonus 290m fine via","0","0"
"218032693294809089","lawyers using words like limitless describe potential legal liability barclays banks face libor fraud suits","0","5"
"218032706188095488","astonishing barclays emails revealed","2","3"
"218033643296264192","barclays done everything short destroying forest moon endor","42","280"
"218036529115828224","lib dem lord oakeshott calls bob diamond quit barclays fined nearly 300 mill interest rate rigging","0","22"
"218036745286070272","protecting corrupt tax evading elite hammering poorest barclays","0","0"
"218038154572218368","local news barclays integrity market","0","0"
"218038934226223106","derivatives traders stupid barclays ones put libor manipulation writing especially dumb lot","0","1"
"218040502677811200","asking money fsa gets barclays fine used cut fees banks pay fsa","0","56"
"218042328185704449","since barclays derivatives traders provably criminals go prison c4news","0","7"
"218042747322515457","considering yesterday barely restrain tweeting barclays suck balls today thrilled 2 hear 290m fine","0","0"
"218043222595866625","barclays chief executive gives bonus not quite agreed paid natwest account","1","42"
"218045304904228864","barclays","3","32"
"218046687946616832","massive fraud corruption barclays bank no arrests no convictions customers shareholders swindled","0","0"
"218048741398159360","barclays fined manipulating interest rates diamond says not take bonus supposed grateful","0","5"
"218049005253439489","cameron take morality barclays manipulation morgage rates also know buck stop","0","0"
"218049955598835713","barclays fined 450m trying manipulate key bank interest rate influences cost loans mortgages","0","1"
"218050678759763968","national news barclays scandal engulfs industry via","0","0"
"218050792010153984","video record fine barclays bank","0","0"
"218051075524149248","not criminal investigation bob diamond barclays law allinittogether","0","13"
"218053718371868672","libor rate critical element financial system barclays manipulated figures contributed setting no one prosecuted","8","174"
"218053841940250624","new definition libor ludicrous information barclays organized reported","0","11"
"218055565149093888","lost barclays lowers libor win plse help","0","0"
