"tweet_id","text","likes","retweets""218056810848985088","number crunching cost nhs fecked pfi deals 190mill fine barclays bank fecking deals 290mill","0","0"
"218059910448029697","not osborne treasury withdrawn barclays banking licence massive repeated systemic fraud tories","0","0"
"218060480864985088","ibnd spdr barclays stock analysis","0","0"
"218063697883574274","worse jesus fucking christ barclays received fsa standard 30 percent discount settling early ttp","0","3"
"218065564344655872","bankers capital w nuff said barclays","0","0"
"218070592769884162","look barclays coughed nearly half billion dollars lie bor","1","10"
"218070752426065920","firms complaining interest rate swaps say cases helped barclays judgement interesting fsa set rule friday","0","3"
"218073666611724288","reported barclays plc tower hamlets division metropolitan police","4","54"
"218073983973728256","independent frontpage barclays shamed 290m fine market fixing skypapers","2","10"
"218080017920442368","financial control balance sheet control avp barclays capital new york ny","0","0"
"218083337208729600","daily telegraph frontpage interest rate rigged barclays skypapers","0","13"
"218084145140731905","barclays fined 450 million lending rates barclays subsidiaries pay 453 million news","0","0"
"218087362159325184","vxz barclays bank stock analysis day trading strategies beginners","0","0"
"218088272298119169","heartbroken barclays exec giving 2 7 million bonus not like 250 years salary","0","0"
"218089568346439680","bob diamond hang barclays libor scandal via","0","0"
"218091060914683904","thursday guardian front page barclays fined 290m bid manipulate rates exposed tomorrowspaperstoday","0","4"
"218091830179397634","guardian frontpage barclays fined 290m bid manipulate rates exposed skypapers","0","13"
"218093443887529984","wimbledon wimbledon 2012 barclays criticised token gesture","0","0"
"218095603958292480","bet rbs thought thank f k saw news barclays","0","0"
"218096060185329665","ok newsnight barclays story basically boils bail still screw us","1","36"
"218096153399525377","disgusted barclays banks try local credit union libor","0","0"
"218097364555153408","barclays lying cheating fraud crime spineless fsa protects fraudsters refuses prosecute ukuncut payup occupy ows","1","52"
"218098331249938432","barclays newsnight call public enquiry levenson fraud manipulation wrongdoing british bankers role bba","8","87"
"218098338648698881","watching newsnight bbc1 bad bad bad barclays manipulating libor rates","0","0"
"218098879713918976","rt inadequate barclays response libor scandal reinforces impression bank run 4 benefit bankers","0","2"
"218099169099923456","commodity futures trading commission report us via barclays","0","0"
"218099386524237825","rt barclays fined 295m trying manipulate rates emails ims provide evidence ediscovery","0","1"
"218099508838547457","people planning move natwest barclays changing minds tonight","0","0"
"218099987026935809","rt thx not understand libor done u big boy fraudulent mayb ur email ettiquette criminal","0","0"
"218103743978287104","breaking former barclays boss john varley criminality took place line become bank england boss","0","4"
"218104137999589376","barclays perpetrates gigantic fraud rates drive global market yet nobody gone jail missing something","0","32"
"218104327997358080","fixing inter bank loan rates affects millions home owners britain around world barclays defrauded billions millions","0","3"
"218104994329673730","restore ethos quaker bankering really difficult act integrity barclays","0","7"
"218105309581950977","barclays scandal happened labour government labour regulator using labour rules newsnight","0","1"
"218105925981044737","dear bob diamond barclays please hand resignation immediately fraudulent swine britain","0","7"
"218106010047488000","barclays fined manipulation barclays bank pays 290m penalties boss bob diamond gives bonus tried man","0","0"
"218107025052270592","dealbook barclays pay 450 million regulatory deal british bank struck deal resolve accusa","0","0"
"218108476294049792","rbs rumoured involved libor barclays scandal wonder ever banking cock not involve rbs","0","0"
"218109061617565696","barclays rigged interest rates boris johnson quick blame bob crow tomorrow sic","0","3"
"218111106101673985","interest rate rigged barclays","0","0"
"218114128399695872","bet barclays boss sorry not manage irish bank get bonus pension increments bailouts included vinb","0","3"
"218114201514815489","sportsnews video record fine barclays bank barclays fined nearly 290m british sportsnews","0","0"
"218114537029779456","police not called investigate barclays libor fixing millions obtained fraud publics mortgages","0","0"
"218121579278778368","cbclolx favorite source news good coverage libor probe barclays settlement","0","0"
"218122243115458560","rt uk rioters imprisoned 4 stealing bottles water barclays slapped wrist 4manipulation trillion pound markets liebor","0","3"
"218123718386393088","wrong say barclays manipulation libor implications govt policy dealing recession newsnight","0","0"
"218125714757660672","barclays execs get no criminal charges manipulating global interest rates go jail smoking pot","1","6"
"218203340918620160","barclays one britain biggest banks fined systematically distorting financial data used set interest rates","1","5"
"218212465664729088","lieborbarclays","0","0"
"218215819832852481","fsa report reveals happens 290m fine barclays used reduce fees paid fsa banks r4today","0","13"
"218216404502056960","shouldn bob diamond giving back bonuses years barclays manipulated market not year","4","23"
"218218518041202688","barclays bank fined lying capitalism crisis rich continue get richer poor poorer signofthetimes","0","0"
"218220853979131905","no dude big boy robbed barclays go jail barclays robs robbers get slightly less enormous bonus","8","65"
"218221674833788928","barclays 290 million total fine 10 days profit based first quarter results","14","290"
"218221712012083200","bobs no diamond market rigging barclays another reminder one needed us shameless highly immoral","2","5"
"218223535330574336","barclays thing properly naughty","0","5"
"218226868430700544","banks bad management allowed fail barclays chief exec bob diamond parliament 11 january 2011","6","111"
"218228961874948096","high expectation barclays bob diamond given level reward says former rbs chair sir george mathewson","0","13"
"218229253244850176","give man gun rob bank give man bank rob world right bob barclays teamindie","6","71"
"218230455017803776","barclays top man not taking bonus fine passed fraud massive scale sounds fair badbankers","0","0"
"218232090813140992","imagine getting 290m fine post fill undies unlucky barclays haha","0","0"
"218233472756617216","recapping worst libor emails done big boy emails nailed barclays","1","7"
"218233978942009344","barclays latest scandal shows banks interested making money customers lying consequences","0","1"
"218236188643962880","calls barclays boss resign senior uk politicians calling barclays chief executive bob diamond","0","0"
"218236596540026880","barclays fined attempts manipulate libor rates iceland right idea jail bankers","2","13"
"218237455319564289","calls barclays boss resign senior uk politicians call barclays chief executive bob diamond resign","0","0"
"218239321772261376","barclays screwing years knew reason poor","0","0"
"218241485701787648","barclays scandal natwest crisis make banker bashing olympic sport among politicians","0","1"
"218242033666621440","breaking jimmy carr borrows bob diamond bonus pay tax offshore company insuring barclays fines rigging interest rates","0","6"
"218242595502043137","move money barclays","1","21"
"218242697754980352","barclays scandal breathtaking root people responsible rot stop","0","3"
"218243105055449088","douchebaggery banks continues time barclays banking finance willtheyneverlearn","0","0"
"218243352494211073","barclays given slap wrist massive fraud still long keep jailing pesky benefit scroungers sleep easy eh","0","0"
"218243373474119681","bob diamond staff collectively act culture values shred integrity resign barclays","1","0"
"218245545016303616","today mostly taking piss oldskool buddies barclays already got bollinger ice","0","1"
"218245785215713280","mr diamond shred shame resign barclays board inch backbone get rid","0","0"
"218248092074512385","sky news call barclays boss go 290m fine surely fraud","0","1"
"218248650877435904","yes 60 million barclays fine paid fsa rest goes us authorities","0","10"
"218248964485558272","somewhere edinburgh hear rbs pr team phew seem saying barclays libor liebor","0","0"
"218250315244388352","may simple country parson deals widow mites rather billions hasn barclays management board resigned","3","80"
"218251141316739072","concern get sued sight barclays","0","0"
"218251946644078592","barclays strong core brand values embedded organisation top still fined 300 mil","0","0"
"218252457711644673","love top guys barclays created beano bob diamond rich ricci not wait monty moneybags take","8","180"
"218253974908837890","barclays signed anti prosecution deal regulators protect directors not make stuff tried","6","161"
"218254081549017088","another c k banking industry barclays thinking","0","0"
"218254421266661376","barclays boss issues grovelling apology public gives bonus still receives 1m","0","0"
"218254861857329153","criminal bank regulators sign anti prosecution deal criminal bankers barclays think revelation corruption","0","1"
"218257504113672192","tfl negotiate contact barclays barclays","0","1"
"218257689678061568","good job barclays not benefit claimant charity student teacher nhs 25 pasty really trouble","0","1"
"218258795950903297","barclays read report feel caught contagion barclays new cancer","0","0"
"218258825298460672","bankers deal avoid criminal charges barclays banking conspiracy disgusting","1","2"
"218259655783223298","time remind everyone undeclared losses rbs 18bill hsbc 10b barclays 6 7b schart 3 6bn lloyds 3 6b","1","4"
"218259982934745088","barclays accused dishonesty former chief executive barclays martin taylor tells bbc bank w","0","0"
"218260852971806720","barclays fined 291million lying cheating manipulating prices bob diamond reaction give smaller two bonuses","7","161"
"218261291532423168","allowed spivs ruin barclays bank culture built quakers","0","1"
"218262172365631488","rome burnt barclays boss fiddled","0","0"
"218262177587531776","typed barclays phone changed narcosis hmmm","0","1"
"218262507909939200","pressure builds barclays boss bob diamond noticias","0","0"
"218263065735606272","done big boy extract exchange barclays rate setter trader bellend","0","0"
"218265417297313792","uk chancellor george osborne make statement barclays house commons afternoon details soon","5","60"
"218266990740115457","chancellor george osborne make commons statement fsa investigation barclays around midday","2","42"
"218267691205672960","read barclays actions may affected rates tens millions mortgage customers 290m fine seems paltry let","1","27"
"218267876602290176","barclays accused dishonesty","0","0"
"218268163408797696","barclays nat west philosophy give us money steal","0","2"
"218269344633851904","bbc news systematic dishonesty barclays says former boss confirmation suspected dishonest banks","0","1"
"218269571117883392","bbc news systematic dishonesty barclays says former boss","0","0"
"218270320036028416","don tell anybody emails reveal suspicious behaviour barclays staff called fraud","0","8"
"218270955234017280","systematic dishonesty barclays says former boss systematic dishonesty lying cheating robbing","0","0"
"218271953474158593","barclays banker greed via","0","2"
"218272079181643776","ed mili ratchets pressure calling criminal prosecutions barclays interest rate fixing scandal quite right","0","29"
"218272585576755201","pursuit dude big boy 20 banks investigated scandal beseiging barclays snowblog","10","91"
"218273144660701184","barclays fined 290m serious misconduct nothing slap wrist","0","0"
"218274477937668097","turns ed balls partly responsible nobody barclays going prison huge scam","0","2"
"218274843337043968","miliband calls criminal probe barclays","0","0"
"218275006919081984","matthew hancock says bob diamond serious questions answer barclays libor rate manipulation","0","2"
"218275618972905473","barclays lies went 2005 2009 four execs give 2012 bonuses bonuses paid 2005 2009 cheated trading results","5","53"
"218275700988325888","give man gun rob bank give man barclays bank rob world","144","1730"
"218275737545867264","barclays fine libor scandal start banks implicated face even bigger fines","1","31"
"218276525265522690","petition judicial inqury bankers wrongdoing no 10 site barclays libor","0","4"
"218277578052599809","comes barclays fined 290m 450m trying manipulate interest rates mr taylor said","0","0"
"218278085311733761","barclays though tories believed responsibility wrong lies wrong no longer","0","1"
"218278849237094400","pressure builds barclays boss bob diamond","3","7"
"218279365677551618","uk opp leader ed miliband barclays criminal prosecutions follow broke law details soon","6","87"
"218279458581393408","uk pm david cameron barclays whole management team got serious questions answer details soon","11","103"
"218279810160541696","uk opp leader ed miliband barclays criminal prosecutions follow broke law well done ed showing backbone","0","6"
"218280358683230209","david cameron barclays whole management team got serious questions answer adding like cut bitches","0","5"
"218280436487569408","barclays getting creamed today","2","8"
"218280546491564032","appears natwest not operate zx spectrum barclays run criminals left bank","1","18"
"218281201927077888","sign petition full independent judicial enquiry banking ethics practices barclays libor","2","11"
"218282736681619458","david cameron saying barclays questions answer interest rate manipulation business barclays shares 8 business","0","5"
"218282790012207105","thousands people jail result debt lying barclays scammers walk free bob diamond scum","1","10"
"218283785643491328","feels like tolerance city bankers rupture greed barclays executives mean reached tipping point","7","130"
"218284096466583552","barclays share 8 percent pm says management questions answer asks accountable","0","9"
"218284444119875585","barclays paying 453 million settle libor probe washington london reuters u k bank barclays pay 4","0","0"
"218285605937885184","time jump barclays bikes","0","0"
"218286934626279425","fact split banks investment retail stop liebor scam fact barclays lobbied fact won","22","310"
"218287162012082176","surely standard poor no option downgrade bob diamond result barclays scandal bob glass bob cubic zirconia","0","0"
"218287484981878784","barclays created diversion time machiavellian policy making","0","0"
"218288328045367297","barclays little bit naughty not arsed write maybe dabble little later","0","0"
"218289311949398017","vivid whistleblower account barclays management culture macho poker fear mock executions","27","120"
"218289347244470273","companies barclays no longer allowed promote interests careful wish communism","0","0"
"218289427246628864","barclays runs givingforce wonder takingforce","0","2"
"218290647503876097","chancellor address parliament 1215 barclays say prosecute labour laws prevent prosecution leave cps","0","8"
"218290957878169602","weird people shocked banks setting rates deal barclays not alone linterbankor needs banks deal","0","0"
"218291343980642304","no bbc not strong comments coming no10 barclays wiggle wiggle wiggle shhhhh not us look butterfly","0","5"
"218291851239751680","osborne make statement barclays manipulation libor businessweek","0","0"
"218292185764855808","time proper public inquiry banking crisis barclays","1","27"
"218292522328391680","took money barclays 1982 protest apartheid teenager never went back","0","0"
"218294663277330433","strip barclays bike sponsorship deal give brand exposure various london charities","1","12"
"218295283145125889","barclays share price 9 percent bank shares sliding","0","11"
"218295921925038080","inside barclays tax avoidance factory lt lt electric chair dinner cow eating club thrown","1","5"
"218297322373775360","barclays world largest arms investor holding 7 3 billion shares arms manufacturers","6","64"
"218297723261173760","mt entirely appropriate barclays sponsors london cycle hire seeing appear taking us ride","0","0"
"218297828131356672","barclays wondering cameron osborne bank looking money","0","0"
"218298779328200704","according war want barclays dealings known producers cluster munitions depleted uranium","0","13"
"218298830582587393","barclays bank anagram rascals bank barclays","0","0"
"218299078725996545","2011 world development movement report barclays make 340 million year speculation commodities including food","0","2"
"218299522621767680","natwest going taking barclays jokes","0","0"
"218299631669477377","new barclays center subway stop inspires protest shirt read nyc tshirt","0","0"
"218302513189883904","george osborne use new special advisor expected call bob diamond resignation barclays statement follow","0","1"
"218302551811039233","not economist think markets trying tell barclays boardroom something 10 41","0","1"
"218305382081232897","barclays getting creamed today","0","0"
"218305828095139840","watch bbc parliament barclays libor","0","1"
"218305872818995201","pressure mounts barclays chief david cameron said serious questions whole barclays","0","0"
"218306317385875457","cameron says barclays debacle labour fault conveniently forgetting tories said banking sector regulated time","0","0"
"218307470840442880","rt next rumor efsf bailing barclays","0","0"
"218308070604931073","barclays libor scandal affect","0","0"
"218308557169369088","barc nearing 12 barclays","0","0"
"218308993351823360","moon barclays collapse 900 overdraft slips net something happen rescueme","0","0"
"218309400220274691","customers seems like barclays r going fall guys","1","0"
"218309747932270592","natwest rbs barclays ulster bank not thought big banks reputations sink lower week proved wrong","4","95"
"218310285197443073","breakingnews uk chancellor george osborne barclays banks flagrant breach proper market","0","0"
"218310423320080384","opendata trending second right behind barclays","0","10"
"218310884982919169","george osborne statement barclays scandal politics live blog ons says recession deeper originally th","0","0"
"218311214353227776","absolutely extraordinary falls bank share prices barclays 16 rbs 13 lloyds 7","5","200"
"218311837089923073","breaking news queues forming barclays across country worried depositors attempted withdraw money dejavu haha","0","1"
"218312256524533762","fuel news barclays boss bob diamond intense pressure quit independent petrol diesel","0","0"
"218312608854450177","barclaysmageddon barclays 17 libor fine yesterday please follow clusterstock twitt","0","0"
"218312994738806784","stephen barclay mp declares interest used work barclays bank fsa osborne says least not work ed balls","0","1"
"218313191694934017","wait barclays seriously chief executive named ricci rich","0","3"
"218313800040984576","commodity analysis barclays oil markets strategy 120626","0","0"
"218313827417210880","barclays osborne slams systematic greed","0","4"
"218314151217475584","barclays shares 16 board sells shares buy fake passports sunglasses","1","50"
"218314529837285379","rt absolutely extraordinary falls bank share prices barclays 16 rbs 13 lloyds 7 lt yikes 2008","0","0"
"218314932507250688","shareholders know investigation libor rates approved packages board members barclays","0","0"
"218315089835606016","uk not heard lessons enron barclays news corp anything go depressing failure corporate culture","0","4"
"218315397240336384","osborne promises action libor scandal warns barclays bosses unlikely face criminal charges","0","3"
"218315922367184896","serious questions barclays yeh like whhich open prison like mr banker","0","0"
"218316232745684992","barclays not manipulated libor estimate least 5 banks implicated plus serious questions bba","0","0"
"218316321027395584","rt barclays shares 17 libor scandal risks turning crisis confidence situation unsustainable","0","15"
"218316757037883393","david cameron barclays boss bob diamond questions answer","0","0"
"218316937384574976","barclays share price 17 gt 3bn market vale rbs 12 george osborne confirms investigation market fixing","0","0"
"218317130339319810","barclays icelandic word bankers banksters","0","0"
"218318084417662976","barclays bob diamond rest greedy bastards banks fucking crooks suits start taking money bang em","0","3"
"218318090830745601","point barclays appear trump lga case think","0","0"
"218318287954644992","barclays get hub problem credit crunch kicked banks not lending cont","0","0"
"218318318187200512","barclays bank tip ponzi iceberg","0","2"
"218318401184083968","real credibility boost jamie co bout barclays libor","0","0"
"218318506066853889","barclays libor fixing time proper public inquiry banking crisis telegraph blogs via","0","0"
"218318610920255488","going pay barclays liebor fine 290m ceo traders no course not customers shareholders fail","0","0"
"218318619292082177","barclays laugh face 290m fine laughingallthewaytothemselves barclays","0","0"
"218319445578354689","libor lies reek insider trading scandals 1980s retro ing bob diamond barclays","1","2"
"218320213140189184","start barclays","0","0"
"218321824180736000","uk investigate barclays bosses libor fixing via","0","1"
"218322152661848064","sick seeing adverts everywhere especially given reputation barclays de brand bikes askboris","2","13"
"218322167694237696","news sw 19 barclays corp hospitality fixed special rate","0","0"
"218322394169876480","cameron says barclays libor scam scandal investigated hunt bskyb deal also scandal swept carpet","1","5"
"218322792620363777","debrandthebikes boris matter time find barclays drown kittens well manipulative scum","0","0"
"218323872888537088","come rioters last year got massively inflated sentences stealing items like donuts yet barclays bosses walking free","4","82"
"218323895713931264","david cameron called barclays morally wrong yet","0","5"
"218325804122251268","barclays bank big obey rules editorial via","0","0"
"218326939230932992","big boy emails nailed barclays","13","56"
"218328870192021504","uk investigate barclays bosses libor fixing british authorities find executives barclays knew","0","0"
"218331554525618176","barclays chief pressure shares fall sharply wall street journal wall street journalbarc ifollowback","0","0"
"218331888983609344","fsa report reveals happens 290m fine barclays used reduce fees paid fsa banks","1","2"
"218334247260401664","gary rothfeld barclays chief pressure shares fall sharply wall street journal wall street journalbarclays c gary rothfeld","0","0"
"218334359625801728","david cameron says barclays boss bob diamond serious questions answer man colleagues crooks said bob diamond","1","23"
"218334398020452352","criminal prosecutions barclays","8","117"
"218336336761995265","question barclays got caught manipulating libor come gets stay primary dealer u treasuries","25","129"
"218338075477155840","let us hit bob diamond hurts bank barclays stop blog please rt agree","0","26"
"218339604141584384","uk investigate barclays bosses libor fixing","3","36"
"218341369209556993","new post barclays hit 290m fine libor fixing","0","0"
"218342770098704386","barclays chairman waiving bonuses waving hello p45","0","0"
"218346948619546625","serious chatter city possibility diamond barclays chair marcus agius standing one told","0","19"
"218349023797583872","mililiband wants barclays shareholders hold bosses account shareholders profited rate fixing","1","2"
"218352521872277506","bankers wanton criminality somehow becomes failure regulation bob diamond barclays","0","0"
"218353188754046977","mainstream days rt wow barclays obamacare scotus trending something scandalous quick kim kardashian","0","0"
"218355504014045184","ummm ring fence barcap sue please not want bail barclays libor bob diamond","0","0"
"218355843740073984","know happened mr martin banking system become massive criminal enterprise barclays","0","2"
"218360172266000386","barclays sfo city watchdog undertake investigation best make last rest us forget","0","2"
"218360541377343489","barclays matter power time crook crook allinittogether bbcnews skynews skypapersatUser","0","0"
"218360927253307392","barclays hsbc rbs ubs citigroup also probed says uk treasury chief","0","0"
"218361883563008000","dude owe big time come opening bottle bollinger barclays manipulating libor scandal","0","0"
"218363428673294337","barclays shareholders demand meeting sir michael rake","0","1"
"218363497187258369","barclays former quaker bank went bad tale happens book eminent corporations","0","3"
"218364609025933312","security barclays rbs sink heavy volume londons banks fell sharply thursday barclays register","0","1"
"218367502940504064","barclays bank fined 453m market fixing","4","33"
"218369961779920897","barclays shares closed 15 5 lower 165 6p wiping 3 2 billion value","0","0"
"218370121142509568","breaking barclays lost 3bn market cap 15 one day","0","0"
"218370724690272256","barclays shares close 15 6 ftse","5","106"