"tweet_id","text","likes","retweets"
"218370783054004224","around 3 7 billion wiped value barclays bank trading today","5","150"
"218371857609535491","fb better barclays today","0","0"
"218371975192645632","loving fsa fines barclays fine distributed fsa equally guilty banks trebles round","1","13"
"218372906172940288","barclays chairman firing line","0","0"
"218375951237656576","linked barclays","0","0"
"218375972217565184","barclays libor labour scandal ed balls failed regulate banks charge via","0","1"
"218376513295351808","cramer barclays get jail time","0","1"
"218379805794648066","barclays statement not customers affected rate fixing via alright","0","0"
"218381559009509377","ibe director bbcr4 pm programme barclays ethics","0","0"
"218383333229465600","uk rioters imprisoned 4stealing bottles water barclays bosses slapped wrist manipulation trillion pound markets cunts","0","1"
"218385367466917889","barclays bank","0","0"
"218389909902340096","dave learn everything happened barclays not get caught like thay rip people","0","0"
"218391881204240384","barclays westminster entire public sector morally devoid leads back one bent lawyer tony blair","0","0"
"218392736838070275","bob diamond serial offender barclays looting","0","0"
"218394053857918976","sorry suffering pollen know hate summer hope not consuming reserve little bit hate barclays","0","0"
"218394079023742976","anybody authorising codoning fiddling market rates bank charged fraud act period bobdiamond barclays","0","0"
"218395626705125376","pissed barclays stop moaning close account en masse watch take notice retweet away letscausehavoc","0","1"
"218396788372160512","barclays scandal threatens implicit deal uk establishment done banks since 2008 blogs","5","30"
"218399070249697280","barclays ladbrokes shares crash not company well like gamble","0","0"
"218400759719534593","epetition 4 inquiry banks wrongdoing 2000 signatures today barclays keep pressure","1","6"
"218404573189124096","not saying us initiating run barclays bank hilarious hilarious c4news","0","0"
"218406232510308353","notice main media plays appalling extent barclays corruption ripped us probably still","1","3"
"218407723107233792","mta subway atlantic ave barclays center b n q r 2 3 4 5 brooklyn ny","0","0"
"218413867741614081","surprised barclays thought better","0","0"
"218414809044094977","frankly disgusted barclays threaten security jobs homes cynically manipulating interest rates","0","7"
"218416229147348992","exclusive barclays haggles fsa mis selling deal","0","0"
"218417709426294785","assets barclays execs bobdiamond seized pay fines libor heist","4","4"
"218418900927397888","rt pursuit dude big boy 20 banks investigated scandal beseiging barclays","0","1"
"218418932078481408","barclays shows well light touch regulation beloved many nodding idiot politicians works","1","10"
"218424336749576192","bob thinks stay barclays not think end next week plus want see controversy payout","0","0"
"218428300358455296","uk drafts fraud squad libor fine hits barclays forex fx","0","0"
"218430201120555018","dear guardian barclays not attempt manipulate interest rates manipulated interest rates pressfail","12","105"
"218430292644466688","rt 230m fines barclays levied us authorities seem go direct us treasury","0","0"
"218431900476391426","barclays bank cunt day unsurprising news manipulated rates make obscene amounts money","9","199"
"218431949407125505","latest barclays scandal feel better taking hard line reporting breaches scaryboss","0","0"
"218434591797678081","barclays crisis mps call leveson style inquiry political mood towards banks turns increasingly hostile","0","0"
"218441216067506176","barclays fined 453 million rate manipulation","4","18"
"218446885529194496","12 barclays premier league games lucas leiva won tackles 52 vincent kompany 51 31 games outstanding","9","154"
"218450056209121281","davidcameron rioted last summer taught not go round breaking law friends taught barclays","0","0"
"218450697937625090","fuck people not nicked barclays rigging horse race","0","0"
"218450702110961665","barclays darker history shit going recently southafrica apartheid","0","0"
"218453422238728192","stupid short term greedy barclays execs hit news today attended opening bomber command memorial","1","1"
"218454858796240896","60m fine barclays pays fsa goes reduce firms fsa fees not taxpayer needs changing commons debating thankfully","2","42"
"218455143908249600","straightforward barclays employees way top committed fraud law no new laws needed","0","0"
"218456439713300481","david cameron turns heat barclays go right top lt unless name hunt","5","61"
"218456476388306944","barclays crisis mps call leveson style inquiry","4","11"
"218458323178098690","dealbook barclays chief faces political firestorm robert e diamond jr chief executive barclays face","0","0"
"218459581532209152","chairman barclays chairs bba bbc british establishment disgrace","2","36"
"218460013470027776","barclays boss blames staff boss barclays says manipulation banking lending rates bank limited","0","0"
"213280006099578882","barclays premier league fixtures 2012 13 season announced next monday 18 june","0","0"
"213568102863085569","rt fixtures 2012 13 barclays premier league season published 0900 bst monday 18th june bpl","0","1"
"217977630769684480","dealbook barclays pay 450 million regulatory deal","0","0"
"217990058509205505","barclays chief bob diamond gives 2012 bonus 290m fine via","0","0"
"218016482620227584","barclays chief bob diamond gives 2012 bonus 290m fine via","0","0"
"218097960016293888","barclays chief bob diamond gives 2012 bonus 290m fine","0","1"
"218291532464267266","rt vivid whistleblower account barclays management culture macho poker fear mock executions","0","2"
