"tweet_id","text","author","language","likes","retweets","media","timestamp"
"209640264602619904","#10PeopleIveSeenLive Beyonce, jay z, eminem, biddy clyro, foo fighters, lady gaga, Paolo nutini, coldplay, snow patrol","RebeccaMurph4","ES",0,0,"no url","2012-06-04 13:38:28"
"209642911208448002","#10PeopleIveSeenLive Lady Gaga. Yes I've watched all of her Asian BTWBalls LIVE on my LAPTOP. What a great huh","bagasalvin","EN",0,0,"no url","2012-06-04 13:48:59"
"209646547657428992","#10FamousPeopleIveMet Mariah Carey and Lady Gaga :*","Bee_Lamb4Life","EN",0,0,"no url","2012-06-04 14:03:26"
"209648296673804289","Don't hide yourself in regret, just love yourself and you're set.  - Lady Gaga","HungryyMonsterr","EN",0,0,"no url","2012-06-04 14:10:23"
"209651283022458882","@barwaniqueen yeah I know its kind of cool tho plus I have plenty of time at nights to browse so why not lady gaga lol","kingmaye","EN",0,0,"no url","2012-06-04 14:22:15"
"209652197368139776","RT @DiafragmaUI: Fashion and shopping and tribute to Lady Gaga in one package? join the #JakartaFashionMarket June 8,9,10 more info: @JFM_ID","HIMADMUI","EN",0,0,"no url","2012-06-04 14:25:53"
"209653002678702081","If I audition for #IdolsSA I'd probably sing Lady Gaga's You &amp; I. See that song,just kill &amp; I know I sound good, only that song. Lol","Nokoliciousdcom","EN",0,0,"no url","2012-06-04 14:29:05"
"209656995643527168","When The Lady Gaga's Music Is ON. My World Is OFF!","Monsterlicioso","EN",0,5,"no url","2012-06-04 14:44:57"
"209658404929679361","The Oakridge Park 'jubilee fun day' is blasting out Lady Gaga. It's time to retaliate. #TheSexPistols #GodSaveTheQueen #WindowsOpen #Loud","devilsaardvark","EN",0,0,"no url","2012-06-04 14:50:33"
"209658853724401666","&lt;&lt;&lt;&lt;&lt; this monster can't wait for the next album of Lady Gaga","heymonsterss","EN",0,1,"no url","2012-06-04 14:52:20"
"209659772436357120","¿Tributo o ironía? Madonna incluye un tema de Lady Gaga en su gira (mirá el video) http://t.co/hBGUeDCc","telefenoticias","ES",2,14,"no url","2012-06-04 14:55:59"
"209662922195091459","This was the reaction of lady gaga when he saw the MDNA tour. http://t.co/KO2YADm5","JustCiccone","EN",0,7,"https://pbs.twimg.com/media/AujfUSBCQAQzn3A.jpg","2012-06-04 15:08:31"
"209663870116171777","Lady Gaga Cancels Show In Response to Fundamentalist Threats | Care2 Causes http://t.co/kvWRpV2S","JoyceDenne","EN",0,0,"no url","2012-06-04 15:12:16"
"209664729948491776","How can ppl call Lady Gaga the queen of pop when she hasn't done a SIXTEENTH of what Madonna or even","herlockerxfprh9","EN",0,0,"no url","2012-06-04 15:15:41"
"209669511446663168","@PawsUp4Monster because lady gaga says: if you don't love you self nobody will love you!","FrejaNordenhof","EN",0,0,"no url","2012-06-04 15:34:41"
"209671281459732480","He añadido un vídeo a una lista de reproducción de @YouTube. http://t.co/ckVXxfa0 lady GaGa - Just Dance Lyri","noefreak","ES",0,0,"no url","2012-06-04 15:41:43"
"209675366716030976","Little Monsters in Indonesia Show Lady Gaga Some Love [VIDEO] http://t.co/33eh8v7T via @Mashable","GorillaCM","EN",0,0,"no url","2012-06-04 15:57:57"
"209675438002405376","Little Monsters in Indonesia Show Lady Gaga Some Love [VIDEO]: A group of dedicated fans in Jakarta made Lady Ga... http://t.co/QSIlrVgz","WebTech_update","EN",0,0,"no url","2012-06-04 15:58:14"
"209677421908209666","Lady Gaga's Health Worries Elton John - http://t.co/sjBZUUXw http://t.co/f4FlbTuM #gagaupdate","GagaUpdts","EN",0,0,"no url","2012-06-04 16:06:07"
"209681062589247488","More for you @ladygaga from Indonesian fans! Little Monsters in Indonesia Show Lady Gaga Some Love http://t.co/AfH8r8Cp via @mashable","FreedMyself","EN",1,0,"no url","2012-06-04 16:20:35"
"209684426425241600","Lady Gaga edition by DontCallMeEve http://t.co/XIGgRSZa","DontCallMeEve","EN",0,0,"no url","2012-06-04 16:33:57"
"209693066695684097","Bullying Is Not Cool .. If you don't know yet, Lady Gaga has been trying to make it illegal; its a hate crime. http://t.co/3snll58x","stefspico","EN",0,0,"https://pbs.twimg.com/media/Auj6u7CCMAAhRPG.jpg","2012-06-04 17:08:18"
"209694010388918273","News: Lady Gaga's Indonesian Flash Mob Made Her 'Cry So Hard' - http://t.co/9xUqDusI http://t.co/WxTJRzzS","lady_gaga_cool","EN",0,0,"no url","2012-06-04 17:12:02"
"209697399411712001","Elton John fears for Lady Gaga's health | Gigwise: Star shares concerns following own health scare left him hosp... http://t.co/UaaQgIVX","PRODoBOTS","EN",0,0,"no url","2012-06-04 17:25:30"
"209699035173486594","that lady gaga thing i told u about is postponed till tomorrow!","jasonitos","EN",0,0,"no url","2012-06-04 17:32:00"
"209702461928255488","God beats Lady Gaga on Twitter: http://t.co/gETfuK2U. Yep. #socialmedia #engagement","sbiedak","EN",0,0,"no url","2012-06-04 17:45:37"
"209704600142479362","-mamá mamá en la escuela me dicen Lady Gaga!!!! -Quien hija? -Alejandrooo ale alejandro ale alejandroo.","MemesMexico","ES",3,19,"no url","2012-06-04 17:54:07"
"209705532146204673","me vicio con la canción just dance de lady gaga. es mi cancion favorita de ella y amo la parte de colby. dshfkdsf","ampimcfly","ES",0,0,"no url","2012-06-04 17:57:49"
"209714612810162177","Dear Elton John: If You're Worried About Lady Gaga's Weight, Talk To Her, Not ... http://t.co/MOkE8YAC","getfastfatloss","EN",0,0,"no url","2012-06-04 18:33:54"
"209717318694080512","Saw Jessie J at media event 3/4 years ago.Guitar,demurely dressed,almost folksy.  Record company ""Be Lady Gaga instead"".","StanCollymore","EN",8,87,"no url","2012-06-04 18:44:39"
"209717875974483968","I'm not sure how people are saying that Lady Gaga is the most amazing original  (@YouTube http://t.co/NLmkCu7H)","XxShirokoxX","EN",0,0,"no url","2012-06-04 18:46:52"
"209720216400314369","Elton John fears for Lady Gaga's health | Gigwise http://t.co/9mFF7OYn","evafox777","EN",0,0,"no url","2012-06-04 18:56:10"
"209727837471649792","Grace Jones the original Lady GAGA #jubileeconcert","Jonaldo14","EN",0,0,"no url","2012-06-04 19:26:27"
"209728026215333889","""wow she's scary"" Madame on grace jones ... She laughed when I said maybe she's the lady gaga of her day :/ lol #jubileeconcert","willowtree81","EN",0,0,"no url","2012-06-04 19:27:12"
"209728055579652096","-(from last tweet) except lady gaga can sing!","emma_greenacre","EN",0,0,"no url","2012-06-04 19:27:19"
"209728114262147072","Omg lady gaga turned black!!!!!  lmfao #gracejones  #jubileeconcert #fb","chris_simms","EN",0,1,"no url","2012-06-04 19:27:33"
"209728370131476482","Music FAILS: If You Think Lady Gaga Blows … - EPIC FAIL Funny ...: Music FAILS - Music FAILS: If You Think Lady ... http://t.co/OzVG6Ufs","WorldofLadyGaGa","EN",0,0,"no url","2012-06-04 19:28:34"
"209728433046032384","Lady GaGa:tune into Jubilee concert to watch a legend who was doing what u think is original now about 20 years ago #gracejones #legend #fb","chris_fry","EN",0,0,"no url","2012-06-04 19:28:49"
"209728438049837056","Text from Mr Cameron: ""Good God, Lady Gaga's let herself go"". #jubileeconcert","Charles_HRH","EN",30,287,"no url","2012-06-04 19:28:50"
"209728445641531394","she should share outfits with lady gaga.","TiaGreenlees","EN",0,0,"no url","2012-06-04 19:28:52"
"209728625971445760","Grace Jones - the people's Lady Gaga. #jubileeconcert","ianfreeman","EN",0,0,"no url","2012-06-04 19:29:35"
"209728747631423489","Grace Jones was Lady Gaga before Lady Gaga.","Plaktow","EN",0,0,"no url","2012-06-04 19:30:04"
"209729083163152384","Nothing shows the queens jubilee, than a Lady Gaga lookalike, Hula hooping #jubileeconcert","Andy_2_Randy","EN",0,0,"no url","2012-06-04 19:31:24"
"209731406794985472","Lady Gaga and Taylor Kinney: Back On! http://t.co/RnJdsU65","CelebrityCutes","EN",0,0,"no url","2012-06-04 19:40:38"
"209732728009138177","played the song 'PokeR FaCe LaDy GaGa' by ♥→jαmOnciitα...☆! 『ADD MЄ』★ on @myspace http://t.co/1w3Uw5sA","JSWinchester","EN",0,0,"no url","2012-06-04 19:45:53"
"209733436871684096","Les gusta Lady Gaga? A las que les guste, les dejo una página... http://t.co/pzwAls0m","BeliebersFanPag","ES",0,0,"no url","2012-06-04 19:48:42"
"209741702590775296","Lady Gaga, Adele y Amy Winehouse son las mujeres que han dominado la música durante estos últimos 7 años.... http://t.co/8YbB7agS","Lady_GagaVenzla","ES",0,1,"no url","2012-06-04 20:21:33"
"209741720588521472","Lady Gaga should perform at this Jubilee thing, I bet the Queen loves Gaga :')","SomeGingerKidX","EN",0,0,"no url","2012-06-04 20:21:37"
"209741825475481600","Alright guys can you help me to spread the world w/ my cover #youtube Miya Scealsy - Yoü &amp; I by Lady Gaga (cover) http://t.co/3uZ81yvu","MiyaScealsy","EN",0,0,"no url","2012-06-04 20:22:02"
"209743628992655361","Llega a Almaloca Coyn Rouge  MADONNA Y LADY GAGA; de la mano de Fede Carey; actor - Transformista desde BS AS::::... http://t.co/ZYVJCSW8","geri_ayos","ES",0,0,"no url","2012-06-04 20:29:12"
"209745109611323392","#YOLO SO love Lady Gaga and follow @benjaminjackrae and get this baby trending #jubileetommorow","MichaelIrving5","EN",0,0,"no url","2012-06-04 20:35:05"
"209748692582932480","""Miley Cyrus is SO HOT. She makes me wanna be a man!"" - Lady Gaga.","dazzlingmrc","EN",0,51,"no url","2012-06-04 20:49:19"
"209748942034964480","Queremos a Lady Gaga en Bogota en el Estado El Campín @PAOOVALLE @Gobiernoaldia @petrogustavo @Bogota_DC @OcesaColombia","GagaColombia","ES",3,6,"no url","2012-06-04 20:50:19"
"209750117601914881","Dear Elton John: If You're Worried About Lady Gaga's Weight, Talk To Her, Not ...: by Hanna Brooks Olsen | Leave... http://t.co/dTgaQk6J","DietTips4MeToo","EN",0,0,"no url","2012-06-04 20:54:59"
"209750935507968000","Facilitated lady gaga today. A very confident "" you can all go to hell"" subperson. I don't have to go anywhere to meet these famous people:)","MarijkeLeys","EN",0,0,"no url","2012-06-04 20:58:14"
"209751770497421312","Queremos a Lady Gaga en Colombia y en Bogotá en el Estado El Campín. @PAOOVALLE @Gobiernoaldia @petrogustavo @Bogota_DC @OcesaColombia","GagaColombia","ES",5,28,"no url","2012-06-04 21:01:33"
"209754886508781568","BRING ON LADY GAGA!!!! #jubileeconcert","xXPiraticaXx","EN",0,0,"no url","2012-06-04 21:13:56"
"209757247910330369","Queremos a Lady Gaga en Colombia y en Medellin en el Estadio Atanasio Girardot :d @PAOOVALLE @OcesaColombia","BraiianGMonster","ES",0,0,"no url","2012-06-04 21:23:19"
"209760272024481792","@BRETT_SPECKS are you kidding me? its gone from like whitney Houston to lady gaga wot.","kellyRossxo","EN",0,0,"no url","2012-06-04 21:35:20"
"209763858120835073","Queremos a Lady Gaga en Colombia y en Bogotá en el Estado El Campín @PAOOVALLE @Gobiernoaldia @petrogustavo @Bogota_DC @OcesaColombia♦","JenniiCr","ES",0,0,"no url","2012-06-04 21:49:35"
"209768452481761281","God beats Lady Gaga on Twitter http://t.co/9nwXfHTC via @nytimes","stephsigel","EN",1,1,"no url","2012-06-04 22:07:51"
"209771487572402178","I favorited a @YouTube video http://t.co/Yn4AtcaN Starstruck- Lady GaGa w/ Lyrics","DarkGoddess007","EN",0,0,"no url","2012-06-04 22:19:54"
"209779005359009794","Maybe Just Dance 4 will actually have some LADY GAGA ON IT CONSIDERING THE TITLE IS ONE OF HER SONGS","urfamemonster","EN",0,3,"no url","2012-06-04 22:49:47"
"209779041530687488","@GagaTrueNews Lady Gaga graphic the novel is now in stores. Almost sold out! http://t.co/wVsHikH8 #ladygaga and also on #Kindle &amp; #Nook","BluewaterProd","EN",0,0,"no url","2012-06-04 22:49:55"
"209781356790693888","I liked an @YouTube videofrom @jhonnykmusic http://t.co/vgyr1CDZ Born This Way - Lady Gaga (acoustic)","Leeroy7Com","EN",0,0,"no url","2012-06-04 22:59:07"
"209783139344715777","Ojala los DIVOS queden limpiarle la plancha a lady gaga.....","El_Cent1nela","ES",0,0,"no url","2012-06-04 23:06:12"
"209783596171534337","#HowToKeepARelationship it's so simple. Monsters + Lady Gaga = FOREVER.","LillyGagaloo","EN",0,1,"no url","2012-06-04 23:08:01"
"209785024092962816","@FrannGonzlz  We are trending I SUPPORT LADY GAGA  watch video to understand why http://t.co/FSVESamn","StressedMonster","EN",0,1,"no url","2012-06-04 23:13:42"
"209788042507063296","Now Playing Lady GaGa - Heavy Metal Lover  http://t.co/ttO0dqci","DMGRADIO_","EN",0,0,"no url","2012-06-04 23:25:41"
"209791159168544769","I Support Lady Gaga always and forever &lt;3","Gagasgrrl","EN",0,5,"no url","2012-06-04 23:38:04"
"209791919155449856","I SUPPORT LADY GAGA no matter what happens with gaga♥  http://t.co/iiOkCJIp @ladygaga @momgerm @germanottajoe @BTWFoundation !","FaizaAlKhalifaC","EN",0,2,"no url","2012-06-04 23:41:05"
"209792976170389505","“@WillyWonkaDice: —Hola, ¿cómo te llamas? —Born This Way, ¿y tú? —Alejandro.— ¡NO MAMES! como la canción de Lady Gaga.”@KarlaDJimenezE","Pamela_Who","ES",0,1,"no url","2012-06-04 23:45:17"
"209792991769018368","Bruno Mars covers The Edge of Glory by Lady Gaga (unreleased... http://t.co/mxitroU3","Crazytrainish","EN",0,0,"no url","2012-06-04 23:45:21"
"209795365757665281","Four keys to creating products for the Lady Gaga generation: http://t.co/PZ5EiSN4 (@FastCoDesign)","bobbygwald","EN",2,0,"no url","2012-06-04 23:54:47"
"209802990977171456","Listened to Lady Gaga for 12 hours straight.","LiamBlaney115","EN",0,0,"no url","2012-06-05 00:25:05"
"209803368472903680","Thanks to Twitter I'm following #E3 and #Lammys at 30,000 ft while watching Lady Gaga","Ku_DJ","EN",0,0,"no url","2012-06-05 00:26:35"
"209804773585727489","I bet @TimWilsonBarrio is on it. #oldfriends #biglittlemonsters “@PipAdam: Oo. Lady Gaga is here ... maybe. http://t.co/ZkzJbXrH”","nzdodo","EN",0,0,"no url","2012-06-05 00:32:10"
"209805574668431360","Cindy Crawford le responde vía twitter a Lady Gaga.  El pasado 01 de junio, Lady Gaga se manifestó muy contenta... http://t.co/2Lpk32eq","rebefanmonster","ES",0,0,"no url","2012-06-05 00:35:21"
"209810008056147969","My 40th birthday dinner at The Top with Marc: 60% eating meat &amp; onion rings, 40% discussing the cultural role of Lady Gaga. Not kidding.","FrancisIsBusy","EN",0,0,"no url","2012-06-05 00:52:58"
"209814126858477569","First HQ photo of Lady Gaga in New Zealand with a fan- http://t.co/nUYIMVl7","GagaMediaDotNet","EN",0,6,"no url","2012-06-05 01:09:20"
"209816022713245697","Creo que no hay duda Lady Gaga la cantante del momento","zayajean1991","ES",0,0,"no url","2012-06-05 01:16:52"
"209817033540505600","jasdan has 6 ticket(s) for Lady Gaga at Allphones Arena (Acer) (Sydney) on Thursday, 21 June.","Ticketman_au","EN",0,0,"no url","2012-06-05 01:20:53"
"209818027586371584","@bondpm @trollenas claro, el cebollo y Lady GaGa ya son pristas declarados y copetudos!!","alfonsogg71","ES",0,0,"no url","2012-06-05 01:24:50"
"209822343533559808","Lady gaga is sexy! But nicki come first!","smack_dat_azz","EN",0,0,"no url","2012-06-05 01:41:59"
"209824801387327491","You And I - Lady GaGa","Sonsomix925","EN",0,0,"no url","2012-06-05 01:51:45"
"209825006899826688","We got some quick pics of Lady Gaga on her arrival at her Auckland hotel - check them out here: http://t.co/YaUQ4iL8","NZGirlfriendMag","EN",0,1,"no url","2012-06-05 01:52:34"
"209827762544984064","Lady Gaga ya Llego a Nueva Zelanda,Australia &lt;3  Aqui un Video : http://t.co/nyN2Ta79... http://t.co/W6H46AVg","gaga_goddess","ES",0,1,"no url","2012-06-05 02:03:31"
"209829184414040064","Impressed at how well Lady Gaga pulls off the Hillary Clinton look. http://t.co/UmQpXcYM","LewStoddart","EN",0,1,"no url","2012-06-05 02:09:10"
"209830681793138688","Earlier tweet had two lines from Lady Gaga","rajivWORLD","EN",0,0,"no url","2012-06-05 02:15:07"
"209832233673043969","Fans abuzz as Lady Gaga arrives in NZ http://t.co/Lamfjnkg","ladygagasurf","EN",0,0,"no url","2012-06-05 02:21:17"
"209836570574979072","Lady GaGa - You and I Lyrics: http://t.co/I3ceF1Hv via @youtube Wanna sing ? With You And I :) &lt;3","GagaFansSupport","EN",0,0,"no url","2012-06-05 02:38:31"
"209838026015256576","No bueno osea creo que conseguir boletos para 1D esta mas difícil que para Lady Gaga! #nomamar yo si quería ir! Hahaha","MarthaPtbi3","ES",0,0,"no url","2012-06-05 02:44:18"
"209838747427151872","Fans abuzz as Lady Gaga arrives in NZ: Lady Gaga has arrived in NZ, wearing a bright orange dress with white hig... http://t.co/zchjhnE5","todaysipadnews","EN",0,0,"no url","2012-06-05 02:47:10"
"209842885330341888","Lady Gaga arrived in New Zealand. pics: http://t.co/je1BqlCp #CDNEWS","creativedisc","EN",0,6,"no url","2012-06-05 03:03:37"
"209844401374113793","@YOUuUuUuUuANDI Very Good Video Lady Gaga Arriving in NZ: http://t.co/FA83Z2dw via @youtube http://t.co/7YLkvYNz","BigOldMonster","EN",0,0,"no url","2012-06-05 03:09:38"
"209847693881774081","Lady Gaga's Indonesian Flash Mob Made Her 'Cry So Hard' http://t.co/IRXsfltD","FrezzFK","EN",0,0,"no url","2012-06-05 03:22:43"
"209851489731088385","Wow, the simpsons lady gaga episode was quite possibly the worst thing ever.","Ibbored","EN",0,0,"no url","2012-06-05 03:37:48"
"209853142303649794","@VannyaPerez @daniigonzalezm una amiga tiene la peluca de Lady Gaga, onda la que slaio en el video Judas, ese color xD bien platiná!","FabbyPaz27","ES",0,0,"no url","2012-06-05 03:44:22"
"209857508561530881","Sweets is busy packing for her trip to Auckland to see Lady Gaga. She is a tat excited","crumblecromwell","EN",0,0,"no url","2012-06-05 04:01:43"
"209861275059109888","Alguien sabe como se llama el video de Lady Gaga donde parece lesbiana?","nery_reyna","ES",0,0,"no url","2012-06-05 04:16:41"
"209022860323332097","I think Lady Gaga just puts glue on herself and rolls around on random things.","Laughbook","EN",189,787,"no url","2012-06-02 20:45:08"
"209279357443784704","I think Lady Gaga just puts glue on herself and rolls around on random things.","AdamDee96","EN",12,71,"no url","2012-06-03 13:44:21"
"208324641431891968","Lady Gaga, la primera tuitera que supera los 25 millones de seguidores http://t.co/Z7YrIwsp","Chupates","ES",0,0,"no url","2012-05-31 22:30:39"
"208866591650226176","Lady Gaga Saved Pop Music","LadyGaGasFever","EN",0,1,"no url","2012-06-02 10:24:10"
"208902251627028480","Lady Gaga Saved Pop Music","MrChio","EN",0,0,"no url","2012-06-02 12:45:52"
"208749948051783681","Kicking off tour, Madonna shows she's no lady (Gaga) http://t.co/dCs6vI6I","BurnZMediainc","EN",0,0,"no url","2012-06-02 02:40:40"
"208680230322315264","Happy Birthday, Marilyn Monroe: Lady Gaga, More Stars Channel Her Iconic Style:  http://t.co/O6IKINTd","Entertain_Much","EN",0,0,"no url","2012-06-01 22:03:38"
"208695265442537472","Rihanna has red hair, Lady Gaga has yellow hair, Katy Perry has blue hair, &amp; Nicki Minaj has pink hair. The Power Rangers has been reunited.","Kendrick_lamaar","EN",188,1134,"no url","2012-06-01 23:03:23"
"208702560801001472","Rihanna has red hair, Lady Gaga has yellow hair, Katy Perry has blue hair, &amp; Nicki Minaj has pink hair. The Power Rangers has been reunited.","Dejaa_Vu","EN",0,0,"no url","2012-06-01 23:32:22"
"208709929295560704","Rihanna has red hair, Lady Gaga has yellow hair, Katy Perry has blue hair, &amp; Nicki Minaj has pink hair. The Power Rangers has been reunited.","MeekMilI","EN",2,67,"no url","2012-06-02 00:01:39"
"208738912867323906","Rihanna has red hair, Lady Gaga has yellow hair, Katy Perry has blue hair, &amp; Nicki Minaj has pink hair. The Power Rangers has been reunited.","Obey_Travis","EN",0,2,"no url","2012-06-02 01:56:49"
"209424861888647170","Rihanna has red hair, Lady Gaga has yellow hair, Katy Perry has blue hair, &amp; Nicki Minaj has pink hair. The Power Rangers has been reunited.","whitney_iruke","EN",0,1,"no url","2012-06-03 23:22:32"
"208872757277114369","Lady Gaga Saved Pop Music Lady Gaga has become the biggest pop star in the world, has won 5 Grammys + sold 100 million records","justinisal","EN",0,0,"no url","2012-06-02 10:48:40"
"209046447621017600","Lady Gaga Saved Pop Music? RT for Yes, Favorite for No. http://t.co/xqiGpM1k","Antoniomoster0","EN",0,4,"https://pbs.twimg.com/media/AuauovRCEAApAwr.jpg","2012-06-02 22:18:52"
"209675886788747264","Little Monsters in Indonesia Show Lady Gaga Some Love [VIDEO]: A group of dedicated fans in Jakarta made Lady Ga... http://t.co/5SfT6XvF","Tech_etc","EN",0,0,"no url","2012-06-04 16:00:01"
"209676822135320576","Little Monsters in Indonesia Show Lady Gaga Some Love [VIDEO]: A group of dedicated fans in Jakarta made Lady Ga... http://t.co/pG4q6XHb","twittme_user","EN",0,0,"no url","2012-06-04 16:03:44"
"209677346444283904","Little Monsters in Indonesia Show Lady Gaga Some Love [VIDEO]: A group of dedicated fans in Jakarta made Lady Ga... http://t.co/IGX2YKWL","LuxusWellness","EN",0,0,"no url","2012-06-04 16:05:49"
"209686938796556288","Little Monsters in Indonesia Show Lady Gaga Some Love [VIDEO] http://t.co/53qgMmVP","Daveakins","EN",0,0,"no url","2012-06-04 16:43:56"
"209779125412569088","@OurMonsters Lady Gaga graphic the novel is now in stores. Almost sold out! http://t.co/wVsHikH8 #ladygaga and also on #Kindle &amp; #Nook","BluewaterProd","EN",0,0,"no url","2012-06-04 22:50:15"
"209779221856387072","@versacewarrior Lady Gaga graphic the novel is now in stores. Almost sold out! http://t.co/wVsHikH8 #ladygaga and also on #Kindle &amp; #Nook","BluewaterProd","EN",0,0,"no url","2012-06-04 22:50:38"
