"tweet_id","text","author","language","likes","retweets","media","timestamp"
"88502024827715584","@WatchWTF_Utweet uhhhh, harvard? I said my ABC's backwards, my ass is going to YALE!","Matt_Mandingo","EN",0,0,"no url","2011-07-06 06:58:21"
"88642445931323393","@shez_Tomlinsonx haha, yeah well Yale's in Connecticut! I live like 5 minutes away from yale!","saharaxo14","EN",0,0,"no url","2011-07-06 16:16:20"
"88643578389204992","Cool RT: @mcchrystalgroup Check out General McChrystal speaking about the new Yale Executive Global Leadership Course http://t.co/bHq8iQc","fivestarspeaker","EN",0,0,"no url","2011-07-06 16:20:50"
"88663371305586689","RT @RiggdUp: Yale school of music is, or will be, tuition-free... #HighNotes(that's what's up!)","lilshakur","EN",0,0,"no url","2011-07-06 17:39:29"
"88796527874674688","@PaulPabst Yale, and Florida A/M titles are my proudest work - as you know.  Give 'em hell Paulie P","notthefakeSVP","EN",0,0,"no url","2011-07-07 02:28:36"
"88820726873849856","La colección de Max Uhle: Un tema que de refilón se relaciona con el caso de las piezas de Machu Picchu y Yale http://t.co/MOGlGaE","tanquedecasma","ES",0,2,"no url","2011-07-07 04:04:46"
"88880271348350976","Introduction to Political Philosophy: A Free Yale Course:  Stephen B. Smith, a political science professor at Ya... http://bit.ly/p77qyB","CultureLivre","EN",0,0,"no url","2011-07-07 08:01:22"
"88926148658073600","@Jess_Yale @nat_griff  What the hell are you to on about?","MattyGriffiths_","EN",0,0,"no url","2011-07-07 11:03:40"
"88958214103760896","EDUARDO ENGEL, ECONOMISTA Y PROFESOR DE LA UNIVERSIDAD DE YALE: “Lavín tiene un conflicto de interés enorme” http://t.co/elucwqN","thecliniccl","ES",2,11,"no url","2011-07-07 13:11:05"
"88999045632245760","Gold Seeker: Adventures of a Belgian Argonaut during the Gold Rush Years (Yale Western Americana Series):  http://amzn.to/l3Aqhl","RukkensuFarfava","EN",0,0,"no url","2011-07-07 15:53:20"
"89048693629652992","So much to learn, so little time. RT @DGalpert @rmbyrne Take a Course from Yale This Summer? It's Free http://t.co/6oZNb9Y #jed21 #education","TechRav","EN",0,0,"no url","2011-07-07 19:10:37"
"89068369118101505","Yale Researcher Wants to Expand Program Into 50 Schools. - Patch.com http://dld.bz/afTes","bestessaycom","EN",0,0,"no url","2011-07-07 20:28:48"
"89072596976545792","If all the girls who attended the Harvard-Yale game were laid end to end, I wouldn't be surprised. ~ Dorothy Parker #quote","robinbloor","EN",0,2,"no url","2011-07-07 20:45:36"
"89116809139191809","#YALE sin esfuerzo RT @Aweboniaito: @DiegOrtiz_22 @TonnyxXx_47 mirala... _---&gt;  @Barbara_B18 pero ojo con ella muchachos.","DiegOrtiz_22","ES",0,0,"no url","2011-07-07 23:41:17"
"89137147319300097","25¢ Coney's in Yale Tomorrow! Whoo! Rayburn! Now let's add some more!","WingsStef","EN",0,0,"no url","2011-07-08 01:02:06"
"89328541770055681","""To most families, a second income is not a luxury, but a necessity"" J. S. Hacker. Prof. of Pol. Sci. Yale","WTNWR","EN",0,0,"no url","2011-07-08 13:42:38"
"89363283219464193","I'm at My Home Office (16 Wildwood Ave, Yale Ave., Morton) http://4sq.com/qdRFZ5","dribbs1","EN",0,0,"no url","2011-07-08 16:00:41"
"89401044529975297","O Sister, What Art Thou: Kathryn Lofton on the Religion of Oprah: The Neo-Gothic towers of Yale University glint... http://bit.ly/oIw82L","Saviey","EN",0,0,"no url","2011-07-08 18:30:44"
"89405612122832896","Why Dorothy Parker is great---she said: ""If all the girls who attended the Yale prom were laid end to end, I wouldn't be a bit surprised.""","MiguelATF","EN",1,1,"no url","2011-07-08 18:48:53"
"89676476080865280","TRAFFIC HAZARD/URGENT @ 100 CROSSTIMBERS and 4400 YALE Sat Jul 09 07:40:00 -0500 2011 #hpd","HPD_scanner","EN",0,0,"no url","2011-07-09 12:45:12"
"89686458503401472","""you FOLKS... RIGHT?!"" -FOLKS-75th and YALE South Side CHICAGO #wordsthatshapedmylife","BIG_KENNEY","EN",0,0,"no url","2011-07-09 13:24:52"
"89711804695052290","Does anyone else find it a bit odd that @Yale was not included in @BrooksBrothers College Clothing Line?","ashtondarian","EN",0,0,"no url","2011-07-09 15:05:35"
"89726933532803074","I checked in at Some Crust Bakery (119 Yale Ave) on #Yelp http://bit.ly/90k6ly","1fireguy13","EN",0,0,"no url","2011-07-09 16:05:42"
"89798953956147200","DisplayPort Yale University Press http://www.displayport.biz/k/Yale%20University%20Press","DisplayPort2","EN",0,0,"no url","2011-07-09 20:51:53"
"89829727572992000","@UhhhhRonny @the_mick9 were to good for Yale straight up.","lifeasotis","EN",0,0,"no url","2011-07-09 22:54:10"
"89832369967734784","@Don_Yale who doing your micros???","SwisherTweet101","EN",0,0,"no url","2011-07-09 23:04:40"
"89985696940568576","Latest mentions for Yale Hotel: http://sch.mp/0u4gh - RT @mrperki Good policy  @ The Yale Hotel http://instagr.am/p/HWYDX/","VancouverPicks","EN",0,0,"no url","2011-07-10 09:13:56"
"90043788034187265","2 bedroom #Apartment for rent in #Abbotsford $750. http://www.rentcompass.com/Rentals/Abbotsford/Apartment/33095-Old-Yale-Road/L41460","RentCompassList","EN",0,0,"no url","2011-07-10 13:04:46"
"90060460405178370","http://bit.ly/iNBMrL Yale University lectures online: Yale University has lectures from several of their courses... http://bit.ly/pxbgnd","FuzukeT","EN",0,0,"no url","2011-07-10 14:11:01"
"90131860033765379","Yale workplace accident highlights work and school danger. http://ow.ly/5ASiH","leading_lawyers","EN",0,0,"no url","2011-07-10 18:54:44"
"90217176396595201","WORLDmag.com | Community | Blog Archive | Save Yale, save the ...","htukittenpe","EN",0,0,"no url","2011-07-11 00:33:45"
"90449326916112384","It's rather interesting that the Yale class of 1773 produced possibly the best and worst American spies of the Revolutionary War.","History_Doctor","EN",0,1,"no url","2011-07-11 15:56:14"
"90585255915950080","@NotCoachTito Did Prince Fielder go to Harvard or Yale? What an educated interview..","CaptPat48","EN",0,0,"no url","2011-07-12 00:56:22"
"91012936528707584","@yale_oficial Ok ok spero star ahii muero de ganas! Graciaas nena!","nubecillaaa","ES",0,0,"no url","2011-07-13 05:15:49"
"91150291600293889","#WCS_at_Yale: Today, details of the campaign. Opposition Research w/ Annie Mayol and Polling w/ Drew Lieberman.  Good stuff","ctpcsw","EN",0,0,"no url","2011-07-13 14:21:37"
"91263416169267200","DTN Pakistan: ‘Last dinosaur’ fossil backs asteroid extinction theory: Washington,  Researchers from Yale Univer... http://bit.ly/qEJpeS","DTNPakistan","EN",0,0,"no url","2011-07-13 21:51:08"
"91272253551017987","My Take: Why we're drawn to Harry Potter's theology: I was a graduate student at Yale when I first heard words l... http://bit.ly/mYpgzp","Authenticiam","EN",0,0,"no url","2011-07-13 22:26:15"
"91526453526663168","@ViewFromVegas biggest upset I've found from last nights convo: Yale +20 dog against BC.","tribebrowns","EN",0,0,"no url","2011-07-14 15:16:21"
"91527426613583872","RT @mncee: Yale Environment 360: Analysis Suggests Ways to Dramatically Increase Wind Farm Output -  http://t.co/MJQJS2b","ACIadvancing","EN",0,0,"no url","2011-07-14 15:20:13"
"91550201675907075","@pmartinezarroyo Entonces la tierra que te iban a dar era de primera calidad, criada por jardineros titulados en Yale.","s9rgio","ES",0,0,"no url","2011-07-14 16:50:43"
"91602006988439552","New Yale Women's Crew Assistant Coach: Christine Glandorf http://fb.me/BJYhdGCs","rowersedge","EN",0,2,"no url","2011-07-14 20:16:35"
"91649657050120192","Esta página es una joya http://t.co/zd5HtVR cursos de Yale en linea gratis (via @REFORMACOM )","emiliomglez","ES",0,1,"no url","2011-07-14 23:25:55"
"91895745225048064","Yale NUS? liberal arts? No wayyyyy","royyeeo","EN",0,0,"no url","2011-07-15 15:43:47"
"91945221226643456","A Yale University lecturer says evil is the central theme of the Harry Potter franchise. When asked about the... http://fb.me/17hREKiJj","thehooch36","EN",0,0,"no url","2011-07-15 19:00:23"
"92013781340782592","Yale library  @ Yale University - Sterling Memorial Library http://instagr.am/p/HvPSl/","ONEshawshank","EN",0,0,"no url","2011-07-15 23:32:49"
"92214961132146688","@howsmyrolling www.datpiff.com look up harvard yale its free","Therealgavbeats","EN",0,0,"no url","2011-07-16 12:52:14"
"92240449909161984","I'm at AMC Southroads 20 (4923 E. 41st Street, 41st & Yale, Tulsa) w/ 2 others http://4sq.com/qOhBQg","irox","EN",0,0,"no url","2011-07-16 14:33:31"
"92322662487048192","U 17 Gold- Champions at Yale. Congratulations!","nhtomahawks","EN",0,0,"no url","2011-07-16 20:00:12"
"92366564241842176","@Yale_Oficial cuando se valla @SofiaSisniega @PaolaGalina y @portugalandrea :3  rayos es el ultimo día N L I. W. Golding :'(","Man_Fatale","ES",0,0,"no url","2011-07-16 22:54:39"
"92758475817492480","Solid difference between great traditions & great rivalries. Harvard-Yale is great tradition, America at large could care less of ""rivalry""","Schottey","EN",0,0,"no url","2011-07-18 00:51:58"
"92993694113869824","Yale SCHOLAR program nurtures budding scientists from New Haven School- The New Haven Register http://t.co/ZsE4rM4 via @nhregister","YaleGCGE","EN",0,2,"no url","2011-07-18 16:26:39"
"93021999743500290","A Yale study shows #Mormons are more likely to be faithful in their church as their education level goes up, opposite many churches. #lds","LDSFacts","EN",0,0,"no url","2011-07-18 18:19:07"
"93025510392733696","5 Dead After Head on Collision Near Yale - http://fwix.com/a/59_7d67f644b0","Tulsawire","EN",0,0,"no url","2011-07-18 18:33:04"
"93087632216702976","The Art and Architecture of the Indian Subcontinent: Second Edition (The Yale University Press Pelican Histor):  http://amzn.to/lbQnHS","NoboriAarkm","EN",0,0,"no url","2011-07-18 22:39:55"
"93146046938615808","Make millions? http://t.co/RdPUpZ5 #short #bonds #toronto #reuters #calgary #bloomberg #harvard #ucla #london #yale #stanford #economics 21","FirstFinInsight","EN",1,1,"no url","2011-07-19 02:32:02"
"93147292009369600","Make millions? http://t.co/3k1WiWq #short #bonds #toronto #reuters #calgary #bloomberg #harvard #ucla #london #yale #stanford #economics h3","bestdeedswords","EN",0,0,"no url","2011-07-19 02:36:59"
"93173061817348096","Search Home - Search Yale Digital Commons http://wp.me/p1voZ2-ab","MyWeb4Ed","EN",0,0,"no url","2011-07-19 04:19:23"
"93219605975269376","#MBA News: Yale/SOM Announces 2011/2012 Application Deadlines and Essay Questions http://ow.ly/1dS7vJ","mbaprepschool","EN",0,0,"no url","2011-07-19 07:24:20"
"93229596840960000","Finally I get to study what I ever wanted to.  Astrophysics | Yale Video Course - http://t.co/k2fCyNP","eprenen","EN",0,0,"no url","2011-07-19 08:04:02"
"93358882029699072","Andrew Lloyd Webber (Yale Broadway Masters Series):  http://amzn.to/iskAsA","RageKahofo","EN",0,0,"no url","2011-07-19 16:37:46"
"93381124478341120","Photo: This is a letter by Haydn written in perfect French! We have a collection of letters at Yale Music... http://tumblr.com/xyy3l5ft4w","yalemusiclib","EN",1,6,"no url","2011-07-19 18:06:09"
"93520429846769665","I'm sure Harvard and Yale beef like this too","cgaston1911","EN",0,1,"no url","2011-07-20 03:19:42"
"93520689922973696","La publicidad y comunicación de la marca #Yale esta de osooooo!!!! Pero aun así siguen incrementando sus vtas.  #nomelahagan","jorkuri","ES",0,0,"no url","2011-07-20 03:20:44"
"93545553748688897","Cocaine Lured Freud, Yale Surgeon Into Bowling Alleys, Drug Abuse: Books – Bloomberg: Cocaine Lured Freud, Yale ... http://bit.ly/nwJrCf","ukbookpublisher","EN",0,0,"no url","2011-07-20 04:59:32"
"93670967640993792","YDS Alums a Yale Alumni Leadership Exchange Dinner in Beijing that included participants from the Yale Alumni... http://fb.me/ERmixOEq","YaleDivSchool","EN",0,1,"no url","2011-07-20 13:17:53"
"93728861610713088","#whitehouse #carney Jay Carney used term ""ineluctable modality"" in briefing today. Had to look it up. From Joyce in Ulysses. Hook 'em, Yale.","ronflatter","EN",0,0,"no url","2011-07-20 17:07:56"
"93735635386515456","heading to trinity and uconnnn. stupid yale bookstore was closed. dumb.","allsilverkim","EN",0,0,"no url","2011-07-20 17:34:51"
"93760298510594048","GQ names #Yale one of 10 'Douchiest Colleges in America' http://bit.ly/pqc7Nk #NHV @GQMagazine","nhregister","EN",0,10,"no url","2011-07-20 19:12:51"
"93794867385339904","The ""skull-and-bones douche"" resides at Yale, #3 on our new Douchiest Colleges list. http://gqm.ag/oaCyie @yale","GQMagazine","EN",3,12,"no url","2011-07-20 21:30:13"
"93825011848183808","115th yale gotta boobe trap,damn tree down!!! bring yo ass down the block if u want too #first48 missing persons chicago,n imma watch it","GotChocolate28","EN",0,0,"no url","2011-07-20 23:30:00"
"93864157253877760","I got offers from UT yale stanford harvard rice tcu columbia and cornell...how the fuck did i end up at unt??","HimOva__There","EN",0,0,"no url","2011-07-21 02:05:33"
"93925905801547776","Art for Yale: A History of the Yale University Art Gallery:  http://amzn.to/lPaeM6","ThobariKarnyk","EN",0,0,"no url","2011-07-21 06:10:55"
"94074400965525504","#amzn toys- Martin Yale PB1 Shredder Bags: Martin Yale Office Shredder Bags - PB1 These Martin Yale small offic... http://amzn.to/ohQ4KX","ADMeyers11","EN",0,0,"no url","2011-07-21 16:00:59"
"94211164623486976","Yale's art school has about the worst website ever I've ever seen. My eyes are still hurting: http://t.co/1IZAbLk","carlvlewis","EN",0,0,"no url","2011-07-22 01:04:26"
"94378223764377601","Whiffenpoofs deliver a supurb concert in Fez: The Whiffenpoofs - Every year, 14 senior Yale men are selected to ... http://bit.ly/rkbpKG","MarocBlogs","EN",0,0,"no url","2011-07-22 12:08:16"
"94411753017974784","Kat, who is studying astronomy and has been accepted to Yale on a partial scholarship, also works at a local planetarium.","victortejano","EN",0,0,"no url","2011-07-22 14:21:30"
"94435979301093376","Calling young singers: Perform at the New Haven Open at Yale:  Know a budding Caruso or Beyoncé? Young crooners ... http://bit.ly/pbPn4m","bildung_news","EN",0,0,"no url","2011-07-22 15:57:46"
"94464869667057665","Indian Creek; Arawak Site on Antigua, West Indies; 1973 Excavation by Yale University and the Antigua Archeolog... http://amzn.to/mAZB6F","SamidareNarapb","EN",1,1,"no url","2011-07-22 17:52:34"
"94516879049240576","Acupuncture Reduces Hot Flashes After Chemotherapy – Yale Study  http://t.co/u0N8pNM","AcupunctureCEUs","EN",0,0,"no url","2011-07-22 21:19:14"
"94540383924649984","Acupuncture Reduces Hot Flashes After Chemotherapy – Yale Study: In most cases, the use of the chemotherapy agen... http://bit.ly/rgaGFn","BestDeals4Now","EN",0,0,"no url","2011-07-22 22:52:38"
"95206741398142977","#Peru Facts, Did U Know: TODAY marks the 100th anniversary of the Western discovery of Machu Picchu by Yale Professor Bingham.","emilyadrianna","EN",9,36,"no url","2011-07-24 19:00:30"
"95778420830650368","Master Drawings from the Yale University Art Gallery:  http://amzn.to/iASFBp","HolySougaxj","EN",0,0,"no url","2011-07-26 08:52:09"
"95846846714490880","colleges that bring highest pay-check. Yale not among them http://t.co/NNGutvz","LinaComley","EN",1,0,"no url","2011-07-26 13:24:03"
"95871190412951552","Said Nasretdinov ’11: What made Yale SOM great was the “diversity in the class.” http://ow.ly/5NBYM","YaleSOM","EN",0,2,"no url","2011-07-26 15:00:47"
"95874587832750080","@robinhosking @farrowharvey NYU & Columbia are good programs. Yale too, & then you'd be there for New Haven Open","BostonGal04","EN",0,0,"no url","2011-07-26 15:14:17"
"95932150465048576","Also for those interested in non-profit work, check out tonight's panel in NYC by Yale Alumni Non-Profit Alliance http://t.co/P0vHhOW","YaleAlumAssocNY","EN",0,0,"no url","2011-07-26 19:03:01"
"95979541889171456","Y We Gt Streets Named Aftr Schools We Cant Afford && Shit. Yale, Princeton, Harvard ..University, Wat Is They On Wit Us?.! Lol","FerreroC_Rocher","EN",0,0,"no url","2011-07-26 22:11:20"
"96022579646697472","Yale's latest victim: Franco romance: Many a romance has fallen victim to the academic pressures of Yale. Case i... http://bit.ly/oR9z9I","LargeDating","EN",0,0,"no url","2011-07-27 01:02:21"
"96024345448693760","The Art and Architecture of Japan: Third Edition (The Yale University Press Pelican Histor):  http://amzn.to/lelEWn","YuzukiEisenpo","EN",0,0,"no url","2011-07-27 01:09:22"
"96032973127811072","Barack Obama's record on the environment | Environment | guardiancouk: How is Obama doing? Yale Environment 360 ... http://bit.ly/oeOqNl","Shakira_Shak","EN",0,0,"no url","2011-07-27 01:43:39"
"96155098677391360","http://books4business.net/r/56/why-globalization-works-yale-nota-bene-reviews.html business book: Wh Nota Bene) Reviews #Bene #Globalization","books4business2","EN",0,0,"no url","2011-07-27 09:48:56"
"96184567903424513","@azevedonelson buenos dias !!! Mientras abro mis ojos recuerdo y pienso en todo lo maravilloso q es star contigo. Que tengas un buen dia","yale_albornoz","ES",0,1,"no url","2011-07-27 11:46:02"
"96249546048413696","Indian guys are hott! There's this Indian journalist from Yale! He needs to come my way.. Too bad he's my teacher haha!!","SeXiiGiirL28","EN",0,0,"no url","2011-07-27 16:04:14"
"96291725395501057","Can wrinkles mean bone loss? A recent Yale study says yes. Take care of your body from the inside out – get ti… (cont) http://deck.ly/~ujU1W","DrKFields","EN",0,3,"no url","2011-07-27 18:51:51"
"96339740344848384","ok this yale camp talent show has the bass, guitar drums kb playrr. they goin all out.","LeShealuvbnme","EN",0,0,"no url","2011-07-27 22:02:38"
"96407734194417665","j #TIME...The Book (Video Trailer) http://t.co/cs1ARii #calgary #london #newyork #poems #imagine #yale #france #harvard #uae #france","bestdeedswords","EN",0,0,"no url","2011-07-28 02:32:49"
"96431461384732673","Introducing Intimus Multimedia Shredders and Martin Yale Pharmacy Shredders - http://tinyurl.com/4ynd8g4","multimediadaily","EN",0,0,"no url","2011-07-28 04:07:06"
"96441666117971968","@Yale_Oficial pues mañana pregunto bien y ya t aviso para q vallamos vale!!! ;)","Man_Fatale","ES",0,0,"no url","2011-07-28 04:47:39"
"96574080307838976","@goon48 Guess the answer was UNH. Figured obsession with Yale was the reason for the tweet!","MikeSwainey","EN",0,0,"no url","2011-07-28 13:33:49"
"96618162434486272","@forever21 Has some Alabama and Auburn sweats right up there with like Harvard and Yale. I thought it odd/cool.","CarrieEckles","EN",0,0,"no url","2011-07-28 16:28:59"
"96653743558373377","Job on @USTFCCCA: Assistant Coach: Yale University Assistant Coach Men’s Cross Country and Track and Field Prima... http://bit.ly/qWehr4","USTFCCCA","EN",0,2,"no url","2011-07-28 18:50:22"
"96698780581236736","A venerated Yale professor suggests we solve the debt-ceiling crisis with trillion-dollar coins http://t.co/URnEkFR","NYMag","EN",4,19,"no url","2011-07-28 21:49:20"
"96717936538034176","And he was gon send my sista to Yale.","ShawtyGoHard90","EN",0,0,"no url","2011-07-28 23:05:27"
"96721457920475136","@Nocaseyanthony:I'm a 3L at Yale and I volunteer my services to anyone who wants to sue her. Any money she gets, I'll help take it away.","AS307","EN",0,3,"no url","2011-07-28 23:19:27"
"96801512239542272","Two developmental psychologists at Yale are now suggesting these and many other non-scientific beliefs�their list... http://dlvr.it/d0PkL","WhySupernatural","EN",0,0,"no url","2011-07-29 04:37:33"
"96833187631738880","Yale University Hotels - Get the best deals on hotels near Yale University, and save ! http://t.co/h037Q4w via @UnivHotels","AlessaTravelTip","EN",0,0,"no url","2011-07-29 06:43:25"
"96906063672127488","News: Yale's 'World Fellows' program a melting pot of elites  (AFP) http://yhoo.it/oJdm9F","SummerJobsQ","EN",0,0,"no url","2011-07-29 11:33:00"
"97089216340701184","Check this video out -- Ancient Art, Modern Science: 200 Years of Medicine at Yale http://t.co/azggMlH via @youtube","yachachiq","EN",0,0,"no url","2011-07-29 23:40:47"
"97116370432573440","I used to think Disney was the happiest place on Earth, but then I came to @Yale","fcojavier_gr","EN",0,1,"no url","2011-07-30 01:28:41"
"97117409869172736","Sad to see well researched pieces vanish from web: Alex Cockburn: GW Bush Dealt Cocaine at Yale & much more www.antifascistencyclopedia.com/","PamelaDrew","EN",0,2,"no url","2011-07-30 01:32:49"
"97167520947109888","Harvard, Yale, and Bard Back ‘Floating University’ That Showcases Scholars’ Online Lectures http://bit.ly/oItR0M","martaescotet","EN",0,1,"no url","2011-07-30 04:51:56"
"97377012582326273","""Crisis? What Crisis?"" Yale law professor Bruce Ackerman with some useful perspective on the debt showdown: http://slate.me/oNjw0Y","Atul_Gawande","EN",15,33,"no url","2011-07-30 18:44:23"
"97518390121463809","That's why he didn't get accepted to Yale! 0.o","jemisonvalencia","EN",0,0,"no url","2011-07-31 04:06:10"
"97534559138226177","Preaching tom. 10:30 AM @ Yale Ave Presby Church, 5th & Yale. Message is: ""It Ain't Over Til It's Over - You Have a Story"" #RadicalChurch","UprisingTulsa","EN",0,0,"no url","2011-07-31 05:10:25"
"97540796076666880","Lol yes! RT @MissAianna: I got this sweats today that say 'YALE' on them lol I can always dream right !?","O_Ash","EN",0,0,"no url","2011-07-31 05:35:12"
"97551835501576192","New Haven Jobs: IT Support Technician 2: Yale University - Yale, MI - New Haven, CT - 1.... http://dlvr.it/dF6M2 #Jobs #NewHaven","New_Haven_Job","EN",0,0,"no url","2011-07-31 06:19:04"
"97741388669657088","Yale Law's Balkin on the 14th Amendment option: Bondholders win, Seniors loose, Obama gets impeached  http://t.co/LsPl8S5 (via CNN.com)","ross_abbey","EN",0,0,"no url","2011-07-31 18:52:17"
"97804844278091776","I'm at Yale University - Old Campus (344 College St, New Haven) http://4sq.com/pVqRTi","glennstrachan","EN",0,0,"no url","2011-07-31 23:04:26"
"97827910785835008","Memo to the guy in the gold BMW with the Yale bumper sticker playing a fucking RECORDER at a red light: I respect you implicitly.","bornferal","EN",21,2,"no url","2011-08-01 00:36:06"
"97910469435736064","Hearing Brickhouse for the first time at The Yale. Lead singer has an insane voice. Note to self. #yvr","ryanjespersen","EN",0,0,"no url","2011-08-01 06:04:09"
"98346295395221506","RT @imsure Yale Food Cop: You’re Incapable of Eating Right http://is.gd/C1Jmsk","Starr_Foxx","EN",0,0,"no url","2011-08-02 10:55:58"
"98443779396210688","Forgot my phone. I feel naked :( exploring New haven and visiting Yale!","sgochuico","EN",0,0,"no url","2011-08-02 17:23:20"
"98446660870483969","Coke product plants 'Idol;' Yale fat think tank wigs out... http://bit.ly/2PMNv0","ctcapitolreport","EN",0,0,"no url","2011-08-02 17:34:47"
"98466793538068481","I'm at 26 Beach Cafe (3100 Washington Blvd, at Yale Ave., Venice) http://4sq.com/pUjntC","Armpitlazers","EN",0,0,"no url","2011-08-02 18:54:47"
"98478399177236480","Ontwerpwedstrijd: Logo - Yale University Center for the Translational Neuroscience of Alcoholism http://bit.ly/qtDZXx #Crowdspring","Ontwerp_wedstr","EN",0,0,"no url","2011-08-02 19:40:54"
"98488125776605184","We are already looking forward to fall career fairs @harvard, @yale, @brownuniversity, Davidson, @barnardcollege, @dartmouth and Princeton!","CarneySandoe","EN",0,0,"no url","2011-08-02 20:19:33"
"98832343892111360","Got milk? No, but Nia Froome has a successful vegan baking business. Now it's time for freshman year at Yale. http://fb.me/FEp3bPnc","yalealumnimag","EN",0,1,"no url","2011-08-03 19:07:21"
"98837712630591488","The Yale Bulldog Shop is GOING LIVE!! Drawings by 'yours truly'... check it out! :) http://fb.me/EerMUJ6E","BeTheBreeze","EN",0,0,"no url","2011-08-03 19:28:41"
"98845413364338688","Law schools that produce the most partners: http://t.co/H8XwzIm Very interesting- Harvard #1, UT #9, NW #10, Yale #16 (!) #Law @BabyAlchian","MattHoberg","EN",0,0,"no url","2011-08-03 19:59:17"
"98896126698209280","@dmcg1230 doug lampher would have it no other way... phi, yale","TheCampGrounds","EN",0,0,"no url","2011-08-03 23:20:48"
"98906008751063040","RT @yalemusic: Season tickets to the Horowitz Piano Series + the Oneppo Chamber Music Society are now on sale! http://bit.ly/n2wYFz","Yale","EN",0,2,"no url","2011-08-04 00:00:04"
"99005522535129088","product review http://t.co/oEiZpZY Medtronic to Make Public Release of Infuse Data for Yale Review","Tawandaljubp","EN",0,0,"no url","2011-08-04 06:35:30"
"99102633255641089","A.M. Vitals: Medtronic Will Fund Yale Study of Infuse Spinal Product http://hisoc.us/oDjdVe","HealthIsSocial","EN",0,0,"no url","2011-08-04 13:01:23"
"99116700951265280","Improved Yale Links Menu Coming Monday: The Yale University Library is pleased to offer a streamlined and simpli... http://bit.ly/nkSfbr","YaleClassicsLib","EN",0,0,"no url","2011-08-04 13:57:17"
"99119267844325376","☠☢☤☣☀ Medtronic hires Yale experts for spine drug review: Medtronic hires Yale experts for spi... http://on.fb.me/oOPx0D ☀☣☤☢☠","arishmaryshow","EN",0,0,"no url","2011-08-04 14:07:29"
"99240877511290882","$4000/5bd-3Ba Beautiful, Modern Large House For Rent http://bit.ly/nO2yMr (Wayland St at Yale St)","hb_excelsior","EN",0,0,"no url","2011-08-04 22:10:43"
"99654683332841472","accident at 1885 S YALE AVE ; PULLED INTO REASORS P/L. http://tulsata.com/a/32548","tulsata","EN",0,0,"no url","2011-08-06 01:35:02"
"99833176142262272","You know what it is, its the yale in the air its very intimidating..","AwesomeVines","EN",0,0,"no url","2011-08-06 13:24:18"
"99864750862774272","Pues que te digo que me haces muy feliz :) yale","yaeelLC","ES",0,0,"no url","2011-08-06 15:29:46"
