"tweet_id","text","author","language","likes","retweets","media","timestamp"
"89050765624213504","Reminder for New Jersey folks: Our Editor-in-Chief Asma Uddin will be at Princeton Theological Seminary this... http://fb.me/zjHU3eyj","AltMuslimah","EN",0,0,"no url","2011-07-07 19:18:51"
"89177504899805185","@DaMindlessBiebs can I please get one with Princeton????? :) n btw I love your tweets :)","ita2luv","EN",0,0,"no url","2011-07-08 03:42:28"
"89329007337799681","@sabrefreakydeak Amen to that - I was there last weekend in Princeton, NJ - Never happier to see the WELCOME TO NY sign!","MusingMaryAnn","EN",0,0,"no url","2011-07-08 13:44:29"
"89335839879991296","Adam Kantor & Veronica J. Kuehn Join AVENUE Q in July as 'Princeton' & 'Kate': The Tony Award winning musical, A... http://bit.ly/ppY5fn","ANMT","EN",0,0,"no url","2011-07-08 14:11:38"
"89376285540892672","closertomydreams121 asked: Is Lydia Like Just A Fan That Says She Goes Out With Princeton Or Does She... http://tumblr.com/xtn3e5ou1f","MBsoldiers","EN",0,0,"no url","2011-07-08 16:52:21"
"89403087143444480","Stay Tuned about #princeton at http://tiny.cc/oqbtn","photodecoration","EN",0,0,"no url","2011-07-08 18:38:51"
"89427388961783809","Patent Paralegal with 3+ years for Public Corporation - Princeton, NJ  http://bit.ly/gdr8bQ","SmartHireinc","EN",0,0,"no url","2011-07-08 20:15:25"
"89488353141075968","Patriot Online: As a Indiana Chevrolet Pontiac Buick GMC Dealer  customers from Evansville  Princeton and ... http://tinyurl.com/3bevjs7","addyourlink","EN",0,0,"no url","2011-07-09 00:17:40"
"89686949253742592","Una colección sobre traducción y literatura comparada en Princeton University Press: http://t.co/fMDJdCt","Malapartiana","ES",0,0,"no url","2011-07-09 13:26:49"
"90053959246548992","Make Up Artistry | Kendall Park / Princeton NJ-Hair Mania Salon & Spa Styling Nails: www.hairmaniasalonandspa.co... http://bit.ly/o1z3ml","Paige1136","EN",0,0,"no url","2011-07-10 13:45:11"
"90214970020724736","Princeton soooo cut that shirt !!!","LoveCharity_","EN",0,2,"no url","2011-07-11 00:24:59"
"90421174760247296","Princeton transport has severely deteriorated since the last time I visited. Dinky has been replaced by infrequent bus.","jorgitomusser","EN",0,0,"no url","2011-07-11 14:04:22"
"90476426326847488","Taking the girl to see her dream school...Princeton. She saw it in a movie once, thought it was pretty & now wants to go. #waytopickacollege","KerryOCerra","EN",0,0,"no url","2011-07-11 17:43:55"
"90489982317375488","16lb baby...damn. Princeton 17months nd only weigh 23. I cant imagine that comin outta me","MiszEclipse","EN",0,0,"no url","2011-07-11 18:37:47"
"90500858143449088","#StolenVehicle at E PRINCETON ST / I4 EBO[E PRINCETON ST & I4 , Orlando, FL]. #orlpol","orlpol_strange","EN",0,0,"no url","2011-07-11 19:21:00"
"90622081905082368","@MindlessBhavior U should make poetry because ur soo motivational and ur tweets mean so much to me #Princeton","MindlessBeauty1","EN",0,0,"no url","2011-07-12 03:22:42"
"90635788915703808","@PrincetonMB,dear princeton can i be your miss.right of the week,because i like u for u,im from Jackson","SchcarriC","EN",1,0,"no url","2011-07-12 04:17:10"
"90739551793975296","Are you a good fit for this job? Sr. Enterprise Architect in Princeton, NJ http://bull.hn/l/2TFC/6 #job","DPCriticalPath","EN",0,0,"no url","2011-07-12 11:09:29"
"90757327224975360","#AccidentInjuries at N JOHN YOUNG PY & W PRINCETON ST[W Princeton St, Orlando, FL]. #orlpol","orlpol_strange","EN",0,0,"no url","2011-07-12 12:20:07"
"90789992464515072","WTHR.com: Princeton movie theater closes after 63-year run: A southern Indiana movie theater that began showing ... http://bit.ly/p1lDOJ","WTHRcom","EN",0,0,"no url","2011-07-12 14:29:55"
"90795462021484544","When someone say ""Princeton my man"" I say oh hell noo #stopitrightthere","DanceIsLife_Mia","EN",0,1,"no url","2011-07-12 14:51:39"
"90952991544324096","Surprised I remembered how to get here. (@ Princeton Club East Side) http://4sq.com/nCQoDJ","cjune51","EN",0,0,"no url","2011-07-13 01:17:37"
"90957638828965888","What do Princeton students and the poor have in common? David Brooks tells us: http://nyti.ms/pcG2fv","truthnprogress","EN",0,0,"no url","2011-07-13 01:36:05"
"91000101945884673","@LoveeLenaaM i wanna b name Quansha nd it nd i wanna b Princeton gf","mzprinceton15","EN",0,0,"no url","2011-07-13 04:24:49"
"91031907348918272","PRINCETON: Volunteer!: Making new friends at SAVE animal shelter: The socialization is important: it readies the dog... http://adf.ly/258S2","catsloverz","EN",0,0,"no url","2011-07-13 06:31:12"
"91073074430087168","I'm at Lakeview Trailer Court (Princeton Rd, Depue) http://4sq.com/nLSJJF","nascarqdog","EN",0,0,"no url","2011-07-13 09:14:47"
"91137360544268289","Princeton Mexican Migrant Project: Illegal Flow of Migrants To The United States Has Nearly Stopped http://t.co/g6b0pZG","kramos1841","EN",0,0,"no url","2011-07-13 13:30:14"
"91181807592157184","Township Pilot Food Waste Pickup Program Is Going Strong; Pellichero Hopes It ...: Princeton Township's Organic ... http://bit.ly/nWv0NM","helenlowell","EN",0,0,"no url","2011-07-13 16:26:51"
"91189952917946368","I'm at Princeton Club (8080 Watts Rd, S High Point Rd, Madison) http://4sq.com/qgGclb","MKEBND","EN",0,0,"no url","2011-07-13 16:59:13"
"91209972347699200","Two hospices join forces to remodel hospital rooms for inpatient #hospice unit at Princeton Community Hospital http://t.co/VZuaN9h","hospicepharmacy","EN",0,0,"no url","2011-07-13 18:18:46"
"91271947450724352","30+ Artists respond to the inhumane policies along border states. July in Princeton, NJ. http://ow.ly/5AHu8","favianna","EN",0,1,"no url","2011-07-13 22:25:02"
"91290742034673664","Shout out to our bro Adrian...his son Princeton was born early this morning! #Blessed","GoGettasMusic","EN",0,0,"no url","2011-07-13 23:39:43"
"91315710751539202","Check this video out -- MINDLESS BEHAVIOR SING OFF http://t.co/cGnP2j3 via @youtube.who do u think won?prodigy or princeton","Symphony12345","EN",0,0,"no url","2011-07-14 01:18:56"
"91316318925635585","RT @stormspotter81: pic of thunderstorm top looking south from Princeton Indiana #tristatewx http://twitpic.com/5prlcb","colonialdude","EN",0,0,"no url","2011-07-14 01:21:21"
"91324317446578176","Si quiere saber que es la HOMEOPATÍA, vea esto (James Randi en Princeton) http://t.co/SNB6D0c","GaboTuitero","ES",0,0,"no url","2011-07-14 01:53:08"
"91373885731241984","Princeton Tec Fuel 3 Headlamp - $11.99 - 56% off. http://bit.ly/cdsteepcheap","steepcheap","EN",0,0,"no url","2011-07-14 05:10:06"
"91381695571439616","#imagine Princeton wraps his arms around you from behind, he whispers: I love you! in your ear and kisses you on the cheek (:","DaMindlessBiebs","EN",13,8,"no url","2011-07-14 05:41:08"
"91387093581959168","Jersey City Jobs: Java/BPM Developer - Reference Data: Princeton Information - Jersey City, NJ -... http://dlvr.it/b6KMH #Jobs #JerseyCity","Jersey_City_Job","EN",0,0,"no url","2011-07-14 06:02:35"
"91520136904835072","Good Luck to our Rattlers as they take on Princeton HS at noon in today's 7 on 7 State Tournament on the campus of... http://fb.me/xvI9RMVC","NavasotaISD","EN",0,0,"no url","2011-07-14 14:51:15"
"91537730902835200","#imagine PrinceMom: what is that ? *points to his wrist* Princeton: oh i wrote i love [your name] PrinceMom: awwww that is so cute ♥","DaMindlessBiebs","EN",9,7,"no url","2011-07-14 16:01:10"
"91591079362707456","@Official_iOla omg i love them they are amazing , i think ray ray and princeton are the best out of all of them","lilmizcrazzy","EN",0,0,"no url","2011-07-14 19:33:09"
"91910429479157760","#theIVD Awesome session on innovation with Prof. Wole Soboyejo- Professor of Mechanical & Aerospace Engineering at Princeton Uni. @theIVD","eseoraka","EN",0,0,"no url","2011-07-15 16:42:08"
"91919866667343872","Happy #FF! @TownTopics @princetoninfo @Princeton @PrincetonPL @TicosEatery @dcilea @PRtips @mccarter @gfsnj @HiTOPSInc @BFFox @ywcaprinceton","NassauInn","EN",0,0,"no url","2011-07-15 17:19:38"
"91940565586935808","They wasted tax payers money over a man w hand gun.. Princeton n West Windsor had pics officers @ the scene. Smdh","mercymarque","EN",0,0,"no url","2011-07-15 18:41:53"
"91968268960665601","Resignation of WSJ publisher/Dow Jones CEO is local story in Princeton. Co has large local ops + hometown late editor/CEO Bernard Kilgore","twmtalks","EN",0,0,"no url","2011-07-15 20:31:58"
"91969124565123073","I'm at Orlando Science Center (777 East Princeton Street, Orlando) w/ 2 others http://4sq.com/phQEjO","FlawdazFinest86","EN",0,0,"no url","2011-07-15 20:35:22"
"92003689836978176","PRINCETON: Area activities honor our independence http://t.co/al19y89","selenapolhemuw","EN",0,0,"no url","2011-07-15 22:52:43"
"92046467547672576","Save up to 60% on watches! Shop our current #sale at Princeton Watches ... http://tinyurl.com/6aguxl7","emmaburnsapp","EN",0,0,"no url","2011-07-16 01:42:42"
"92246930104647680","Senior Executive Secretary Job: Fidelity - Princeton, NJ - as neededQualificationsEducation and... http://bit.ly/noMjGh New Jersey  Jobs","NewJersey_Jobs_","EN",0,0,"no url","2011-07-16 14:59:16"
"92263107535183872","On my way to Princeton,IL.That's always fun..right?","AllisTheName","EN",0,0,"no url","2011-07-16 16:03:33"
"92316291314094080","NRG Energy Scores Solar Victory for Washington Redskins: NRG Energy, a Princeton-based energy company, plans to ... http://bit.ly/rftyil","pennsolarpower","EN",0,0,"no url","2011-07-16 19:34:53"
"92360461525331968","PAPER: The disappearing black middle class:  Princeton Professor Cornel West (center) eagerly shakes the hand of... http://bit.ly/qxhiir","ColonelSixx","EN",0,0,"no url","2011-07-16 22:30:24"
"92378631246053376","@envymyprinceton its between rayray and princeton so I pick princeton","Mindl3ssPassion","EN",0,0,"no url","2011-07-16 23:42:36"
"92412873556508672","A sad finish on the Anchor House Ride for Runaways as Princeton Township resident Doug McCune dies in an accident... http://fb.me/w1RYE7hW","PlanetPrinceton","EN",0,0,"no url","2011-07-17 01:58:40"
"92441680032182272","Really! I tweet @MindlessBhavior hoping to get a reply from Princeton a few minutes ago and here they r nw tweeting :C","MindlessChika","EN",0,0,"no url","2011-07-17 03:53:08"
"92472495583670272","Okay time to draw Princeton....","Chelseas_Unique","EN",0,1,"no url","2011-07-17 05:55:35"
"92619933762068480","RT @DaMindlessBiebs: #Imagine You: never let me go. Princeton: i would never let the best thing that ever happen to me in my life go *Smiles","MindlessChika","EN",0,0,"no url","2011-07-17 15:41:27"
"92669309117149184","i will kill myself if ray ray and princeton won't follow me i won't go tht far love u princeton and ray ray!!!","dfraz22","EN",0,0,"no url","2011-07-17 18:57:39"
"92685377499967488","@teammindless11 same but Princeton's 1st","143Princess_30","EN",0,0,"no url","2011-07-17 20:01:30"
"92745901298294784","I'm at Zaxby's (3770 Princeton Lakes Pkwy SW, Atlanta) http://4sq.com/oR3nkp","marvie3grl","EN",0,0,"no url","2011-07-18 00:02:00"
"92747746796240896","Rachel is wearing a Princeton shirt.... ANOTHER COLLEGE MISREPRESENTATION #BB13 #CBSBigBrother","BBInsanity","EN",0,0,"no url","2011-07-18 00:09:20"
"92748925378904064","@thinkinboutroc LOL yea,, you have a pic of yu and Princeton?","KKelley14","EN",0,0,"no url","2011-07-18 00:14:01"
"92799072494305281","Im going to sleep nw nitey nite luve u @MindlessBhavior #Princeton","MindlessBeauty1","EN",0,0,"no url","2011-07-18 03:33:17"
"92830432105734144","Ray Ray is teaching Princeton on how to be freaky.","iamShay","EN",2,7,"no url","2011-07-18 05:37:54"
"92831565763194880","Woah! @mindlessbhavior princeton u know wat u just did? Omg!! (= You done got me started.","iHartJHarris","EN",0,2,"no url","2011-07-18 05:42:24"
"92884564980154368",":O :O :O :O at that video w. Princeton ohh lawwwd.","iCRAVEDiggy","EN",0,0,"no url","2011-07-18 09:13:00"
"93108452754341888","PRINCETON: 101 Fund helps PHS grads pay for college: Combined with her sister finishing college, a fact that dra... http://bit.ly/qBtadK","College_Grant","EN",0,0,"no url","2011-07-19 00:02:39"
"93119008638906368","The Princeton Public Library has expanded its popular Museum Pass program to include the Grounds for Sculpture in... http://fb.me/WRPivQhV","PlanetPrinceton","EN",0,2,"no url","2011-07-19 00:44:36"
"93130393150160897","Princeton follow me I love u u the best mindless behavior 1-4-3 ;)","lilpebbless1","EN",0,0,"no url","2011-07-19 01:29:50"
"93145626866483201","I'm going to @MindlessBhavior's show @HOBCleveland on 7/24 to see if I'm Mrs. Right! #MrsRightOH Get tix at http://t.co/ezKNM8D #princeton","prodigy_wifey13","EN",0,0,"no url","2011-07-19 02:30:22"
"93164870320660480","Saw car w/ these college stickers on back window: Harvard, Princeton, Brown, Stanford. Why not just put ""My dumbest kid went to Stanford""","juliefishman","EN",0,0,"no url","2011-07-19 03:46:50"
"93184726172569600","RT if @MindlessBhavior are the cutest #Princeton,#RayRay,#Prodigy,#RocRoyal :)","QPrinV3","EN",1,3,"no url","2011-07-19 05:05:44"
"93296554680651776","These are for clients that would like to preview the offsite space in Princeton (@YouTube http://youtu.be/-1XZbAlxyAo?a)","cliffsinon","EN",0,0,"no url","2011-07-19 12:30:06"
"93330671153577985","Serge Goldstein – DataSpace [ #rdlmw ]: I’ve reported on Serge’s experimental model at Princeton before, at http... http://bit.ly/pOd131","orensr","EN",1,0,"no url","2011-07-19 14:45:40"
"93336757080301569","Princeton RDLM: Bill Michener: we don't need more data repositories -- we have 500 mill. silos now-- we just need interoperability.","kbaker_hms","EN",0,0,"no url","2011-07-19 15:09:51"
"93369523016712192","To the Jacob perez on fb ur phony ass needa gtfoh ur NOT Princeton Princeton don't even act the way u do u always got sum issues n u on 24/7","ILoveDeeJaay","EN",0,0,"no url","2011-07-19 17:20:03"
"93370424775294976","#imagine *you & Princeton are watching a love story* *movie goes off* Princeton : RIPOFF!!! They stole the story of you & me *kisses you* ;)","iStanForYOU","EN",0,0,"no url","2011-07-19 17:23:38"
"93400518885511168","Now hiring: Microstrategy Developer - Princeton Information - Jersey City, NJ http://jobcircle.com/z106z #jobs","princeton_info","EN",0,0,"no url","2011-07-19 19:23:13"
"93442730360975360","Theft on HENRY HALL, Princeton, NJ (via spotcrime.com): Theft http://bit.ly/r4WvT4","princeton_crime","EN",0,0,"no url","2011-07-19 22:10:57"
"93489027113680896","@143Musicisluv hell yea he finee !!! That y ever1 said princeton :D","M3m3_alday","EN",0,0,"no url","2011-07-20 01:14:55"
"93490469958467584","Doesn't it seem like Princeton is the ONE that stands out?","MagicCity_Movie","EN",0,5,"no url","2011-07-20 01:20:39"
"93509323354939394","@iKissPrinceton I Just Want To Hear Princeton's Sexy Voice !","Dally_Bear","EN",0,0,"no url","2011-07-20 02:35:34"
"93529770595328001","A degree is a degree no matter were u get it from unless it's harvard or princeton","To_Fresh_Shawty","EN",0,0,"no url","2011-07-20 03:56:49"
"93640667980500994","Visited one of my favorite rustic style microbreweries in Princeton NJ with friends to celebrate Krystle's engagement! http://t.co/3sed7JM","ElleKayDesign","EN",0,0,"no url","2011-07-20 11:17:29"
"93642639294996480","Know anyone for this job? Director Nursing Programs- Medicaid in Princeton, NJ http://bull.hn/l/2JMC/5 #job","dennissalinas","EN",0,0,"no url","2011-07-20 11:25:19"
"93668937597861888","This Sat 1am...ISR's Ivy League Indie Mix ftg bands from Brown, Harvard, Princeton, Cornell, Dartmouth and more!","indiesouprunner","EN",0,0,"no url","2011-07-20 13:09:49"
"93681311050510336","On this day in History in 1876: The first U.S. intercollegiate track meet is held in Saratoga, New York; Princeton wins.","AtoBoldon","EN",1,13,"no url","2011-07-20 13:58:59"
"93687195390582784","thank you princeton for eating my underwear into tiny pieces","KerrieHurley","EN",0,0,"no url","2011-07-20 14:22:22"
"93732523238113280","MICHELLE!!! Michele--one of the hardest working ladies at the Princeton Shopping Center (PRINCETON LAUNDROMAT... http://fb.me/vODQ0r00","psc301harrison","EN",0,0,"no url","2011-07-20 17:22:29"
"93762613166616576","@MountainRiding how's it going? Thnx for the follower, Hows the trails out there? I normally go up near Mt. Princeton but couldn't this year","cowbbret","EN",0,0,"no url","2011-07-20 19:22:03"
"93765381403066368","Flatland: A Romance of Many Dimensions (Princeton Science Library):  http://amzn.to/kDymid","MiyakaSundaad","EN",0,0,"no url","2011-07-20 19:33:03"
"93851301733076993","The Messiah: Developments in Earliest Judaism and Christianity : The First Princeton Symposium on Judaism and C... http:/...  #bethaderej","BetHaderej","EN",0,0,"no url","2011-07-21 01:14:28"
"93890610750160896","Join us this Friday @ 6am at the ship,God is doing amazing things! 45th and princeton.","jaysee3rocks","EN",0,0,"no url","2011-07-21 03:50:40"
"93953890197835776","Wallace Stevens: Imagination and Faith (Princeton essays in literature):  http://amzn.to/kGEbT6","CinqueKaorijg","EN",0,0,"no url","2011-07-21 08:02:07"
"94018520257527808","July 23: Princeton, W. Va. Baseball Team Promotes “Coal” TV Show on Saturday, #mining, http://t.co/h0AYKNk","MiningConnect","EN",0,0,"no url","2011-07-21 12:18:56"
"94020139237900288","A bit more background on the Floorgraphics/ Murdoch #hacking from my Princeton Comment 'Bad Deeds Will Out' post http://ow.ly/5JQIF","BFFox","EN",0,1,"no url","2011-07-21 12:25:22"
"94027869356957696","Monday Morning Flowers Princeton Nj http://knbykl.org/103649.htm #Japhette #Peony","FlowersShopping","EN",0,0,"no url","2011-07-21 12:56:05"
"94085285180219395","@TeddyBearBestie ray ray and roc and princeton did some freaky moves when is prodigy going to do something?","teammindless11","EN",0,0,"no url","2011-07-21 16:44:14"
"94128612340539392","I'm at Exclaim Mobility (3490 US Hwy 1, Princeton) http://4sq.com/ohqvrS","DrewG78","EN",0,0,"no url","2011-07-21 19:36:24"
"94181854806151168","Now hiring: Help Desk Support - Intermediate - Princeton Information - Dulles, VA http://jobcircle.com/z9332499 #jobcircle #jobs","virginiajobs","EN",0,0,"no url","2011-07-21 23:07:58"
"94195968676872193","Phoenix Jobs Office Assistant - The Princeton Review -  Phoenix, AZ: The Princeton Review is looking for a part-... http://bit.ly/okzfdj","JobsPhoenix","EN",0,0,"no url","2011-07-22 00:04:03"
"94212968190984192","Choose a hotel in #Princeton, #West Virginia here! http://bit.ly/m30g61","screamradius","EN",0,0,"no url","2011-07-22 01:11:36"
"94218278167248897","Princeton GARAGE SALE 7/22 & 7/23 http://bit.ly/mV5ZqX","PrincetonAds","EN",0,0,"no url","2011-07-22 01:32:42"
"94314508075536384","Foreign Influences in American Life: Essays and Criticism (Princeton paperbacks, 47):  http://amzn.to/igBfv8","TazunaSyuna","EN",0,0,"no url","2011-07-22 07:55:05"
"94392295633334272","Looking for a  Peoplesoft Project Manager in Princeton, NJ http://bull.hn/l/2FZM/ #job","veenarecruiter","EN",0,0,"no url","2011-07-22 13:04:11"
"94393784615452672","Rutgers...man oh man.. where to begin. Trips to Princeton or NY train rides on NJ transit...yeah I made moves","ShoeFreaKStro","EN",0,0,"no url","2011-07-22 13:10:06"
"94401451803164672","Letter to @TownTopics says ""Princeton composting program is easy, effective, convenient and economical"" http://bit.ly/qRKFfJ","sustainptn","EN",0,0,"no url","2011-07-22 13:40:34"
"94529976635895808","#Tesla's Model S design prototype coming to Princeton NJ this weekend. Details here: http://ow.ly/5LlwI","TeslaMotors","EN",1,10,"no url","2011-07-22 22:11:17"
"94533981994881026","This Weekend in Princeton: a bounty of Rossini, Menotti and Thomas Pasatieri at @OperaNJ http://t.co/8nfW2ko","WQXR","EN",0,3,"no url","2011-07-22 22:27:12"
"94600505367605248","RT all the #Princeton lover. : )","HookItUpDawgg","EN",0,14,"no url","2011-07-23 02:51:32"
"94791635342344192","Princeton is truly sexy , iloveeee him so much (:","Shakia_Mekele","EN",0,0,"no url","2011-07-23 15:31:01"
"94798786446102528","my sister cant stop looking at my Princeton poster -_____- @MindlessBhavior thanks jacob","TarioMinajYMCMB","EN",0,2,"no url","2011-07-23 15:59:26"
"94811692504059905","Motorhome For Sale: 2002 Damon ESCAPER - Princeton, NC: CALL FOR MORE INFORMATION 919-580-1184  OPTIONS INCLUD... http://rvtra.de/j408qV","rvlistings","ES",0,0,"no url","2011-07-23 16:50:43"
"94911307219861504","The Bible and the Dead Sea Scrolls: The Princeton Symposium on the Dead Sea Srolls:  http://amzn.to/mKdKU1","IbukiReilakk","EN",0,0,"no url","2011-07-23 23:26:33"
"94915906098036737","Ya'll are so dead about Roc's birthday.. When it was Princeton it was TOTALLY differnet.. Is Roc not special? *sigh* You are to me!","xoErica_","EN",0,5,"no url","2011-07-23 23:44:50"
"94963635360763904","Happy Birthday #RocRoyal!! Hope #Prodigy, #RayRay, #Princeton and Er'body else on the @MindlessBhavior team Made It Un4Getable 4 U!! 1-4-3!!","IchaLiciousS","EN",0,0,"no url","2011-07-24 02:54:29"
"95012817765277696","@TheReal_Trenard Princeton Lil Cousin Passed Away??","Octoberz_Own11","EN",0,0,"no url","2011-07-24 06:09:55"
"95058879586635776","The Ruthwell Cross: Papers from the Colloquium Sponsored by the Index of Christian Art Princeton University 8 D... http://amzn.to/jGbGri","YokoyamaEnerufg","EN",0,0,"no url","2011-07-24 09:12:57"
"95153775731421184","Highlights Tour is today at Princeton University Art Museum, Princeton campus, 2 p.m. Free.  More events: http://ow.ly/5Lvpv","wwpinfo","EN",0,0,"no url","2011-07-24 15:30:02"
"95211049959165952","The answer is A ! Princeton from @MindlessBhavior is Latin and African American .","TeamMindless","EN",3,5,"no url","2011-07-24 19:17:37"
"95221069136408576","@TheyLove_REA @giselle_xo @ido_princeton so who wanna qo first n be the dare-er","iWant_YourLove","EN",0,0,"no url","2011-07-24 19:57:26"
"95331635016376320","The New York show is gonna be LIVEEEEEEEEEE!!!!!!!!!!! *princeton voice*","TanasiaSmith","EN",1,6,"no url","2011-07-25 03:16:47"
"95373804737531904","St Petersburg Jobs: C# .NET Developer: Princeton Information - Saint Petersburg, FL - Princeton... http://dlvr.it/cSFMJ #Jobs #Jobs","St_PetersburgWk","EN",0,0,"no url","2011-07-25 06:04:21"
"95375901881147392","Jersey City Jobs: ASP.Net Developer: Princeton Information - Jersey City, NJ - Application devel... http://bit.ly/pUsswl #JerseyCityJobs","Jersey_City_Job","EN",0,0,"no url","2011-07-25 06:12:41"
"95447192445259776","Here again for 6 AM spinning. Might be starting a habit now. (@ Princeton Club) http://4sq.com/odU1x6","dainec","EN",0,0,"no url","2011-07-25 10:55:58"
"95480067416788992","A New Kind of Accounting Firm Opens Its Doors in Princeton, NJ (E-media wire) feedzilla.com:115678522","alife_insurance","EN",0,0,"no url","2011-07-25 13:06:36"
"95491127779659777","Miss Lola Says™ Cross Currents Minority Rowing Hosts National Diversity Invitational Regatta: PRINCETON, N.J. – ... http://bit.ly/nIx6i9","misslolasays","EN",0,0,"no url","2011-07-25 13:50:33"
"95495414056353793","RT if 4 boys named Prodigy, Princeton, Ray Ray, and Roc Royal have a special place in your heart :) &lt;3","AlohaNelly","EN",11,256,"no url","2011-07-25 14:07:35"
"95534853403049984","Back in Princeton (@ Princetonian Diner & Restaurant) http://4sq.com/oexfxw","TedSmith55","EN",0,0,"no url","2011-07-25 16:44:18"
"95609918035460096","Princeton Is Freaky !!!!! Oweeee","RedLovesWoodie","EN",0,1,"no url","2011-07-25 21:42:35"
"95616566833590272","princeton from mindless behavior is so cute.","BriannaMathers","EN",0,0,"no url","2011-07-25 22:09:00"
"95616587805097984","Princeton got some pretty hair too. #Shoutout to his future kids","LyricsN_Taylors","EN",0,0,"no url","2011-07-25 22:09:05"
"95616730432409600","Princeton is just to cute and Rock Walla!","TasteOf_Brie","EN",0,0,"no url","2011-07-25 22:09:39"
"95620103655264257","""Are you breathing?"" Lol Princeton.","CiaraJvsmine","EN",1,1,"no url","2011-07-25 22:23:03"
"95627446879125504","US envoy to press two Sudans to talk: Princeton Lyman, the US special envoy on Sudan, will urge leaders in Khart... http://bit.ly/n5nfy0","secwatchigss","EN",0,0,"no url","2011-07-25 22:52:14"
"95663132013371392","I'm at The Back Porch Saloon (9626 Princeton-Glendale Rd, at Muhlhauser Rd, Hamilton) w/ 4 others http://4sq.com/nXPaUB","BioClaw","EN",0,0,"no url","2011-07-26 01:14:02"
"95671760791420928","Princeton and Ray Ray can't be vigirns! They must've been studying Chris Brown or some shit lol","MiahhlynMonroe","EN",0,1,"no url","2011-07-26 01:48:19"
"95677069664591872","@TweetsSayItAll i hugged princeton!","BeautifulMeBrie","EN",0,0,"no url","2011-07-26 02:09:25"
"95830665085460481","Wooo! RT @Sixers: Get ready, Princeton NJ! RT @HipHop76: Sitting here with Fabian & @ChristianCrosby getting ... http://tmi.me/dxbLB","ChristianCrosby","EN",0,0,"no url","2011-07-26 12:19:45"
"95861845553987584","@VA_holman Hahahah, you should get out more! Head up to Princeton and hang out, that's a fun place","MikeMizov","EN",0,0,"no url","2011-07-26 14:23:39"
"95883928564539393","Princeton RCMP report an attempted B&E in a shed in the neighbourhood of Princeton General Hospital. The incident... http://fb.me/wFAHmwD7","PrincetonBCNews","EN",0,0,"no url","2011-07-26 15:51:24"
"95960618431037440","Princeton consulting is hiring #orms types. http://t.co/iAuZM9e for more info via @parubin","miketrick","EN",0,1,"no url","2011-07-26 20:56:08"
"95960852070543360","Paleosols: Their Recognition and Interpretation (Princeton Series in Geology and Paleontology):  http://amzn.to/izEWVc","NicoRenkafc","EN",0,0,"no url","2011-07-26 20:57:04"
