"tweet_id","text","author","language","likes","retweets","media","timestamp"
"88384584298934272","Father, daughter survive Columbia plane crash http://dlvr.it/Z4JlZ #Modesto","spooney35","EN",0,0,"no url","2011-07-05 23:11:41"
"88409594958856192","Columbia 5, Gastonia 0 mid 5th","Smith_Derek","EN",0,0,"no url","2011-07-06 00:51:04"
"88412606464929792","@Sanicole @lunarsnow1: Well excuse me!! lol. I'm can be a filmmaker too whether I attended Columbia or not! So bam! haha.","JLeslieMonique","EN",0,0,"no url","2011-07-06 01:03:02"
"88448937521987584","Asia: Case Studies in the Social Sciences (Columbia Project on Asia in the Core Curriculum):  http://amzn.to/j3coga","RukkensuFarfava","EN",0,0,"no url","2011-07-06 03:27:24"
"88474015240437760","Windsurfing-&quot;The Gorge&quot; Windsurf  www.snakebitefilms.com Extreme windsurfing on the Columbia River G... http://zmarter.com/2180841","Z_ExtremeSport","EN",0,0,"no url","2011-07-06 05:07:03"
"88543275811733504","You will receive your gorgeous circle lenses in just a few days because ship directly from Vancouver, British Columbia, Canada!!","BlinkLens","EN",0,0,"no url","2011-07-06 09:42:16"
"88576771527671808","NOW CASTING: www.HoodStarzzTV.com seeking ARTISTS!!! Columbia: JUL 14 | Charleston: JUL 15 | Myrtle Beach: JUL 16: 404-532-9232","atticalundy","EN",0,1,"no url","2011-07-06 11:55:22"
"88577681670668288","I'm at Wags (1906 Kingsbridge Rd, Columbia) http://4sq.com/q57Mms","cjddad","EN",0,0,"no url","2011-07-06 11:58:59"
"88594479904325632","If you love the Thicket please take a minute and vote for us in Free Times Best of Columbia Poll!  Thanks! http://ow.ly/5xMNq","LizardsThicket","EN",0,3,"no url","2011-07-06 13:05:44"
"88613798805639168","People In Columbia Adopt Feral Cat Rules: (AP) - Columbia residents can now apply to be caretakers for feral cat... http://bit.ly/nxo8Bd","KTTSNews","EN",0,0,"no url","2011-07-06 14:22:30"
"88616462226432001","@bobandtom waverly-shell rock Go-Hawks. Columbia Hickman Kewpies","NetworkingPWR","EN",0,0,"no url","2011-07-06 14:33:05"
"88624825660223489","How many economics classes did you receive credit for at Columbia and Harvard? Did you have to do more than say, ""Present!"" #AskObama","bteacher99","EN",0,0,"no url","2011-07-06 15:06:19"
"88647399395962880","i don't want to go to Columbia SC","UCantBMe1","EN",0,0,"no url","2011-07-06 16:36:01"
"88667792114581504","In the gloaming, on threadbare fields in wintry Argentina, the Copa unfolds daily. Tonight Arg/Columbia, 8:45. http://t.co/drel1HF","MisterJohnDoyle","EN",0,0,"no url","2011-07-06 17:57:03"
"88669746630897664","Medical Marijuana Program Goes Forward In D.C.; Feds Watching: ​The District of Columbia passed its... http://wevape.it/oxMG4n #Marijuana","Vaporfection","EN",0,0,"no url","2011-07-06 18:04:49"
"88673248891506690","I'm at Naxos of America, Inc. (1810 Columbia Ave Ste. 28, Franklin) http://4sq.com/qx6cI5","CollinJRae","EN",0,0,"no url","2011-07-06 18:18:44"
"88680232390893568","GREEN DRINKS event at Water's Edge on East Deck overlooking the Columbia River, Dalles Dam and Bridge! Not to be... http://fb.me/QNBw2FPQ","LPVGorge","EN",0,0,"no url","2011-07-06 18:46:29"
"88680253379182592","Susan Smith solicitor weighs in on Anthony verdict - WIS News 10 - Columbia, South Carolina |: http://t.co/vB6oTlV via @AddThis","RadiantBirdLive","EN",0,0,"no url","2011-07-06 18:46:34"
"88682967106453504","Scorelines as of now: ESPN: Team Sweden Women 0 : 0 @ussoccer_wnt ESPN2: Team DPR Korea Women 0 : 0 Team Columbia Women","TeshawnEdmonds","EN",0,0,"no url","2011-07-06 18:57:21"
"88686637088903169","Photo: Malloreigh in East 52nd LOCATION: British Columbia, Canada INTO: Ethical (local, cruelty-free)... http://tumblr.com/xeq3cwunwi","SuicideGirls","EN",2,3,"no url","2011-07-06 19:11:56"
"88686897165111296","phone was in west columbia this morning...this thing better be fed-exed to my house today or imma be pissed.","cwagnerrr","EN",0,0,"no url","2011-07-06 19:12:58"
"88688579081015296","@Greenspeak Third Question: Is there a study abroad option with their affiliate school British Columbia?","mosespippy","EN",0,0,"no url","2011-07-06 19:19:39"
"88692685275271168","I'm at UBC University of British Columbia (2329 West Mall, Vancouver) http://4sq.com/oJu4KX","JJMacLean","EN",0,0,"no url","2011-07-06 19:35:58"
"88697064162205696","The RedWolves' game at Columbia on Wednesday was rained out.","VoiceOfPeeDee","EN",0,0,"no url","2011-07-06 19:53:22"
"88705033323036672","Mexican Chocolate Mousse: Pretty to look at, velvety to eat! Sliced up daily at Geraldine's Counter in Columbia City. http://ow.ly/5xArp","AlaModePies","EN",1,0,"no url","2011-07-06 20:25:02"
"88708213884719104","Undercover officers just busted a guy for drugs at Columbia Heights stop. DC, you're so exciting! #wmata","nealthea","EN",0,6,"no url","2011-07-06 20:37:40"
"88708938232631296","Pat Lowery and Cape Cod League's Brewster Whitecaps Work Out at Fenway Park - Columbia University Athletics: Pat... http://bit.ly/ps4bsf","CapeCodDaily","EN",0,2,"no url","2011-07-06 20:40:33"
"88735492354482177","Phil Williams (footballer) : MAKING A DIFFERENCE: Phillip Williams Sr. - Columbia Daily Tribune http://uxp.in/38292269","wkbruce","EN",0,0,"no url","2011-07-06 22:26:04"
"88747416760762369","Eastern Oregon, Columbia River Gorge, Coast Range... Where do you indulge your passion for the outdoors?","bboutside","EN",0,0,"no url","2011-07-06 23:13:27"
"88749149025079296","Survey shows Columbia Transit riders want expanded night service during week. City Manager says no money for it. /via @DavidEarlLive ^BH","KOMUnews","EN",0,0,"no url","2011-07-06 23:20:20"
"88755822145966080","At The Burger Joint in Columbia...this place is cute.","dreamforDRESDEN","EN",0,0,"no url","2011-07-06 23:46:51"
"88789405950685184","#ProfessionalMusicMasteringStudio  COLUMBIA SOUNDS MASTERING columbiasounds@gmail.com","ColumbiaSound","ES",0,0,"no url","2011-07-07 02:00:18"
"88798276878471169","@NoBigWeevils I have wasted my night watching this crap, let's go Columbia!","tweetingisajoke","EN",0,0,"no url","2011-07-07 02:35:33"
"88806359310671872","I'm at Publick House (2307 Devine Street, Columbia) http://4sq.com/oe86EA","EvilestDrewbie","EN",0,0,"no url","2011-07-07 03:07:40"
"88815028945436673","@c_pizzle What is up with the game against Columbia today? Messi needs support. (I'm wearing my Argentina jersey.)","TerryMunson","EN",0,0,"no url","2011-07-07 03:42:07"
"88837355225620480","Columbia Men's Cougar Peaks II Jacket for $16 + free shipping via Prime http://bit.ly/qzMU3r","RawSignalDeals","EN",0,0,"no url","2011-07-07 05:10:50"
"88856900694839296","Continental GT has a show coming up on 07/08/2011 at 10:00 PM @ Utopia Food ... in Columbia, SC http://soc.li/uzYwpjI","ContinentalGT","EN",0,0,"no url","2011-07-07 06:28:30"
"88860046427029504","Hot #5: Columbia Boys 8-20 Fast Trek Full Zip Fleece: Columbia Boys 8-20 Fast Trek Full Zip Fleece  Columbia  Bu... http://bit.ly/niWweu","tenhotlists","EN",0,0,"no url","2011-07-07 06:41:00"
"88864744034934784","Columbia Men's Big Cougar Peaks II Jacket for $12 + free shipping via Prime http://bit.ly/qQo6ey","BargainZoneUSA","EN",0,0,"no url","2011-07-07 06:59:40"
"88946604257722368","I'm at Starbucks (7090 Deepage Dr, at Carved Stone Way, Columbia) http://4sq.com/nMvtky","jsavaiano","EN",0,0,"no url","2011-07-07 12:24:57"
"88950332989779968","Columbia best team I've seen so far in Copa America. What are their chances of going all the way @marklangdon ?","liamdelaney1","EN",0,0,"no url","2011-07-07 12:39:46"
"88964467785867264","Research: another amazing photo from Chicago's Columbia Exposition: http://bit.ly/pJmwzR","CWBooksnet","EN",0,0,"no url","2011-07-07 13:35:56"
"88970948023287808","i remember watching Columbia back in April 1981. Goosebumps. ( #NASAtweetup live at http://ustre.am/6GiT)","FarewellAtlanti","EN",0,0,"no url","2011-07-07 14:01:41"
"88977667285712897","Specialist, Social Work Clinical Supervision,... - District of Columbia Public Schools #Washington, DC http://DCJobs.com/j/2236470 #jobs","ljn_was_edu","EN",0,0,"no url","2011-07-07 14:28:23"
"88984634016284672","@sidlowe Did u see #Messi free kick V Columbia in #Copa? One of the worst ever #messi and #Argentina look woeful.","JSmithy64","EN",0,0,"no url","2011-07-07 14:56:04"
"88992691286843392","I'm at Home Goods (9041 Snowden River Pkwy, Columbia) http://4sq.com/roAxjI","psychobob808","EN",0,0,"no url","2011-07-07 15:28:05"
"88999616091127808","I'm at Marshalls (9031 Snowden River Parkeay, Columbia) http://4sq.com/njRFwb","psychobob808","EN",0,0,"no url","2011-07-07 15:55:36"
"89011225886859265","Hey drivers of Columbia. You know what's cool? Blinkers.","regnargenoimreh","EN",0,1,"no url","2011-07-07 16:41:44"
"89027415925473280","@perkypessimist i get off at 5 lol i'm in columbia soo it'll be bout 20 mins before i get back over tht way lol","cecemechell","EN",0,0,"no url","2011-07-07 17:46:04"
"89034785309200384","Vacation: Save 50% on a Houseboat Trip from Waterway #Houseboat Vacations in British Columbia #Canada: http://bit.ly/k3dufz","HotTorontoDeals","EN",0,0,"no url","2011-07-07 18:15:21"
"89040514715881472","Bye bye Wilmington, NC and back to Denmark we all go....well Columbia for me","Sweet_San","EN",0,0,"no url","2011-07-07 18:38:07"
"89067073069776896","@SouthwestAir I love you, but why don't you fly out of Columbia, SC? :( Any hope you'll begin doing flights there in the future?","nestrada89","EN",0,0,"no url","2011-07-07 20:23:39"
"89074975146917889","British Columbia providers keep hand-washing top of mind http://ow.ly/5z47T #ptsafety #handhygiene","Patient_Safety","EN",0,1,"no url","2011-07-07 20:55:03"
"89090032677298176","RT @SassyVirgo14 OMG nooo ni  @MzLatishe90: RT @SassyVirgo14 Since when did Columbia get a #Goody's store?? &lt;----Its onli stage &lt;--Indeed","MzLatishe90","EN",0,0,"no url","2011-07-07 21:54:53"
"89108697355264001","Brian Bayley: Early Warning Report:     VANCOUVER, BRITISH COLUMBIA--(Marketwire - July 7, 2011) - Bria... http://mwne.ws/r74D40","matteraryan","EN",0,0,"no url","2011-07-07 23:09:03"
"89137361191059456","@twittersuggests ALERT: Urge University of British Columbia to disclose information about its cruel experiments http://t.co/l08ptqk","StopUBCanimalre","EN",0,0,"no url","2011-07-08 01:02:57"
"89158676656566272","Really wants to go planking.....we have to make a Columbia group to do this","cjfollowsjc","EN",0,0,"no url","2011-07-08 02:27:39"
"89162724151533569","! http://t.co/UBmotdT new york drug rehab CTV British Columbia  Experts: Weiners Behavior Similar to Addicts  CTV News","Belindajxedq","EN",0,0,"no url","2011-07-08 02:43:44"
"89168461959405568","Columbia's high today was only 76. It was the coolest July day since the 11th of July last year. #como #mowx","chester_lampkin","EN",0,0,"no url","2011-07-08 03:06:32"
"89174334018568193","Condo for Rent (Columbia, SC) $700 2bd http://ow.ly/1dGg4p","colarentals","EN",0,0,"no url","2011-07-08 03:29:52"
"89283159396581376","I'm at Oak Grove at Wildewood Apartments (811 Mallet Hill Rd., Columbia) http://4sq.com/n3xR2C","grcjr","EN",0,0,"no url","2011-07-08 10:42:18"
"89302797140492290","RT @fashioncares: Jeffrey Kalinsky featured in @womensweardaily about his upcoming collaboration w Columbia Sportswear! http://ow.ly/5z73o","carenwestpr","EN",0,1,"no url","2011-07-08 12:00:20"
"89317177416630274","Bill Morris discusses Columbia's NeuWrite program (http://t.co/UnX0Rjm) and pairing scientists with MFAs: http://t.co/C05IMYW","The_Millions","EN",1,3,"no url","2011-07-08 12:57:29"
"89318978786312196","I went out columbia for the fireworks w/ da fam RT @WshMeLuckk @BEEdntgivatweet I was sleep all day :/","BEEdntgivatweet","EN",0,0,"no url","2011-07-08 13:04:38"
"89325404422287360","YouTube - Columbia Cash for Clunkers at Lexington Automotive and ... http://bit.ly/qBT77L","Gengras_Motors","EN",0,0,"no url","2011-07-08 13:30:10"
"89329330328576000","Commander of the first Space Shuttle mission #STS1 aboard Columbia in 1981 was veteran Astronaut John Watts Young: http://t.co/fW59NmD","georgiadog","EN",0,0,"no url","2011-07-08 13:45:46"
"89333960802435072","Man dies after falling out of stands at MLB stadium - WIS News 10 - Columbia, South Carolina |: http://t.co/G7bVecu via @AddThis","asthehosptuRNs","EN",0,0,"no url","2011-07-08 14:04:10"
"89341267296796673","God speed Atlantis. Was 10 when Columbia launched, 40 as STS retires. Incredible 30 years @NASA thanks for the science, memories. #STS135","tmclain","EN",0,0,"no url","2011-07-08 14:33:12"
"89342622073753602","Columbia City Worker Dies near Katy Trail | KOMU.com | Columbia, MO | http://t.co/CehPtQY via @KOMUnews","jeranther","ES",0,0,"no url","2011-07-08 14:38:35"
"89342777246224384","1/2 priced drinks @ Columbia Social @ 168st & B'way 2nite @ 11. Mention Divino & you're free all night. Inform a friend... or 2","DDeNegro","EN",0,2,"no url","2011-07-08 14:39:12"
"89354508731297792","City parks worker dies in accident: A Columbia city worker was killed in an accident Friday morning while working... http://dlvr.it/ZRwcM","ColumbiaMOBuzz","EN",0,0,"no url","2011-07-08 15:25:49"
"89354831688507392","@guavalicious if you need a press contact for the Columbia Dinner Train, call 573-474-2223 and ask for Amando. cc: @ColumbiaMOCVB @CoMoMegs","NewsVisitMO","EN",0,0,"no url","2011-07-08 15:27:06"
"89361181835411456","On this historic day let us not forget Challenger & Columbia. #spaceshuttle","toadsalsa","EN",0,0,"no url","2011-07-08 15:52:20"
"89363232866840576","@TIDEVINE A great way to combat obesity. SC is 8th in the nation! Get Moving, Columbia! http://t.co/YDiwDLW (cc: @randy_scott)","columbiasunnews","EN",0,0,"no url","2011-07-08 16:00:29"
"89369989878005762","@NASAGoddard Columbia April 12 1981. Bunked off school afternoon of the 10th only for the launch to be delayed to the Sunday. #SpaceShuttle","RealCainMosni","EN",0,0,"no url","2011-07-08 16:27:20"
"89372165199237120","I think it is appropriate today to remember back to 1981, when the first space shuttle, Columbia, launched into space http://t.co/q3P1uGS","Joe_Quincy","EN",0,1,"no url","2011-07-08 16:35:59"
"89392496542629888","Great, but sad, to see the #spaceshuttle #Atlantis fly one last time. I was 10 when #Columbia first launched!","drewwagar","EN",0,0,"no url","2011-07-08 17:56:46"
"89400893509877760","Backing @ElectElla for #bootcamp5's governor's race. She'll be the coalition builder Columbia needs.","joshualyman","EN",0,2,"no url","2011-07-08 18:30:08"
"89401610744250368","Tonight, I drink to Columbia, Challenger, Discover, Atlantis, and Endeavor...  *The* space ship of my generation will have flown its last","AJMashburn","EN",0,0,"no url","2011-07-08 18:32:59"
"89433063842516993","Headed to Columbia!!! SO EXCITED TO SEE @lasanders13 :)","TWEETtheTAY","EN",0,0,"no url","2011-07-08 20:37:58"
"89447337067429888","Bags packed, Columbia for the weekend! =))","_tiaaam","EN",0,0,"no url","2011-07-08 21:34:41"
"89450969338888192","News: Ky. firefighter dies after responding to fire: COLUMBIA, Ky. — A Kentucky firefighter died Friday as a res... http://bit.ly/pt8JDd","FirefightersWW","EN",0,0,"no url","2011-07-08 21:49:07"
"89459894784229376","I'm at Dairy Queen - Columbia Heights (3959 Central Ave NE, 40th Ave NE, Minneapolis) http://4sq.com/rgGiPs","Psyche329","EN",0,0,"no url","2011-07-08 22:24:35"
"89461551567872000","RT @RubenShot: Gente de plata ps. RT @MafeFerrer: Las camisas de promoción de odontología usm este año son columbia. Normal.","Odonto_UCV","ES",0,0,"no url","2011-07-08 22:31:10"
"89462562390937600","@KristySko Is it sad that after going wall-to-wall in college during the Columbia disaster, I went home and watched that movie?","ainver","EN",0,0,"no url","2011-07-08 22:35:11"
"89466289688547329","Sask., Alberta, B.C. back Ottawa on CWB: CBC.ca - Alberta, Saskatchewan and British Columbia ... http://bit.ly/nBRbNq http://ow.ly/3DSpE","yourregina","EN",0,0,"no url","2011-07-08 22:50:00"
"89468883211272192","Columbia's Business Dean on Disclosure, Leading, Ethics http://ow.ly/5Adcf","Growthink","EN",0,0,"no url","2011-07-08 23:00:18"
"89504933245755393","Listings: Created a listing for 74 The Retreat Way # 74, Columbia, SC 29201 http://bit.ly/pfDCtS","screalestatenow","EN",0,0,"no url","2011-07-09 01:23:33"
"89514382983303168","GREAT Headline.  ::  Frank Haith Unable To Locate Columbia Hammock District http://t.co/h0gWwyh via @akulawolf","BarkingCarnival","EN",0,0,"no url","2011-07-09 02:01:06"
"89525963469234176","14 states and the District of Columbia have legalized #medicalmarijuana #capot #marijuana","KQEDNewsLive","EN",0,1,"no url","2011-07-09 02:47:07"
"89581798039879680","@DupeFiasco the attractive men are in Columbia. Aka this guy.","Cornell_Patrick","EN",0,0,"no url","2011-07-09 06:28:59"
"89593751810486272","Which place has a warmer environment: British Columbia or Alberta?: http://bit.ly/n4laGK","hbioc","EN",0,0,"no url","2011-07-09 07:16:29"
"89597845472149505","This day of reckoning has been coming since 2004, a year after the Columbia tragedy, when President George W. Bush... http://dlvr.it/ZWkg6","BarackLight","EN",0,0,"no url","2011-07-09 07:32:45"
"89600081031999488","Nights like tonight are what I'm gonna miss about Columbia. I can't wait to defend Missouri's awesome might to some snooty New Yorkers.","robbratney","EN",0,0,"no url","2011-07-09 07:41:38"
"89650358162423810","Indy day 2: this shit ain't Columbia coke ain't welcome. @natashagisondi @elliottcowburn Julie Maheu sucks gooch.","DylanJFerr","EN",0,0,"no url","2011-07-09 11:01:25"
"89666878036905984","RT @nbcaaron: Triple shooting in Columbia Hts.  Per DC Fire/EMS:  1 transported, 2 dead. Live report on News4 at 9am http://bit.ly/mY3tk1?","nbcwashington","EN",0,6,"no url","2011-07-09 12:07:04"
"89695908270313472","@E_Frm_Entourage I hope you didn't end up in Columbia again lol","EnglandCapital","EN",0,0,"no url","2011-07-09 14:02:25"
"89754641117609984","In Columbia, about to do a show on Two Notch Road...come out and support!","troop_sc","EN",0,0,"no url","2011-07-09 17:55:48"
"89764397085495296","Columbia(コロンビア) Womens Argonne Short Curry XLサイズ:  http://amzn.to/mdWca0","BeinhornGodaixo","EN",0,0,"no url","2011-07-09 18:34:34"
"89768884982390784","Cosmic Delight Shipping Off To Columbia - We got together on a Friday for J Ryke’s last show for a while.... http://tumblr.com/xlq3et2mph","FrankyNeedles","EN",0,0,"no url","2011-07-09 18:52:24"
"89804813390454785","ph1999-07-09 :: Merriweather Post Pavillion Columbia MD ::[AUD]SHNfamily TiPh Companion]  http://bt.etree.org","jamjoints","EN",0,0,"no url","2011-07-09 21:15:10"
"89820424568979456","Columbia been live every night since I've been back","ejhouston09","EN",0,0,"no url","2011-07-09 22:17:12"
"89824732140154880","At Columbia with my Brotha @JonRashawn ... He's gettin Beat  http://lockerz.com/s/118654117","gqtrilogy","EN",0,1,"no url","2011-07-09 22:34:19"
"89838837597077504","I-5, 2 Mi S of Oregon Washington Border, Delay &lt; 20min, A crash has the left ln closed north of Columbia, use cau... http://tpck.us/I109425","TripCheckI_5A","EN",0,0,"no url","2011-07-09 23:30:22"
"89860069134577664","Staying the night in columbia! Then to hilton head in the AM","misssarah_10","EN",0,0,"no url","2011-07-10 00:54:44"
"89877681050615810","Tweeted about @Groupon this morning, & the Groupon from Columbia, MO, replied! Way to do your homework, @GrouponCoMo! #sortofcreepythough","katewantstorun","EN",0,0,"no url","2011-07-10 02:04:43"
"89885633442623488","Watching Segway tours drive by from the docks. Great Fun. (@ Columbia Yacht Club) http://4sq.com/nA7ari","robertljones","EN",0,0,"no url","2011-07-10 02:36:19"
"89890897289945088","Columbia is on fire tonight!......no seriously call the fire department.","DPIKE1386","EN",0,0,"no url","2011-07-10 02:57:14"
"89894667440766976","Checkin out my boy Matty Fresh aka @matt_morrison's show at Rogers arena in beautiful british columbia. He's killin it, mad proud","MarkSalling","EN",78,145,"no url","2011-07-10 03:12:13"
"89901211096068096","Without twitter, how would I be able to randomly discuss Columbia football with a Patriots beat writer?","simmonsclass","EN",0,0,"no url","2011-07-10 03:38:13"
"89906453950906368","Hombres de Mcbo! Entiendan que las camisas Columbia son prendas con un proposito muy distinto al de ir a Mi Vaquita un sabado en la noche.","wilgonzalez","ES",0,0,"no url","2011-07-10 03:59:03"
"90000305693003776","RT @SeanGallagherLA Sunday morning haunt. #london #flowers @ Columbia Road Flower Market http://instagr.am/p/HWk2n/","hoxbot","EN",0,0,"no url","2011-07-10 10:11:59"
"90047382552715265","_Big Time Rush_ - Boyfriend feat. Snoop Dogg , Copyright (c) Columbia. Got You All in Check,' TLC's 'No Scrubs' and... http://dlvr.it/Zffgg","NickBTRShow","EN",0,0,"no url","2011-07-10 13:19:03"
"90065879370440704","WEATHER: The National Weather Service has issued a Special Weather Statement, warning folks about excessive heat..... http://fb.me/XDetHzMJ","abc_columbia","EN",0,1,"no url","2011-07-10 14:32:33"
"90088969093656576","Road trip so far: drive through Columbia River Gorge, interviewed someone, attended pirate landing on Alki Beach,","KirsteninMT","EN",0,0,"no url","2011-07-10 16:04:18"
"90091225637584896","Always gr8! #OneDayUWillFindOutWhy #GoCocks RT @croediger52: Billboard in Columbia says ""Gamecock Football: Its great to be a Gamecock"".","theUSC","EN",0,0,"no url","2011-07-10 16:13:16"
"90119688180346881","This game is as good as one my Hartsville Cards soccer game I played against Columbia when I was 10","ClevJer","EN",0,0,"no url","2011-07-10 18:06:22"
"90137325216083968","Falcao gets off the mark in this #CopaAmerica & puts #Columbia ahead against Bolivia. Could win the group and put #Argentina under pressure","paulottey","EN",0,0,"no url","2011-07-10 19:16:27"
"90140659687759873","@RagingBitch Too late for praying. Columbia already 2 up after 25 minutes","Xaviesque","EN",0,0,"no url","2011-07-10 19:29:42"
"90180015597166592","Don't miss the next DC area meeting on franchise sales w/social media expert @PaulSegreto Tues, July 19, Columbia MD. http://t.co/uKj2hOc","vmaione","EN",0,1,"no url","2011-07-10 22:06:05"
"90189116486074368","Imma stay in columbia,sc another two days then make my way to nc or dc for a day then ny til sat","FaN_TasTiCo","EN",0,0,"no url","2011-07-10 22:42:15"
"90203045790617601","Deputies: Columbia woman stabbed husband to death | http://t.co/tLjZBIK #sc","postandcourier","EN",0,0,"no url","2011-07-10 23:37:36"
"90215049863512064","CTV British Columbia - Newborn orca joins K-Pod - News Photo Gallery: http://t.co/1gcrYYe via @AddThis","DavidSHodgins","EN",0,0,"no url","2011-07-11 00:25:18"
"90226202547200001","You: Columbia University TAG Heuer Watch – Women’s Steel Aquaracer Watch http://bit.ly/qxXlbf","beoveru","ES",0,0,"no url","2011-07-11 01:09:37"
"90241524327120896","I'm at Columbia Ice Fields Gym (CIF) (Hagey Blvd, Columbia St. W, Waterloo) http://4sq.com/pBeNeq","trplanet","EN",0,0,"no url","2011-07-11 02:10:30"
"90278979445063681","@DaniiCaroline well ill be in columbia so you should transfer, it'd mean the world to me :)","AlexFoster13","EN",0,0,"no url","2011-07-11 04:39:20"
"90284331381178369","Across South Carolina: AP COLUMBIA - South Carolina's new inspector general already has opened investigations on... http://bit.ly/q79BAo","jessica82b","EN",0,0,"no url","2011-07-11 05:00:36"
"90285182829072384","@Juvywyman Yessss. Its in Columbia","shanny_101","EN",0,0,"no url","2011-07-11 05:03:59"
"90285434483118081","Lake Carolina | Columbia SC homes from $130k | Lake Living in South Carolina http://goo.gl/fb/x7ZQE","DescribeWeb","EN",0,0,"no url","2011-07-11 05:04:59"
"90355668103598080","Columbia vs. Korea. Weird to see these guys play roller hockey but good they're getting involved http://yfrog.com/kgexnmej","jamieviss","EN",0,0,"no url","2011-07-11 09:44:04"
"90402560409731074","If you get tattooed anywhere in Columbia other than Iron Tiger, YOU'RE DOING IT WRONG.","justthepants","EN",0,0,"no url","2011-07-11 12:50:24"
"90411251028606976","Bearing Resources Closes $6 Million Private Placement:     VANCOUVER, BRITISH COLUMBIA--(Marketwire - J... http://mwne.ws/nZz4he","ryan_mattera","EN",0,0,"no url","2011-07-11 13:24:56"
"90412841152167936","Human Resource Consultant III: Location: Vancouver, British Columbia, CANADA          ... http://bit.ly/otroSf #jobs","Vancouver_PRO","EN",0,1,"no url","2011-07-11 13:31:15"
"90417416655474688","RT @kenseals: http://fms.ws/5KlNF Summit to myself. Socked in clouds :) #Columbia guy hiking the Appalachian Trail. Follow him. #famouslyhot","walkermckay","EN",0,1,"no url","2011-07-11 13:49:26"
"90447586263187456","Off to Columbia for the second time in 2 days. Can I just move in already?? #comeonn","dallas_frick","EN",0,0,"no url","2011-07-11 15:49:19"
"90448098001825793","@stevekrysak @dksan @spaetzel Yup, Columbia and Phillip. Walked past it while heading to campus.","tossayo","EN",0,0,"no url","2011-07-11 15:51:21"
"90452191965495296","si el disfraz de lo toyoteros es Columbia el de los Jeeperos es Franelas de Mayonesa y Polar","Elculopzo","ES",0,10,"no url","2011-07-11 16:07:37"
"90453106944507904","Celeb Alert. @99_AflacRacing Carl Edwards with #Mizzou's Jon Hamm at @AndersonCharity in Columbia.  http://t.co/nRZVgB1","BlumbergOTB","EN",0,5,"no url","2011-07-11 16:11:15"
"90470290043314176","Columbia County Health Department makes move to new building Employees from all three locations have packed up t... http://bit.ly/piyVh5","SEARCHAUGUSTA","EN",0,0,"no url","2011-07-11 17:19:32"
"90479379104276480","RT @miss_alex_p @secret_london @helena_williams Spitalfields, brick lane and Columbia rd markets in east London ... http://bit.ly/qK7YQp","hoxbot","EN",0,0,"no url","2011-07-11 17:55:39"
