"tweet_id","text","author","language","likes","retweets","media","timestamp"
"209051974161801218","Lady gaga - badromance #unitas59 @Joske_Unitas http://t.co/9wlrrZ2o","Mandytjeh","EN",0,1,"no url","2012-06-02 22:40:49"
"209053898940493824","@emilyclayden it's the song! Wale - Chillin ft. Lady Gaga http://t.co/vHpRH9Tp","samhunt_","EN",0,1,"no url","2012-06-02 22:48:28"
"209055821873676288","Vota por Lady Gaga como la mujer más sexy del pop aquí: http://t.co/EeuR0mOn http://t.co/4ORkeeqm","GagaColombia","ES",0,1,"no url","2012-06-02 22:56:06"
"209065305199226881","@TheSwaagger a Alexander McQueen se lo perdono aunque ya no es mi modelo a seguir, pero a Lady Gaga a Justin Bieber y a Foster The People no","HeartOfMcQueen","ES",0,0,"no url","2012-06-02 23:33:47"
"209065352028635136","Monsters are really mad that Justin beat Lady Gaga's records for selling out shows. Lol, he's probably like http://t.co/ynkh9rVL","StrongForJustin","EN",2,11,"no url","2012-06-02 23:33:58"
"209067385582387201","Lady Gaga Tops Twitter with 25 Million Followers, Barack Obama On Distant Second: The other famous celebrities r... http://t.co/Ey9W1Uoz","celebritybuzzon","EN",0,0,"no url","2012-06-02 23:42:03"
"209068510020780032","Típico estas desayunando y llega lady gaga y te quita el cereal  y se lo arroja encima http://t.co/aGdQGRBE","luisM_monster","ES",1,3,"https://pbs.twimg.com/media/AubCs8HCQAA7E1K.jpg","2012-06-02 23:46:32"
"209069671503237120","RT If You Said Lady Gaga Today","Monsterlicioso","EN",0,19,"no url","2012-06-02 23:51:08"
"209075027604275200","Me ha gustado un vídeo de @YouTube. http://t.co/umCUWfnc Lady Gaga - Marry The Night (Zedd Remix)","Luccas_Monster","ES",0,0,"no url","2012-06-03 00:12:25"
"209075635761586177","Entertain her in a GAGAliy way. lool. RT @cremepinky11: In a gaga way RT @Ceebeelah: How do you entertain Lady GaGa?","IamDudeMeister","EN",0,1,"no url","2012-06-03 00:14:50"
"209078468024082434","Todo es culpa de lady gaga  ""@Megarockerita: Ya no hay temor a Dios.""","aliferchampion","ES",0,1,"no url","2012-06-03 00:26:05"
"209079213502889984","@dannews Have you heard anything more about Lady Gaga? Where is she - or is she disguised as a lamb chop?","algroovy","EN",0,0,"no url","2012-06-03 00:29:03"
"209081822364184576","http://t.co/H4VssEmk - lady gaga judas mp3","ompariciner","ES",0,0,"no url","2012-06-03 00:39:25"
"209083823034609664","TELEVISA : Lady Gaga posa al estilo Marilyn Monroe: Como un homenaje a Marilyn, debido a su cumpleaños, Lady Gag... http://t.co/lAnf8DWv","Leote10","ES",0,0,"no url","2012-06-03 00:47:22"
"209084712222867456","edge of glory glee &gt;&gt;&gt;&gt;&gt;&gt; abismo &gt;&gt;&gt; inferno &gt;&gt;&gt;&gt;&gt;&gt;&gt;&gt;&gt; edge of glory lady gaga","caauhp","EN",0,0,"no url","2012-06-03 00:50:54"
"209090982724108288","#GenFMMusikkuSurabayaKotaku “@TTangryyayas: np : lady gaga - paparazzi. @1031Genfmsby. #harineladygaga.”","1031Genfmsby","ES",0,0,"no url","2012-06-03 01:15:49"
"209093704823218176","Yesss.. Mi seguidor #100, ya solo me lleva Lady Gaga 25,564,678","marco__morales","ES",0,0,"no url","2012-06-03 01:26:38"
"209094556258537474","Lady Gaga tweets that she will buy 'a fake Rolex"" in Thailand - http://t.co/Mz3ufRt2 http://t.co/pUPlWqy7","LadyGagaTopNews","EN",0,0,"no url","2012-06-03 01:30:01"
"209096770867838976","#EresEstupidoSi juras que Lady Gaga es hombre","Devonshow","ES",0,0,"no url","2012-06-03 01:38:49"
"209111039881646080","@MeganDavis1988  Why Lady Gaga wears two-piece in consert, I think she needs to show her sexy.  http://t.co/WQYaTnL6 http://t.co/99erFQ7c","pongpruk","EN",0,0,"https://pbs.twimg.com/media/AubpYgMCEAAKs5e.jpg","2012-06-03 02:35:32"
"209111818436755456","There is also Tribute to LADY GAGA &amp; Costume party @JFM_ID #JakartaFashionMarket part II @fXSudirman JUNE 8-10,2012! FREE ENTRY loh! :D","radioLSPR","EN",0,7,"no url","2012-06-03 02:38:37"
"209112918925651968","♫ Marry the Night - Born This Way - Lady GaGa #nowplaying http://t.co/SfXXg1wF","mashapom","EN",0,0,"https://pbs.twimg.com/media/AubrF4LCMAABtd8.jpg","2012-06-03 02:43:00"
"209113851176816641","The Greatest Thing which was supposed to be a Lady Gaga and Cher collaboration, is not going to be released anymore.","LGMonsterFacts","EN",2,27,"no url","2012-06-03 02:46:41"
"209117234885435393","[ON AIR] : Lady Gaga (@ladygaga) ft.Beyonce - Telephone &gt;&gt;&gt; http://t.co/EksiGpeO ( We predict the Hits ) #Music","WIMAXRADIO","EN",0,0,"no url","2012-06-03 03:00:08"
"209118195351699456","#SongPlayMusic Lady Gaga - Poker Face (Dave Aude Remix) (Radio Edit) http://t.co/ssxDUS2P","SongPlayMusic","EN",0,0,"no url","2012-06-03 03:03:57"
"209120351236521984","#listeningto ""Eurythmics vs. Lady Gaga, Dance Dreams [Divide &amp; Kreate]"" http://t.co/TmAqPJpO","BazedBarrie","ES",0,0,"no url","2012-06-03 03:12:31"
"209128076519542786","Lady Gaga posó al estilo Marilyn Monroe!!! http://t.co/zGTj9XyF","TVNotasmx","ES",0,6,"no url","2012-06-03 03:43:13"
"209129536783257600","Lady Gaga Live in Bangkok 2012 Part 2 (HD): http://t.co/zMRnX53o via @youtube","FoLKMonster","EN",0,0,"no url","2012-06-03 03:49:01"
"209129608065454080","A Drag King &amp; Queen unite to play Lady Gaga &amp; her make alter who at #Mados !!! #MontrealRoyalty http://t.co/e3ra2ioN","shaychguy","EN",0,0,"https://pbs.twimg.com/media/Aub6RUFCEAAd0dW.jpg","2012-06-03 03:49:19"
"209130178515968002","Marqué un video de @YouTube como Me gusta http://t.co/m1WPJHQM Mi Nombre (SOY EL HIJO PERDIDO DE LADY GAGA!!)","JeissonSolarte","ES",0,0,"no url","2012-06-03 03:51:34"
"209133034807640064","8. Lady Gaga vs. Nicki Minaj: no me gusta ninguna pero la nicki","ibelu1Dhoran","ES",0,0,"no url","2012-06-03 04:02:55"
"209133559112409090","RT @I_HeartRangga: ♥Lady Gaga♥ #ReTweet if you LOVE Lady Gaga ♥Lady Gaga♥♥Lady Gaga♥♥Lady Gaga♥♥Lady Gaga♥♥Lady Gaga♥♥Lady Gaga♥♥Lady Gaga♥","fenikarisma","EN",0,1,"no url","2012-06-03 04:05:00"
"209139632460410880","e_____e luego te quejas del bullying RT @BeatlOasis:  #DiscosQueMisHijosDebenDeEscuchar Lady Gaga quiero que mis crías sean como ella.","reyxD","ES",0,0,"no url","2012-06-03 04:29:08"
"209139930272768000","7 de las 10 cuentas con más seguidores en #Twitter son de estrellas de pop. Lady Gaga y Justin Bieber están en la lista http://t.co/gdtMDraA","ElUniversal","ES",1,5,"no url","2012-06-03 04:30:19"
"209141255668629504","today 3-06-2012 lady gaga concert @GBK ,  was canceled","cattleyaisk05","EN",0,0,"no url","2012-06-03 04:35:35"
"209142094495879168","@ladygaga I LOVE Mother Monster And Lady Gaga","adjiechOw","EN",0,0,"no url","2012-06-03 04:38:55"
"209153310094139392","At Home: Lady Gaga at surface of deeper Indonesian conflict: JAKARTA, Indonesia — Titin Karisma parades onto the... http://t.co/p6JBHPDl","KareneAnnCortez","EN",0,0,"no url","2012-06-03 05:23:29"
"209154639692697601","En la película de Blanca Nieves y el cazador sale Lady Gaga del video vas romance... Atentos","HectorCamara","ES",0,1,"no url","2012-06-03 05:28:46"
"209156409688985600","Amen.. RT @bengaldridge: I like little big town, but I'm still trying to figure out how on earth does lady gaga relate to Elvis?","mmbaloney9","EN",0,0,"no url","2012-06-03 05:35:48"
"209156631991304192","Lady Gaga the Fame and Fortune http://t.co/gApnSr7H","Crazytrainish","EN",0,1,"no url","2012-06-03 05:36:41"
"209156656926437376","Partyin with Katy Perry, Lady Gaga, and the Black Eyed Peas #TheLodge","agraman11","EN",0,1,"no url","2012-06-03 05:36:47"
"209158578127380481","#NP: Out of control - Lady Gaga","jhowcorrea","EN",0,0,"no url","2012-06-03 05:44:25"
"209167713313103872","#MusicianProblems ""I love music, it's the language of the soul""*listens to lady gaga*","_MusicProblems","EN",2,1,"no url","2012-06-03 06:20:43"
"209173384003727360","Considering how much cctv we have in the gym, dancing to Lady Gaga - Edge of Glory on the running ma","christophedcnh4","EN",0,0,"no url","2012-06-03 06:43:15"
"209174071890542593","Rihanna: Red hair, Katy Perry: blue, Lady Gaga: green, Nicki Minaj: Pink....WOW!!! d power rangers a","brixzsemec2","EN",0,0,"no url","2012-06-03 06:45:59"
"209187044877021184","Haces mas promesas que el numero de followers de Lady Gaga PorEsoNoTienesNoviaGali","muinaygjt8","ES",0,0,"no url","2012-06-03 07:37:32"
"209195815166672897","@lynnaleto he's a singer that Ellen Degeneres discovered, he got a phone call from Lady Gaga because he sang Paparazzi! He's just a singer!","YaraLteif","EN",0,0,"no url","2012-06-03 08:12:23"
"209201469084282881","Sexy dance shows all the rage even as Indonesia sends Lady Gaga packing - Winnipeg Free Press: Sexy dance shows ... http://t.co/gQi10AXS","LadyGaga_pap","EN",0,0,"no url","2012-06-03 08:34:51"
"209202106618490882","Gorgeous :D ! RT@texsaverio: Moment of truth: Lady Gaga in Tex Saverio in her BTWBall World Tour! http://t.co/6waUXb4C","bikkasalim","EN",0,0,"no url","2012-06-03 08:37:23"
"209202437955915776","@MaaikeRemers most of the big artists I've seen do 2h live sets. Lady Gaga, the French.singer I see, Mylène Farmer. I think Shakira &amp; Kylie","MartinCox0155","EN",0,0,"no url","2012-06-03 08:38:42"
"209204394120581120","Rihanna ranked as the most popular artists on social media: As Lady Gaga Jumps to No. 2 http://t.co/REBTieus","NigezieTV","EN",0,1,"no url","2012-06-03 08:46:29"
"209209425670582272","#10peopleiwannameet Lady Gaga just cause I have a friend I named after her","EniolaLillian","EN",0,0,"no url","2012-06-03 09:06:28"
"209211845792374784","Twitter - Week on 1 Fav Source+1 other like Ad Age: Digital-The Week in Twitter: 'RIP Lady Gaga' Doesn't Mean Wh... http://t.co/cO921Gah","jenniferBuzzBox","EN",0,0,"no url","2012-06-03 09:16:05"
"209216539205976065","Girl cries out diamond no acussation, Lady Gaga sings tons of acussation? #indonesia","dgoforfum","EN",0,0,"no url","2012-06-03 09:34:44"
"209216585339109378","just got a anon say 'you don't even like lady gaga ok' made me lol, love knowing who it is as well","s1anrees","EN",0,0,"no url","2012-06-03 09:34:55"
"209231772943265792","Llamar a Robbin la Lady Gaga Sueca es un grave insulto a Robbin #HeDicho","dani_b22","ES",0,0,"no url","2012-06-03 10:35:16"
"209232603390296065","@notsolittlekhan haha doubt that she isn't lady gaga. Who has breast milk ice cream *sick* -_- x","Missi_xXx","EN",0,0,"no url","2012-06-03 10:38:34"
"209258490634567680","so lady gaga is one of top listed aliens #mib3","kikapon","EN",0,0,"no url","2012-06-03 12:21:26"
"209258771648745473","Lady Gaga so we can JUST DANCE and have a BAD ROMANCE and lots of LOVE GAMES together  #10peopleiwannameet","GGsaid","EN",0,0,"no url","2012-06-03 12:22:33"
"209268196258222080","#20SongsOnShuffle 1.This Love,Maroon5. 2.You and I-Lady Gaga 3.Bellas Lullaby-Carter Burrell 4.Take it all-Adele","EmmzTerzic","EN",0,0,"no url","2012-06-03 13:00:00"
"209273908887695360","@Ch3linx @ladygaga @yogipurnami yeaayy!! Really want to see Lady Gaga concert again..let's go to Perth!!","rumilay","EN",0,0,"no url","2012-06-03 13:22:42"
"209276714533142528","Lady Gaga y su extraña obsesión con parecer ciudadana del Capitolio.","peetamybreadboy","ES",9,81,"no url","2012-06-03 13:33:51"
"209279801888997376","Lady Gaga Featuring Beyonce - Telephone #LadyGaga - on Soda Radio - Hitz listen live @ http://t.co/B9BUhiqA","soda_radio","EN",0,0,"no url","2012-06-03 13:46:07"
"209281504784818176","@alL_Ba , más conocida como Lady Gaga.","scptl","ES",0,0,"no url","2012-06-03 13:52:53"
"209284763767410689","♥ : Lady Gaga Telephone Parody (ft Beyonce): Key of Awesome #17Lady Gaga Telephone Parody (ft Beyonce): Key ... http://t.co/980T0osk ♥","arishmaryshow","EN",0,0,"no url","2012-06-03 14:05:50"
"209284858525130752","When do Lord and a Lady Gaga arrive? #jubilee","dannywallace","EN",3,29,"no url","2012-06-03 14:06:13"
"209284952511094784","Madonna shows she’s no lady (Gaga): Pop superstar Madonna kicked off a new world tour on Thursday wishing peace ... http://t.co/ZtbboUdR","khon7","EN",0,0,"no url","2012-06-03 14:06:35"
"209296063230771200","What happened to lady gaga? She fell off bad. She was like beiber popular for a while","seanklock","EN",0,0,"no url","2012-06-03 14:50:44"
"209296639582666752","""#RihannaIsTheQueenOfPop"" - 90s: Madonna. 2000s: Britney Spears. 2010s: Lady Gaga. Never: Rihanna.","hausoframez","ES",21,85,"no url","2012-06-03 14:53:02"
"209296900426444800","#RihannaIsTheQueenOfPop? I understand if you say Madonna or Lady Gaga, but RIHANNA? She has had no influence on music.","gagamonster96","EN",4,20,"no url","2012-06-03 14:54:04"
"209298311373529088","Jomblo say jomblo justin bieber - never say never :D ""@nadnednods: #replacesongwithjomblo Lady gaga - The edge of jomblo""","NAivah","EN",0,1,"no url","2012-06-03 14:59:40"
"209301742301622272","#20SongsOnShuffle 10-Telephone (Lady GaGa feat. Beyonce)","ItsJustDany","EN",0,0,"no url","2012-06-03 15:13:18"
"209301999605383169","I realized lady gaga isn't that bad ! She's cool . She's unique. She's a superstar","nicholasttan","EN",1,0,"no url","2012-06-03 15:14:20"
"209303811276279809","“@TheXDExperience: Lady Gaga sings....i just wish she'd dumb all this wizardry and nonsense.” &lt;&lt; LMAO","ATFierce","EN",0,1,"no url","2012-06-03 15:21:31"
"209305027746074624","Lady Gaga says: ladygaga: Um I think the bird was a peacock. And I think it left me a note! Why is his name Harold?!... http://t.co/BbZZD1nI","blazin100tweets","EN",0,2,"no url","2012-06-03 15:26:21"
"209306544796479490","Madonna Is The Only Queen Of Pop ? HAHA what a joke ! I would consider lady gaga in the line but the true queen is Mariah Carey","kunase","EN",0,0,"no url","2012-06-03 15:32:23"
"209308730012073984","RT @vgragon: Lady Gaga Ready To Launch Own Social Network – Little Monsters http://t.co/BnanSe3a//jajaja , que chido….mmhh….paso :/","XtreMaster","ES",0,0,"no url","2012-06-03 15:41:04"
"209309036217245698","News: John worries for Lady Gaga - WXXA http://t.co/WJ5KoeVg","lady_gaga_cool","EN",0,0,"no url","2012-06-03 15:42:17"
"209309916991717377","Para mí Madonna es la reina del pop, y Lady Gaga su heredera al trono.","MonteithlyCory","ES",0,1,"no url","2012-06-03 15:45:47"
"209316372033974272","""@dcostdj: thank god Lady Gaga hasn't come out with a new song in a while.. the radio is sucha better place without her""","anth_sabatino","EN",0,0,"no url","2012-06-03 16:11:26"
"209318146211971073","Money Honey - Lady Gaga #20SongsOnShuffle","Always_Unbroken","EN",0,0,"no url","2012-06-03 16:18:29"
"209319429698363394","Lady Gaga nos coment Um I think the bird was a peacock. And I think it left me a note! Why is his nam... http://t.co/fzAosnsR","lagartijoweb","EN",0,0,"no url","2012-06-03 16:23:35"
"209322445407141889","todo el mundo sabe quien domina la música ahora mismo y esa es Lady Gaga.","PawsUp_for_Gaga","ES",0,0,"no url","2012-06-03 16:35:34"
"209332578837204993","Lady Gaga Poses As Marilyn Monroe To Celebrate The Late Icon's Birthday 502","misformusicnews","EN",0,0,"no url","2012-06-03 17:15:50"
"209334478865309696","EVERYONE PLEASE FAST FORWARD TO 1:13 HAHAHAHAHA!! Lady Gaga - THE BORN THIS WAY BALL Singapore 2012 - Born This Way: http://t.co/qcjiLp2z","ddeokbbokki","EN",0,0,"no url","2012-06-03 17:23:23"
"209343377739759617","7 de las 10 cuentas con más seguidores en #Twitter son de estrellas de pop. Lady Gaga y Rihanna están en la lista http://t.co/Rv16tkUE","ElUniversal","ES",0,6,"no url","2012-06-03 17:58:45"
"209344265422241792","Lady Gaga ugly? next joke please. http://t.co/c0PccaA2","holyfoolmandy","EN",1,5,"https://pbs.twimg.com/media/Aue9gBCCAAA0Lbd.jpg","2012-06-03 18:02:17"
"209344323051982849","I favorited a @YouTube video from @djChopin http://t.co/CG8RgkF6 Lady Gaga - ''Born This Way (Dj Chopin Hardstyl","thenameisalicia","EN",0,1,"no url","2012-06-03 18:02:30"
"209348714442129409","Space Cowboy, Lady Gaga, Lady Gaga, here we go, cherry cherry boom boom!","GagaCreative","EN",0,0,"no url","2012-06-03 18:19:57"
"209352167683919872","#CosasSobrevaloradas Lady Gaga, Britney Spears, Rihanna etc...Todas esas artistas que graban la misma canción cambiando la letra.","Chus_c14","ES",0,7,"no url","2012-06-03 18:33:41"
"209352348487786496","Selena Gomez, Justin Bieber, Miley Cyrus, 1D, Ariana Grande, Taylor Swift, Demi Lovato, Lady Gaga. RT if one of your idols is here!","xiheartariana_","EN",1,12,"no url","2012-06-03 18:34:24"
"209354410172747776","RT @Anggun_Cipta RT @texsaverio: Moment of truth: Lady Gaga in Tex Saverio in her BTWBall World Tour! http://t.co/m4C2d5Hz","viesylvie01","EN",0,0,"no url","2012-06-03 18:42:35"
"209355307770580993","Me ha gustado un vídeo de @YouTube. http://t.co/MpY1Tnbb Lady Gaga - So happy I could die (HBO Special)","Sp_Truco","ES",0,0,"no url","2012-06-03 18:46:09"
"209360420639735809","Lady Gaga, Tyga, The Weeknd &gt; fuck your music","ewPUSSY","EN",0,0,"no url","2012-06-03 19:06:28"
"209367462846803968","She said she was trying to be Lady Gaga. Smh http://t.co/vbNjXkBm","Lizilicious","EN",0,0,"no url","2012-06-03 19:34:27"
"209368975367344129","Mom: Wake up! Me: *Sleeping.* Mom: WAKE UP! Me: *Still sleeping.* Mom: LADY GAGA!!! Me: WHERE?!?! *Falls out the bed.*","FaithfulToGaga","EN",3,11,"no url","2012-06-03 19:40:28"
"209372990968827904","Me gusta la letra de Lady Gaga ;)","MisterGago_MBC","ES",0,0,"no url","2012-06-03 19:56:25"
"209382150166953984","Vote for Lady Gaga as the sexiest woman in Pop on Billboard ---&gt; http://t.co/TvSFIFLV - RT!","LGMonsterFacts","EN",6,48,"no url","2012-06-03 20:32:49"
"209389042557648896","Is this the same Indonesia that banned Lady Gaga from performing for being too lewd?: http://t.co/e0Km5bNS","metzada3833","EN",0,0,"no url","2012-06-03 21:00:12"
"209389308824657920","Lady gaga fans where yall at? She copies her to. Lets expose this bitch ww #NickiMinajStopCopyingLilKim""","teamkimlisa","EN",1,4,"no url","2012-06-03 21:01:16"
"209389608801275907","New post: Elton John worried about Lady GaGa's health http://t.co/DTVnXgXj","gemhamma","EN",0,0,"no url","2012-06-03 21:02:27"
"209390288253362176","Breaking News: Lady Gaga puts glue on herself and rolls around on random things.  :- /","lindermanfzxj6","EN",0,0,"no url","2012-06-03 21:05:09"
"209391533957451776","I liked a @YouTube video http://t.co/dYfaDOt4 Matt Pumanes - ""Americano"" by Lady Gaga","akalilBILL2","EN",0,0,"no url","2012-06-03 21:10:06"
"209400038969974784","en cuanto tiempo Maddona &amp; Britney Fueron Leyendas? en cuanto tiempo Lady Gaga Fue Leyenda?","iJoshJack","ES",0,2,"no url","2012-06-03 21:43:54"
"209403403833585664","Madonna Covers Lady Gaga's 'Born This Way' (Video) - Hollywood ... http://t.co/7BICpLci #madonna","madonna_fans_","EN",0,0,"no url","2012-06-03 21:57:16"
"209412539044470785","lo mismo aplica para lady gaga","_leofreak","ES",0,0,"no url","2012-06-03 22:33:34"
"209414465018544128","""I will live and die and breathe my work and my art to protect your dreams, because you protect mine."" - Lady Gaga","Monsterlicioso","EN",2,7,"no url","2012-06-03 22:41:13"
"209414799753363456","""Space Renegade: Lady Gaga. Has escaped. Alien fugitive objective: Birth a new race. Operation: KILL THE BITCH""","CarlozGaGa","EN",0,0,"no url","2012-06-03 22:42:33"
"209427888573911041","1D to Dominican Republic and Lady Gaga to Dominican Republic too!!!!!! RT","ElaPrez","EN",0,4,"no url","2012-06-03 23:34:34"
"209430264160587780","@NICKIMINAJ shut up wanna be lady gaga,modanna,kate perry....u fake ....get out of here! Nobody wants to listen to ur wack music","kingjose81","EN",0,0,"no url","2012-06-03 23:44:00"
"209432738820927488","Indonesia – ‘Little Monsters’ flock to the site of Lady Gaga’s canceled show http://t.co/yxxjtsVm via @actuporg","Pixel51","EN",0,0,"no url","2012-06-03 23:53:50"
"209437678154952704","""Why do you love Lady Gaga?"" Me: I wrote the reasons here: http://t.co/XHhlbCgW","FaithfulToGaga","EN",3,12,"https://pbs.twimg.com/media/AugSdWoCAAAvbet.jpg","2012-06-04 00:13:28"
"209439290311192576","@LizbethbalderaJ Lady gaga To Dominican republic :)","PrinzJunkie","ES",0,2,"no url","2012-06-04 00:19:52"
"209445028681093120","Lady Gaga is going to perform THE NEW SINGLE on Radio 1's Live Lounge on September 9th!","AlexandriaLust1","EN",0,2,"no url","2012-06-04 00:42:40"
"209445258801577984","@JoCalderone ITALY = OBRIVAETSA HEART BLOOD-heart aches for Italy LADY GAGA AND VIKTOR REBEL.ROME, June 4 - An earthquake with magnitude 5.1","VIKTOREL13","EN",0,0,"no url","2012-06-04 00:43:35"
"209452678525358080","Emily : "" I'd you could bone one famous person who would it be ? "" Me : "" lady gaga , oh that weird ass bitch &lt;3 ""","NatieePoo","EN",0,0,"no url","2012-06-04 01:13:04"
"209453655789797376","Lady Gaga is about to launch her own social network. Yes, for real. http://t.co/zG0PLfAs","jeffbeisenberg","EN",0,0,"no url","2012-06-04 01:16:57"
"209457007055486977","¿Si Lady Gaga va todo el año disfrazada, en Halloween se vestirá de persona normal?""","Bruno716904","ES",0,0,"no url","2012-06-04 01:30:16"
"209459964052385792","Only 24+ million to go to catch Lady Gaga. RT @richarddeitsch NEW YORK -- The @AP hit one million followers today.","BrendanPrunty","EN",0,0,"no url","2012-06-04 01:42:01"
"209461127514554368","-Hola, ¿Cómo te llamas? _Waka Waka, ¿Y tú? -Alejandro. _JAJAJAJAJÁ ¡NO MAMES! Como el de la canción de Lady Gaga.","MrFuckinItAll","ES",71,285,"no url","2012-06-04 01:46:39"
"209476376330379265","I bet the most expensive hamburger in the world is made out of the meat on Lady GaGa's meat dress ^.^","TheWorldOfEDMx3","EN",0,0,"no url","2012-06-04 02:47:14"
"209486734810034176","Blast ""Judas"" by Lady Gaga in the parking lot #ThingsYouDontDoAfterChurch","holyh00ker","EN",63,357,"no url","2012-06-04 03:28:24"
"209498262217043968","Lady Gaga-Poker face Cover by kacee - YouTube: me singing Pokerface. ... Dominic's version of Lady Gaga's Poker ... http://t.co/6iwrZZ8e","WorldofLadyGaGa","EN",0,0,"no url","2012-06-04 04:14:12"
"209519648998309888","Lady Gaga: Secrets and biography of the singer - Free Fashion Trends http://t.co/4I9hTw0s","VitaliaSharapov","EN",0,0,"no url","2012-06-04 05:39:11"
"209525051249266688","“And now, I'm just trying to change the world, one sequin at a time.”  ― Lady Gaga @ladygaga #LittleMonsterINDO ^^","juralmind","EN",0,0,"no url","2012-06-04 06:00:39"
"209529270421299200","#TweetnesianOpinion what do you think about LADY GAGA ?","Tweetnesian","EN",0,3,"no url","2012-06-04 06:17:25"
"209533129495547904","just watched the new MV of #bigbang. My only comment is GD looks like Lady Gaga.. Haha","cioccolatolover","EN",0,0,"no url","2012-06-04 06:32:45"
"209533406286069760","dejar a Justin en paz y traer a LADY GAGA. #GAGAalHormiguero","PawsUp_for_Gaga","ES",0,5,"no url","2012-06-04 06:33:51"
"209535440527695872","Lady Gaga loves the sitar: Fateh Ali Khan - India Today: India TodayLady Gaga loves the sitar: Fateh Ali KhanInd... http://t.co/6N9IAhR7","myformula1","EN",0,0,"no url","2012-06-04 06:41:56"
"209540917063987200","id rather listen to lady gaga then cody sing refill","Mego_1225","EN",0,1,"no url","2012-06-04 07:03:42"
"209553773847257089","@GagaAndDanny yes and when I recive a mail .. Lady Gaga followed u .. I panic and then I see the username :-L ..","IoaaRaluca","EN",0,0,"no url","2012-06-04 07:54:47"
"209559419393028096","☆★☆Lady Gaga - Telephone ft. Beyoncé  http://t.co/aknxID0D","naoyadoi","EN",0,0,"no url","2012-06-04 08:17:13"
"209568319689330688","@ladygaga Lady Gaga I love you as I know that you had a concert in Thailand.","SupakritKeawlas","EN",0,0,"no url","2012-06-04 08:52:35"
"209577819771109376","I love Lady Gaga and Rihanna. Even if they're illuminati believers o.O","syiraaawr","EN",0,0,"no url","2012-06-04 09:30:20"
"209581471592235010","When you look up the dictionary for the definition of 'flawless', you'll probably find Lady Gaga there. Gaga Is Our Perfect Idol","PIasticMonster","EN",0,9,"no url","2012-06-04 09:44:51"
"209590759232512000","Lady Gaga: reina de Twitter y de Facebook: A pesar de las polémicas en que frecuentemente se ha visto envuelta l... http://t.co/CVJMCaTV","chismefarandula","ES",0,0,"no url","2012-06-04 10:21:45"
"209591077991227392","I wouldn't mind being Lady Gaga just for a week. Cause everything she does looks like fun, hard work, but still epic.","Azzyterror","EN",0,0,"no url","2012-06-04 10:23:01"
"209601006626021376","@SS_rafly @SS_Ariya Support youth empowerment, social change! Spread #BTWFoundation http://t.co/RyK5nOG7 Lady Gaga Is Our Perfect Idol","AussieChuckster","EN",0,2,"no url","2012-06-04 11:02:28"
"209606735336456193","hotel portofino lady gaga 2.3GP http://t.co/mr3pPW3V","Yabanci_Muzik","ES",0,0,"no url","2012-06-04 11:25:14"
"209614985519837184","“@MYXphilippines: http://t.co/9kPoBi8K update: Lady Gaga Almost In Tears From Indonesian Fans' Flash Mob http://t.co/eC2be3D2”","GreenElektron","EN",0,0,"no url","2012-06-04 11:58:01"
"209616407388893185","http://t.co/Zg6HkO77 #GagaChallenge Ⓖ 20 - How many Lady Gaga songs do you have? ➜ All of them","SuzzElizabeth","EN",0,0,"no url","2012-06-04 12:03:40"
"209619469235007488","Muero de ganas de escuchar el nuevo single de Lady Gaga.","CarlosNoodles","ES",0,0,"no url","2012-06-04 12:15:50"
"209631469260374016","In just 4 years, Lady Gaga has managed to sell 1/3rd of Madonna's total worldwide sales, which took her 30 years.","skeletongunsss","EN",1,5,"no url","2012-06-04 13:03:31"
"209638645597077505","Must say we are loving Lady Gaga on he cover of Vogue China! http://t.co/bCWbgYOL","FashionRocksQA","EN",0,0,"no url","2012-06-04 13:32:02"
"209640251348627456","@Miranda_Lambert you f*cking rocked the house last night &lt;3333 and thank you for sing Lady GaGa's You&amp;I #ILoveYouRan","Sarah_Hauss","EN",0,1,"no url","2012-06-04 13:38:25"
