"tweet_id","text","author","language","likes","retweets","media","timestamp"
"100010532295294976","In berkeley, being on time usually means being first and waiting for about 15 minutes lol","wildbillchen","EN",0,0,"no url","2011-08-07 01:09:03"
"100017528406937600","@johnbreech With Lawrence Berkeley National Labs in the background!!! This picture sums up my college life.","DavidERod","EN",0,0,"no url","2011-08-07 01:37:04"
"100364338610716674","Craigslist job: Cafe retail position FT-needed immediately (berkeley north / hills) http://ow.ly/1e8OJj","ACNewBeginnings","EN",0,0,"no url","2011-08-08 00:34:57"
"100611487420260353","Video: Energy efficiency for sale. Who's buying? A conversation with Berkeley Lab's Merrian Fuller http://bit.ly/odVCvi","BerkeleyLab","EN",0,1,"no url","2011-08-08 16:57:02"
"100662461342040064","@gaiaprom @elcuaderno13 @canal13colombia george berkeley se reporta dkjdjdkd","RuizDanielaC","ES",0,0,"no url","2011-08-08 20:19:35"
"100677326416781314","Store CO2 underground and extract electricity? A Berkeley Lab-led team is working on it http://bit.ly/qJPsvC","BerkeleyLab","EN",0,6,"no url","2011-08-08 21:18:39"
"100683671954132992","@Morgyy_Babyy your driving to berkeley dope ok I'm ready lol","DaKidSK","EN",0,0,"no url","2011-08-08 21:43:52"
"100705113244573697","Live tonight at 9:00pm in the Space Lounge at the Saturn Cafe Berkeley: Grace Gravity.  Click below for a sample - http://fb.me/JOCsLXJk","saturncafe","EN",0,0,"no url","2011-08-08 23:09:04"
"100721923981451264","Max R.'s Review of Berkeley Construction - Berkeley (5/5) on Yelp: I have worked with a… http://goo.gl/fb/L2hj5","groupbuyon","EN",0,0,"no url","2011-08-09 00:15:52"
"100722536374996993","I'm tweeting new balance Falmouth Road Race times for Berkeley O'Keefe in real time on race day. Courtesy of new balance","bhokeefe","EN",0,0,"no url","2011-08-09 00:18:18"
"100995308728750080","Little b telegraph Berkeley california","ChampANDActives","EN",0,0,"no url","2011-08-09 18:22:12"
"101069564699353088","Berkeley Researchers Say Carbon Pollution Can Be Turned Into Energy:  It’s a beautiful thing when innovators tak... http://bit.ly/pqsEbU","EcoFoamCEO","EN",0,0,"no url","2011-08-09 23:17:16"
"101088563290062849","I showed the Al Jazeera English docu on #Bahrain ""Shouting in the Dark"" to a class I taught today at Berkeley. We were all gutted.","monaeltahawy","EN",6,28,"no url","2011-08-10 00:32:46"
"101199760085622784","American Thinker: Articles - Robin of Berkeley: The Sleeping Giant Awakens: http://t.co/lnqxnmT #tcot #teaparty","William_S_Blair","EN",0,0,"no url","2011-08-10 07:54:37"
"101251186438582272","Berkeley Researchers Say #Carbon #Pollution Can Be Turned Into #Energy | Inhabitat - Green Design Will Save the World -  http://t.co/ps4KCKt","globexpert","EN",0,0,"no url","2011-08-10 11:18:58"
"101292240290320384","I'm at Press 195 (195 Fifth Ave, btw Union St & Berkeley Pl, Brooklyn) http://4sq.com/nlqFml","Yokman_serenade","EN",0,0,"no url","2011-08-10 14:02:06"
"101339161977556992","#openhome_berkeley 1781 OXFORD ST BERKELEY (Sun Aug 14 01:00 PM to 04:00 PM) Listed by James S. Shin: http://goo.gl/Z2b4g","homesopentoday","EN",0,0,"no url","2011-08-10 17:08:33"
"101387648136003584","Nice to be at Berkeley Square (The) http://weav.rs/qu3t89","aubreywonders","EN",0,0,"no url","2011-08-10 20:21:13"
"101482653299130369","Berkeley, the Prius Capitol of the world. If you were playing slug bug, you'd have a broken arm by now.","jvilter","EN",0,0,"no url","2011-08-11 02:38:44"
"101601318539497472","Berkeley and Oakland Come to the Table: Alice Waters and Nikki Henderson occupy radically different places in ... http://bit.ly/owtdtY","SpillBPSpill","EN",0,0,"no url","2011-08-11 10:30:16"
"101713201602895872","I'm at Slow (1966 University Ave, Milvia, Berkeley) http://4sq.com/pUAppm","walktrotcanter","EN",0,0,"no url","2011-08-11 17:54:51"
"101731199352975360","@BerkeleyLab: Shooting light a curve: Berkeley Lab researchers develop way to control plasmonic airy beams http://bit.ly/pBWeh7","Energy_Science","EN",0,0,"no url","2011-08-11 19:06:22"
"101735922139283457","@foureyedcub Yeah man its a cafe in Berkeley that me and my friends run. We have free wifi, fair trade coffee and a full cereal bar :D","chadbercea","EN",0,0,"no url","2011-08-11 19:25:08"
"101908534547062784","Berkeley tomorrow! Excited to finally get outta the house :)","Rosaabigail","EN",0,0,"no url","2011-08-12 06:51:02"
"102044589841588225","DROPLET: ""Do you want to get married and have babies?"" (Man on cell while eating at Green Papaya in Berkeley, #overheard  by Steve Finacom)","leahgarchik","EN",0,0,"no url","2011-08-12 15:51:40"
"102081763509149697","Now Hiring: Senior Research Associate: Our client, a growing biotech company in the Berkeley / Emeryville area, ... http://t.co/Dmyj0lv","rachrapp248","EN",0,0,"no url","2011-08-12 18:19:23"
"102102139408621568","Berkeley County jamboree cancelled tonight due to inclement weather. No reschedule date.","EvelynFernandez","EN",0,0,"no url","2011-08-12 19:40:21"
"102111878590889984","#jobs Payroll Analyst 2 #12669 - University of California - Berkeley -  Berkeley, CA http://t.co/RX5PB9u","Jobs_Berkeley","EN",0,0,"no url","2011-08-12 20:19:03"
"102122428796383235","Crossing Borders: Berkeley Immigration Conference Seeks Education Journalist Fellows:   If you’ve been on the ... http://t.co/JEI3SbP","EdWriters","EN",0,2,"no url","2011-08-12 21:00:59"
"102135274699632640","BERKELEY: WB 80 after Gilman st. A 2 car crash is blocking the left lane. Traffic is slow from San Pablo Dam rd.","kcbstraffic","EN",0,1,"no url","2011-08-12 21:52:01"
"102190135910727680","+1! The winner of UC Berkeley's design challenge to rethink the food label http://j.mp/nQI1el","curiositycounts","EN",0,3,"no url","2011-08-13 01:30:01"
"102205935849713664","berkeley j-school holds a design competition to reimagine food labels: http://t.co/CMuSAvb","AAlampi","EN",0,0,"no url","2011-08-13 02:32:48"
"102304149688954882","Pete Redfern : Berkeley boosts Pidgleys pay by a third to £3.2m - Building.co.uk http://t.co/9lzxCv0","trcardon","EN",0,0,"no url","2011-08-13 09:03:04"
"102461880680972288","And @TeahouseStudio in Berkeley is adorable! Comforting. Creative. Magenta. Elephant painting. Hope to take workshop there again soon.","martinejoelle","EN",0,1,"no url","2011-08-13 19:29:50"
"102652486640336897","Lovely eve playing for our friend's wedding at Lawrence Hall in Berkeley! Sunset over the Bay was incomparable tonight...","brassmenazeri","EN",0,0,"no url","2011-08-14 08:07:14"
"102782791057539072","Finally! @officialadele plays the Greek Theatre in Berkeley tonight: http://t.co/KqdpoHz","MetromixSanFran","EN",0,0,"no url","2011-08-14 16:45:01"
"102838415917199360","Shooting light a curve: « Berkeley Lab News Center http://t.co/iNoc0Jv","Ngan3970","EN",0,0,"no url","2011-08-14 20:26:03"
"102902370677174272","people watching at Berkeley... these guys are moving in to their new place!! how cute... but how stalker-y of me!! lol","rjsanjose","EN",0,0,"no url","2011-08-15 00:40:11"
"103066565108449280","Wedding Village at Berkeley Show http://t.co/8A6K8mL","berkeleycastle","EN",0,0,"no url","2011-08-15 11:32:38"
"103079898796670977","Ughhhh , on my way to prison ! #BERKELEY .","_Tay2x","EN",0,0,"no url","2011-08-15 12:25:37"
"103101373612179456","Used Toyota Camry 1996 ($1500) for sale in CA, Berkeley, 94704 - http://t.co/Rj7dMvU","freecarsforsale","EN",0,0,"no url","2011-08-15 13:50:57"
"103147095728463872","Just passed Berkeley cafe #memories","theycallmeCELA","EN",0,0,"no url","2011-08-15 16:52:38"
"103190590686117888","The public tickets for Edible Education 101 at UC Berkeley became available this morning and  booked out in 12 minutes!!","AliceWaters","EN",1,8,"no url","2011-08-15 19:45:28"
"103201955312185345","August 19, Berkeley, talk on ""wearable electrochemical sensors for monitoring performance athletes"" http://t.co/9gjKJNj","hrheingold","EN",0,2,"no url","2011-08-15 20:30:38"
"103359398805651456","New crop swap comes to the Lorin District #Berkeley http://t.co/5IIknkK","noreen","EN",0,0,"no url","2011-08-16 06:56:15"
"103473706210295809","Interested in an MBA from UC Berkeley ?? They will visit Monterrey and Mexico City, see the calendar:  http://ow.ly/64rgn","EducationUSAMty","EN",0,0,"no url","2011-08-16 14:30:28"
"103539208639094784","Last 4 of 10 New Homes on New Cul-De-Sac in Berkeley Hts. NJ. Ready To Start http://t.co/Mnl9PLh via #constantcontact","NJEstates2","EN",0,0,"no url","2011-08-16 18:50:45"
"103568560365912064","http://t.co/lnScqkX Love your blog Em. I miss you already. Keep us posted from Berkeley!!","msb000","EN",0,0,"no url","2011-08-16 20:47:23"
"103579012068159490","Bay Area students get hands-on science experience and a salary « Berkeley Lab News Center http://t.co/DmFbcyP","rleuty_biotech","EN",1,1,"no url","2011-08-16 21:28:55"
"103589427040878592","I'm at Starbucks (443 Boylston St, at Berkeley St, Boston) w/ 3 others http://t.co/RACmtPX","redheadedjen","EN",0,0,"no url","2011-08-16 22:10:18"
"103610675384942594",".@openculture, check out the @MotherJones coverage of those UC Berkeley scientists' most recent (and related) study http://t.co/Ofpdqvx","H_Lev","EN",0,0,"no url","2011-08-16 23:34:44"
"103658621916815363","This is killer. RT @bguenther Thanks Biz! RT @biz: Lectured at UC Berkeley today -- my new part time gig! http://t.co/MZaMrTz #haas","BrianMDunham","EN",0,3,"no url","2011-08-17 02:45:16"
"103680049189883905","I hit a ton of personal bests in tonight's Berkeley Tuesday Night Ride:  http://t.co/wMkB3yV. Totally kicked my ass, too.","markos","EN",0,0,"no url","2011-08-17 04:10:24"
"103750551216472064","lol UC Berkeley had Asians at 41% and whites 31%","jaejoongiekim","EN",0,0,"no url","2011-08-17 08:50:33"
"103843614450397185","RT @metu_berkeley: Stop hating, its bad 4 d health","Mczeph","EN",0,0,"no url","2011-08-17 15:00:21"
"103848744084180993","Just a launch NEW WEBSITE: ESALEN MASSAGE http://t.co/Dn1xl01 Berkeley & Livermore &gt; web design by @lonzodesigns &gt;we follow back","lonzodesigns","EN",0,0,"no url","2011-08-17 15:20:44"
"103866407846019072","Filmmaker Miranda July reminisces about growing up in Berkeley, walking to @moesbooks, Cody’s, Half-Priced Books...http://t.co/ZUuN81r","berkeleyside","EN",0,3,"no url","2011-08-17 16:30:56"
"103878972441509890","I'm at Philz Coffee (1600 Shattuck Ave., at Cedar St., Berkeley) http://t.co/3dINoNZ","walktrotcanter","EN",0,0,"no url","2011-08-17 17:20:51"
"103914779181203456","RT @katetorralba: past few days here in US were amazing: THISCLOSE to @AdeleOfficial in Berkeley (wow she (cont) http://t.co/f2mqNXV","BelaSheria","EN",0,0,"no url","2011-08-17 19:43:08"
"103921774932144128","just tried to log baq into my UC Berkeley Tele-BEARS account online and my password and username didnt work.. kinda sad im not gonna lie.","ShaneVereen34","EN",1,10,"no url","2011-08-17 20:10:56"
"103946668491284480","University Of California 1 (510) 642-6000 Berkeley, CA 94720 http://t.co/2tGvAto","vadams8","EN",0,0,"no url","2011-08-17 21:49:51"
"103974015353360384","Packing for Berkeley. NorCal in 24 hours. :)","thewalkingipod","EN",0,0,"no url","2011-08-17 23:38:31"
"104052457218375681","I'm at Apple Store (1823 Fourth Street, Berkeley) http://t.co/beeqDsu","romeronando","EN",0,0,"no url","2011-08-18 04:50:13"
"104244926396628992","Tonight in Berkeley: a screening of the renewable fuel-focused documentary FREEDOM. Tour the Freedom Bus! @rebeccatickell http://ow.ly/66FXh","EcoTuesday","EN",1,5,"no url","2011-08-18 17:35:01"
"104281554297176064","Group Glass-Arts Class, Private Class or Up to Eight, or Merchandise at Stained Glass Garden in Berkeley http://MyDe.al/MDz","DealGatorSF","EN",0,0,"no url","2011-08-18 20:00:34"
"104314395693289473","#openhome_berkeley 3109 ELLIS ST BERKELEY (Sun Aug 21 02:00 PM to 04:30 PM) Listed by WARWICK MAY: http://t.co/2f933y5","homesopentoday","EN",0,0,"no url","2011-08-18 22:11:04"
"104344653435908097","@MackinAzzZay down town by berkeley high by the walgreens","heycharlieeee","EN",0,0,"no url","2011-08-19 00:11:18"
"104363674579382272","Last night in the big bad town of Berkeley Springs... #winning","zsosolo","EN",0,0,"no url","2011-08-19 01:26:53"
"104680919163604992","Lack of human capital to be precised  @Vinniebovinnie: Learning from the Berkeley Club VC Talk,LIVE now is talking about human capital.","sandiuno","EN",0,0,"no url","2011-08-19 22:27:30"
"104707947258580992","BIG back ups in Pierce Co - SB 5 slow from Tac Mall to Dupont = 10 miles, NB 5 slow Nisqually to Berkeley Ave = 8 miles","komonewsradio","EN",0,1,"no url","2011-08-20 00:14:54"
"104896267297095680","New energy lab searches for next biofuel breakthrough (photos): Lawrence Berkeley National Laboratory's cutting... http://t.co/NlF8zZz","vividspirit","EN",0,0,"no url","2011-08-20 12:43:13"
"104936666858397696","Jan Wahl of @CBSSF gives Gun Hill Road 4 Hats! http://t.co/dx6DBLI Now Playing in SF & Berkeley - http://t.co/Toq4VAZ http://t.co/EWLbj4H","gunhillroadfilm","EN",0,1,"no url","2011-08-20 15:23:45"
"105101935006322688","I liked a @YouTube video http://t.co/IzNdJqg THE NORTH FACE 2011 F/W Berkeley with G-Dragon","Jmui82","EN",0,0,"no url","2011-08-21 02:20:28"
"105107354026115072","Interested in Accounting? Learn more at Accounting Info Session at 1pm, Basement Lecture Theatre, The Spot, 198 Berkeley St #unimelbopen","unimelb","EN",0,1,"no url","2011-08-21 02:42:00"
"105149905252782080","Elaine S.'s Review of Tea Fragrance House - Berkeley (1/5) on Yelp: We ordered delivery because they left a flyer on... http://t.co/eDmJlO0","sfcommunitynews","EN",0,0,"no url","2011-08-21 05:31:05"
"105365937082990593","I'm at Fellini Coffee Bar (1401 University Ave, Acton, Berkeley) http://t.co/udEbm0g","Brixest","EN",0,0,"no url","2011-08-21 19:49:31"
"105366033531011072","I'm at Bette's Oceanview Diner (1807 4th St, btw Hearst & Virginia, Berkeley) http://t.co/pPNr7yv","miles5000","EN",0,0,"no url","2011-08-21 19:49:54"
"105386124280725504","Wow lot of great History classes being taught at Berkeley this semester. Wish I was still in school for those.","abhiyerra","EN",0,0,"no url","2011-08-21 21:09:44"
"105418332320174080","Skin Care CA:  Berkeley Dermatology: Berkeley Physicians & Surgeons http://t.co/sfdmMPJ","FindSkinCareCA","EN",0,0,"no url","2011-08-21 23:17:43"
"105428801298767872","Note to self. Busby Berkeley's DAMES! On TCM at 615pm Wednesday.","davidlook","EN",0,0,"no url","2011-08-21 23:59:19"
"105671139791081473","10 Luxury New Homes, 6 Sold, 4 More Start in 2011 - Berkeley Heights, NJ Patch http://t.co/TNJqGKP  More New Homes http://t.co/62QZghA","NJEstates2","EN",0,0,"no url","2011-08-22 16:02:17"
"105688663626752000","life fitness http://t.co/62Bl6h9 Berkeley Heights 5K Charity Road Race  Fitness Walk in September :)","filllive","EN",0,0,"no url","2011-08-22 17:11:55"
"105699770135359488","Ministry of Education - Berkeley Institute Budget response http://t.co/Z5Wl1OB","dciBermuda","EN",0,0,"no url","2011-08-22 17:56:03"
"105702051828338688","$1,200,000 Berkeley HeightsCounty: UnionStyle: ColonialBedrooms: 5Bathrooms: 3½Area: contact:Paul Stillwaggon(908) 31 http://ow.ly/68mOh","BarryACooper","EN",0,0,"no url","2011-08-22 18:05:07"
"105737422385577984","Alice Waters of Berkeley's Chez Panisse is the guest on FRESH AIR today. At 2pm & 7pm.","OPB_Radio","EN",0,0,"no url","2011-08-22 20:25:40"
"105756720403451904","i think i found my roommate for berkeley :D http://t.co/R3igbl4 #bestroommateever #craigslist","littlechicken","EN",0,0,"no url","2011-08-22 21:42:21"
"105896621392396288","We met in a hallway at Berkeley High School in 2003 . . . We were 15 years old . . . The rest is","TYRONEOlague2","EN",0,0,"no url","2011-08-23 06:58:16"
"105980339708633090","Renovo Capital may take over bankrupt Andronico's http://t.co/vEPWDCE via @sfgate --&gt; Sad! I used to shop at the #Berkeley stores.","queenkv","EN",0,0,"no url","2011-08-23 12:30:56"
"106020550484295682","*FINALLY* I know where my SFO pit stops are :&gt;) Im most excited about being in Berkeley..","faren800","EN",0,0,"no url","2011-08-23 15:10:43"
"106025210347655170","Central New Jersey New Homes Started or Starting in 2011. $725,000. Up - Berkeley Heights, NJ Patch http://t.co/80nuGtO","NJEstates3","EN",0,0,"no url","2011-08-23 15:29:14"
"106062307393671169","Cooks' Book Club: 4th Street in Berkeley 2night. Pasta Shop 6pm, Books Inc. @ .  Come chow and chat with @mynepenthe and @bluechairfruit","lettuceeatkale","EN",0,1,"no url","2011-08-23 17:56:39"
"106119208911384576","Rest In Peace: Codys Books in Berkeley, CA http://t.co/nXXyDsh","colbybuzzell","EN",0,0,"https://pbs.twimg.com/media/AXkC27dCMAAM3-i.jpg","2011-08-23 21:42:45"
"106155565130055681","This Saturday we've got Original Sin Burlesque in the Space Lounge at the Saturn Cafe Berkeley.  Here's a snapshot... http://t.co/cfekTJS","saturncafe","EN",0,0,"no url","2011-08-24 00:07:13"
"106163161006215169","Museums, food and art intersect at OPEN: When the crowds descend upon the UC Berkeley Art Museum's grounds this ... http://t.co/PZMr9sh","Rapricorn","EN",0,0,"no url","2011-08-24 00:37:24"
"106254206779924480","Just felt a thump and shaking at 11:37pm PST in North Oakland/ South Berkeley. #earthquake","elaineishere","EN",0,0,"no url","2011-08-24 06:39:11"
"106335085539758080","Mechanical Design Engineer job in Cumbria at Berkeley Square IT Ltd http://t.co/Mo2h3zB #jobs #engineering","AllEngineerJobs","EN",0,0,"no url","2011-08-24 12:00:34"
"106370575122968576","We'll be serving lunch at 5th and Minna today! and Dinner at in Berkeley at Shattuck and Rose. Hope to see you all!","senorsisig","EN",0,2,"no url","2011-08-24 14:21:36"
"106398087815241728","Berkeley SETI chosen as one of the #PopSci 25 Most Awesome College Labs 2011 http://t.co/WcYVBqM","setiathome","EN",0,2,"no url","2011-08-24 16:10:55"
"106419625918595073","missing the SF sunshine to do work. but looking forward to sushi in the east bay tonight! #berkeley","IntentionalTart","EN",0,0,"no url","2011-08-24 17:36:30"
"106420527706537985","Tomorrow! Dont miss Briget Boyle, Janet Kutulas and Corinne Sykes singing a free concert at the Berkeley Public... http://t.co/JumQhXU","briget","EN",0,0,"no url","2011-08-24 17:40:05"
"106437653062356993","Fall classes begin this week at UC Berkeley http://t.co/BWFbwnE","eindiainsurance","EN",0,0,"no url","2011-08-24 18:48:08"
"106442770109050880","Brownie for lunch, lol. I love Berkeley.","herrb_","EN",0,0,"no url","2011-08-24 19:08:28"
"106448428204167168","FOUND Iphone in South/dtown Berkeley #found #craigslist #community #lost #SFO http://t.co/nraunk7","SFOLost","EN",0,0,"no url","2011-08-24 19:30:57"
"106455386583871488","@burritojustice I felt nothing here at Pier 3; whereas last night's felt disproportionately strong last night in Berkeley.","SFNick","EN",0,0,"no url","2011-08-24 19:58:36"
"106472587424579584","On 9/18/11 @ Berkeley Cafe I will be hittin the stage with @Hometeam_DjSam on the 1's and 2's! Get your $8 tickets here: http://t.co/hs4x9IN","descendentMC","EN",0,1,"no url","2011-08-24 21:06:57"
"106473644896698368","I don't think I've been so embarrased in my life o_o #sorrycoach @doubled143","Anna_Berkeley","EN",0,1,"no url","2011-08-24 21:11:09"
"106476379046023169","Berkeley Square - Read more … http://t.co/HPSUDiR","kramerw","EN",0,0,"no url","2011-08-24 21:22:01"
"106511674143555584","#jobs Research/Administrative Assistant III - University of California Berkeley -  Berkeley, CA http://t.co/7s5hHsA","Jobs_Berkeley","EN",0,0,"no url","2011-08-24 23:42:16"
"106524483539582978","Berkeley chancellor seeking funds for undocumented students - San Jose Mercury News http://t.co/iuQVW6g","FightPropaganda","EN",0,0,"no url","2011-08-25 00:33:10"
"106524953318391810","Berkeley Oakland need a new paint job for your car or truck? http://t.co/tsR8jq7","shattuckauto","EN",0,0,"no url","2011-08-25 00:35:02"
"106676426387898368","#US Charleston, Berkeley, Dorchester decrease response status: Charleston County shifted gea... http://t.co/dd9GqCK #News #WestVirginia","RF_WestVirginia","ES",0,0,"no url","2011-08-25 10:36:56"
"106697637008388096","I'm always bemused by the number of 'e's in 'Berkeley'. Do they really need that many? In a country that removed the 'u' from 'colour'?","silentypewriter","EN",0,0,"no url","2011-08-25 12:01:13"
"106716867854475264","I've woken up so early I just saw two deer trotting through downtown Berkeley. Snapped a blurry pic http://t.co/LQ4CbA8","emilychangtv","EN",0,0,"no url","2011-08-25 13:17:38"
"106724950311841792","Mobile Applications Developer - Matrix Resources -  Berkeley, CA: is looking for several Mobile Applications Dev... http://t.co/NmlVroh","sfmobilejobs","EN",0,0,"no url","2011-08-25 13:49:45"
"106738590171672576","MAJESTIC Tantric Massage London 57 Upper Berkeley Street, London W1H 7PP, United Kingdom +44 20 7060 3137 http://t.co/vF1Bj74","bambi01jones","EN",0,0,"no url","2011-08-25 14:43:57"
"106775588144025600","#openhome_berkeley 6845 BRISTOL DR BERKELEY (Sun Aug 28 02:00 PM to 04:30 PM) Listed by HEIDI MARCHESOTTI: http://t.co/nNN6XQC","homesopentoday","EN",0,0,"no url","2011-08-25 17:10:58"
"106804056026136576","Berkeley Rep is looking for a new, rockstar institutional grants manager. Know anyone? http://t.co/epeIj5D","berkeleyrep","EN",0,3,"no url","2011-08-25 19:04:05"
"106832869720199168","I'm at Strawberry Canyon Recreational Area (Centennial Dr, at Stadium Rim Way, Berkeley) http://t.co/HjE0zge","walktrotcanter","EN",0,0,"no url","2011-08-25 20:58:35"
"106854143242665984","Berkeley  (Live Concert) album downloads: Jimi Hendrix mp3 download DOWNLOAD Berkeley (Live Concert) album: Arti... http://t.co/GZD1yzf","buzzpearomsa198","EN",0,0,"no url","2011-08-25 22:23:07"
"106857104425484290","Biofuels Research Facility Opens at DOE's Lawrence Berkeley National Laboratory: The Advanced Biofuels Proces... http://t.co/SdfxiUM","MENVD","EN",0,2,"no url","2011-08-25 22:34:53"
"106858001423536128","Berkeley Scientists Discover an “Instant Cosmic Classic” Supernova http://t.co/mADzXEE","PTTU","ES",0,2,"no url","2011-08-25 22:38:27"
"106922346824216576","""@kevinpanganiban: Berkeley, UNR, UNLV, or stay at FEU for next sem? goodness life changing decisions.."" Pick any that are in the states","hughes_lajuan3","EN",0,0,"no url","2011-08-26 02:54:08"
"106957386056609793","*brainwave* I'm going to be in Berkeley part of this weekend. I should go to Industrial and get my second tattoo.","kredcarroll","EN",0,0,"no url","2011-08-26 05:13:22"
"107059240249729024","Berkeley county school district announces half-day today. #chs #irenesc","AndyParas","EN",0,5,"no url","2011-08-26 11:58:06"
"107060469461819393","#Berkeley County School District to operate on a half-day schedule -- www.berkeley.k12.sc.us for more info.","CabbageTV","EN",0,0,"no url","2011-08-26 12:02:59"
"107147681620692992","@anajonesxox lol naw girl im home! berkeley county had a half of day","WaltGotIt","EN",0,0,"no url","2011-08-26 17:49:32"
"107152035312439297","On the UC-Berkeley campus today for the IFC Kickoff event! #AKLalpha","AKLFraternity","EN",0,0,"no url","2011-08-26 18:06:50"
"107175720555515904","Looking for warm, inspiring, #joyful High #Holy Day services full of prayer, music + deep teachings? Tickets now at chochmat.org #berkeley","Chochmat","EN",0,1,"no url","2011-08-26 19:40:57"
"107195513446727680","A special thank you to the Berkeley Police Department for their ""Tip-A-Cop"" fundraiser at Skates on the Bay.  We... http://t.co/7eQBQBm","BPGtweet","EN",0,0,"no url","2011-08-26 20:59:36"
"107199657440059393","@RogerFOMOUrbina it closed while we were on our way there so we went to Berkeley haha","vykinikki","EN",0,0,"no url","2011-08-26 21:16:04"
"107240350569074688","@corralboca @newskeith Some swear by Manhattan Bagel down on 4th St in Berkeley. Really no great bagels anywhere in East Bay","SovernNation","EN",0,0,"no url","2011-08-26 23:57:46"
"107322693136822272","Panasonic Supports Solar Vehicle Teams From Berkeley and Stanford for 2011 World Solar Challenge http://t.co/XSIDNfk","ecofriendly_tip","EN",0,0,"no url","2011-08-27 05:24:58"
"107325801116078080","@berkeley_eagle had to turn 2gb off they were shitting me that much. Caught Horrible Bosses at the movies to lighten up. Very funny ! ","recuerom","EN",0,0,"no url","2011-08-27 05:37:19"
"107338811847090176","Citizens of #berkeley!  Pack a tarp + shovel, wheel down to the Berkeley Marina for gorgeous, sifted #compost !! Last Sat of the month! Free","gardengrouch","EN",0,0,"no url","2011-08-27 06:29:01"
"107356318880374784","@metu_berkeley ....u use ur twitter account go borrow money 4 bank?","Foxy_Rubby","EN",0,0,"no url","2011-08-27 07:38:35"
"107539610602708992","There's still room at the Berkeley Art Museum! Come on by for edible installations and interactive environments from @OPEN_restaurant","AliceWaters","EN",0,3,"no url","2011-08-27 19:46:55"
"107583947935973376","I'm at Octoberfeast Bakery (1954 University Avenue, Milvia Way, Berkeley) http://t.co/4iXNhSO","walktrotcanter","EN",0,0,"no url","2011-08-27 22:43:06"
"107602818118074368","Tecnicart Homes Starts Construction @ Primrose in Harding Township, NJ $1,600,000, Up - Berkeley Heights, NJ Patch http://t.co/yfd8zoB","NJEstates1","EN",0,0,"no url","2011-08-27 23:58:05"
"107664637364932608","congrats! “@bjo3rn: Tied @landay on undergrad HCI course ratings at Berkeley (CS160) - his record was from '97 http://t.co/04Fj6Mv”","ManuKumar","EN",0,1,"no url","2011-08-28 04:03:44"
"107837577507254273","Hot and cold zones of San Diego real estate: --Cynthia A. Kroll, economist at UC Berkeley's real estate center a... http://t.co/ytkBFBz","angelinacasual","EN",0,0,"no url","2011-08-28 15:30:56"
