"tweet_id","text","author","language","likes","retweets","media","timestamp"
"106020777001877504","@sheilachiamaka Princeton is not too bad...its near my house and my popsi was going to send me there if i was expelled from LJC","Uzoma_O","EN",0,0,"no url","2011-08-23 15:11:37"
"106066310366117888","Now hiring: Application Integrator Developer - Princeton Information - Jersey City, NJ http://t.co/mqO1JPt #jobs","princeton_info","EN",0,0,"no url","2011-08-23 18:12:33"
"106068428464467968","Apparently the quake's center was in Virginia.  I hope everyone's okay there!  It rocked Princeton, according to my mom","MollyDollies","EN",0,0,"no url","2011-08-23 18:20:58"
"106087369945513984","@MindlessBhavior &lt;3 you Princeton","MindlessCutiiee","EN",0,0,"no url","2011-08-23 19:36:14"
"106099776688369664","Slightly ! Thought it was the construction going on RT @MeredithGould: @rampracer You felt it in Princeton? #earthquake","rampracer","EN",0,0,"no url","2011-08-23 20:25:32"
"106101727048114176","Lunch with Ryan and Mikey before Ryan leaves for Princeton!! (@ Stacked: Food Well Built) http://t.co/KyuSslo","jcres","EN",0,0,"no url","2011-08-23 20:33:17"
"106137052860530688","2011 WILD IN THE PARKS STOP #10 PRINCETON, NJ: Volcom Stones 2011 North American Wild in the Parks tour packe... http://t.co/y1qSSfR","Volcom","EN",0,3,"no url","2011-08-23 22:53:39"
"106443684458938368","UW makes the Green Honor Roll with Princeton Review  | Environmental Stewardship and Sustainability http://t.co/74qZkBN","sustainableUW","EN",0,0,"no url","2011-08-24 19:12:06"
"106477213729300480","@OhSo_Mindless go follow the real princeton @IamPrincetonMB","iamLaniya","EN",0,0,"no url","2011-08-24 21:25:20"
"106485195498196992","i still have princeton in my heart lol","Fr3shBarbieDoll","EN",0,0,"no url","2011-08-24 21:57:03"
"106493441474691072","@MindlessBhavior http://t.co/wq5n2xs - I just realized Princeton isnt wearing his shades, he looks really good with out them :)","Vanillasugar95","EN",0,0,"no url","2011-08-24 22:29:49"
"106496889209356288","Omg princeton coming to chicago lolxz best newz ever and check us out on facebok under unforgetablez  http://rpx.me/UXVc","Dazzydabest","EN",0,0,"no url","2011-08-24 22:43:31"
"106502476022292480","@MindlessBhavior URGENT: #PRINCETON LOOK AT THIS TWEET!!!!!!!!!! hi =) i love you! cant wait for the #SCREAMtour PLZ TWEET ME","iwuvlove","EN",0,0,"no url","2011-08-24 23:05:43"
"106510386471239681","@CareOhLynn_3 follow the real princeton @IamPrincetonMB","iamLaniya","EN",0,0,"no url","2011-08-24 23:37:09"
"106521530745360384","@Ayo_Princeton: are you ready 4 school? MZ.PR!NC3T0N &lt;3","PrettyGirlLexi1","EN",0,0,"no url","2011-08-25 00:21:26"
"106522776470429696","@Ayo_Princeton oh ok. so thats how u feel princeton.; |","LeLeLuvmb","EN",0,0,"no url","2011-08-25 00:26:23"
"106531915846266880","My friend she,good at soundin lk princeton n roc royal she cracked mi up","pqttyPbehnroyal","EN",0,0,"no url","2011-08-25 01:02:42"
"106537372635770880","WAIT WAIT WAIT HOLD MY DOMINOES. princeton was BULLIED IN SCHOOL? OH HELL NO.","PrincetonsMafia","EN",0,0,"no url","2011-08-25 01:24:23"
"106542644871696384","@Aja_BeenBreezy well Princeton's kinda cute, I like his hair...and nahh, I don't really listen to him","TygaYeah3x","EN",0,0,"no url","2011-08-25 01:45:20"
"106544637157711873","@its_sophiaXD cause any of us can get depressed? We go to Princeton girl!","basscreator5","EN",0,0,"no url","2011-08-25 01:53:15"
"106559673733365761","Can't believe someone would bully princeton ): http://t.co/W4m8TDr","theralovesjb","EN",1,2,"no url","2011-08-25 02:53:00"
"106747737965473792","Stop by and say hi at Princeton Grass Drags this weekend. Booth spot 75 and 76. We will have all the New Castle X,... http://t.co/9qHfOd6","MonsterSports","EN",0,0,"no url","2011-08-25 15:20:18"
"106760153101123584","@6WCBot 65 minutes of #Russian #SCTranslation (Princeton Russian course A)","teango","EN",0,0,"no url","2011-08-25 16:09:38"
"106800728798015488","@IamPrincetonMB is this the real Princeton from mb or is this a fake","Bre_LuvsRoc","EN",0,0,"no url","2011-08-25 18:50:52"
"106865451111424000","#El #Niño #appearances tied to civil conflicts in tropical countries: http://t.co/NhXqn6Z | #Columbia #La #Ocean #Pacific #Princeton","TibidyUS","EN",0,0,"no url","2011-08-25 23:08:03"
"106907675144630272","@Tamia_Princeton  you can't get here?","Chelseas_Unique","EN",0,0,"no url","2011-08-26 01:55:50"
"106914084049518593","I would be sad/mad but i would be happy it was one of them *princeton* RT @iThinkMbNastii: #WWYD if u got pregnant by a MB member","Princetonwifey3","EN",0,0,"no url","2011-08-26 02:21:18"
"106923894509801472","@Princeton_MrsRi Whos Billy?!","KikiDat_Bait","EN",0,0,"no url","2011-08-26 03:00:17"
"107175628255674368","Check out our job opening for a Administrative Assistant in Princeton, NJ! Aerotek #Jobs http://t.co/jNHxx2T","phl_adm_jobs","EN",0,0,"no url","2011-08-26 19:40:35"
"107178430075904000","RT @WomenWhoTech: RT @maddiegrant: Anyone based near Princeton? Have a great Web Manager position to share if you know anyone. cc @starmike","PurpleCar","EN",0,0,"no url","2011-08-26 19:51:43"
"107191268819480578","C O M M E N T  If you want to be Princeton GirlFriend & Why -Mimi","Lena_Marie_C","EN",0,0,"no url","2011-08-26 20:42:44"
"107242162491633664","Princeton 34-20 end of third quarter  vs Anderson","st50moore","EN",0,0,"no url","2011-08-27 00:04:58"
"107256087580905472","@RadioRaheem_  Don't you dare talk about my Princeton like that! He's as straight as they come! Forreal chill he's perfect!","HugsNot_Drugs","EN",0,0,"no url","2011-08-27 01:00:18"
"107279911571558400","RT if you say you'll RAPE either #Prodigy, #RayRay, #RocRoyal, or #Princeton (:","_MsRenee","EN",0,7,"no url","2011-08-27 02:34:58"
"107316087095431170","Photo: Pretty thing I saw tonight, Princeton IL, 8.26.11 http://t.co/Ivgmixm","deanberner","EN",2,0,"no url","2011-08-27 04:58:43"
"107319178301673474","iPhone camera being used for traffic light testing A group of researchers at MIT and Princeton University are  via @tuaw http://t.co/YpcHLli","EricTTung","EN",0,1,"no url","2011-08-27 05:11:00"
"107338568594231296","iPhone camera being used for traffic light testing: A group of researchers at MIT and Princeton University are t... http://t.co/7Mwtkmz","mandroidmarket","EN",0,0,"no url","2011-08-27 06:28:03"
"107414984610422784","Betting on Gold and Silver Stocks: Chen Lin stumbled into investing. While working on a doctorate at  Princeton, ... http://t.co/71KQRAh","hantucantik1","EN",0,0,"no url","2011-08-27 11:31:42"
"107471347675959296","Poor brides wedding was canceled !! Welp, my work is done here ! Cya princeton, back to north jerzz.","Jaimelyncollins","EN",0,0,"no url","2011-08-27 15:15:40"
"107506354255708161","#MindlessBehaviorPassword BitchBitMyShoulder -Princeton","AlluredByTanika","EN",4,15,"no url","2011-08-27 17:34:46"
"107520381866348545","From Princeton to Brooklyn to the People's Republic of Cambridge, insufferable people are getting ready to do the Lear speech outside.","georgelazenby","EN",20,31,"no url","2011-08-27 18:30:31"
"107529589781299200","RT if you dial 323-319-6060 just to hear Princeton nd Roc's voice !","TeamMBNigeriaaa","EN",0,0,"no url","2011-08-27 19:07:06"
"107539215679623169","On my way to Princeton!","crazyfruitloopz","EN",0,0,"no url","2011-08-27 19:45:21"
"107608790802767872","I wanna eat with #Princeton and #Roc come to NJ and eat with us :) @MindlessBhavior  &lt;3","MindlessGyrl21","EN",0,0,"no url","2011-08-28 00:21:49"
"107612364345589760","@PrincetonPatch & @PrincetonScoop say power outage in @Princeton. Charged comp/iPod if out here, should be enough, say their product specs","nassau_weekly","EN",0,0,"no url","2011-08-28 00:36:01"
"107652885520719873","RT @tkq Lights flickering again in the Jugtown section of #Princeton. #irene","PrincetonPatch","EN",0,0,"no url","2011-08-28 03:17:02"
"107662763110834176","@manoushz #njirene trees down on several wires in town, harrison st, etc #princeton","sethboyardee","EN",0,0,"no url","2011-08-28 03:56:17"
"107679431279132672","@MindlessBhavior omg i mean i want to be ur mrs right princeton urjust a cutie and we have a lot of thing in comment likewe both like green","hubbyPrinceton","EN",0,0,"no url","2011-08-28 05:02:31"
"107703678537969665","ugh RT @Princeton: @Princeton Tornado watch in effect until 5 a.m. Sunday, roads flooded, power outages reported. http://t.co/DnBvJRO","IAmMikeRich","EN",0,0,"no url","2011-08-28 06:38:52"
"107816257880981505","I heard from My son Alec @Schmeegan at Princeton this morning, ""We're all alive."" That's comforting! Ugh! #Irene","ChesleyMartin","EN",0,0,"no url","2011-08-28 14:06:13"
"107830195540606976","@andersoncooper @cnnbrk. @LukeRussert In #Princeton #PSEG #NJ said we will have power back on 9/4! A WEEK FROM NOW!? #IRENE.","LunaMoon137","EN",0,0,"no url","2011-08-28 15:01:36"
"107847012715724800","Two fatalities in New Jersey. Including Princeton firefighter who died from injuries suffered in water rescue, governor says #Irene #acpress","LyndaCohen","EN",0,1,"no url","2011-08-28 16:08:26"
"107847646328258560","Two NJ storm-related deaths including firefighter ""attempting swiftwater rescue"" in Princeton","RickLeventhal","EN",9,65,"no url","2011-08-28 16:10:57"
"107851011888119809","“@RickLeventhal: Two NJ storm-related deaths including firefighter ""attempting swiftwater rescue"" in Princeton”Praying for his family","jtedscott","EN",0,0,"no url","2011-08-28 16:24:19"
"107852266064711680","Governor Christie announces two fatalities in NJ, 1 firefighter died in attempting water rescue in Princeton - NBC News","BreakingNews","EN",11,241,"no url","2011-08-28 16:29:18"
"107853071266217984","HEARTBREAKING&gt;RT @BreakingNews: Gov Christie announces 2 fatalities in NJ, 1 firefighter died attempting water rescue in Princeton- NBC News","jmcaninch68","EN",0,1,"no url","2011-08-28 16:32:30"
"107861149491539968","I'm at Walmart Supercenter (2101 S Princeton St, Ottawa) http://t.co/nJZSEHY","eBayQueen","EN",0,0,"no url","2011-08-28 17:04:36"
"107863893115809794","The Princeton Township PD reporting on Twitter  that @GovChristie is wrong, no Princeton fire fighter dead.","GingerGibson","EN",0,3,"no url","2011-08-28 17:15:30"
"107871530398126080","@kimberlywoods If I remember correctly, he gave a concert at @Princeton didn't he?","kathleenwoods","EN",0,0,"no url","2011-08-28 17:45:51"
"107896524264046593","Check out our job opening for a Marketing - Job Fair Monday September 26..Many New Com in Princeton, NJ! Career #Jobs http://t.co/CsOTxll","phl_mar_jobs","EN",0,0,"no url","2011-08-28 19:25:10"
"107899128943611904","Can't believe all the news outlets reporting death of Princeton firefighter. Rescue squad person referenced is in... http://t.co/wuLaUHJ","PlanetPrinceton","EN",0,0,"no url","2011-08-28 19:35:31"
"107912110733934592","The following roadways are closed in Princeton Township due to wires and/or poles down: Rt. 206 between Ewin… (cont) http://t.co/oxYEvLP","PrincetonPolice","EN",0,4,"no url","2011-08-28 20:27:06"
"107927419524091905","“@MindlessBhavior: Headed to theVMA's excited!!! :) #Princeton”","iamJusticee","EN",0,0,"no url","2011-08-28 21:27:56"
"107927545340637184","@MindlessBhavior luv yu princeton follow me please","SheritaNdRayRay","EN",0,0,"no url","2011-08-28 21:28:26"
"107957484257427457","I'm at Walmart Supercenter (1207 Princeton Ave, Vermillion) w/ 4 others http://t.co/QAKCFT2","morganspeck","EN",0,0,"no url","2011-08-28 23:27:24"
"107981010112745473","Senior Tax Compliance Analyst - Princeton, NJ  http://t.co/DUvEPej","ThePeoplePlace","EN",0,0,"no url","2011-08-29 01:00:53"
"108001209885003776","Here at the #VMAS Chris just killed it #Princeton :)","IamPrincetonMB","EN",2,3,"no url","2011-08-29 02:21:09"
"108006733779189761","#imagine Princeton: where u get that from? You: get what? Prince:all that pretty on ur face you:aw Thanx and idk baby i was Born this way!","MindlessManiacs","EN",7,2,"no url","2011-08-29 02:43:06"
"108024908038144000","Hey, duffers, you haven't seen a water hazard till you've seen the one at Princeton Country Club http://t.co/aueNeej #NJIrene #JRC","Trentonian","EN",0,1,"no url","2011-08-29 03:55:19"
"108032507810820097","WSJ: Labor Economist to Fill Key Post - Princeton University's Alan Krueger would likely provide a voice inside the ... http://t.co/M0hVYnn","KFAQ","EN",0,0,"no url","2011-08-29 04:25:31"
"108037415146487809","@MoneyGraphics By the time you're done with her she'll be ready for Yale, Harvard or Princeton lol","KumikoMing","EN",0,0,"no url","2011-08-29 04:45:01"
"108112849678770176","Princeton Day School announces iPad pilot program for middle school students - http://t.co/Lshrtt4","iPadNewsAlert","EN",0,0,"no url","2011-08-29 09:44:46"
"108161990148632576","NYU named in best and worst of Princeton Review rankings http://t.co/w7yCdJ3","nyunews","EN",1,4,"no url","2011-08-29 13:00:02"
"108168147407876096","@CharleenNagay i believe parts of route one and quakerbridge are closed which leaves washington rd as the only way out of princeton for me","mattharisiades","EN",0,0,"no url","2011-08-29 13:24:30"
"108185117528305664","I'm at Princeton BMW (3466 US 1, Princeton) http://t.co/7oOrYMA","nickbhatt120","EN",0,0,"no url","2011-08-29 14:31:56"
"108188653339160576","The math department at Princeton would have a cow if they saw what girls wear on a college campus.","MadiParker14","EN",1,0,"no url","2011-08-29 14:45:59"
"108194516959363072","Politica Mundial Princeton economist to join Obama economic team: President Obama is expected M... http://t.co/tesG5hT #politicamundial","juanjaimefl","EN",0,0,"no url","2011-08-29 15:09:17"
"108214150500597760","Video: Who Is Alan Krueger? http://t.co/J71lUIs  President Obama may soon have a new economic adviser. Alan Krueger, a Princeton Universit","WebWideNews","EN",0,0,"no url","2011-08-29 16:27:18"
"108217610834935808","Obama Names Krueger as Top Economist: The president tapped the a Princeton University labor economist to the job... http://t.co/5F0gAgU","imhiring","EN",0,0,"no url","2011-08-29 16:41:03"
"108222463632093184","Obama Nominates Princeton Professor as Head of Economic Advisers Team - Fox News: PoliticoObama Nominates Prince... http://t.co/oDZamcq","gi981","EN",0,0,"no url","2011-08-29 17:00:20"
"108237001081364480","Princeton's Alan Krueger To Run President Obama's Council of Economic Advisers | .. http://t.co/BzOPqgQ","DNDailyPolitics","EN",0,0,"no url","2011-08-29 17:58:06"
"108248397466710016","Obama's pick for top White House economist: Princeton labor economist Alan Krueger http://ht.ly/6fN5g","GlobalPost","EN",1,6,"no url","2011-08-29 18:43:23"
"108251236553342976","Just wanted to thank everyone that came out to see us at the Princeton Outlaw Grass Drags.  It was a great... http://t.co/6CJDm2c","teamhard","EN",0,0,"no url","2011-08-29 18:54:40"
"108290474246275072","In Princeton #almostthere","kailynndonofrio","EN",0,0,"no url","2011-08-29 21:30:35"
"108291501871742976","Reader wants to know if power restored at Princeton Shopping Center. Anyone know and if so, anything open?","PlanetPrinceton","EN",0,0,"no url","2011-08-29 21:34:40"
"108293825532932097","#20peopleidmarry Princeton from Mindless Behavior !","ColorfulBieber","EN",0,0,"no url","2011-08-29 21:43:54"
"108299181650747392","Obama Taps Princeton Prof to Head Economic Council By @Stephenkeppel http://ow.ly/6fYCa #EconomicCouncil #AlanKreuger","UnivisionNews","EN",0,1,"no url","2011-08-29 22:05:11"
"108302946609012737","#20PeopleIdMarry , Princeton &lt;3 .","JustCourtnei","EN",0,3,"no url","2011-08-29 22:20:09"
"108312074932846592","Century's first new copper mine opens near Princeton: It's the first time since the turn of the millenn... http://t.co/QHu9bfI #merritt","MerrittHerald","EN",0,0,"no url","2011-08-29 22:56:25"
"108346111726587905","9:11 here in Princeton (New York time) EST #kinderchat","hechternacht","EN",0,0,"no url","2011-08-30 01:11:40"
"108389766386548736","Live in Princeton and interested in property assessment? There are vacancies on the Property Assessment Review Panel. http://ow.ly/6fZQQ","BCGovNews","EN",0,2,"no url","2011-08-30 04:05:08"
"108409688965644288","Would it be cute or corny if I got a Princeton university shirt?!?","0hSoRidiculous","EN",0,0,"no url","2011-08-30 05:24:18"
"108462696583798785","Researchers at MIT and Princeton University using iPhone to save fuel by keeping an eye on traffic lights: A gro... http://t.co/b56tSMI","go2phonedeals","EN",0,0,"no url","2011-08-30 08:54:56"
"108462822417121280","Researchers at MIT and Princeton University using iPhone to save fuel by keeping an eye on traffic lights http://t.co/AJFvf0e","into_iphone","EN",0,0,"no url","2011-08-30 08:55:26"
"108476785267716096","closed today: James Frank Dent ES, Kenmoor ES, Magnolia ES, Princeton ES, Rockledge ES (part 3 of 4) #pgcounty","DCAbloob","EN",0,0,"no url","2011-08-30 09:50:55"
"108528475866005505","MT @kale1919 US Rt 1 Northbound btwn Princeton-N. Bruns a mess. we have been in the car 1.5 hours; haven't even reached N. Bruns #njcommute","PaulBell55","EN",0,0,"no url","2011-08-30 13:16:19"
"108552370782355456","6K SF immediately available for lease in Princeton - call Peter Shikar at 732-509-8915","CBRENewJersey","EN",0,0,"no url","2011-08-30 14:51:16"
"108592346727333889","Princeton first-aider dies from injuries sustained in water rescue http://ht.ly/6gOjw","NFFF_News","EN",0,0,"no url","2011-08-30 17:30:07"
"108607475586043904","Jackson State ranked in nation's Top-10 universities, outranks Yale, Princeton, etc... http://t.co/SN7OXiz","JacksonStateU","EN",2,54,"no url","2011-08-30 18:30:14"
"108666313253203968","Woo Hoo “@kyanna: special shout-out to my alma mater: Wellesley #1 for Faculty in Princeton Review Results http://t.co/oHGzpGn","Nik2tweets","EN",0,0,"no url","2011-08-30 22:24:02"
"108682944767471616","Am I the only one who thinks RAY RAY nd PRINCETON from MINDLESS BEHAVIOR are the cutest juvies ever","BheeReal","EN",0,2,"no url","2011-08-30 23:30:07"
"108788942123438080","Paramus Jobs: compliance manager-Policy Management and Writing: Princeton Information - Paramus, NJ -... http://t.co/xocdtNa #Jobs #Paramus","Paramus_Jobs","EN",0,0,"no url","2011-08-31 06:31:19"
"86561370690158592","Princeton restaurant owner wins N.J. Seafood Challenge: Saed Hindash/The Star-LedgerThe governors mansion, Drumt... http://bit.ly/jS5c8q","JerseyTweets","EN",0,0,"no url","2011-06-30 22:26:53"
"86599362704179200","The Bluefield Blue Jays lead Princeton 6-4 in the 7th in game one of the Mercer Cup","WVVASPORTS","EN",0,1,"no url","2011-07-01 00:57:51"
"86628177576853504","@Princeton_duhh follow back ? (:","CherishMySmilee","EN",0,0,"no url","2011-07-01 02:52:21"
"86672058364329984","Today Around Town - Miscellany: Fireworks, Spirit of Princeton, Princeton Stadium, 609-683… http://goo.gl/fb/cxzHp","wwptoday","EN",0,0,"no url","2011-07-01 05:46:43"
"86675489292427264","PRINCETON: Residents thank Scouts for garden work: Residents of Harriet Bryan House and Elm Court thanked local ... http://bit.ly/m6ADfk","gardeningtoday","EN",0,0,"no url","2011-07-01 06:00:21"
"86757802541985792","アメリカ： JAPANESE ANALYST - Princeton, NJ - Japanese Analyst  Princeton, NJ Category: Accounting  Temporary/Contract ... http://ht.ly/1dyuy0","OshigotoUSA","EN",0,0,"no url","2011-07-01 11:27:26"
"86786399281491969","Rahway Student Named To Dean's List: PRINCETON — Andrew Brothers of Rahway, a music major, has been named... http://bit.ly/ih5PvM #choir","SingTogether","EN",0,0,"no url","2011-07-01 13:21:04"
"86787115916066816","Princeton researchers solve problem filling space -- without cubes http://t.co/8j7nTaK","sc_k","EN",4,5,"no url","2011-07-01 13:23:55"
"86840078000852992","Woman dies on Mount Princeton: By Dick Dixon Mail Copy Editor One woman died Thursday after a fall on 14197-foot... http://bit.ly/jppG63","CarinaWilli5","EN",0,0,"no url","2011-07-01 16:54:22"
"86868691546931201","2BR/2BA 1520sf $779900  Princeton BC Property #realestate http://realestatechannel.ca/40270109","RealEstateVan","EN",0,0,"no url","2011-07-01 18:48:04"
"86933866811629568","Woman Dies While Hiking Colorado's Mount Princeton « CBS Denver http://dlvr.it/YcXBr","OpentrailsHike","EN",0,0,"no url","2011-07-01 23:07:03"
"86966852189818880","#imagine Princeton:""I miss (YN)!!"" Keisha:""it's only been 5 minutes since she left -_-"" Princeton:""It feels like 50 years! I love her..""","MBDreamers","EN",4,4,"no url","2011-07-02 01:18:07"
"86975419231899648","#imagine Princeton brings you to a dark place. He gently holds your waist and kiss your lips passionately...as *he whisper* ILoveU♥","DaMindlessBiebs","EN",9,12,"no url","2011-07-02 01:52:10"
"86980562010636290","Just shot my last 4th-of-July-weekend fireworks at @Princeton. :|","garybc","EN",0,0,"no url","2011-07-02 02:12:36"
"86981556056494080","Pearl Mantels 159-48-80 The Princeton 48-Inch Fireplace Mantel Surround, French Country:     Shop for ... http://bit.ly/jhtXu4","tamdoodotnet","EN",0,0,"no url","2011-07-02 02:16:33"
"87168244548505601","My 16 month old Sahana getting a hair cut @ Great Clips, Princeton Shopping Ctr. Lolly Pop calms her down.","srini_venkat","EN",0,0,"no url","2011-07-02 14:38:23"
"87388239987613696","Pearl Mantels 159-56-80 The Princeton 56-Inch Fireplace Mantel Surround, French Country:     ...Read m... http://bit.ly/lAy1SR","tamdoodotnet","EN",0,0,"no url","2011-07-03 05:12:34"
"87476337119461377","Princeton fitness wellness nj http://goo.gl/fb/Yltu8","adisearch1","EN",0,0,"no url","2011-07-03 11:02:38"
"87547823675019264","Profunda y emotiva carta del gran profesor de Princeton, Philip Pettit, en Elmer. Participa en la discusión del blog. http://t.co/o6G5DuM","pablosimonetti","ES",3,9,"no url","2011-07-03 15:46:42"
"87585351291506688","@TeamMindless who loves #princeton just like me..lolx retweets","princeton_baby","EN",0,0,"no url","2011-07-03 18:15:49"
"87721308846161921","#imagine Princeton taking off his shirt show his abs an-.....Wait ......  #NuffSaid ;)","DaMindlessBiebs","EN",5,14,"no url","2011-07-04 03:16:04"
"87739303228215296","Never thought I'd b caught dead n Princeton attire. #godforgiveme","hAyHaYvBaLl","EN",0,0,"no url","2011-07-04 04:27:34"
"87782202569527296","Anonymous asked: How would you react if Princeton stripped naked in front of you o.O ?? http://tumblr.com/xv13bff2mf","TeamMindlessDC","EN",0,0,"no url","2011-07-04 07:18:02"
"87909638112153601","#Princeton_BC Current Conditions: 8C and Fair. Forecast: 25C and Mainly Sunny. POP: 20%. Cold last night - Frost on car windshield!","PrincetonBCNews","EN",0,0,"no url","2011-07-04 15:44:25"
"88131814417367040","U.S. Special Envoy for Sudan Princeton Lyman Travels to Ethiopia and Sudan http://t.co/zA4HAQg #AFRICA #AFRICOM","USAfricaCommand","EN",0,3,"no url","2011-07-05 06:27:16"
"88258021192511488","Bell Tower  @ Downtown Princeton http://instagr.am/p/HBbmU/","misterallaire","EN",0,0,"no url","2011-07-05 14:48:46"
"88275683385688064","Photo: Princeton Baptist #roadside #church #sign #marquee (Taken with instagram) http://tumblr.com/xat3c5txnh","ArtSkoolDamage","EN",0,0,"no url","2011-07-05 15:58:57"
"88293987336728576","http://t.co/8i35AYF Im princeton Mrs, Right 4 sure. If only i could show him, instead of sayin it ;)","Chilosa2009","EN",0,0,"no url","2011-07-05 17:11:41"
"88342876127371264","sf: i'm going to continue to be in you for much of the summer. i'll be in princeton from the 8th to the 16th. ps. need a housesitter?","maximolly","EN",0,0,"no url","2011-07-05 20:25:57"
"88358437028757504","#developer #itjobs Entry Level .net/sharepoint Admin - TEKsystems - Princeton http://ow.ly/1dDiXf","TEK_AppsJobs","EN",0,0,"no url","2011-07-05 21:27:47"
"88426758042435584","Here for 5 nights.  Had'rachah year two (@ Princeton Marriott Hotel and Conference Center at Forrestal) http://4sq.com/pJhKvI","samsimon","EN",0,0,"no url","2011-07-06 01:59:16"
"88434211316445185","Job Search: Principal Mechanical Engineer at Abbott Laboratories (Princeton, NJ)  http://bit.ly/ioATpR","EngineersJobsQ","EN",0,0,"no url","2011-07-06 02:28:53"
"88435796759154689","@MindlessBhavior Please Follow Meeeee :))))) ! I Love Youu Princeton & Ya Bushyy Hair , lol FOLLOW ME &lt;3","AderaLuvsTwist","EN",0,0,"no url","2011-07-06 02:35:11"
"88435985519607808","Since when did princeton have a motorcycle cop?","MeddlingBarista","EN",0,0,"no url","2011-07-06 02:35:56"
"88477785919721472","I liked a @YouTube video http://youtu.be/YmVWi_g5kCo?a Jimmy Roundboy Graham on Diego at Catch A Rising Star Princeton","CatchPrinceton","EN",0,0,"no url","2011-07-06 05:22:02"
"88505044718202880","Here is the link to a review with easy exercises for people with Huntington's, which a post doc at Princeton just char…http://lnkd.in/Pc3WXr","VisualizeLife","EN",0,0,"no url","2011-07-06 07:10:21"
"88608958608187393","Newsletter Princeton BAsketball - Download Now - http://dld.bz/vv6t","coachdeforest","EN",0,0,"no url","2011-07-06 14:03:16"
"88644148797779968","#Adopt #MN Labrador Retriever - Kato - Medium - Baby - Male - Dog - Please Contact (Princeton) http://goo.gl/fb/o1vZT","PepperDog_MN","EN",0,0,"no url","2011-07-06 16:23:06"
"88786218292228097","@clintifer find me a guy to buy then! i go out in princeton a lot, dublin square.. lots of places","musichigh","EN",0,0,"no url","2011-07-07 01:47:38"
"88826554888626177","I look like Princeton from MB with my hair curly like this.Thank God for this shoot in the am cause I'm not going to #CTMD w/ it like this","IamJasmineN","EN",0,0,"no url","2011-07-07 04:27:55"
"88947975816093696","Toyota Corolla 2011 Princeton:  			Price: $19160 , Engine: 1.8 ,Transmission: Not Specified , Miles: 0 , Seller:... http://bit.ly/qlRDDu","toyota_sales","ES",0,0,"no url","2011-07-07 12:30:24"
