"tweet_id","text","author","language","likes","retweets","media","timestamp"
"92661688041615360","@Andre_99301 I adore Calexico! Saw them in a tiny bar in Berkeley years ago with about 30 other lucky people...","ShenoaLawrence","EN",0,0,"no url","2011-07-17 18:27:22"
"92667971113189376","@anchelljocelyn Can u PLS Support by #followme View, RT & commenting on my latest video http://t.co/THrVfIF #BERKELEY CA","FamousFi","EN",0,0,"no url","2011-07-17 18:52:20"
"92671272055619584","I'm at Philz Coffee (1600 Shattuck Ave., at Cedar, Berkeley) w/ 3 others http://4sq.com/nKaTHI","downforwhatevz","EN",0,0,"no url","2011-07-17 19:05:27"
"92672127676850176","Itd be interesting to see what % of berkeley people take pride in lil b and what % dont even fuck with him","peteymayne","EN",0,0,"no url","2011-07-17 19:08:51"
"92717304525234176","Someone apply for Franchise Service Manager at #Berkeley Scott in # http://otl.nu/eLZm4h #hotel #job","hotelsjobs","EN",0,0,"no url","2011-07-17 22:08:22"
"92758438064566272","Elizabeth R.'s Review of 924 Gilman - Berkeley (5/5) on Yelp: 924 Gilman is by far the best… http://goo.gl/fb/fwu5p","groupbuyon","EN",0,0,"no url","2011-07-18 00:51:49"
"92763601244405761","Journalism? USC, Berkeley or other? What is best?","ingrid_butler","EN",0,0,"no url","2011-07-18 01:12:20"
"92801639404146688","Had a great day in Berkeley with @janine_ballard and @sunita_d - Japanese food, Chocolatier Blue, and a lot of great conversation.","redrobinreader","EN",0,0,"no url","2011-07-18 03:43:29"
"92826213814505472","did I just hear a gunshot? #berkeley","dcheesy","EN",0,0,"no url","2011-07-18 05:21:08"
"92892986211442688","BIG week at FP! We got: Chris Foss, Berkeley Breathed, Spirit of Hope Charity event and MAGIC on Sunday! http://forbiddenplanet.com/events/","ForbiddenPlanet","EN",0,4,"no url","2011-07-18 09:46:28"
"92975967240323072","Walking the pup at Berkeley's Aquatic Park this a.m., noticed evidence of a homeless feast last night -- Yukon golds still on the grill...","John_Birdsall","EN",0,0,"no url","2011-07-18 15:16:12"
"92991318418141186","@BerkeleyLab: New way to study living cells: Berkeley Lab researchers make copper-catalyzed click chemistry biocompatible http://bit....","Energy_Science","EN",0,0,"no url","2011-07-18 16:17:12"
"92997857325498369","NEW DEAL!! 55% Off Catering from Saul’s Restaurant & Delicatessen in Berkeley: http://j.mp/rlN2pI","SanFranPicks","EN",0,0,"no url","2011-07-18 16:43:11"
"92998499079172098","@realmeng How's Berkeley today?","efleischer","EN",0,0,"no url","2011-07-18 16:45:44"
"93028765168443392","Attack of the dim bulbs! Read it in the Berkeley blog, http://bit.ly/pJv4nN #cal","Cal","EN",0,0,"no url","2011-07-18 18:46:00"
"93050018411462657","Brain like Berkeley RT @xxlilmomi: Stripper booty with a rack like wowww","PictureSpitter","EN",0,0,"no url","2011-07-18 20:10:27"
"93092748390965248","Are mist nets safe? A UC Berkeley study answers that question, post @audubonmagazine http://bit.ly/qdmdfo","UCBerkeleyNews","EN",0,2,"no url","2011-07-18 23:00:15"
"93192141668487168","#travel #hotels Ready-to-Wear Teatime - The Berkeley Hotel 'Prêt-à-Portea' Features the Latest Fashion for (... http://feedzil.la/nyc9Hw","NDTravel","EN",0,0,"no url","2011-07-19 05:35:12"
"93279999775342592","Berkeley asks freshmen to submit audio snippets as part of diversity project.  Via @chronicle   http://bit.ly/qw2Inp","theaudioprof","EN",0,0,"no url","2011-07-19 11:24:19"
"93336257953931265","http://t.co/bUBsNMm Phase Change Transformations Observed In Nanocrystals By Berkeley Labs - CrazyEngineers VoiCE","ramosanbo","EN",0,0,"no url","2011-07-19 15:07:52"
"93353521734352896","Give ur workouts a soulful infusion via today's get-fit #deal: $60 for 2 mnth intro to United Capoeira Assoc in Berkeley http://t.co/H923R0L","dealsyoudig","EN",0,0,"no url","2011-07-19 16:16:28"
"93364715958452224","Berkeley Lab kicks off public meetings for proposed second campus http://bit.ly/pcyJ58","BerkeleyLab","EN",0,2,"no url","2011-07-19 17:00:57"
"93365869777911809","BERKELEY WISDOM: Bruce Rosen's new book IF YOU EVER NEED ME, I WON'T BE FAR AWAY, will be published by AlmaRose Publishing in October.","AuthorConnect","EN",0,0,"no url","2011-07-19 17:05:32"
"93403782054027265","Last day to score a Groupon for Berkeley's Escapist Comics http://fb.me/X1mRQyrZ","MissionComics","EN",0,0,"no url","2011-07-19 19:36:11"
"93404520276697088","_Green Lantern_: Emerald Knights � Christopher Berkeley, Lauren Montgomery, Jay Oliva. An interesting little series... http://dlvr.it/bnsj7","GoGreenLantern","EN",0,0,"no url","2011-07-19 19:39:07"
"93407913472819200","I'm at Lewis Hall (Gayley Rd, S Hall Rd, Berkeley) http://4sq.com/qSYPG2","jamezbreh","EN",0,0,"no url","2011-07-19 19:52:36"
"93442340294897665","so exciting! RT @winningwithwolf: 4 days until @neworganizing CA Advanced Data Training in Berkeley! #NOIdata","tianaej","EN",0,0,"no url","2011-07-19 22:09:24"
"93451366453870592","Go get 'em, Team Data! RT @winningwithwolf: 4 days until @neworganizing CA Advanced Data Training in Berkeley!  #NOIdata","neworganizing","EN",0,0,"no url","2011-07-19 22:45:16"
"93491396903833600","DIDI M.'s Review of Virginia Bakery - Berkeley (5/5) on Yelp: Professionalism, excellent… http://goo.gl/fb/Oj6KS","groupbuyon","EN",0,0,"no url","2011-07-20 01:24:20"
"93522623492915200","Has anyone been to ""off the grid"" in berkeley yet? Is it worth the trip?","houseofwong","EN",0,0,"no url","2011-07-20 03:28:25"
"93542974419501057","Berkeley Company Goes Hi-Tech to Dress You Up | NBC Bay Area http://t.co/mIUZL3z @GQfashion @mikerelm @mrchuckd @whobet @berkleymagazine","albertmingstyle","EN",0,1,"no url","2011-07-20 04:49:17"
"93577216562171904","Packing to stay in Berkeley for the next 4 nights. I'm bringing short shorts and sweaters. I fully expect to wear both #BaySummer","Kiryatraber","EN",1,0,"no url","2011-07-20 07:05:21"
"93611949560041472","Berkeley Primary School get creative at the Castle... http://fb.me/LeKkpdD8","CotsAttractions","EN",0,1,"no url","2011-07-20 09:23:22"
"93689510633803776","@lknecht150 I'm on my way to the bay now, but I'll be in Berkeley and Oakland...only around til tomorrow. Maybe I should come on a weekend?","kourtneyjason","EN",0,0,"no url","2011-07-20 14:31:34"
"93700461990912003","A lot of effort to show a point: all incoming Univ. of CA - Berkeley students' voices & accents will be recorded & mapped http://ow.ly/5GFAi","Intrculturalst","EN",0,1,"no url","2011-07-20 15:15:05"
"93722456912699392","#recoveryact @SFBART replacing critical 480v switchgear 4 train operations at #Berkeley sta @RecoveryDotGov  http://lockerz.com/s/121988482","kenyaw","EN",0,0,"no url","2011-07-20 16:42:29"
"93733982851698688","Brain like Berkeley #SlickerThoughts RT @DJSEANSOUL: ""Stripper booty and a rack like WOW!"" #Slickthoughts LOL","THEFAVEXGIRL","EN",0,0,"no url","2011-07-20 17:28:17"
"93811522932965377","•  Berkeley City College’s Fall 2011 Online Transfer College  Provides Expanded Learning Options for Busy Adults","bccmarketing","EN",0,0,"no url","2011-07-20 22:36:24"
"93823040495955968","All hands on deck soon, hopefully #Beneteau Group Therapy on SF Bay, Tiburon, Sausalito, Berkeley yacht clubs http://post.ly/2ZDmj","Coach4SM","EN",0,0,"no url","2011-07-20 23:22:10"
"93863771394670592","At Zachary's Pizza in Berkeley! Dinner with @automattic peeps and @Typekit before the #Trueuniversity kegger","rosso","EN",0,0,"no url","2011-07-21 02:04:01"
"93931232563433472","Man Stabbed with Nail File During Argument Over Spilled Coffee: Berkeley police arrested an Oakland man on suspi... http://bit.ly/qcRFVE","beccawyms2005","EN",0,0,"no url","2011-07-21 06:32:05"
"93950740279738368","D: RT @DJ_Dannny: My #Berkeley crewneck sweater is dope tho ;D","sleazy_e","EN",0,0,"no url","2011-07-21 07:49:36"
"94048098468372480","CfP: C19: Society of Nineteenth-Century Americanists Conference 12-15 Apr 2012, U of California, Berkeley: c19americanists.org/conference/.","Inquire_JCL","EN",0,0,"no url","2011-07-21 14:16:28"
"94069103530229760","Berkeley Heights #NJ, (1) One Stop Town, School, Demographics Info, http://t.co/Upkd4CH & Local Places Of Worship  http://t.co/TW0hjsT","NJEstates","EN",0,0,"no url","2011-07-21 15:39:56"
"94114636915421184","Berkeley revamps business loan program: ""That's a lot of money to be taking out of that loan fund,"" Moore said. ... http://bit.ly/mYJy7n","prathamavatar","EN",0,0,"no url","2011-07-21 18:40:52"
"94115630940307456","UC Berkeley asks incoming students to say more than 'hello' http://t.co/CZDNrhs","meredithansens","EN",0,0,"no url","2011-07-21 18:44:49"
"94130197774860288","@olganunes not really, but I did some stuff in Berkeley while I was at school there -- I would love to get into the party scene in SF!","colour","EN",0,0,"no url","2011-07-21 19:42:42"
"94147029508440064","Rolling up that I-5 for a few days of festivies with @nivbavarsky. Never been to Berkeley, excited!","FranciscusRebro","EN",0,0,"no url","2011-07-21 20:49:35"
"94153593619365888","U.C. Berkeley's Ken Rosen says housing affordability at best level in 30 years.","BillMarty","EN",0,0,"no url","2011-07-21 21:15:40"
"94186464354635777","Toward an AIDS cure: Berkeley scientists get good results (in culture) driving HIV out of latency & killing the cells http://t.co/4U64cQB","bobthesciguy","EN",0,0,"no url","2011-07-21 23:26:17"
"94208182469144576","I'm at Blueprint (196 5th ave, btwn Union & Berkeley, Brooklyn) http://4sq.com/qjoWR6","kestober","EN",0,0,"no url","2011-07-22 00:52:35"
"94269163450810368","Mike Ragogna: Chatting with REO Speedwagon's Kevin Cronin, Graham Colton and David Berkeley, Plus The Box Story's New Video","ToryLuster","EN",0,0,"no url","2011-07-22 04:54:54"
"94325866238193664","@charlieconnelly @fionarhw ""I fired an arrow in the air, she came to rest in Berkeley Square...""","urchinette","EN",0,0,"no url","2011-07-22 08:40:13"
"94339476784033792","Berkeley needs school supplies for kids, classrooms http://t.co/bl0GQxY :O school supplies","Lashawnaenbgl","EN",0,0,"no url","2011-07-22 09:34:18"
"94372851230052352","Good article: A #Synthetic Biology Lab In Berkeley http://bit.ly/mOABR1 #gmo #biosafety","GMWatch","EN",0,2,"no url","2011-07-22 11:46:55"
"94487200149934080","RT @brenisphere UC Berkeley Research: Who Could Have Guessed -- 3D Hurts Your Eyes techcrunch.com/2011/07/22/who… TechCrunch &lt; I knew it!!","IdleFeline","EN",0,0,"no url","2011-07-22 19:21:18"
"94505785110962176","Richmond puts on charm offensive to woo Berkeley Lab http://bit.ly/ojINyp","mercnews","EN",0,0,"no url","2011-07-22 20:35:09"
"94678171001159681","my final day in bay area coming to an end - it was great meeting an old friend and visit THE PUB, probably the coolest bar in Berkeley","michuk","EN",0,0,"no url","2011-07-23 08:00:09"
"94713874825228288","‎#ATTN THIS SUNDAY 3pm @philthyrichFOD @TheHoodstarz @SHADY28NATE in store signing at rasputin cd store in berkeley ca","SHADY28NATE","EN",0,1,"no url","2011-07-23 10:22:02"
"94796311970328576","Going to Berkeley Springs, WV, for vacation soon. What's fun to do there with kids? What are the best places to see, eat at and shop?","lfamous","EN",0,0,"no url","2011-07-23 15:49:36"
"94910707413417984","Check this video out -- On the Same Page: Voices of Berkeley Welcome Video http://t.co/Klh1hs4 via @youtube","langmag","EN",0,0,"no url","2011-07-23 23:24:10"
"94939362902544384","@djjAckizback just dm'd you it....thanks for supporting the #berkeley shop!!","wex1200","EN",0,0,"no url","2011-07-24 01:18:02"
"94973848470036482","Sunday! Sunday! Sunday! July 24 3-5:30 or so. House concert in Berkeley Hills. Kurt Ribak Trio - Kurt, Greg... http://fb.me/OsnniNuA","KurtRibakTrio","EN",0,0,"no url","2011-07-24 03:35:04"
"94996472550002688","Customer Service/Beer Geek Needed (berkeley): Bobby G's Pizzeria the artisan pizza, pasta, and panini restaurant ...  http://goo.gl/nGrSV","SFBayVacancy","EN",0,0,"no url","2011-07-24 05:04:58"
"95005251224084482","Berkeley Place » Blog Archive » FREE STUFF! (A monster giveaway post): FREE STUFF! (A monster giveaway post). Po... http://bit.ly/qOYs5e","mvanderbilt09","EN",0,0,"no url","2011-07-24 05:39:51"
"95110465356693506","I'm at Berkeley Hall Practice Tee http://4sq.com/qQu1LL","k2corley","EN",0,0,"no url","2011-07-24 12:37:56"
"95141990177587200","Bioinformatics Software Developer 3 - Synthetic Biology / Single Cell Genomics - Berkeley. http://t.co/8wZTLQx #synbio #job","SynBioNews","EN",2,1,"no url","2011-07-24 14:43:12"
"95226005823832064","I'm at Hellman Tennis Complex (Fulton St. and Kittredge St., Berkeley) http://4sq.com/rk5WpA","WillCwhatIam","EN",0,0,"no url","2011-07-24 20:17:03"
"95260167188389888","“@alt1040: Estudio de Berkeley muestra que el 3D tiene efectos nocivos en la vista http://t.co/ibNFiwf” Insensatos! Seguid comprando !","Nachomm","ES",0,5,"no url","2011-07-24 22:32:48"
"95264467604082688","Apparently the Berkeley newspaper in 1900 ran stories like ""Chickens Became Thirsty"" and ""Woman Loses Purse and Valuable Pin"".","shaddih","EN",0,0,"no url","2011-07-24 22:49:53"
"95317974323441664","Walking with the fam (@ Gelateria Naia - Downtown Berkeley) http://4sq.com/mPC5lJ","dasthedj","EN",0,0,"no url","2011-07-25 02:22:30"
"95318867714392064","I'm at Filippo's (2930 College Ave, btw Ashby and Russell, Berkeley) http://4sq.com/nzW9Hp","BreannePH","EN",0,0,"no url","2011-07-25 02:26:03"
"95329059898265600","The Berkeley Conference on Dutch Linguistics 1997: The Dutch Language at the Millennium (Publications of the Am... http://amzn.to/kzXJ2V","SoltyKaoruvy","EN",0,0,"no url","2011-07-25 03:06:33"
"95331769385103361","RT @earcos: Estudio de Berkeley muestra que el 3D tiene efectos nocivos en la vista http://bit.ly/pLN4Kq","cambronero","ES",1,1,"no url","2011-07-25 03:17:19"
"95359212716167168","Another pickup and another heavy utility truck just arrived. North #Berkeley might see power again tonight","agentdero","EN",0,0,"no url","2011-07-25 05:06:22"
"95405425574416384","Hardhats are connecting the lines from both poles now, while it dangles about 15ft over the intersection #Berkeley","agentdero","EN",0,0,"no url","2011-07-25 08:10:00"
"95433598705999872","Senior ActionScript Engineer – Game Developer – CyberCoders Engineering – Berkeley, CA: Skills Flash, UI… http://goo.gl/fb/Y5Gg4","cgjoblist","EN",0,0,"no url","2011-07-25 10:01:57"
"95455111287017472","I'm at Tesco Metro (8 Berkeley Precinct, Ecclesall Road, Sheffield) http://4sq.com/r2zX5X","hoggmeister81","EN",0,0,"no url","2011-07-25 11:27:26"
"95480642044833792","Five Berkeley homes feature on new architecture tour http://dlvr.it/cVkDh","BerkeleyHillsRE","EN",0,0,"no url","2011-07-25 13:08:53"
"95516033577783297","Berkeley Square - The Complete Mini Series [UK Import] für EUR 28,41 #deal #dvd #bluray http://amzn.to/riM8HK","dvds_guenstig","ES",0,0,"no url","2011-07-25 15:29:31"
"95553622934421504","@ellisgl have you tried berkeley db xml? XQuery should do the trick for you","figaro_bdbxml","EN",0,0,"no url","2011-07-25 17:58:53"
"95730513507135489","@SweetButFierce Can u PLS Support by #followme View, commenting on my Music Video http://t.co/THrVfIF #BERKELEY ,CA""","FamousFi","EN",0,0,"no url","2011-07-26 05:41:47"
"95854178341093377","I'm at Murphy USA (2625 Pleasant Hill Rd, at N Berkeley Rd, Duluth) http://4sq.com/mV5Dze","RoadScholarWolf","EN",0,0,"no url","2011-07-26 13:53:11"
"95911589991030784","Gov. Brown nominates Berkeley professor to CA high court: Gov. Jerry Brown announced that he is nominating UC Be... http://bit.ly/n5R31j","CA_Report","EN",0,0,"no url","2011-07-26 17:41:19"
"95917814317203456","In Berkeley: The lost beauty of Schoolhouse Creek http://dlvr.it/cgZkL","BerkeleyHillsRE","EN",0,0,"no url","2011-07-26 18:06:03"
"95928962794008576","$59 for One Month of Unlimited Yoga in Berkeley ($159 Value) http://MyDe.al/FJB","dgSFFitness","EN",0,0,"no url","2011-07-26 18:50:21"
"95959656702296065","Estudio de Berkeley muestra que el 3D tiene efectos nocivos en la vista: http://t.co/ZPbLPtD","silviaherant","ES",0,0,"no url","2011-07-26 20:52:19"
"96003621421981697","Maybe it was Albany not berkeley.","Steve_Tuck","EN",0,0,"no url","2011-07-26 23:47:01"
"96026211628752896","Nanny State won't stop 'til Happy Meal gets the full Berkeley makeover: Tofu burger, apples, kale/wheatgrass juicebox.","michellemalkin","EN",6,76,"no url","2011-07-27 01:16:47"
"96039457546969088","Well, so much for that sunny evening... Berkeley is covered in dense fog. Still trying to get use to the micro climates here.","kittygutz","EN",0,0,"no url","2011-07-27 02:09:25"
"96081316692508673","http://swimly.net SanFranciscoRSS: Clog| PayScale Rankings Diss Berkeley: We here at the Clog love c http://mrkt.ms/nD8s1V http://swimly.com","Swimly","EN",0,0,"no url","2011-07-27 04:55:45"
"96082696614318081","I'm at McClain's Coffeehouse (817 N Harbor Blvd, Harbor and Berkeley, Fullerton) [pic]: http://4sq.com/oHxD0n","PauPauVonKitten","EN",0,0,"no url","2011-07-27 05:01:14"
"96180772024762368","""The founders are young and scrappy too. All three are 19-year-old UC Berkeley engineering dropouts."" This resonates cool!","MikeSundberg","EN",0,0,"no url","2011-07-27 11:30:57"
"96203224129880064","RT @Pat_Gray: I think it's a shame that bad owners have given a wonderful breed a bad reputation. Alan Berkeley #quotes","sweetestdog","EN",0,0,"no url","2011-07-27 13:00:10"
"96214078992818177","Morning Briefing: July 27, 2011: Jerry Brown (D-CA) appointed UC Berkeley law professor Goodwin Liu to the Calif... http://bit.ly/r5oexS","Cal_Politics","EN",0,1,"no url","2011-07-27 13:43:18"
"96229132123389952","New UC Berkeley webcast lecture: Scientific Approaches to Consciousness http://t.co/Dw3pJtj","neuroconscience","EN",2,2,"no url","2011-07-27 14:43:07"
"96312136615211008","Stoopid is coming to the Greek Theatre in Berkeley, CA this Friday July 29th. RT for a chance to win 2 tix #SeedlessSummer","SlightlyStoopid","EN",0,15,"no url","2011-07-27 20:12:57"
"96360107901845504","RT @L0vemypumps Talkin to Berkeley unified school district ... my daughter will b goin to SKOOL in Berkeley ;) ,.&gt;&gt;#swag","L_SeaSick","EN",0,0,"no url","2011-07-27 23:23:34"
"96368316158976001","Mint Leaf Indian food, Berkeley. We outchyeah. I love seeing my nigga @Leonalikes play the boss at her job.","mikoolsux","EN",0,0,"no url","2011-07-27 23:56:11"
"96415913091403777","#jobs Assistant Director of Programs - University of California Berkeley -  Berkeley, CA http://bit.ly/oVjwUz","Jobs_Berkeley","EN",0,0,"no url","2011-07-28 03:05:19"
"96472863346925568","I am now officially living in Berkeley. Unpacked and everything, there's no going back now. :)","Hanjabanja","EN",0,0,"no url","2011-07-28 06:51:37"
"96596977021763584","dont know y said not disease assoc but pity did not go ahead esp for ALDH2 hets - berkeley in pharmgx j http://bit.ly/orPoU9","eurogene","EN",0,0,"no url","2011-07-28 15:04:48"
"96613947184128000","Pharmacy Well: Designing a Better Food Label: A project at the University of California-Berkeley School of Jour... http://nyti.ms/r11cg2","VemmaDistributo","EN",0,0,"no url","2011-07-28 16:12:14"
"96691936051740672","Where to Get Camping Gear in Berkeley http://bit.ly/qCOrbr #camping #caravan","AlecTownsend","EN",0,0,"no url","2011-07-28 21:22:08"
"96727222752260096","New: Q&A with LaeCharles Lawrence, Jr, creator of the ""Whole Foods Parking Lot"" music video Berkeley remix: http://bit.ly/q7Z0EI","berkeleyside","EN",0,0,"no url","2011-07-28 23:42:21"
"96749255422771200","I'm at Tico (222 Berkeley Street, Boston) w/ 4 others http://4sq.com/pWNWyY","lmpulver","EN",0,0,"no url","2011-07-29 01:09:54"
"96859971341385728","Ubiquitous Learning Conference 2011: 11.11.2011 - 12.11.2011, Berkeley, California: The Ubiquitous Learning Conf... http://bit.ly/q4SRQR","DBS_20","EN",0,1,"no url","2011-07-29 08:29:51"
"96971188487725056","If I go to California I have to go to Berkeley, California, Green Day live theree :)","MauroGDFAN","EN",1,0,"no url","2011-07-29 15:51:47"
"97018609422962688","C-Money is ready to get down tonight in Berkeley!","PlayersInc","EN",0,0,"no url","2011-07-29 19:00:13"
"97066420306845696","I'm at Berkeley Restaurant & Fish Market (24th Ave. and Central Ave., Seaside Park) http://4sq.com/nV0OLO","mountainmomma","EN",0,0,"no url","2011-07-29 22:10:12"
"97099186184523777","I blame it on the model broad with the hollywood smile , stripper booty and rack like wow , brain like berkeley...&lt;3 #novacane","Tamara_Kinley","EN",0,0,"no url","2011-07-30 00:20:24"
"97153758290653185","needs to go home but first something to eat!  pronto!!...where to go for good food but fast and easy to take home??  in berkeley??","stefanierenee","EN",0,0,"no url","2011-07-30 03:57:15"
"97165942727000064","@jimgoldstein in Connecticut no less, what's next, downtown Berkeley? oh wait...... cougar","davidsanger","EN",0,0,"no url","2011-07-30 04:45:40"
"97241087898435584","Fantastic start to our Part 2 at EncounterLife, Berkeley Vale, Central Coast, N.S.W. Can't wait to get back there Tuesday!!","PropheticAS","EN",0,0,"no url","2011-07-30 09:44:16"
"97256107675877376","There are two major products that come out of Berkeley: LSD and UNIX. We don't believe this to be a coincidence. -- Jeremy S. Anderson","ratatoskM15","EN",0,0,"no url","2011-07-30 10:43:57"
"97450555617705984","Bought in Berkeley Springs this afternoon so you don't get lost the next time you wander our back acreage: http://lockerz.com/s/125167484","scottedelman","EN",0,0,"no url","2011-07-30 23:36:37"
"97483858395668480","A Perfect Circle (@ Greek Theater Berkeley w/ 19 others) http://4sq.com/q68z1q","DaveCowl","EN",0,0,"no url","2011-07-31 01:48:57"
"97580214141452288","$20 for a Full-Face Threading at M&M Thread Salon in Berkeley ($40 Value) on Deal51: $20 for a Full-Face Threading... http://dlvr.it/dFh6c","deal51_sfo","EN",0,0,"no url","2011-07-31 08:11:50"
"97697356878843904","Researchers at U.C. Berkeley have discovered that some of the net’s most popular sites are using a track... http://bit.ly/oSRI6X #reddit","RedditTech","EN",0,0,"no url","2011-07-31 15:57:19"
"97831394218225664","RT @dntfollowmorgie: In berkeley with this idiot -_-&gt;&gt;&gt;#Swag","L_SeaSick","EN",0,0,"no url","2011-08-01 00:49:56"
"97954547368083456","Are You Stuck in a Dead-End Customer Service Job?: CA-Berkeley, Having Trouble Viewing This Job Posting?  Here i... http://bit.ly/n6u1Kp","Jobs_Oakland","EN",0,0,"no url","2011-08-01 08:59:18"
"98138975142809600","I just ousted Samantha S. as the mayor of Berkeley Vale Primary School on @foursquare! http://4sq.com/9jNIg3","woojm","EN",0,0,"no url","2011-08-01 21:12:09"
"98356265260027904","I'm at Berkeley Hall Practice Tee http://4sq.com/r1KmQW","k2corley","EN",0,0,"no url","2011-08-02 11:35:35"
"98405518967701504","#jobs Lab Technician - ATR International, Inc. -  Berkeley, CA http://bit.ly/pMVWR2","Jobs_Berkeley","EN",0,0,"no url","2011-08-02 14:51:18"
"98443632608153600","$15 for $30 credit to Cafe Colucci Ethiopian fare #berkeley #oakland. Vegetarian and vegan friendly. http://bit.ly/ppGfCj","oakberkeats","EN",0,0,"no url","2011-08-02 17:22:45"
"98474288776101888","@scottadhoc incidentally, i just learned on elizabeth berkeley's twitter feed that she wasn't in that ep b/c she hurt her knee in rehearsal.","leahruthie","EN",0,0,"no url","2011-08-02 19:24:34"
"98480047534522368","K Road Power Partners with Barclays Natural Resource Investments: BERKELEY, Calif., Aug 02, 2011 (BUSINESS WIRE)... http://bit.ly/nwgdee","simplesolar101","EN",0,0,"no url","2011-08-02 19:47:27"
"98518643540901888","#LWX 1 N Martinsburg Arpt [Berkeley Co, WV] asos reports TSTM WND GST of M68 MPH at 01 Aug, 05:58 PM EDT http://bit.ly/pQ9OkH","iembot_lwx","EN",0,0,"no url","2011-08-02 22:20:49"
"98519461425979393","@AlbaMayo go to Gypsy's in berkeley, there lasagna is BOMB!!! =D","AceCanTweet","EN",0,0,"no url","2011-08-02 22:24:04"
"98545663238873089","#openhome_berkeley 2229 Ashby Avenue BERKELEY (Sun Aug 07 02:00 PM to 04:30 PM) Listed by IRA SERKES: http://goo.gl/Kebok","homesopentoday","EN",0,0,"no url","2011-08-03 00:08:11"
"98598528229711872","@classic_film They Made Me a Criminal is great! Crime directed by Busby Berkeley! Garfield, Rains and Dead End Kids are great in it! ;)","SheriBiesen","EN",0,0,"no url","2011-08-03 03:38:15"
"98737228443955200","Student project at UC Berkeley: Nutrition Label Gets a Design Overhaul - NYTimes.com http://t.co/2V6hH69 via “@ellenLupton","iA","EN",18,17,"no url","2011-08-03 12:49:24"
"98739024822419457","I'm at Liberty Mutual (175 Berkeley St, St James Ave, Boston) w/ 3 others http://4sq.com/oZyP9d","KTrerotola","EN",0,0,"no url","2011-08-03 12:56:32"
"98746390045409280","Wow! Telling it like it is, not only in California • A letter to my students & The Berkeley Blog http://su.pr/2zgQNZ #edchatie","levdavidovic","EN",0,1,"no url","2011-08-03 13:25:48"
"98785623548248064","@arichristos Can u PLS Support by #followme View, commenting on my Music Video http://t.co/THrVfIF #BERKELEY ,CA","FamousFi","EN",0,0,"no url","2011-08-03 16:01:42"
"98796205806583808","Berkeley Edible Gardens Initiative Part of Larger ... - Ecology Center: The Ecology Center is promoting changes ... http://bit.ly/nFtGFc","thegreengod","EN",0,0,"no url","2011-08-03 16:43:45"
"98909733028761600","@BofA_Help Wow, you guys are really helpful! #sarcasm All I need is a direct number to your Berkeley branch!!! How hard is that? #frustrated","kcwhitlo","EN",0,0,"no url","2011-08-04 00:14:52"
"98911050006663169","My other dream is to become an offensive coordinator at the University of California Berkeley or Stanford.","undagroundmilli","EN",0,0,"no url","2011-08-04 00:20:06"
