"tweet_id","text","author","language","likes","retweets","media","timestamp"
"117730795619237888","@tg_1030 here's my list in order: Columbia, Harvard, Princeton, Brown, Yale. Cambridge was number 3 but its not up to my standards anymore.","MattThorpe5","EN",0,0,"no url","2011-09-24 22:43:03"
"117768468836794369","Frustrations boil over at meeting | WCMessenger.com: For his part, Yale was hardly contrite when he was intervie... http://t.co/mkzlsa7C","SandraFoxy1","EN",0,0,"no url","2011-09-25 01:12:45"
"117794157271068672","""Europe’s story became America’s story"" - Robert Shiller, @Yale. cc: @ShillerFeeds. http://t.co/tSlqwbaC","ProSyn","EN",4,6,"no url","2011-09-25 02:54:50"
"117801792582062080","#Yale #Connecticut New Haven, CT, June 2011 - Yale University Campus With Sterling ... http://t.co/g7y9oCOZ  #hithotus","CT_HitHot","EN",0,0,"no url","2011-09-25 03:25:10"
"117872392218488834","Yale students vote against PA statehood bid: US university's debate society, main forum for political discussion... http://t.co/cTdvUsgX","Jerusalem_Post","EN",3,11,"no url","2011-09-25 08:05:42"
"117929806934446080","This Yale transit bus in front of me is driving like a maniac.","hilaryrose","EN",0,0,"no url","2011-09-25 11:53:51"
"117964029871398912","Happy New Year and hope this link from our friend Yale Federbush makes you smile.... who knew! http://t.co/wkljV1lU","danielsilvabook","EN",0,2,"no url","2011-09-25 14:09:51"
"117990926340722688","1963 Yale Bulldogs vs. Harvard Crimson 36 x 48 Canvas Historic Football Print http://t.co/6ejA7sbC","innerinner","ES",0,0,"no url","2011-09-25 15:56:43"
"118087940579659776","I'm at Heritage Park (14301 Yale Ave, Irvine) http://t.co/Mm7DERqe","leepunk13","EN",0,0,"no url","2011-09-25 22:22:13"
"118152021185544192","Fears of massive Wall St Social Unrest sending jitters http://t.co/60OR0uyx through markets. #chicago #omaha #nyc #yale","FirstFinInsight","EN",0,1,"no url","2011-09-26 02:36:51"
"118335287091920896","RT @AdamKissel: Not a rape culture, just a PC one | Yale Daily News http://t.co/kKFUucwn","katherinemiller","EN",0,0,"no url","2011-09-26 14:45:05"
"118338931929522176","Check out Yale Hauptman's new blog post: http://t.co/fJFpZ4LC","HauptmanLaw","EN",0,0,"no url","2011-09-26 14:59:34"
"118402307871342592","Yale ain't seen nothin yet....Nothin","scary_harry","EN",0,0,"no url","2011-09-26 19:11:24"
"118415142420615168","Don't call kids 'obese,' parents tell doctors: Yale University ""Our findings indicate that the terms ""fat,"" ""ext... http://t.co/Rz0q3x3D","banishfat4ever","EN",0,0,"no url","2011-09-26 20:02:24"
"118669883478245377","Cha! Ngiyakuva!RT @sifisodl: @Phesh_Unplugged cut down iBudget yale ""chap"" and let people vote for (cont) http://t.co/DnS5Tesi","Phesh_Unplugged","EN",0,0,"no url","2011-09-27 12:54:39"
"118750237962674177","My wife's non-market Yale friends are asking what cornholio means","KeithMcCullough","EN",0,1,"no url","2011-09-27 18:13:57"
"118802117325631488","#1 Men's Soccer take on Yale at Morrone Stadium starting at 7:30 PM. John Tuite and Colin Hensel are LIVE from... http://t.co/cQtnSV89","WHUSSports","EN",0,0,"no url","2011-09-27 21:40:06"
"118841602872573952","Yale delivers for the Red Sox: Lavarnway three-run homer gives Boston a 5-1 lead, a couple of innings after he makes a great throw at third.","Buster_ESPN","EN",1,26,"no url","2011-09-28 00:17:00"
"118893968397316097","One month in, seven crime reports emailed to the Yale community by police. Today's notable: grad student punched off of bike. Very GTA IV.","andrewLgoble","EN",2,0,"no url","2011-09-28 03:45:05"
"118894496850251776","Hace unos días que estoy pensando en ""ir a Yale"" osea, esto me esta haciendo mal!","MartinaLisanti","ES",0,0,"no url","2011-09-28 03:47:11"
"118905636921675776","@bijanstephen I have no idea what that class would be like, let alone at Yale. Are you taking physics too?","baconophilus","EN",0,0,"no url","2011-09-28 04:31:27"
"118934330180517888","Milgram 50 years on: These were the words spoken to participants of Yale professor Stanley Milgram's social psyc... http://t.co/xfHofUDR","woodypaul2","EN",0,0,"no url","2011-09-28 06:25:28"
"118960037065539585","I'm at Yale University - Swing Space (100 Tower Parkway, New Haven) http://t.co/edWdc95S","RADryburgh","EN",0,0,"no url","2011-09-28 08:07:37"
"119026600653234176","Shout out to Uconn Soccer for being Ranked #1 in the Country after beating YALE by 1 point yesterday!","HotMorning937","EN",0,0,"no url","2011-09-28 12:32:07"
"119094036828127232","Yale Men's Hockey: Bulldogs Picked 1st By Coaches, Media http://t.co/nQ56d6Fj","Boola_Bulldog","EN",0,1,"no url","2011-09-28 17:00:05"
"119105386459566080","Non-Injury accident at 9800 S YALE AVE ; UNK  JS OF THE TURNPIKE. http://t.co/nTCQ6zUs","tulsata","EN",0,0,"no url","2011-09-28 17:45:11"
"119111791170174976","@HcBaLLiN22 one was yale's quote ""hey guys how's the party going""","KyleSkaggs","EN",0,0,"no url","2011-09-28 18:10:38"
"119113145586434049","#Yale -New Haven Hospital, St. Rae's agree to merge, but will keep two #NHV sites http://t.co/m6GL3gs5 @HospStRaphael @YNHH","nhregister","EN",0,4,"no url","2011-09-28 18:16:01"
"119113921893371904","Yale's No Boundaries Series Announces 2011-12 Season...  http://t.co/edDZm1mY","bww_ct","EN",0,0,"no url","2011-09-28 18:19:06"
"119121542918578177","RT LOL @FakePeteGammons: The more clean cut Yale boys we get into #Redsox uniforms the better it is for the entire game of baseball. YALE!","dchurbuck","EN",0,0,"no url","2011-09-28 18:49:23"
"119125976297914368","Yale HAS TO have a quota for _____!!!! No offense","RoBrEn613","EN",0,0,"no url","2011-09-28 19:07:00"
"119291324150185984","Yale Says Endowment Reaches $19.4 Billion http://t.co/Gynh4bgJ","NorthStateTv","EN",0,0,"no url","2011-09-29 06:04:02"
"119374769819877376","Amazing 22% returns for Stanford and Yale, topped by Duke at 25% http://t.co/T8iVLEtr","hkanji","EN",0,2,"no url","2011-09-29 11:35:37"
"119408156500705280","En 1965 Frederick Smith, estudiante de la Universidad de Yale escribio un trabajo de reprtir paquetes dentro de EU en 2 dias.","alesolanov","ES",0,0,"no url","2011-09-29 13:48:17"
"119411150046773249","Planning a joint school visit with @SFERYale on Harvard-Yale weekend! Gotta love competition over football but camaraderie over #edreform","SFERHarvard","EN",0,2,"no url","2011-09-29 14:00:11"
"119442818228957185","I'm at SpaFax (1507 W Yale Ave, at Main St, Orange) http://t.co/HH2P862t","daveplubell","EN",0,0,"no url","2011-09-29 16:06:01"
"119470223790313472","Photo “Be Invited” by Geoff Yale (@yalephotography) #500px http://t.co/rqvsto3J","YalePhotography","EN",0,0,"no url","2011-09-29 17:54:55"
"136825673816879104","Yale reforestation program receives $5.5M from Arcadia Fund to continue its work in Latin America and Southeast ... http://t.co/GfQ83nOV","ctenvheadlines","EN",0,0,"no url","2011-11-16 15:19:17"
"136900325150961664","Yale Assembly is the place to be this week!","Maximthorne","EN",0,0,"no url","2011-11-16 20:15:55"
"136909942685831169","FREE Yale men's basketball t-shirts for the first 100 fans in attendance for Thursday home opener vs. Lyndon State. Tip-off is 7:00 p.m","Yale_Basketball","EN",0,3,"no url","2011-11-16 20:54:08"
"137005145010606081","Here are my fuck offs for tonight: fuck Yale arts, Fuck Hillyer art space & Fuck John Bankston.. F**got ass b*tches!","_TheArtLife_","EN",0,0,"no url","2011-11-17 03:12:26"
"137072039990272000","@PaulPabst Cat-Griz Sat..great rivalry..Montana State shirt Friday? Or you sporting Yale? http://t.co/Xj4aJ5ED","bobcatfan58","EN",0,0,"https://pbs.twimg.com/media/Aeb6S0yCIAAkrr6.jpg","2011-11-17 07:38:16"
"137170455126749188","Hope to see you tonight: Check out ""PreGame"" Harvard/Yale Party 2011"" http://t.co/8It4RmI1  @eventbrite #HarvardYaleDC #HBASDC","jjeannelin","EN",0,0,"no url","2011-11-17 14:09:19"
"137193238581874689","""Sound so smart like you went to college. Like you went to Yale but you probably went to Howard"" &lt; I don't appreciate that line, Drake.","kiyosabi","EN",0,1,"no url","2011-11-17 15:39:51"
"137194412974407680","@PaulPabst What is your connection to Yale?  I know SIU is the Yale of the Midwest, but you seem to tweet Yale info a lot.","MikeWagner9","EN",0,0,"no url","2011-11-17 15:44:31"
"137195578990927873","#thatawkwardmomentwhen a kid wears a Yale sweatshirt and he really goes to St. Johns.","Supa_Baste","EN",0,1,"no url","2011-11-17 15:49:09"
"137201744613613568","Making the Case for the Value of Environmental Rules by Gernot Wagner: Yale Environment 360 from @YaleE360 http://t.co/CVlnvGwI","LSchnapf","EN",0,0,"no url","2011-11-17 16:13:39"
"137231004082511873","@smg1981 @Ms_Yale @JPHuber @camerons234 @JohnDWorkman No Scott - he was lying.","drewwilson12","EN",0,0,"no url","2011-11-17 18:09:55"
"137232681812496384","Running on a treadmill and only eating salad Sounds so smart, like you graduated college Like u went 2 yale, but u probably went to Howard","LeAnnSealy","EN",0,0,"no url","2011-11-17 18:16:35"
"137233617129701376","My lil bro's doin it big, holdin it down with his canadian team at Yale university in NYC this weekend!","DougWatts91","EN",0,0,"no url","2011-11-17 18:20:18"
"137268543111704577","Yale University Students Protest Morgan Stanley Recruitment, Chant ‘Make Change Not Money’ http://t.co/f9b7CDf3 via @thinkprogress","Ivanroberson","EN",0,1,"no url","2011-11-17 20:39:05"
"137275568570892290","Got my nails done for free in Yale #result","Jade_Styles","EN",0,0,"no url","2011-11-17 21:07:00"
"137288524767571968","Once upon a time I wanted to go to YALE and become somebody important! #thenlifehappened","Lionessqueen48","EN",0,0,"no url","2011-11-17 21:58:29"
"137322616099848192","@keek917 @clinegrosso @danakvpitts its shnowing ashley yale its shnowing!!!!!!","keggengriffith","EN",0,0,"no url","2011-11-18 00:13:57"
"137342896574693376","@MySoulDontDream @lucylovingud lol. you tryna be all educated like you went to yale, but you prolly go to howard knowing you lol. *drake*","OrangeCruise","EN",0,1,"no url","2011-11-18 01:34:32"
"137371299348627457","Yale reviewing football coach's claim that he was Rhodes scholar candidate http://t.co/5q0czFWQ","EnnisNYT","EN",0,0,"no url","2011-11-18 03:27:24"
"137374700962709504","“@mlancegrantham:  the Yale qb thing...advised him to play instead of going to Rhodes scholar interview”/ wow! Not surprised though.","skyhawks25","EN",0,0,"no url","2011-11-18 03:40:55"
"137391033548947457","Yale professor uses video games as tool for sex ed.: Video games have been accused of inciting violence and shor... http://t.co/etpO8OYa","jesusrivera22","EN",0,0,"no url","2011-11-18 04:45:49"
"137423044502237186","RT | Yale Quarterback Chooses Football Over Scholarship - http://t.co/LKTiGIQ2","CollegeIs4Me","EN",0,0,"no url","2011-11-18 06:53:01"
"137509388435984384","Yale Coach: Yale’s head football coach Thomas Williams '92 M.A. '95 is being investigated by Yale University... http://t.co/g7UQOfOQ","PaloAltoNews","EN",0,0,"no url","2011-11-18 12:36:07"
"137536019133239297","It's GAMEDAY again!!! Come see our Women's Basketball team take on Yale tonight at 7. Swipe in starts at 6:30. #GoRedFoxes","RedFoxNation","EN",0,7,"no url","2011-11-18 14:21:56"
"137611444257697792","@BestBuddies Then BBMA can cheer for Harvard. When it comes to schools across state lines, we have to stick with our own... #TheGame #Yale","BestBuddiesCT","EN",0,0,"no url","2011-11-18 19:21:39"
"137623897125294081","Forgot all about Yale vs Harvard 2morrow..gonna be a mad house","KayHaven","EN",0,0,"no url","2011-11-18 20:11:08"
"137630675145728001","#ComoReconocerAUnNaco usa modismos de puertorriqueños como: yo bailo perreo y sandungueo en las parys con mi yale o no pana!! jejejej","Empanada03","ES",0,0,"no url","2011-11-18 20:38:04"
"137645229380599808","Sweeney Todd at Yale! http://t.co/BH8sUFcP","eifc7","EN",0,0,"no url","2011-11-18 21:35:54"
"137663215512457216","On the eve of harvard yale don't miss @FoxCT news at 10! We're in new haven as all the big alum come back!!!","Almorrisnews","EN",0,3,"no url","2011-11-18 22:47:22"
"137668296987246593","I'll be at YALE Dec 1st! Yup!","RevRunWisdom","EN",9,43,"no url","2011-11-18 23:07:34"
"137672265855803392","@1EZlife It's already on my calendar! Looking forward to hearing @RevRunWisdom at #Yale!","ProverbsthePoet","EN",0,0,"no url","2011-11-18 23:23:20"
"137674957940457472","Excellent essay by Yale's Bill Nordhaus on ineffective (stupid) energy policy and the chance for something better: http://t.co/KCU6QOyp","grant_mcdermott","EN",12,17,"no url","2011-11-18 23:34:02"
"137676330136387584","Nice! RT @MIKKI_NM: Yale scientist visualizes conception to birth #rhbill Watch you might learn. http://t.co/z0R2MPGS","bignotorhbill","EN",0,0,"no url","2011-11-18 23:39:29"
"137686341935841280","#Marist women's basketball vs. Yale! let's do it lady foxes!","Jenna_x3","EN",0,0,"no url","2011-11-19 00:19:16"
"137691647709413376","Clemantine Wamariya 23 Rwandan Refugee now @ Yale/ Newest & Youngest on board of U.S.  Holocost Museum http://t.co/200ZO2SE","thatsDEEPbyE","EN",1,0,"no url","2011-11-19 00:40:21"
"137731808199589888","@tedvaland HAHA she got off at 110th - probably goes to columbia now. yale newspaper oh my god i can't believe you know that","lindsayrbailey","EN",0,0,"no url","2011-11-19 03:19:56"
"137756381703979008","New Newsletter http://t.co/n0lFk83r ! Sex Pot, Sex Week, Lawsuits & Love + #Fire #Yale #FootFetish #OWS #HighTimes #Penthouse #420","drsuzy","EN",1,2,"no url","2011-11-19 04:57:35"
"137767325553270784","Here: Whistler opens and Yale celebrates http://t.co/8RqCPAjg","Landscaper77","EN",0,0,"no url","2011-11-19 05:41:04"
"137910007403511808","New at Book Search UK: Edward III (English Monarchs Series the English Monarchs) (Yale English Monarchs Series) http://t.co/alMTzgaY","BookSearchUK","EN",0,0,"no url","2011-11-19 15:08:02"
"137924205818822656","30 year-old female is dead after a Uhaul truck hit her and two other pedestrians in the tailgating area at the Yale/Harvard Football game.","FoxCT","EN",0,7,"no url","2011-11-19 16:04:27"
"137929221497565184","Yale QB withdrew Rhodes Scholarship application bc interview conflicted with Yale/Harvard game; called it an ""easy decision""...my new hero","bgz43","EN",0,0,"no url","2011-11-19 16:24:23"
"137931209576677376","ESPN NCAAF - One person dead, 2 injured after they were hit by U-Haul truck while tailgating at Harvard/Yale game","mrdodd16","EN",0,0,"no url","2011-11-19 16:32:17"
"137931827871625216","Three people struck in the parking lot of the Yale vs Harvard bowl game. One victim dies. http://t.co/r2GfAVDs","NBCConnecticut","EN",0,13,"no url","2011-11-19 16:34:45"
"137932548859904000","Woman dies after being hit by U-Haul truck outside Yale vs. Harvard game; 2 others injured - @nhregister http://t.co/gUJOE9w0","BreakingNews","EN",7,129,"no url","2011-11-19 16:37:36"
"137933923295563776","Reports: Yale-Harvard tailgater killed by truck: A 30-year-old woman was killed  and two others injured Saturday... http://t.co/I3UOIYEt","Avaaox","EN",0,0,"no url","2011-11-19 16:43:04"
"137935840109281281","Harvard Yale http://t.co/4VMnQneJ","lupski","ES",0,0,"https://pbs.twimg.com/media/AeoL6m_CQAEy8Op.jpg","2011-11-19 16:50:42"
"137940093125132289","Truck strikes Yale-Harvard tailgaters, killing 1: Police say someone driving a U-Haul truck into a tailgating ar... http://t.co/rXQe0uU6","HomeNegotiator","EN",0,0,"no url","2011-11-19 17:07:35"
"137941825846644736","Yale v. Harvard game.. New Haven is flooded wit beautiful rich smart white women right now.. Asians too.. I am overwhelmed lol","mho914","EN",0,1,"no url","2011-11-19 17:14:28"
"137941905060265984","Tailgater Killed by Truck at Yale-Harvard Game http://t.co/DymAHSgY","AllTheBestNews","EN",0,0,"no url","2011-11-19 17:14:47"
"137941911280422912","I like watching the Harvard/Yale game because the camera pans around the stadium and shows you all the people who will destroy America.","Mobute","EN",41,79,"no url","2011-11-19 17:14:49"
"137942106391068672","Harvard-Yale tailgater killed by moving truck: A 30-year-old woman was killed and two others injured Saturday mo... http://t.co/qrIWyQy1","Marianaudm","EN",0,0,"no url","2011-11-19 17:15:35"
"137945654763864065","watching #TheGame #Harvard and #Yale","claytnb","EN",0,0,"no url","2011-11-19 17:29:41"
"137945868681756673","A miracle!  Yale scores the first touchdown.","aaronbetsky","EN",0,0,"no url","2011-11-19 17:30:32"
"137949970430033921","Yale QB gives up a shot at a Rhodes Scholarship for his team and The Game.  ... http://t.co/fhDsa9al","JoeNBC","EN",0,14,"no url","2011-11-19 17:46:50"
"137949979099664386","RT @AP: A truck drove into tailgaters at the Yale-Harvard football game, killing one person and injuring two  - geniuses?","THATbirdDID","EN",0,0,"no url","2011-11-19 17:46:52"
"137950013463601152","FB: End of Q1. Yale is having success on long crossing patterns thus far. Harvard ball on Eli 20 #TheGame #GoCrimson","harvardcrimson","EN",0,1,"no url","2011-11-19 17:47:00"
"137951434514767872","Deadly incident for tailgaters at Yale-Harvard game: Police say someone driving a U-Haul truck into a tailgating... http://t.co/8U7tmP74","RochesterNews","EN",0,0,"no url","2011-11-19 17:52:39"
"137961039462531072","I'm told Harvard-Yale is like BC-Notre Dame for the Protestant crowd.","FakeJerryYork","EN",3,8,"no url","2011-11-19 18:30:49"
"137961886749691904","1 dead, 2 injured in Harvard-Yale tailgate crash - US news - Life - http://t.co/rYMCKakT http://t.co/3y6SGjJZ via @addthis","Hephaestus7","EN",0,0,"no url","2011-11-19 18:34:11"
"137967041515765760","Woman killed, 2 injured in Harvard-Yale tailgate crash – http://t.co/B5t17Fih http://t.co/VMyqSg4O","ShareeHemsath","EN",0,0,"no url","2011-11-19 18:54:40"
"137968312398249985","http://t.co/ol1btEBP Fan Killed In U-Haul Crash At Harvard-Yale Tailgate, According To ...","HollyWestangel","EN",0,0,"no url","2011-11-19 18:59:43"
"137974964589563904","“@jenny8lee: Death at Harvard-Yale tailgate with UHaul crash. :( How often does that happen. http://t.co/U8dwcSBA” are you kidding me?","brennansomers","EN",0,0,"no url","2011-11-19 19:26:09"
"137976399028948993","I'm sure there are many great places to watch #theGame besides the Yale Bowl. The HCNY has got to be nearly top of the list. #goCrimson #fb","JohnSharpMD","EN",0,0,"no url","2011-11-19 19:31:51"
"137978760422113281","As per my wife me are watching the Yale vs Harvard game right now. Or as I put it- Yuppy vs. Preppy! Roman will not be playing for either!","SifuMikeCamba","EN",1,0,"no url","2011-11-19 19:41:14"
"137979347620478976","Damnit yale, stop breaking my heart like this","LorenLo","EN",1,0,"no url","2011-11-19 19:43:34"
"137979393774587905","New Haven PD is looking for an intoxicated male who tired to flip a security golf cart at the #Yale #Harvard game","tketh168","EN",0,0,"no url","2011-11-19 19:43:45"
"137979892884193281","Nice job by @RossTuckerNFL doing color at Harvard/Yale on VS channel.","jhwoods","EN",0,0,"no url","2011-11-19 19:45:44"
"137982145217048576","Bad week for college football: Woman killed, two injured after truck hits tailgaters at Harvard-Yale game (http://t.co/XtwmsfpS) @ivygate","mstockwoman","EN",0,0,"no url","2011-11-19 19:54:41"
"137996280034099200","Three Hit By Car Outside Yale Bowl (morningcall) http://t.co/U9iLr6c9","NBANewsBoard","EN",0,0,"no url","2011-11-19 20:50:51"
"137996699451920385","Lmao RT @ThankUBasedQuad ESPN showing this Yale/Howard highlight like people not named Ryan Fitzpatrick care","rod4short","EN",0,0,"no url","2011-11-19 20:52:31"
"137998225318744064","@drewwilson12 @jcbatuello I think it may be warmer outside than it is in your house. #fail","Ms_Yale","EN",0,1,"no url","2011-11-19 20:58:35"
"137998721102249984","@GoodTasteGuide @ThreeManyCooks Party on, Garth! BTW... are you at the Yale-Harvard game? If so, look for @soulworkDRA. He's there too!","PamAnderson3MC","EN",0,0,"no url","2011-11-19 21:00:33"
"138003817169035264","First Financial Insights Inc.: Secrets of Wealth http://t.co/Wi7Uzp2m #ows #n17 #finance #yale","FirstFinInsight","EN",0,0,"no url","2011-11-19 21:20:48"
"138009789841162240","Our football team did work today against Yale. Had a great year and capped it off by going undefeated in the ivy. Put in some slight work","bcrimson10","EN",0,3,"no url","2011-11-19 21:44:32"
"138013225009680384","Poor Yale @CocoPannell but I will still PROUDLY sport my Yale vs Harvard t-shirt .. Better see u next week! Party at your house Friday?","kmarsh_2","EN",0,0,"no url","2011-11-19 21:58:11"
"55111417111646208","What a story! The incredible legacy left by @Yale University senior Mandi Schwartz. http://bit.ly/enkSfh","NHL","EN",7,57,"no url","2011-04-05 03:36:00"
"86623916147224576","@TimmyDaly  Dad went to Michigan State to teach after a year at Yale Drama School.","sp4joelleeyork","EN",0,0,"no url","2011-07-01 02:35:25"
"86807554709131264","RT @yaleseas: Yale gets $1.5 million from Hong Kong philanthropy to expand stem cell research core facilities: http://t.co/VqPOpEe","Yale","EN",0,3,"no url","2011-07-01 14:45:08"
"86815310631534592","3 weeks until The Yale Publishing Course Books: Print and Digital. A few spots available.  Register at http://t.co/mBoxFmj.","YalePubCourse","EN",0,0,"no url","2011-07-01 15:15:57"
"86837007761948672","@T5JS nothin jst textin friends.. So yale edia?","vyomavyas","EN",0,0,"no url","2011-07-01 16:42:10"
"86843425059639296","What can wrinkles say about your Bones? http://t.co/cooXGBP Yale study #wrinkles #bonedensity #menopausal #women #InsidersHealth #plsRT","InsidersHealth","EN",0,10,"no url","2011-07-01 17:07:40"
"86861200524193792","Plenary Session 4 asks How can we agree to agree? Nayan Chanda, Director of Publications, Yale will participate #tallberg","Tallberg","EN",0,0,"no url","2011-07-01 18:18:18"
"86899775525502976","JAJAJAJA RT @kakyrp: #YaLe RT Herlisndm: Entren q caben 100, ay q caben, q caben 100, entren q caben 100, 50 paraos' 50 de pie -8-","Herlisndm","ES",0,0,"no url","2011-07-01 20:51:35"
"86981681898196993","RT @ProSyn: A Failed Global Recovery-Stephen S. Roach, faculty at @Yale and Non-Exec Chair #MorganStanley Asia. http://bit.ly/kUt9oP #gfc2","Dazinism","EN",1,0,"no url","2011-07-02 02:17:03"
"87104440779288576","Sang with the Yale Whiffenpoofs in Delhi last night! Great fun. http://t.co/nEY7XQG","gauravps","EN",0,0,"no url","2011-07-02 10:24:51"
"87171184726249472","@fancygapdecor - Love bargains, eh? When Yale Gurney #walldecor is sold online, the prices are absurd. Chec… (cont) http://deck.ly/~6WQUB","YaleGurney","EN",0,0,"no url","2011-07-02 14:50:04"
"87210078507249664","RT @nhregister: #Yale findings on climate change might surprise you. Are you Alarmed or Dismissive? http://bit.ly/jw4Pdd #climatechange","CTShade","EN",0,0,"no url","2011-07-02 17:24:37"
"87226310476304384","@Pogue @recreate you didn't know that? Are you sure you went to Yale?","SirKneeland","EN",0,0,"no url","2011-07-02 18:29:07"
"87598725077282816","Las once #reglas del #éxito de Bill Gates en Yale University. El único obstáculo para tu éxito eres tú mismo. http://ow.ly/5vOqx #coaching","juancbarcelo","ES",2,6,"no url","2011-07-03 19:08:58"
"87660743889125377","@momical What are you doing in Yale? :O","majeedalsh","EN",0,0,"no url","2011-07-03 23:15:24"
"87725434657193985","Univ privada no es lo mismo que univ con fines de lucro. Harvard, Yale, Stanford, NYU, Columbia, privadas. Sin fines de lucro","patricionavia","ES",5,105,"no url","2011-07-04 03:32:28"
"87782500352540672","I'm at Yale College (Wrexham) http://4sq.com/jZBZdZ","azzy2121","EN",0,0,"no url","2011-07-04 07:19:13"
"87947059692437504","dogg, arrice is going to Yale off a full boi..im so proud","__mylifeaskiz","EN",0,0,"no url","2011-07-04 18:13:07"
"88162814686007297","yale locksets http://lock-setsforyou.co.cc/yale_locksets.html #amazon #cheap #shopping #online #42","JamieMKimbrough","EN",0,0,"no url","2011-07-05 08:30:27"
"88208004117307392","What leads to success? “It was a privilege to serve as a doctor.”- Sherwin Nuland, professor of surgery, Yale #serve #quote","louiciano","EN",0,0,"no url","2011-07-05 11:30:01"
"88209249813012481","Started 4th of July weekend w family in NJ & ended it watching fireworks w friends in NYC. Perfect weekend. Yale Summer School begins today!","esperanzagarcia","EN",0,0,"no url","2011-07-05 11:34:58"
"88292691317751808","-Mook Starte EVERYTHING, But White and Yale aint Make it NO Better.lol.!","Drinks_onPhill","EN",0,0,"no url","2011-07-05 17:06:32"
"88304724763353089","Peter Eisenman and Anthony Vidler:  A Conversation in Yale School of Architecture http://t.co/1X4KIsd via @youtube","samuelxgarcia","EN",1,0,"no url","2011-07-05 17:54:21"
"88319213470621697","Famous Yale Study: 87% with NO goals, 10% with partial goals, 3% with Written Goals.  The 3% with WRITTEN GOALS earned 10X the rest!","PowerBizNow","EN",0,1,"no url","2011-07-05 18:51:56"
"88368989885038592","@oyboy Also: have you seen Fringe? They say ""HARVARD UNIVERSITY"" and show Yale. Over and over. So strange - I can't understand the decision.","bensaufley","EN",0,0,"no url","2011-07-05 22:09:43"
"88393436151033856","No Haven - Yale and its Anti-Semitism Institute by James Kirchick  http://j.mp/ncJLui","ZekeJMiller","EN",0,1,"no url","2011-07-05 23:46:52"
"88464963961749504","Yale Drama Study Group? Success-ish. Stimuli, the-yah-tah, cleavage, naked beaches, and not studying at all. #hellyeahyaleyeah","Uhsheel1515","EN",0,0,"no url","2011-07-06 04:31:05"
"88465173668569089","Apparently i have an uncle who is a cum laude at harvard and a student at yale. Sige, gora lang :))","diorellatan","EN",0,0,"no url","2011-07-06 04:31:55"
