"tweet_id","text","author","language","likes","retweets","media","timestamp"
"92311820198625280","Crítica de 'Cirkus Columbia' - Amigos y vecinos con denominación de origen balcánica. http://bit.ly/qugLPo","CINEMANIA_ES","ES",0,0,"no url","2011-07-16 19:17:07"
"92323660697837568","Try the Naked chardonnay out of Columbia Valley WA. (@ Le Reve Patisserie & Cafe) http://4sq.com/no2rB5","NeoCloudMarket","EN",0,0,"no url","2011-07-16 20:04:10"
"92334008062590976","good god!  either Columbia or Peru - I don't care which - needs to score in the next 10 mins, because I can't go through extra time","LovelyReba","EN",0,0,"no url","2011-07-16 20:45:17"
"92334976950996992","Ummmmmm #SO RT @LeshG: My name is Felicia La'Trice Green..I am from Columbia, SC and I like apples :)","Real_ISH_Talker","EN",0,0,"no url","2011-07-16 20:49:08"
"92338294658056192","I'm at Mitchell Point Overlook (Columbia River Hwy, Hood River) http://4sq.com/pf8UcY","robfigley","EN",0,0,"no url","2011-07-16 21:02:19"
"92338319811289088","#job Administrative Assistant - Columbia University - New York, NY http://bit.ly/rrAH4B","nycassistantjob","EN",0,0,"no url","2011-07-16 21:02:25"
"92339544539676672","GOAL! 1-0 to Peru after the Columbia keeper drops it! Hanging on time now...come on Peru!","dannybrothers","EN",0,0,"no url","2011-07-16 21:07:17"
"92355134784421888","Columbia Documents of Architecture and Theory:  http://amzn.to/jQu8NA","TigusaIgarizn","EN",0,0,"no url","2011-07-16 22:09:14"
"92358045610409984","traffic lights not working:MD 175 Dobbin Rd Columbia","northernmdrock","EN",0,0,"no url","2011-07-16 22:20:48"
"92358959968694272","#5: Columbia Men's Crested Butte Convertible Pant http://ff.im/I1fnW","dorajperkins","EN",0,0,"no url","2011-07-16 22:24:26"
"92372345792102400","This is your brain on Google: New research from Columbia on how search engines affect the way we remember http://bit.ly/qoHZXB","HBSmktg","EN",0,13,"no url","2011-07-16 23:17:38"
"92383182095253504","#costly Peru 2 Columbia 0: Falcao's penalty miss proves costly in quarter-final extra-time loss http://t.co/HQXGPGD","ERICKAopj","ES",0,0,"no url","2011-07-17 00:00:41"
"92390182392832000","90 guests spent a night in Cole County Jail, for the experience - Columbia Missourian http://ow.ly/1dQork","lhbandb","EN",0,0,"no url","2011-07-17 00:28:30"
"92428337959542784","#Volunteer for Immigrants and Refugees Organizations in #British Columbia, Canada - http://ow.ly/5EYyJ","CanadaVolunteer","EN",0,0,"no url","2011-07-17 03:00:07"
"92448256713433088","Nu... - #Columbia , SC (http://tinyurl.com/66r3brp) Get Nursing Home Administration Jobs #NursingHomeAdministration #jobs #job #GetAllJobs","GetNuHoAdmiJobs","EN",0,0,"no url","2011-07-17 04:19:16"
"92450995577159680","INVESTIGACIÓN EN LA UNIVERSIDAD DE COLUMBIA Buscadores en Internet afectan uso de memoria","Shaliaj","ES",0,0,"no url","2011-07-17 04:30:09"
"92469685408366592","Cross Country Ski Routes: British Columbia:  http://amzn.to/lG9xd7","TakSeaqf","EN",0,0,"no url","2011-07-17 05:44:25"
"92471971312435200","! Columbia Mens Hike Micro Tab,Grout, Charcoal, Intense Red,Medium http://t.co/mKDFyMR charcoal","Jessicaqh62","EN",0,0,"no url","2011-07-17 05:53:30"
"92490484974485504","$15 For $30 Worth Of Sperry, Sebago, Columbia And More Footwear From BoatShoes.com, Plus Free Shipping! http://goo.gl/O2KSX #deal","bezdeals","EN",0,0,"no url","2011-07-17 07:07:04"
"92534323823120385","SCE&G Home Energy Audit Could Save You Money | wltx.com: SCE&G Home Energy Audit Could Save You Money. Columbia,... http://bit.ly/q8RXXd","jljessielong","EN",0,0,"no url","2011-07-17 10:01:16"
"92547162591866880","#listeningto ""The Columbia Ballroom Orchestra, Ballroom Jive"" http://bit.ly/qie2JM","profumoazzurro","ES",0,0,"no url","2011-07-17 10:52:17"
"92551180747677696","#listeningto ""The Columbia Ballroom Orchestra, That's What Friends Are For"" http://bit.ly/obON63","profumoazzurro","EN",0,0,"no url","2011-07-17 11:08:15"
"92573037253230592","#inspiration Artistic inspiration in the Columbia River Basin - Oregonian http://bit.ly/qUWUix","InspiringBooks","EN",0,0,"no url","2011-07-17 12:35:06"
"92589831233863680","E-Book Revolution Upends Columbia Publishing Course - http://nyti.ms/nINsdv","rauspitz","EN",0,0,"no url","2011-07-17 13:41:50"
"92610584658448384","Network Intrusion Analyst (v) Job - Columbia United States  http://jobsurl.com/vpQg","ScienceCareer","EN",0,0,"no url","2011-07-17 15:04:18"
"92651441373708288","'Cash Cab' Taxi Hits, Kills Vancouver Pedestrian: VANCOUVER, British Columbia — A replica taxi used in the Cana... http://huff.to/qldN3v","mustbeVinnie","EN",0,0,"no url","2011-07-17 17:46:39"
"92680981844201473","SCE&G to store toxic waste in casks, not pools: By AP | July 17, 2011 COLUMBIA, SC (AP) — The company that runs ... http://bit.ly/r1Ghl2","_paulagreen","EN",0,0,"no url","2011-07-17 19:44:02"
"92683621734957056","Columbia sc we finally here.","cherokeedassxxx","EN",0,1,"no url","2011-07-17 19:54:32"
"92685767540879360","Columbia: NOW CASTING!!! JUL 14: Follow @qneverlena on @hoodstarzztv:  www.apparelism.org: 404-532-9232","whosgotnextadip","EN",0,0,"no url","2011-07-17 20:03:03"
"92694131012403200","Need Carpets Cleaned (Columbia, MD): I have 4 relatively small bedrooms, a small hallway, and a large basement c... http://bit.ly/oiJc6C","LiveBloggerJobs","EN",0,0,"no url","2011-07-17 20:36:17"
"92704805516099584","Ask.com News Search for &quot;car parts columbia sc&quot; http://bit.ly/n5An4u","RaceHorses","EN",0,0,"no url","2011-07-17 21:18:42"
"92722207670808576","Jason Isbell at the house in Columbia. Everybody come out, what else are you doing tonight? #jasonisbell","lendmeflight","EN",0,0,"no url","2011-07-17 22:27:51"
"92792927851528192","Vendo camisas Columbia. Tallas ""S"", ""M"" y ""L"", con facilidad de pago. Mangas Largas y Cortas. Todos los colores.","Andres_tang","ES",0,0,"no url","2011-07-18 03:08:52"
"92816529183342592","@RaquelGlay Flying back to Colorado from Columbia.  I wish I was in Texas I'd come see you guys.","Jeffarn0ld","EN",0,0,"no url","2011-07-18 04:42:39"
"92832241025167360","RT @LiveSports_News - #Kayaking Exploring British Columbia’s Sunshine Coast by kayak http://dlvr.it/bZ1v8","KayakingCove","EN",0,0,"no url","2011-07-18 05:45:05"
"92834761822830592","B.C. lumber exports to China soar - British Columbia - CBC News: http://t.co/yx2SeG6 via @AddThis","wavetop","EN",0,0,"no url","2011-07-18 05:55:06"
"92837018341621761","A friend that moved 2 Medellín, Columbia said that the cartels all moved to Mexico but murders there in 2009 were 2.5 times US's. Wikifacts","jokeinvadingmad","EN",0,0,"no url","2011-07-18 06:04:04"
"92839992107347968","[コロンビア] Columbia Men's Switchback 2 Omni-Tech:  http://amzn.to/j2Zbhf","InoriSawaieg","EN",0,0,"no url","2011-07-18 06:15:53"
"92846128386682880","Argentina Brazil Columbia & now Chile out. South American football poor at the moment. Cant see past Uruguay. Fingers crossed #CopaAmerica","DavidHanson11","EN",0,0,"no url","2011-07-18 06:40:16"
"92930740064489472","It could be my own personal ""Big Trouble in Little Columbia""...","ISEmanCometh","EN",0,0,"no url","2011-07-18 12:16:29"
"92957671703052289","Software Controls Engineer #Job opening in #Columbia SC http://t.co/fLEgMHf","KaneJobs","EN",0,0,"no url","2011-07-18 14:03:30"
"92959055831773185","It sucks just wondering through a city...But its nce to have Columbia staff just about everywhere to guide everyone","Call_Me_ZYOS","EN",0,0,"no url","2011-07-18 14:09:00"
"92969528983687168","Where you goin for coffee fuckin columbia ? Haha","Bullethed","EN",0,0,"no url","2011-07-18 14:50:37"
"92969759678808064","Rey go back out Columbia smh","WackyGuyDoe","EN",0,0,"no url","2011-07-18 14:51:32"
"92974553764069376","Safe travels to them all today as the @ASAUSASoftball #WNT spends Monday traveling from British Columbia to Oklahoma City!","LadyVol_Sftball","EN",0,0,"no url","2011-07-18 15:10:35"
"92993377833975808","'Cash Cab' taxi hits, kills Vancouver pedestrian: VANCOUVER, British Columbia -- A replica taxi used in the Cana... http://bit.ly/oC5vwz","reviewjournal","EN",0,3,"no url","2011-07-18 16:25:23"
"93002060034871296","1021 Eben Says -- My Publisher Bebe Davis Founder of 1021 says to give Mambo's Caribbean  Grill in Columbia SC a big shout out!","1021Online","EN",0,0,"no url","2011-07-18 16:59:53"
"93009144218529792","@UPursBtch o ok Columbia,SC","BossetCHICA","ES",0,0,"no url","2011-07-18 17:28:02"
"93012549959827456","@the_realization Columbia","cOuTuReDiVa","ES",0,0,"no url","2011-07-18 17:41:34"
"93014967380492289","States close Columbia chinook, sockeye seasons http://goo.gl/fb/HaAti by @ODFW","FishingMarvin","ES",0,1,"no url","2011-07-18 17:51:11"
"93026051453755393","I'm looking for work in Columbia, MO for fall. Would love to work early morning (6-11am) or evenings. Know of any openings? Kaldis ? @MPFZ","DOPEITSTOM","EN",0,0,"no url","2011-07-18 18:35:13"
"93029767586127872","making a pitstop at Columbia Mall, too bad I can no longer visit @bmcarr21 at the Apple store = /","__iBeezBri__","EN",0,0,"no url","2011-07-18 18:49:59"
"93030069601189888","Mortgage Broker | Mortgage Broker Association Of British Columbia http://dlvr.it/bfbDV","vanessef","EN",0,0,"no url","2011-07-18 18:51:11"
"93030417711644672","Thanks for the RT and support all the way from British Columbia, @KMS109!","WalktoDefeatALS","EN",0,0,"no url","2011-07-18 18:52:34"
"93031881506955264","MT @subsurface_life: Pictures & notes this week are from #PavilionLake & Kelly Lake in British Columbia - follow project at @PavilionLake!","DESeaGrant","EN",0,0,"no url","2011-07-18 18:58:23"
"93034351960399873","Columbia: NOW CASTING!!! JUL 14: Follow @ScrapBoyz on @hoodstarzztv:  www.sbepk.com: 404-532-9232","QEBdeApparelIsm","EN",0,0,"no url","2011-07-18 19:08:12"
"93048629362827264","@GODspriincess here meaning pf or columbia?","TyTheRuler","EN",0,0,"no url","2011-07-18 20:04:56"
"93048663894536192","Progress in Understanding the Genetic Basis of Alzheimer’s Disease. Richard Mayeux, M.D., M.Sc. Columbia University http://ow.ly/5GZzi","VeoMed","EN",0,1,"no url","2011-07-18 20:05:04"
"93058423087828993","Does your car have heated, cooled and reclining rear seats?  How about a back seat refrigerator? #luxury #columbia #sc http://t.co/2bopgSh","JHHyundai","EN",0,0,"no url","2011-07-18 20:43:51"
"93065846984941568","COLUMBIA, S.C. (AP) _ Church spokesman: Victim's family told no charges to be filed in fatal SC kiddie ride crash","MegKinnardAP","EN",0,0,"no url","2011-07-18 21:13:21"
"93090182353518592","The 4th Western Hemisphere Shorebird Group Meeting is meeting August 11-15, 2011, in Vancouver, British Columbia.... http://fb.me/17QAD6PkP","USFWSAlaska","EN",0,1,"no url","2011-07-18 22:50:03"
"93105432842878976","Physical Therapist at Genesis Healthcare (Columbia, SC): Genesis Rehabilitation Services is looking for remarkab...  http://bit.ly/mNZ2Be","PTJobsQ","EN",0,0,"no url","2011-07-18 23:50:39"
"93107462873423872","Congrats to Jazz coach Ty Corbin, who will be honored tomorrow by his hometown of Columbia, S.C. with a proclamation and key to the city.","saltcityhoops","EN",0,1,"no url","2011-07-18 23:58:43"
"93143496151662592","eBooks Are Changing Columbia's Publishing Courses - GalleyCat http://bit.ly/o6bpR2","Goodhut","EN",0,0,"no url","2011-07-19 02:21:54"
"93146750918995968","Can only be dead to me for so long, after 48 hours I start missing your sweetness. In Columbia real life grinding. @Shootaaa @MikeRuby56","tekkster88","EN",0,0,"no url","2011-07-19 02:34:50"
"93155806429720576","RT @Leha4: Wats good District of Columbia","WilkChamberlain","EN",0,0,"no url","2011-07-19 03:10:49"
"93201620812304384","SOUTH CAROLINA New Post - Col.... Read it now at http://www.justsouthcarolina.com/columbia-yard-sales-offer-great-deals-for-savvy-shoppers/","ussouthcarolina","EN",0,0,"no url","2011-07-19 06:12:52"
"93235846349725696","'Food desert' label highlights nutrition needs | The Columbia ...: Hunger has reached an all-time record in Colu... http://bit.ly/ob0T9j","Fit4years","EN",0,0,"no url","2011-07-19 08:28:52"
"93241374446600192","TAFL Jobs &gt; Arabic Linguist, Columbia University:   We are looking for a person who has a good knowledge of Stan... http://bit.ly/qrZaoM","e_arabic","EN",0,1,"no url","2011-07-19 08:50:50"
"93241584132427776","I'm wearing full #Columbia Sportwear! Bugproof spf30 pants, omni-dry spf50 Shirt, Omni-tech Ravenous shoe & RiverRunner Drybag. @whywerunn","MyRunningAddict","EN",0,0,"no url","2011-07-19 08:51:40"
"93252220912549888","Pauls Mobile RV: Located in Langley British Columbia Company buys and sells used RVs parts… http://goo.gl/fb/UWOZr","WebDyrOrg","EN",0,0,"no url","2011-07-19 09:33:56"
"93275155333267456","Democrat Party Voters in Columbia - SC: Online campaigns boost DEMOCRATS - http://ow.ly/5Hvg9","VoteDemocrats","EN",0,0,"no url","2011-07-19 11:05:04"
"93301592056545281","Columbia County Pennsylvania : Heat wave hits Valley - Danville News http://uxp.in/38937341","bvzanoga","EN",0,0,"no url","2011-07-19 12:50:07"
"93308315534241792","Check out this AMAZING place in Columbia Heights http://t.co/D8otFpy Something free or cheap to do everyday in the air conditioning!","ppqty","EN",0,0,"no url","2011-07-19 13:16:50"
"93326367822852097","@SupremeIrie yayyyyy um today at 4:30 in the potbelly's at columbia heights or whateva...imma call you when i get off to see where you are.","SpokenFever","EN",0,0,"no url","2011-07-19 14:28:34"
"93337780524032002","Review this CME/CE publication to improve schizophrenia patient outcomes. Sponsors: Columbia University & Med-IQ. http://t.co/66YwaKX","MedIQCME","EN",0,0,"no url","2011-07-19 15:13:55"
"93379950035468288","(Columbia Reg'l Business Report) Man sentenced in mortgage fraud case - http://t.co/a1f2sKu","SCATJ","EN",0,0,"no url","2011-07-19 18:01:29"
"93410629355978752","The province of British Columbia became the first provincial government in Canada to launch an open data portal http://t.co/6p6i5Wv","iassistdata","EN",0,3,"no url","2011-07-19 20:03:24"
"93415903596773376","@DaveMPhoto @julie_hunter yea, been following the bs since the Columbia faze","jpskydawg","EN",0,0,"no url","2011-07-19 20:24:21"
"93425206563049472","http://ping.fm/sNF8W Terrorism Top Topic In India Columbia Daily Tribune","madxnewscom","EN",0,0,"no url","2011-07-19 21:01:19"
"93427031013990400","New Columbia Univ study suggests we're dumber in the Google age.  I thought it made me smarter. #depressing  http://t.co/8sxTkyS","thedancho","EN",0,2,"no url","2011-07-19 21:08:34"
"93428272595075072","Columbia Men Utilizer Zip Short Sleeve Shirt Tall Sizes aj7096: The Columbia Men Utilizer Shirt will keep you pr... http://bit.ly/qmPtg0","TanishaWolf","EN",0,0,"no url","2011-07-19 21:13:30"
"93455132917903360","New shows announced in Tampa, FL - West Columbia, SC - Carrboro, NC http://artistdata.com/a/pa","fangisland","EN",0,1,"no url","2011-07-19 23:00:14"
"93460438729232384","I freaking love this. Someone needs to make one of these in Columbia: Fast Lane - The Slide http://t.co/3fhtEwl","maya_szydlowski","EN",0,0,"no url","2011-07-19 23:21:19"
"93461181116854272","'Lead foot' saves driver in crash with train - British Columbia - CBC News: http://t.co/Emu3sKv via @AddThis","dirtygreydog","EN",0,0,"no url","2011-07-19 23:24:16"
"93462955332603905","I'm at V Nail Salon (1452 Park Road NW, 14th, District of Columbia) http://4sq.com/phIwKn","caplady1225","EN",0,0,"no url","2011-07-19 23:31:19"
"93486309179535362","Update / MPD reports the road closure at 1400 Columbia RD NW and 1500 Harvard ST NW has now reopened: Update / M... http://bit.ly/r8ZPB6","CapitalAlert","EN",0,0,"no url","2011-07-20 01:04:07"
"93511919637495809","Just finished up with grad school for the summer. Hello free time! #Columbia","bradgroznik","EN",0,0,"no url","2011-07-20 02:45:53"
"93519523893886976","Traffic estimates on Columbia River Crossing further muddy the financial picture http://bit.ly/pJG3G9","OregonianEnviro","EN",0,0,"no url","2011-07-20 03:16:06"
"93526566130294784","One of ""Columbia Five"" Pleads Guilty, Will Be Sentenced to Six Months (http://bit.ly/paxFQI)","ivygate","EN",0,2,"no url","2011-07-20 03:44:05"
"93536896713637888","Bay and Bay Transfer: Driver Program #Job (Columbia, MO) http://t.linkup.com/4dde508","jobsonlinkupMO","EN",0,0,"no url","2011-07-20 04:25:08"
"93562549055922176","Columbia Pictures | The Girl With The Dragon Tattoo (Sony) Watch Online Free (see Description … http://dlvr.it/brDR5","superstarpc","EN",0,0,"no url","2011-07-20 06:07:04"
"93567263466192896","RT @djblord: Columbia catch me spinnin @ Pretty Girl Thursdays @ Moda Lounge ...starts July 28th @thisisflee http://lockerz.com/s/121881668","thisisflee","EN",0,1,"no url","2011-07-20 06:25:48"
"93577980936327168","Columbia Student Admits Selling Cocaine on Campus http://nyti.ms/rcJgcN","nytimes","EN",12,63,"no url","2011-07-20 07:08:23"
"93634242285805568","I'm at Columbia Terrace Park (harristown road, Fair Lawn) http://4sq.com/p2DSmG","Jerkratt","EN",0,0,"no url","2011-07-20 10:51:57"
"93666924310962176","NY Times article about a rain garden at Columbia University.  Mentions Permaloc!  http://nyti.ms/rjPZI9","PermalocEdging","EN",0,0,"no url","2011-07-20 13:01:49"
"93672045551960064","Best Thing I Never Had Artist: _Beyonc�_ Label: Columbia Album: 4 Source: http://www.mtv.com/overdrive/?artist=123... http://dlvr.it/btvwz","BeyonceDances","EN",0,0,"no url","2011-07-20 13:22:10"
"93679331066392577","glad u liked #gwu! let us know if we can help! MT @4evafaithful94: I visited Columbia & NYU & liked them but I'm still in love with GW","GWToday","EN",0,1,"no url","2011-07-20 13:51:07"
"93695189713031168","I'm at Columbia University.. This is what it feels like to be in an ivy league school..","marauderMPP","EN",0,0,"no url","2011-07-20 14:54:08"
"93698763146801153","Columbia President Lee Bollinger on, talking about news market. Proposing a worldwide US gov't broadcasting program. http://wny.cc/qVEwbV","BrianLehrer","EN",1,6,"no url","2011-07-20 15:08:20"
"93705142813212672","Help. Typing Columbis for both Columbus and Columbia. #losingmymind","smorris198888","EN",0,0,"no url","2011-07-20 15:33:41"
"93709983031623680","@ForiAmSirSuave should hit up sushi sono with us..By columbia mall around 7","AyeKil","EN",0,0,"no url","2011-07-20 15:52:55"
"93733225217798144","Only 2 days left to vote for @FreeTimes Best of Columbia! We humbly suggest Bone-In for Best BBQ, but we're biased. http://svy.mk/kpxbNw","artisanbbqtruck","EN",1,4,"no url","2011-07-20 17:25:17"
"93734809117016064","""Beautiful ring; color has more green tones than the bluish-teal that is pictured"" - Paula from Columbia, South Carolina","Lulaport","EN",0,0,"no url","2011-07-20 17:31:34"
"93734947533242370","@MadyFernandez a teacher that used to be at silver trail. She was a college swimmer at Columbia, and wants to coach us lol","Kevin_Marcus","EN",0,0,"no url","2011-07-20 17:32:07"
"93743487144570880","Columbia-St. Mary's: RN Resource Team 036120 - Job #: 855306 -Milwaukee, WI #jobs http://bit.ly/oIFZwD","MKEhealthcare","EN",0,0,"no url","2011-07-20 18:06:03"
"93744430846197760","@YourDaddyAbby Truee. What Time Ya'll Going? Cause My Mom Is Gonna Drop Me And My Cousin At Columbia.","TooShortKarene","EN",0,0,"no url","2011-07-20 18:09:48"
"93755247977185280","Use of Kelowna Mortgage Brokers Increasing In Popularity: With a booming real estate economy in British Columbia... http://bit.ly/o0xQkk","freePRnow","EN",0,0,"no url","2011-07-20 18:52:47"
"93756405605072896","Northern Freegold Closes First Tranche of Financing for $6 Million:     VANCOUVER, BRITISH COLUMBIA--(M... http://mwne.ws/oFtWlL","ryanmatteraus","EN",0,0,"no url","2011-07-20 18:57:23"
"93761728185249792","Merlin Media hires updated @AllAccess. More Columbia alums mentioned! http://t.co/jQTATZg","RadioDeptCCC","EN",0,0,"no url","2011-07-20 19:18:32"
"93764752274231296","First Mexican Gold Corp. Closes Private Placement:   VANCOUVER, BRITISH COLUMBIA--(Marketwire - July 20, ... http://mwne.ws/r94nDF","matteraryan","EN",0,0,"no url","2011-07-20 19:30:33"
"93766643896950785","Former Cop Seeks Out Marijuana Grows For Landlords: ​​​A former Canadian Mountie in British Columbia... http://wevape.it/nzdKpZ #Marijuana","Vaporfection","EN",0,0,"no url","2011-07-20 19:38:04"
"93772725646135297","Columbia College men’s basketball team adds four: Columbia College men’s basketball coach Bob Burchard announced... http://dlvr.it/bx5c7","ColumbiaMOBuzz","EN",0,0,"no url","2011-07-20 20:02:14"
"93773052789260288","[http://enFemme.TV] Transgender Person Fatally Shot in NE: District of Columbia Mayor Vincent Gray ... http://bit.ly/oKfsye #transgender","ENFEMMEdotTV","EN",0,0,"no url","2011-07-20 20:03:32"
"93780669662109697","I'm at KMIZ-TV (501 Business Loop 70 E, Columbia) http://4sq.com/oPMIdn","SamSchwartzman","EN",0,0,"no url","2011-07-20 20:33:48"
"93784859738247168","Columbia teen heads to Boys Nation http://dlvr.it/bxJ0T","ColumbiaMO_Buzz","EN",0,0,"no url","2011-07-20 20:50:27"
"93789330866311168","It's just a jump to the left...ROCKY HORROR PICTURE SHOW COLUMBIA FIGURE - #eBay - http://bit.ly/r9puNF","sandystreasures","EN",0,0,"no url","2011-07-20 21:08:13"
"93792854106845185","$7 for Gator Burgers at Albert's Grill in Columbia Heights: http://j.mp/mVfH8y - The deal is ON!","MinnFoodBuzz","EN",0,0,"no url","2011-07-20 21:22:13"
"93800097657257985","I wuda been GUH goin to columbia hgts for a radio shack when there's one down gallery. Smh","Alaija_1123","EN",0,0,"no url","2011-07-20 21:51:00"
"93803289530990592","@IncubusBand Dreaming big for me is actually small! You would be amazing @the_blue_note in Columbia, MO! You'd love it. #incubustour","erholtzclaw","EN",0,0,"no url","2011-07-20 22:03:41"
"93809098629459968","hey anyone in Columbia go get Invincible Iron Man 506 for me lol","nightmareballa1","EN",0,0,"no url","2011-07-20 22:26:46"
"93811178995843072","How to Develop a Multidisciplinary Wound Care Center. T Treadwell MD FACS...vanced Wound Care, AL. Columbia Vascular Conf http://ow.ly/5JcDq","VeoMed","EN",0,0,"no url","2011-07-20 22:35:02"
"93814396052185088","I'm at Wilson's Fitness (2902 Forum Blvd, Columbia) w/ 4 others http://4sq.com/n9mDdT","saraneitzert","EN",0,0,"no url","2011-07-20 22:47:49"
"93818468733956096","RT @OKnox: Quite the Columbia reunion tomorrow as @BarackObama meets with NAACP chief Ben Jealous...","PrimeTimeCF","EN",0,1,"no url","2011-07-20 23:04:00"
"93832515428691968","It's crazy hot here this summer so lets look to somewhere cooler, how about Victoria, British Columbia?  It's 59... http://fb.me/CrxJiS7Z","TravelLeadersTX","EN",0,0,"no url","2011-07-20 23:59:49"
"93832632873398272","Columbia, SC: DHEC issues Ground Level Ozone Alert for 7/21. Learn more: http://bit.ly/lk7lqe. Please RT.","mpbaldauf","EN",0,0,"no url","2011-07-21 00:00:17"
"93833263939985408","On this day (July 20th) in 1965, Bob Dylan's single ""Like A Rolling Stone"" was released by Columbia Records.","BobDylan_News","EN",2,28,"no url","2011-07-21 00:02:48"
"93852908143120384","Need to head up to Columbia soon tho.....","DJFamousDeVille","EN",0,0,"no url","2011-07-21 01:20:51"
"93864157253877760","I got offers from UT yale stanford harvard rice tcu columbia and cornell...how the fuck did i end up at unt??","HimOva__There","EN",0,0,"no url","2011-07-21 02:05:33"
"93877753195139073","Polo Boots And A Columbia? #its2hot4that","LILG_ej","EN",0,0,"no url","2011-07-21 02:59:35"
"93916179210584065","Accounts Payable Clerk: Location: Vancouver, British Columbia, CANADA             ... http://bit.ly/nysoQK #jobs","Vancouver_FIN","EN",0,0,"no url","2011-07-21 05:32:16"
"93957886950117376","STS-135 UPDATE: Atlantis is now on her victory lap of the Earth. Challenger and Columbia are applauding from the heavens #STS135","NASASpaceflight","EN",9,57,"no url","2011-07-21 08:18:00"
"93967110665023488","RT @adry_ara: Ayer vi Cirkus Columbia en los @CinesRenoir , altamente recomendable.","wandafilms","ES",0,0,"no url","2011-07-21 08:54:39"
"93989592121884672","30+ yrs of spaceflight ends w/ @NASA Atlantis' touchdown rem 1st launch of Columbia like yesterday as a HS frosh & test of Enterprise in '77","RedsRocker","EN",0,0,"no url","2011-07-21 10:23:59"
"93995569021845504","Oooo what to do on this car ride!!! Here I come Columbia","JordonMarsh","EN",0,0,"no url","2011-07-21 10:47:44"
"94008877540061184","RT @SAPCareers SAP: Consultant III, Customer Support (  , British Columbia) http://bit.ly/mUdIGo #sap #sapjobs #IT #Jobs #Job #TweetMyJOBS","vancouver_rt","EN",0,0,"no url","2011-07-21 11:40:37"
"94029572219224066","100•F today in Columbia, SC... Toasty","johnamiahford","EN",0,0,"no url","2011-07-21 13:02:51"
"94030868280127489","@kayrachellero I'm jp. She didn't respond to my text n she was up n Columbia. But I talked to her now:)","_Chi_Cha_","EN",0,0,"no url","2011-07-21 13:08:00"
"94046240085512192","In the Northeast, they call it a heat wave.  In Columbia, they call it Thursday.","GamecockRadio","EN",1,50,"no url","2011-07-21 14:09:05"
"94047947473432576","New Record: Hot Chocolate - Mary, Anne / Ruth [Columbia] [1972] http://bit.ly/q7uKJQ","45cat","EN",0,0,"no url","2011-07-21 14:15:52"
"94053316195127296","The Shalom Christian Academy and Daycare of Columbia, Missouri is currently holding a carwash fundraiser in order... http://fb.me/17KAlBXAR","MilMGMT","EN",0,0,"no url","2011-07-21 14:37:12"
"94058340946153473","[コロンビア] Columbia Men's Master Of Faster Low Omni-Tech  BM3665 010 (010(Black)/7.5):  http://amzn.to/mkhi1T","BourdArutinx","EN",0,0,"no url","2011-07-21 14:57:10"
