"tweet_id","text","author","language","likes","retweets","media","timestamp"
"107849787130384384","mr. wonton on berkeley and 7th ave in #parkslope = open.","NineDaves","EN",0,2,"no url","2011-08-28 16:19:27"
"107893818921201664","Man I wish church was closer by da time I get to berkeley it's gonna be over","RemyDaBarber","EN",0,0,"no url","2011-08-28 19:14:25"
"107922503774642179","I hate that Directv is so rare here in Berkeley.","JonathanDeniol","EN",0,0,"no url","2011-08-28 21:08:24"
"107948449751764993","I checked in at Berkeley Aquatic Park (80 Bolivar Dr) on #Yelp http://t.co/xRkw5TC","sfted","EN",0,0,"no url","2011-08-28 22:51:30"
"107982603944067072","@Mbwana @google @mbwanaphoto yes the #photowalk in Berkeley can b found at &gt; http://t.co/tCmipIv &lt; already 73 people attending..!","samdownie","EN",0,0,"no url","2011-08-29 01:07:13"
"107991009333493761","Hwy 80 in Berkeley on Sunday summer evening = coming back from everywhere traffic!! http://t.co/xZU4BGm","NDcarTwit","EN",0,0,"no url","2011-08-29 01:40:37"
"108020373664186368","“@lunapaulina: Berkeley http://t.co/pYpvE9o”// tu muy bien Pau! Saludos! Espero andes excelente!","ferzelaznog","ES",0,0,"no url","2011-08-29 03:37:18"
"108048349659271168","@4ever_Classics Nice choice! With full DVR of #TCM #Summerunderthestars I was happily catching up on Busby Berkeley  What were you watching?","HollywoodLegacy","EN",0,0,"no url","2011-08-29 05:28:28"
"108063705043963904","RT @srbijadanas: UC Berkeley researchers find brightest, closest supernova in years - The Daily Californian - http://t.co/VUiiWUS","cinnamonshelper","EN",0,0,"no url","2011-08-29 06:29:29"
"108199290077323264","Data Structures | Berkeley Video Course http://t.co/qYY9vrD via @academicearth","alimoeX","ES",0,0,"no url","2011-08-29 15:28:15"
"108229455520071680","It's probably just a  layover until they move to Berkeley. RT “@markos: CNN says the Gaddafis are in Algeria.”","SamValley","EN",0,0,"no url","2011-08-29 17:28:07"
"108243816816975872","Brain Waves | www.louis-ttonantigua.tk: Posted in louis-vuitton-antigua | Tagged Ballerina, Berkeley Researchers... http://t.co/2oM49fg","badgermedicine","EN",0,0,"no url","2011-08-29 18:25:11"
"108267153920245760","~PRIMUS @Greek Theatre in Berkeley coming soon~ EXCLUSIVE: Primus Return With 1st New Song | SPIN.com http://t.co/0WC2pUY via @SPINmagazine","Smilodonna","EN",0,0,"no url","2011-08-29 19:57:55"
"108272614904037376","Had a great burger and some beers @TripleRockBeer in Berkeley. Highly recommend the Puddy Porter! #craft","JustinFlagg","EN",0,0,"no url","2011-08-29 20:19:37"
"108273785144225792","Downloads Dealing: Or the Berkeley-to-Boston Forty-Brick Lost-Bag Blues Movies: Dealing: Or the Berkeley-to-Bost... http://t.co/p4g2Syk","ditiduet","EN",0,0,"no url","2011-08-29 20:24:16"
"108306764927217665","#taxi SF police: Taxi driver from Berkeley attacks fellow cabbie with tire iron: SAN FRANCISCO (BCN) A taxi driv... http://t.co/UZvmOSe","taxinieuws","EN",0,0,"no url","2011-08-29 22:35:19"
"108323101766467584","Are you a Berkeley College Athlete, and if so what sport do you play?  Or if you are a Berkeley sports fan…what is your favorite sport?","BerkeleyCollege","EN",0,0,"no url","2011-08-29 23:40:14"
"108349815271862272","$10 for Nepalese & Indian Fare at Taste of the Himalayas in Berkeley: http://j.mp/ngnqjc (this Groupon has already sold 771)","SanFranFoodBuzz","EN",0,0,"no url","2011-08-30 01:26:23"
"108402621546631169","State Bar gives rave review to nominee Goodwin Liu: Goodwin Liu, the UC Berkeley law professor nominated to the ... http://t.co/cjBXxh4","legallawwatch","EN",0,0,"no url","2011-08-30 04:56:13"
"108465766822715392","Berkeley students, wanna free CREAM Ice Cream Sandwich?  Um... YES!  Download @ntro and go to Cream today from 12-6pm. http://t.co/03MveYr","ntro","EN",0,0,"https://pbs.twimg.com/media/AYFZCk4CIAAbAeg.png","2011-08-30 09:07:11"
"108521148391751681","Life Inc.: A piece of France in the Berkeley Hills: Life Inc.: Situated 30 minutes from San Francisco, blue shut... http://t.co/LH1Ilw1","FtWayne_Realtor","EN",0,0,"no url","2011-08-30 12:47:12"
"108536105279823873","#Davis left some philosopher named Berkeley off of his list. Shit, what are we gonna do?","thephildennis","EN",0,0,"no url","2011-08-30 13:46:38"
"108593680507604992","#Berkeley man arrested Saturday after high-speed chase in #Vallejo http://t.co/5Y6cIJf","dailycal","EN",0,0,"no url","2011-08-30 17:35:25"
"108596394201325568","I'm at Longwoods.com (54 Berkeley Street, Toronto) [pic]: http://t.co/GogTLkH","carlosrizo","EN",0,0,"no url","2011-08-30 17:46:12"
"108609002295934976","I'm at Barn Owl (Berkeley way, warndon, worcester) http://t.co/dnyvkVz","halfwelshbeast","EN",0,0,"no url","2011-08-30 18:36:18"
"108621759909068800","@AceKayo This Sunday! #EarnYourStripes IV free cypher @ Adidas Berkeley! Info: http://t.co/lAJGepw http://t.co/rdIgz1P","EmDubious","EN",0,1,"no url","2011-08-30 19:27:00"
"108629755695349762","A few days late to the news, but we are glad that Birdland Jazz and BBQ has found a new home in Berkeley! http://t.co/LW2zixS","JHCMediaCenter","EN",0,0,"no url","2011-08-30 19:58:46"
"108675335222071296","Thawing of prison isolation policy a positive sign « The Berkeley Blog http://t.co/6jwzBVy","solitarywatch","EN",1,4,"no url","2011-08-30 22:59:53"
"108708277268918272","Wow.  Little C is in a class being taught by Michael Pollan, with Alice Waters alongside.  Gotta love UC Berkeley!!","eileenoff","EN",0,0,"no url","2011-08-31 01:10:47"
"108793627173597185","Berkeley #TopOfTheWorld","MomarThaBoy","EN",0,0,"no url","2011-08-31 06:49:56"
"108794281459851264","@kentnichols wish u were in Berkeley. CAL archery is big time. Lmk when u come up north if u want to shoot or I can get u a place on socal","jennselke","EN",0,0,"no url","2011-08-31 06:52:32"
"108867090416549890","Berkeley Electric Cooperative to offer loans for energy saving: Berkeley Electric Cooperative has announced a ne... http://t.co/LKIWjRq","sylviaelane","EN",0,0,"no url","2011-08-31 11:41:51"
"108915404600115202","@TheReal_AlexG I Found My Mans That Look Like Chop That Went to Berkeley","DJWAHBUBBLE","EN",0,1,"no url","2011-08-31 14:53:50"
"108921494733729793","Boston plan fail...resort to chicken wing...lol... (@ Berkeley Corner w/ 2 others) http://t.co/1WKAdiX","JeffKYL","EN",0,0,"no url","2011-08-31 15:18:02"
"108944806666960896","@mrfb somewhere up Berkeley's asshole, no doubt","Drakonskyr","EN",0,0,"no url","2011-08-31 16:50:40"
"108960250085916672","In Berkeley next Thursday? We are hosting an event to show off the new Tesla 4-door Sedan, want to come? http://t.co/BQYGCAJ","tshelton","EN",0,0,"no url","2011-08-31 17:52:02"
"108989480190480384","Former UC Berkeley football player arrested, accused of pimping http://t.co/ahgHdt8","JimKlapthor","EN",0,0,"no url","2011-08-31 19:48:11"
"109007209530269697","Rental home investment: Lender-owned home in Avondale: 11217 W Berkeley Road, Avondale, AZ 85323 http://t.co/0vvNF0m","PhoenixBargains","EN",0,0,"no url","2011-08-31 20:58:38"
"109018508989431808","ah, Berkeley: hippie lady smoking weed and walking her platter-sized tortoise (slowly) in the park today. Only in Berkeley.","JedRooty","EN",0,0,"no url","2011-08-31 21:43:32"
"109026364891471872","@wartonchan throttling. I got more than that at Berkeley.","yokuyuki","EN",0,0,"no url","2011-08-31 22:14:45"
"109037895041560576","Berkeley: where you can both sweat and freeze in the same day.","msdeannawagner","EN",0,2,"no url","2011-08-31 23:00:34"
"109041974958505984","UC Berkeley law professor Goodwin Liu has been confirmed to the California Supreme Court.","KCBSNews","EN",1,15,"no url","2011-08-31 23:16:47"
"109159655695065088","RT @serenaraeeee @EazyTaughtMee It's Berkeley. And I go to Laney college young sir - and im jusst know finding this out -___- ? lol","EazyTaughtMee","EN",0,0,"no url","2011-09-01 07:04:24"
"109306921886031872","I'm at Orange County Superior Court North Justice Center (1275 N Berkeley Ave., W Valley View Dr., Fullerton) http://t.co/GubiSBc","OCCriminalLaw","EN",0,0,"no url","2011-09-01 16:49:35"
"109319186026729472","The new Apple store on 4th street in #Berkeley reveals $AAPL's attention to detail: http://t.co/JcuY8ed","HuangV","EN",0,0,"no url","2011-09-01 17:38:19"
"109324772852252673","Free Admission. All Day at Berkeley Art Museum. #SpecialsBRK http://t.co/j805d74","SpecialsBRK","EN",0,0,"no url","2011-09-01 18:00:31"
"109361351369043968","berkeley, ca is apparently america's hot spot for couples who don't look like they belong together","murphymacdo","EN",0,0,"no url","2011-09-01 20:25:52"
"109376773854208000","I always love discovering new and awesome places to eat in Berkeley!","marissavessels","EN",0,0,"no url","2011-09-01 21:27:09"
"109382855595008000","UC Berkeley prof. confirmed to Calif. high court http://t.co/tPKeu6y just cant wait 4 #Socialist #UnConstitutional rulings","mathewsjw","EN",0,0,"no url","2011-09-01 21:51:19"
"109440682426499072","@yayayarndiva I actually love the work of the Berkeley Media Studies group, and totally see the importance in framing.  :)","TheLactivista","EN",0,0,"no url","2011-09-02 01:41:06"
"109453953242107905","#Beijing Danville driver charged with killing Walnut Creek cyclist flees to China – Berkeley Voice http://t.co/SubIwE9","beijinginformer","EN",0,0,"no url","2011-09-02 02:33:50"
"109471380554268672","Berkeley man makes a (really rather nice) dumpster home | The San Francisco Local - Yahoo! News http://t.co/EcahUgG via @YahooNews","Lacylicious_1","EN",0,0,"no url","2011-09-02 03:43:05"
"109475226714259457","Berkeley's mayor is betting on the Cal Bears http://t.co/HjZL635","4sportsbetting","EN",0,0,"no url","2011-09-02 03:58:22"
"109475675508969472","Berkeley law profs issue guidelines on formation of Accountable Care Orgs under new health care law. http://t.co/5rc3veP","BerkeleyLawNews","EN",0,0,"no url","2011-09-02 04:00:09"
"109479026762059776","Liberal Professor Confirmed to Calif. Supreme Court: A U.C. Berkeley law professor whom many c... http://t.co/ATtXDvF #news #christians","PrayerMinistry","EN",0,0,"no url","2011-09-02 04:13:28"
"109482315121557504","San Leandro, Berkeley set to launch new football rivalry: By Jimmy Durkin The first step in a potentially good f... http://t.co/ZimylU2","ashleyduran","EN",0,0,"no url","2011-09-02 04:26:32"
"109522391700484096","The KBT's f...baby XD RT @bigbanghaven: G-Dragon and Berkeley mid for North Face  http://t.co/Yy3001w","Jiyonglikesme","EN",0,0,"no url","2011-09-02 07:05:47"
"109611038302937088","#jobs CA - Communications Coordinator - Golden Gate Audubon Society -  Berkeley, CA http://t.co/0GbPfIj","Jobs_Berkeley","ES",0,0,"no url","2011-09-02 12:58:02"
"109642248127381505","AND: Billy Preston, Terry Bradshaw, Christa McAuliffe, Nate Archibald, Mark Harmon, Jimmy Connors, John Zorn, John Berkeley #Sept2","kia_who","EN",0,0,"no url","2011-09-02 15:02:03"
"109716310962864128","RT @pollymcdaniel: Travel writer calls Asheville the 'Berkeley of the Blue Ridge.' http://t.co/KzqUDpi #avlnews #Asheville","fobes","EN",0,1,"no url","2011-09-02 19:56:21"
"109719775617368064","When a UC-Berkeley student and a professor meet in court.....: A bizarre showdown between well-known i... http://t.co/EXXDIX5 #tcot #p2","MaosFemaCamp","EN",0,0,"no url","2011-09-02 20:10:07"
"109734816404090880","Join Bauman College the evening of September 6th in Berkeley for a FREE lecture on Healing Foods for Mood. There... http://t.co/AfZ15TM","BaumanCollege","EN",0,0,"no url","2011-09-02 21:09:53"
"109764944089726976","Ok.. got my fitness on All week. I'm already super dark! So I guess just ""L""! Whhoooo!! Kips in Berkeley tonight! #GTL #sorryformetrorockin","DjMetroRock","EN",0,0,"no url","2011-09-02 23:09:36"
"109807899764723712","It's easy to see a supernova this weekend using binoculars in your own back yard. Berkeley labs video: http://t.co/psUkCW3","ebertchicago","EN",63,112,"no url","2011-09-03 02:00:18"
"109811559588573184","I hate the mail service in Berkeley. How can the mailmen at home be so much more competent when it's the same services/companies. wtf.","xSoupyTwist","EN",0,0,"no url","2011-09-03 02:14:50"
"109828433252589568","Two approaches for using nanowires, including core–shell ...: Sol Voltaics and a group at the Berkeley National ... http://t.co/8LnzV9r","dmsolar","EN",0,0,"no url","2011-09-03 03:21:53"
"109855050335141888","Follow @effdupagaiNC on Twitter. It is a delightful Southern spinoff of a Berkeley favorite!","mikegon","EN",0,0,"no url","2011-09-03 05:07:39"
"109883273777393664","Hungry for better food at Berkeley's Echo Lake Camp: Which brings to mind bad camp food. Specifically, the truly... http://t.co/URhnir6","beccarter28","EN",0,0,"no url","2011-09-03 06:59:48"
"109897802850635776","A UC Berkeley study has found that playing #videogames could be used to treat adults with lazy eye. #vgames #health #tech http://ow.ly/6kuaq","AntaReportNews","EN",0,0,"no url","2011-09-03 07:57:32"
"109908615783133184","Tree sitter in Berkeley's People's Park defies order to climb down http://t.co/VFREbX4","tessjohnwater","EN",0,0,"no url","2011-09-03 08:40:30"
"109994536108965888","Study: Video games may improve eyesight for adults with lazy eye: A small UC Berkeley study has found that playi... http://t.co/sVoKU3Y","walker__boh","EN",0,0,"no url","2011-09-03 14:21:55"
"110052774003228672","@USAMarch4JOBS @BarackObama @Music #WorldOneMusicFestival October 5 in Berkeley, California #SWAG #YES #Telegraph #Shattuck #Piedmont","BerkeleyMusik","EN",0,0,"no url","2011-09-03 18:13:20"
"110125352252211200","I'm at Philz Coffee (1600 Shattuck Ave., at Cedar St., Berkeley) w/ 2 others http://t.co/miwb5rc","downforwhatevz","EN",0,0,"no url","2011-09-03 23:01:44"
"110207971623051264","Intel Labs: Intel Science and Technology Center at UC Berkeley http://t.co/2ylMI85","TOpSEssIOn","EN",0,0,"no url","2011-09-04 04:30:02"
"110222708947681280","@blakeshelton we use the song ""god gave me you"" to remember Sara Symons. please help us get this a TT #SaraForHomecomingQueen2011","Anna_Berkeley","EN",0,13,"no url","2011-09-04 05:28:36"
"110247121294327808","Only in Berkeley: today car slams on breaks & hits bicyclist who rolls off hood unhurt, driver jumps out and both hug in intersection.","Stima_Systems","EN",0,1,"no url","2011-09-04 07:05:36"
"110324766245789696","claire b.'s Review of Kabana Restaurant - Berkeley (5/5) on Yelp: Perfect for what it is! A… http://t.co/sanNlZF","groupbuyon","EN",0,0,"no url","2011-09-04 12:14:08"
"110378914702041088","SF police: Taxi driver from Berkeley attacks fellow cabbie with tire iron http://t.co/C0kW0Rf taxi ;P","NikkiVy2078","EN",0,0,"no url","2011-09-04 15:49:18"
"110439063353425920","Today is the day!!! Come through to the Adidas ""Earn Your Stripes"" Cypher!! Get 30% off! 4-8pm! 2333 Telegraph Berkeley,CA","EarnYourz","EN",0,3,"no url","2011-09-04 19:48:19"
"110446140998168576","You ate Lunch now GO TODAY at 3PM http://t.co/fl8ACLE GLASSES MALONE Will be in the Bay Area TODAY ONLY at RASPUTIN'S in BERKELEY @GMALONE","Legendgary","EN",0,0,"no url","2011-09-04 20:16:26"
"110468433711345664","EDUCATION &gt; USA &gt; UC Berkeley extension building proposed to become LGBT-friendly senior housing http://t.co/LsT8p6V","LGTBNews","EN",0,1,"no url","2011-09-04 21:45:01"
"110477799587975168","UC Berkeley Professor Liu Confirmed To California Supreme Court ...","53qtakin","EN",0,0,"no url","2011-09-04 22:22:14"
"110477984154140672","Johns Hopkins, Northwestern, Cal Berkeley and UVA will be at the Providence Marriott on Tuesday, September 13 at 7:30 pm","NSGuidance","EN",1,0,"no url","2011-09-04 22:22:58"
"110492785865535489","Paving Stone 1  @ Berkeley Repertory Theatre http://t.co/jgf9INb","Kobaltblu13","EN",0,0,"no url","2011-09-04 23:21:47"
"110569013121261569","TIL William Hung (the American Idol reject) dropped out of a civil engineering program at UC Berkeley to  #todayilearned http://j.mp/oPm6fN","vrokreddit2","EN",0,0,"no url","2011-09-05 04:24:41"
"110624713495154688","@TheTrophyBox @nathangielis @ckJonesy @berkeley_eagle Wow didn't pick the Zorb thing up, especially after he spoke to us yesterday surprised","MarkTramby","EN",0,0,"no url","2011-09-05 08:06:01"
"110685837074776065","Private Investigator Oakland band PopLyfe is living the dream on 'America's Got Talent' - Berkeley Voic... http://t.co/nSSwjCU #oakland","OaklandPI","EN",0,0,"no url","2011-09-05 12:08:54"
"110767877665193984","Upmarket Berkeley bucks the property trend http://t.co/f2dNklS","guardiannews","EN",0,0,"no url","2011-09-05 17:34:54"
"110826488873500672","Berkeley Taxi Service in Albany CA|Find Taxis in Kensington, Piedmont http://t.co/V9mnm1t","alpha4travel","EN",0,0,"no url","2011-09-05 21:27:48"
"110837616366190592","RT @Anna_Berkeley: Yall we got Sara and her story out on the news! Great tweets #wedidamazing #SaraForHomecomingQueen2011","DoubleD143","EN",0,0,"no url","2011-09-05 22:12:01"
"110865269425061888","Cal Berkeley Kelly Ng Volleyball « Bar-K Investors: Gear you can't live without: Da Gold volleyball by Molten. I... http://t.co/nI5TqOX","voleybalqueen","EN",0,0,"no url","2011-09-06 00:01:54"
"110902548218642436","RT @biz: Why I'm advising at UC Berkeley Haas http://t.co/rraIPWG #cal #twitter","Cal","EN",2,4,"no url","2011-09-06 02:30:02"
"110920315466547202","Wow, la Universidad de Berkeley y su laboratorio de terremotos¡! ñ.ñ","carliish","ES",0,0,"no url","2011-09-06 03:40:38"
"111220266897645568","Try a new place for dinner. Get $50 value for only $25 at Sushi Ko Bar & Grill #ThousandOaks #Berkeley http://t.co/4zSCw3C","yatown_deals","EN",0,0,"no url","2011-09-06 23:32:32"
"111245470491361280","The J. Berkeley Daily Express is out! http://t.co/takSAJn ▸ Top stories today via @shelbylanemd","sproutqueen","EN",0,0,"no url","2011-09-07 01:12:41"
"111260850978951171","Immaterialism: There are NO Material Objects! Immaterialism is the theory propounded by Bishop Berkeley in the 1... http://t.co/d2ZKFhR","onlinerepertory","EN",0,0,"no url","2011-09-07 02:13:48"
"111287497409052673","RT @adamcm777: After getting embarrassed in Berkeley last September, the #Buffs get a rematch with Cal this Saturday: http://t.co/Bz5rWqc","KATSports","EN",0,0,"no url","2011-09-07 03:59:41"
"111293189071192064","@comcastcares is comcast service out in berkeley, ca, or am i inept at setting up my cable box? either seems likely.","smithmachine","EN",0,0,"no url","2011-09-07 04:22:18"
"111296418697842688","Berkeley (aka Bezerkeley) CA is full of Volvo's and Subaru's. Is it wrong for a conservative to avoid the stereotype and drive one?#tcot","CynthiaCHeath","EN",0,0,"no url","2011-09-07 04:35:08"
"111398852002725888","@elcuaderno13 @gaiaprom el george berkeley reportandose108","leo9307","ES",0,0,"no url","2011-09-07 11:22:10"
"111416002503376896","UC Berkeley - Cal Veterans info session  9/12 @ 8:30 pm. #Intl. Careers. #Diplomats.  #Vets. U.S. citizens/EOE.  http://t.co/ZQNZhFz","doscareers","EN",0,1,"no url","2011-09-07 12:30:19"
"111424462393585664","Bits Blog: Serendipity Books, R.I.P.: A legendary bookstore in Berkeley, Calif., closes, another casualty of th... http://t.co/zC4RUFS","erikfranco","EN",0,0,"no url","2011-09-07 13:03:56"
"111438915981938689","#Jobs #Motherwell Berkeley Scott Pubs, Bars & Restaurants Recruiting General Manager – Stylish Old Style PubGlas... http://t.co/tti1boJ","lexxioUK","EN",0,0,"no url","2011-09-07 14:01:22"
"111474940850614272","You want to feel like a minority? Go to the hood, but here, in rockridge and berkeley, you're white and you are normal, i am not","ThisGrace92","EN",0,0,"no url","2011-09-07 16:24:31"
"111492489831133184","DB seminar 9/9/11: Shivnath Babu … – Berkeley Database Group: While Starfish's design is guided by work on self-... http://t.co/YLpH8zi","vapvarun","EN",0,0,"no url","2011-09-07 17:34:15"
"111501721494224897","@cofaolain **Berkeley","cofaolain","EN",0,0,"no url","2011-09-07 18:10:56"
"111501813768925184","Luxology extends research agreement w/ UC Berkeley. #3DCAD. www.luxology.com","wtwh_laurac","EN",0,0,"no url","2011-09-07 18:11:18"
"111525561909776384","Looks A-mazing: RT @theselby Chez Panisse 40th anniversary dinners in sf plus a trip to the berkeley edible schoolyard bit.ly/qTUd0A","LittleHouseNYC","EN",0,0,"no url","2011-09-07 19:45:40"
"111536595810779137","Historic urns restored in Berkeley&#8217;s Thousand Oaks... http://t.co/TbaJjpu","berkeleyside","EN",0,1,"no url","2011-09-07 20:29:31"
"111556239057620992","Would you live in a dumpster? Probably not, but this guy in Berkeley is making i...: Would you live in a d... http://t.co/4w049wR","oliveorganicmil","EN",0,0,"no url","2011-09-07 21:47:34"
"111580020748722176","I almost came today when researching @Berkeley's library and actually had access to articles published more recently than 2006. #nerdgasm","SmartHotFun","EN",0,0,"no url","2011-09-07 23:22:04"
"111584563175759872","@ macarthur omw to meet my girl in berkeley , we both gettin peirced !","MiMiTwoTimes","EN",0,0,"no url","2011-09-07 23:40:07"
"111817430942236673","RT @djpyro: RT @MizzRuby_x: @dougie3fresh Cunt? X &lt; yep,he is! haha the berkeley hunt lolol « zip it you hampton hahaha","dougie3fresh","EN",0,0,"no url","2011-09-08 15:05:27"
"111830493984595968","tonight in Berkeley at @EarPeaceRecords 3268 Adeline -'Quake City Pop-Up Party!' w/ @lroneous @thenothing @SeanEDepp FREE | ALL Ages | 7pm","theunderstudies","EN",0,1,"no url","2011-09-08 15:57:22"
"111833613036818432","Upcoming performance of @PachasPajamas at Hub Berkeley, Thurs. Sept 22nd. FREE for a limited time http://ow.ly/6oXDs #inspiring","meliaspapa","EN",0,1,"no url","2011-09-08 16:09:45"
"111834526916939776","I liked a @YouTube video http://t.co/AE676ER [CF] BIGBANG - The North Face「G-DRAGON's Berkeley」TV CM _30s Ve","SHERLISTER","EN",0,0,"no url","2011-09-08 16:13:23"
"111866651103866880","People's Park tree-sit ends as protester falls out of tree http://t.co/TWgZOuE #Berkeley (via @dailycal)","ReginaldJames","EN",0,0,"no url","2011-09-08 18:21:02"
"111873045681029120","I'm auditing a UC Berkeley class about ancient Egypt. Hells to the yeah.","kiaroskuro","EN",0,1,"no url","2011-09-08 18:46:27"
"111891068844380160","PW: RESI 100: The 100 most influential people in residential property: Tony Pidgley, chairman of Berkeley Group, has... http://t.co/OENA2xw","ukprop","EN",0,0,"no url","2011-09-08 19:58:04"
"111900117442904065","Hope to see many people tonight in Oakland/Berkeley area at @GreatGoodPlace for Books at 7pm. Gorgeous CA weather, come by & say hi!","ellencrosby","EN",0,0,"no url","2011-09-08 20:34:01"
"111934976303443968",".@BayAreaDerbyGrl This handmade scarf to benefit @ACCFB would be perfect for a member of the Berkeley Resistance! http://t.co/REg0ZFV","FeedOakland","EN",0,0,"no url","2011-09-08 22:52:32"
"111965305345015809","TONITE! Gendered Images: The Feminine Divine. Opening: Thu, Sept 8, 5-7pm. Doug Adams Gallery 1798 Scenic Ave Berkeley, CA","Mercury_20","EN",0,0,"no url","2011-09-09 00:53:03"
"111967087890665472","@berkeley_eagle The bus leaves at 5pm, so i would say all dependant on traffic? say 6ish? to be safe","ckJonesy","EN",0,0,"no url","2011-09-09 01:00:08"
"111968480407994369","Private Investigator Bomb scare prompts evacuation of an Oakland high school - Berkeley Voice: OAKLAND ... http://t.co/Q9l2X4D #oakland","OaklandPI","EN",0,0,"no url","2011-09-09 01:05:40"
"111969088598843392","Mold found in portable classroom at Berkeley Co. school - The Herald-Mail: Mold found in portable classroom at B... http://t.co/TgeXkDf","cleaning_group","EN",0,0,"no url","2011-09-09 01:08:05"
"111989317714456577","Engineering professor listing Berkeley 4BD | BlockShopper San Francisco http://t.co/kbeEIOn","BerkeleyHillsRE","EN",0,0,"no url","2011-09-09 02:28:28"
"112142028141379584","@elcuaderno13 @gaiaprom el george berkeley reportandose 513","joseloBRMU","ES",0,0,"no url","2011-09-09 12:35:17"
"112171786707271681","Yay Sutton Gourmet Paper! Cal Berkeley Dining is now using our cupcake liners! Woo Hoo! http://t.co/hcOYMO2 http://t.co/9B4QboA","suttongourmet","EN",0,0,"no url","2011-09-09 14:33:32"
"112275654476705794","What, no meth lab? God bless SC RT“@RayRiveraLive5: Deputies discover moonshine still during drug investigation in Berkeley County.""","rchinnis","EN",0,0,"no url","2011-09-09 21:26:16"
"112280188502540288","enjoyed the @GoodVibesSF Berkeley store on a casual friday afternoon. Good to see women-oriented sex shops.","EBroadbent","EN",0,0,"no url","2011-09-09 21:44:17"
"112282193379864576","Moonshine still uncovered: Officials with the Berkeley County Sheriff's Office released on Friday th... http://t.co/EEHwEL1 #sc #scnews","ABCNews4","EN",0,0,"no url","2011-09-09 21:52:15"
"112282491158667264","I checked in at United States Post Office - South Berkeley (3175 Adeline Street) on #Yelp http://t.co/xLzi3f0","mostsmartist","EN",0,0,"no url","2011-09-09 21:53:26"
"112293543183253504","A small crowd of college aged bikers are gathered in front of the student center; the UC Berkeley bike fest is just getting started.","OGpenn","EN",0,0,"no url","2011-09-09 22:37:21"
"112353102287478785","Great time with @ibbyc. A great weekend to all! (@ Greek Theater Berkeley for Ray Lamontagne & the Pariah Dogs + more) http://t.co/oN30za0","abduzeedo","EN",0,1,"no url","2011-09-10 02:34:01"
"112366545040187392","It's never too late to have a happy childhood. - Berkeley Breathed","CaseyDeanTools","EN",0,0,"no url","2011-09-10 03:27:26"
"112417041822121984","Risk x Retna x Heal the Bay Charity Project:  825 Berkeley St., Santa Monica, California is the home ... http://t.co/g5EIomv #slamxhype","slamxhype","EN",1,2,"no url","2011-09-10 06:48:06"
