"tweet_id","text","author","language","likes","retweets","media","timestamp"
"90481753071960064","Friday - AgencyInsight Breakfast: NSA on Clearances, Industrial Security and Social Networking at Loyola U. in Columbia http://ht.ly/5yOV2","theasbcguy","EN",0,0,"no url","2011-07-11 18:05:05"
"90486291321462784","#Audio Louis Armstrong – The Great Chicago Concert 1956 – Columbia Legacy/ Pure Pleasure – Audiophile Audition http://dlvr.it/Zn7x0","Sci_TechNews","EN",0,0,"no url","2011-07-11 18:23:07"
"90494969344831488","..riding through Columbia like I don't know the speed..","iStr8_Ballweeni","EN",0,0,"no url","2011-07-11 18:57:36"
"90509510967431168","Columbia wrestling duals tonight pretty pumped :): http://yearbook.com/a/1he4wb","kadenskinner","EN",0,0,"no url","2011-07-11 19:55:23"
"90521307703287808","Have you entered @Inside_Columbia's Sunsational Summer Sweepstakes yet??? http://t.co/xQxen9C Prizes everyday!","haleyadams25","EN",0,1,"no url","2011-07-11 20:42:16"
"90528685324648449","Boat operator says all children were wearing life vests during Columbia River rescue - http://bit.ly/pjlK5C","KOINLocal6","EN",0,1,"no url","2011-07-11 21:11:35"
"90530419606425600","Oh how I miss Columbia.","ericapaiger","EN",0,0,"no url","2011-07-11 21:18:28"
"90555803530051585","@maxrushden yer mate summer is going well!! Back to work soon, Columbia ay be careful pal knees up when ur back!","JamesSoccerAM","EN",0,0,"no url","2011-07-11 22:59:20"
"90566985523527680","@DopeBieberGomez ....Teala Dunn, Madison Pettis, Threadless, Island Records, Def Jam Records, Columbia Records, RealD 3D, Greyson Chance....","LiveLoveJelena","EN",0,0,"no url","2011-07-11 23:43:46"
"90567044252184576","Gravitas Design Series: The Columbia - http://eepurl.com/eHZR-/","GravitasBoise","EN",0,0,"no url","2011-07-11 23:44:00"
"90582496068108288","Duct Cleaning Companies in Columbia MD - DUCTZ of Central Mid Atlantic  - A Braggit by DUCTZ of Central Mid-Atlantic http://goo.gl/kcypM","DuctzofLKN","EN",0,0,"no url","2011-07-12 00:45:24"
"90583258043125760","My personal Best of Show: Buffalo Mozzarella from Columbia and the @Vosges brownie. Also, way more halloumi than I needed. #FancyFood","BestFoodBlogEVR","EN",0,1,"no url","2011-07-12 00:48:26"
"90602653880549376","Rivers and Creeks of the Northwestern British Columbia:  http://amzn.to/kTBaae","MaekoujiGenhanz","EN",0,0,"no url","2011-07-12 02:05:30"
"90611331916500992","Lmfaoo ! RT @BIGgurl_22: Memba erybody use to wear DCs....not even knwn them joints dnt stand for district of columbia llS","NekIfYou_NASTY","EN",0,0,"no url","2011-07-12 02:39:59"
"90619938619916288","A day at columbia TC http://instagr.am/p/HenWM/","gimbeydelacruz","EN",0,0,"no url","2011-07-12 03:14:11"
"90623520551342080","RT @KNArnold: Everybody from Columbia is moving to LA...another state takeover! Uh ohhhh,watch out.","Marlin_Million","EN",0,0,"no url","2011-07-12 03:28:25"
"90652712928161792","Just played: See That My Grave Is Kept Clean - Lou Reed - Martin Scorsese Presents the Blues: Soul of A Man(Columbia)","wtul_playlist","EN",0,0,"no url","2011-07-12 05:24:25"
"90697591955795968","Columbia County Man Accused Of Leaving Pets To Die: Animal Care and Control investigators say they were called i... http://bit.ly/paibPR","petduah","EN",0,0,"no url","2011-07-12 08:22:45"
"90729632273408001","Popular stuff on: http://www.gearhood.com/ - Columbia Ravenous Men's Shoes Grey/Green, BMW M3 E92","jpenski11","EN",0,0,"no url","2011-07-12 10:30:04"
"90770325402419201","@ZZZkin Thanks! Had a blast. Miss it already and can't wait to go back. We toasted you at Columbia as well! :)","amissvillemusic","EN",0,0,"no url","2011-07-12 13:11:46"
"90772959425343488","Yes, I will play ice hockey for Columbia! http://fb.me/14w4Q92ZA","sitec_english","EN",0,0,"no url","2011-07-12 13:22:14"
"90778588168728576","“@ImanKay: Back to my District of Columbia!” whoop!","Tonya50","EN",0,0,"no url","2011-07-12 13:44:36"
"90785567490580482","#CoMO Currently: Fair and 82 F at Columbia Regional Airport, MO  http://bit.ly/fU27hB","WeatherZach","EN",0,0,"no url","2011-07-12 14:12:20"
"90795620385832960","The District of Columbia Government: ""I'm outraged, but not surprised."" Maybe we can emblazon that in Latin on the seal.","DaveStroup","EN",1,7,"no url","2011-07-12 14:52:17"
"90834850554183680","6 hours of classtime left, 3 today and 3 on Thursday then freedom!!! :D (@ Columbia College Chicago) http://4sq.com/n1nRHo","nyyankeegurl02","EN",0,0,"no url","2011-07-12 17:28:10"
"90858403567636480","Just saw the Google Maps car roll through the Polish Triangle onto Columbia Rd. #google #boston #dot","adamPDOTcom","EN",0,1,"no url","2011-07-12 19:01:46"
"90868996374659072","@Adam_Harrelson7 yea brah, I start USC Columbia in august","drezzy2two","EN",0,0,"no url","2011-07-12 19:43:51"
"90873563992690688","Check out this Meetup with Columbia Venture Community http://meetu.ps/qwk","rgandhi10","EN",0,1,"no url","2011-07-12 20:02:00"
"90879121428717569","IIROC: Resume, Sino Environ-Energy Tech Corp.:     VANCOUVER, BRITISH COLUMBIA--(Marketwire - July 12, ... http://mwne.ws/qyTlmC","ryanmatteraj","EN",0,0,"no url","2011-07-12 20:24:05"
"90901867143495680","I'm at Noodles & Company (6191 Old Dobbin Ln, Columbia) w/ 2 others http://4sq.com/qEdbT4","GNitro","EN",0,0,"no url","2011-07-12 21:54:28"
"90905331638603776","@kimberlygill @discoveryplace @StewartMoore that is so crazy!!! I'm actually from Greenville & worked in Columbia for a while. Small world","lbstewart","EN",0,0,"no url","2011-07-12 22:08:14"
"90921412625301504","I'm at Best Buy (Columbia Heights) (3100 14th St NW, at Irving St NW, Washington) http://4sq.com/rrbH90","mindthechasm","EN",0,0,"no url","2011-07-12 23:12:08"
"90925946642771968","@soaphia I'd say the British Columbia is one of the prettiest provinces in Canada ;D","101pooie","EN",0,0,"no url","2011-07-12 23:30:09"
"90926580003635200","Extreme photo of the day via @NatGeoPhotos: Climibing in Squamish, British Columbia, #Canada http://on.natgeo.com/nDPhdg #photo #Photography","PCaporali","EN",0,0,"no url","2011-07-12 23:32:40"
"90926940130775040","Flooding at W. Columbia on Evansville's westside. Cars are being threatened by water. #tristatewx #tristateroads http://twitgoo.com/2j7hud","EmilyWDRB","EN",0,1,"no url","2011-07-12 23:34:06"
"90940861591977984","@ericstoller The Savannah-Columbia drive *has* to be faster than all those flights!!","amymengel","EN",0,0,"no url","2011-07-13 00:29:25"
"90953577908027393","@PGAofBC great event this week at @BigSkyGolfClub. As always, one of the best courses in British Columbia. If you havent played it, DO IT!!","kggolf","EN",1,2,"no url","2011-07-13 01:19:57"
"90965243089522688","Steep and Cheap! – daily update!: Columbia City Dweller Pant – Men’s: – $36.99 http://bit.ly/qB6y17","everyonedaysale","EN",0,0,"no url","2011-07-13 02:06:18"
"90965532475523072","British Columbia Man Faces Six Months in Jail for Growing Food http://bit.ly/mYOtrr","UP_food","EN",0,0,"no url","2011-07-13 02:07:27"
"90969852608647169","Who's blonde lady who's in a vineyard in the British Columbia commercial at the Winter Oympics? http://ht.ly/1dM8qm","KennethMil46","EN",0,0,"no url","2011-07-13 02:24:37"
"90980363538677761","Columbia Benbow Lake Metal Sunglasses:     Columbia Benbow Lake Metal Sunglasses »»» Onl... http://bit.ly/oQDDb5","Medbuoy2","EN",0,0,"no url","2011-07-13 03:06:23"
"91002513687453696","@Pfister07 It's a sandwich shop that they have in Columbia and Springfield.  The sandwiches and soups are #snowball worthy.","iamDarrenOwens","EN",0,0,"no url","2011-07-13 04:34:24"
"91078885558587393","Job Opening - Registered Nurse: WI-Milwaukee, Columbia St. Mary's is a healthcare ministry with several re... http://bit.ly/nogF6q #jobs","VeteranJobs","EN",0,2,"no url","2011-07-13 09:37:53"
"91086710129168384","Theft on COLUMBIA STREET, Chapel Hill, NC (via spotcrime.com): Larceny- All Other (C), at S Columbia St At E Frankli... http://bit.ly/qEdXkd","chapelhillcrime","EN",0,0,"no url","2011-07-13 10:08:58"
"91124868367654912","Columbia and areas South of I-20 are under a EXCESSIVE HEAT WARNING from Noon-8pm. This means it will feel like 110-115. (via @wachfox)","columbiasunnews","EN",0,3,"no url","2011-07-13 12:40:36"
"91138870485331968","@johnny_columbia Brooks is *always* a Hot Girl to me.","johnyarddog","EN",0,0,"no url","2011-07-13 13:36:14"
"91152032215474176","No. 1 App Lets You Record Your Own Alarm Clock: Columbia, SC (WLTX) -- News19's Nat Roers talks to Columbia's re... http://bit.ly/pyh0o1","Clock_Store","EN",0,0,"no url","2011-07-13 14:28:32"
"91159900746551296","“@ifeambessah: Plan for today visit NYU and Columbia. Visit Alvin Ailey. And shopping in Harlem...”&lt;~ Really jealous!","mysizemore","EN",0,0,"no url","2011-07-13 14:59:48"
"91162387964624896","I just became the mayor of Lahout's Burton/Life Is Good/Columbia on @foursquare! http://4sq.com/a9Voug","GMoniez","EN",0,0,"no url","2011-07-13 15:09:41"
"91167584698892289","Columbia Beach Resort is also on Twitter; follow us here... http://twitter.com/#!/ColumbiaBResort http://fb.me/Vb6rBNYN","ColumbiaBResort","EN",0,0,"no url","2011-07-13 15:30:20"
"91182201860923392","hear me in a new opera http://t.co/nSi3xB6 2nite at a strange and beautiful architectural experiment at columbia: http://t.co/8OChMRq","brianrady","EN",0,1,"no url","2011-07-13 16:28:25"
"91195116122931200","Columbia with @joejefferies :)","NeishaEstes","EN",0,0,"no url","2011-07-13 17:19:44"
"91196235972751360","@caviarandbanana how abt a new location in Columbia? I've got the perfect spot for you. CrossHill Market opens in 2012 (rt behind my house)","CamilleMaurice","EN",0,0,"no url","2011-07-13 17:24:11"
"91196756091609090","Heat Indicies at 1PM:  Orangeburge 114, Columbia 112, Sumter 108, Chaleston 112, Darlington 115.  Stay COOL!","FarleyWeather","EN",0,0,"no url","2011-07-13 17:26:15"
"91207216694169600","“@Sunkyungholic: I`m in class @ columbia univ. I wanna go home, though. I`m so tired :( http://t.co/t6690tD”  I want a runway show there! :)","Reggie_Marshall","EN",0,0,"no url","2011-07-13 18:07:49"
"91215177474768896","RT @_mosaicofenigma: RT @wltx Heat index in Columbia: 116 F  at 2 p.m. It's been a long time since we've seen a ... http://tmi.me/cXzNN","ChellieBonita","EN",0,0,"no url","2011-07-13 18:39:27"
"91216884531331072","#Columbia #Mens Hiker Heavy Review http://goo.gl/fb/GuPWm #mensthermalsocks #bicycleaccessories #woolsocks #smartwool","sandrawalker7","EN",0,0,"no url","2011-07-13 18:46:14"
"91220902540361728","S/O @DonnieDramatic and the boy  @NationBoy out in Columbia wit that Dirty Dancer track","reneeCabactnoh","EN",0,2,"no url","2011-07-13 19:02:12"
"91224635605135360","Anything new or interesting on Smith, Court, Henry, or Columbia Street?: On par with Seersucker in both quality ... http://bit.ly/qvXWWK","Twptoch1","EN",0,0,"no url","2011-07-13 19:17:02"
"91226669859356672","I'm off work. About to swing by @myRCPL to pick up a book, @McD_Columbia to grab a tea, and home to read before the rain. My kind of day!!","lovedbygod2","EN",0,0,"no url","2011-07-13 19:25:07"
"91228548928503808","PROJECT MANAGER, MINING & METALS - Vancouver, British Columbia  http://bit.ly/gxFMCt","SmartRecruiting","EN",0,0,"no url","2011-07-13 19:32:35"
"91238195794161664","What a great event to attend!! A product demo at the Fretz Corp in Columbia, MD. Put it on your calendar!!! http://fb.me/BFIsrc2n","beth_zdrojewski","EN",0,0,"no url","2011-07-13 20:10:55"
"91240863379894272","@bradwick columbia kho \o/ for my work ""karma: chapter 2"" YOU ARE AWESOME BRAD~ xD;;;","cokho7","EN",0,0,"no url","2011-07-13 20:21:31"
"91256789168955392","I'm at Studio Fringe (725 Crosshill, Columbia) [pic]: http://4sq.com/oSLGEk","Mark_Newsome","EN",0,0,"no url","2011-07-13 21:24:48"
"91271737672613888","@XoXheartbeat yeah, you skytrain from surrey central to columbia(first stop after the bridge) and then go to the other side and get on(cont)","CheersToThis_","EN",0,0,"no url","2011-07-13 22:24:12"
"91275147620786176","@kelseyterp we run hh @VictoriaGPub in Columbia til 7, but then start up a late night hh fr 10pm -2am :)","ToriMarriner","EN",0,0,"no url","2011-07-13 22:37:45"
"91279849456549888","New Record: Iris Williams - Song Of Summer / All Or Nothing At All [Columbia] [1981] http://bit.ly/r2D3cD","45cat","EN",0,0,"no url","2011-07-13 22:56:26"
"91328289460862976","Sign petition for British Columbia man sentenced to 6 months in jail for growing food (http://is.gd/dCRdry) Petition: http://is.gd/4VDNCr","zengreen","EN",0,0,"no url","2011-07-14 02:08:55"
"91334958387441664","Common hatchery practice could be harming salmon - British Columbia - CBC News: http://t.co/i77ZMRW","maricallah","EN",0,0,"no url","2011-07-14 02:35:25"
"91337042985889793","Does anyone on my timeline especially in  NYC have any ties to Columbia University?","Tai_Smoo","EN",0,0,"no url","2011-07-14 02:43:42"
"91337386902044672","Columbia County Fair runs though Sunday http://dlvr.it/b5Vzm","the_daily_news","EN",0,0,"no url","2011-07-14 02:45:04"
"91349484642123776","Barbra Streisand in 'Heated' Talks for Columbia Records Deal Renewal -- http://t.co/FMqkj8J","billboardbiz","EN",0,4,"no url","2011-07-14 03:33:08"
"91373776683544576","$40 for a Get in the Zone Foot Treatment at Sole Zones Reflexology & Massage in Columbia ($80 Value) on Deal51 http://dlvr.it/b64Tn","deal51_dca","EN",0,0,"no url","2011-07-14 05:09:40"
"91376989537185793","#Wells Gray Park, #British Columbia absolutely beautiful!  #hiking, #canoeing-great #familyadventure","girlgreener","EN",0,0,"no url","2011-07-14 05:22:26"
"91394836288126976","found this on Google+ today from Columbia Professor Michael Abbot who hosts the blog www.brainygamer.com -- http://t.co/pdNvwRt","MorrisLessmore","EN",0,1,"no url","2011-07-14 06:33:21"
"91460565607776256","#FamouslyHot in Columbia this week more than a slogan. Weather news, cooling station map","thestate","EN",0,1,"no url","2011-07-14 10:54:32"
"91487622681210880","TOMORROW & SATURDAY AT  @COMEDYHOUSE IN COLUMBIA SC  ALL TIX $15  http://lockerz.com/s/118569355 http://lockerz.com/s/118570428","DarkstrangerNC","EN",0,0,"no url","2011-07-14 12:42:03"
"91489916973887488","I will be at Columbia University tomorrow giving a lecture on ""Social Entrepreneurship and the Principles for Longevity""","RahGor","EN",0,0,"no url","2011-07-14 12:51:10"
"91521495897083905","I'm not twitpicing any more #RickRossBelly's ... Smh Columbia is too small, and informants are at an all-time high I see.","RG803","EN",1,0,"no url","2011-07-14 14:56:39"
"91522628338204673","The business model that fueled my childhood obsession with Columbia House stamps: http://bit.ly/lUEwmZ","NeilGilbert","EN",0,0,"no url","2011-07-14 15:01:09"
"91523119071772672","Have you checked out the new Wildcat Market on Columbia? Read up on them in the Chevy Chaser, and like them on... http://fb.me/Gh7cJlUX","ChevyChaserMag","EN",0,0,"no url","2011-07-14 15:03:06"
"91534498218520577","@itsABbruh lol naw but if u come out columbia I got you","Ziggy2Three","EN",0,0,"no url","2011-07-14 15:48:19"
"91535542616989696","Harbor-Front Hotel in Historic British Columbia..  http://geoflake.com/DLZ8dfa56f at #Ottawa #groupon","GeoflakeOttawa","EN",0,0,"no url","2011-07-14 15:52:28"
"91537589407985665","@corywicker in Columbia shipping cocaine what about you ?","Hansolo92","EN",0,0,"no url","2011-07-14 16:00:36"
"91552579879845888","Speech-Language Pathologist job in Columbia,Maryland. http://bit.ly/onxbtG #SLP #jobs #SLPJobs","slpajobs","EN",0,0,"no url","2011-07-14 17:00:10"
"91561769595703296","Top 10 Reasons Columbia Records Should Never Let Barbra Streisand Go - Examiner.com: Top 10 Rea... http://bit.ly/oWjqps #BarbraStreisand","SoCelStreisand","EN",0,1,"no url","2011-07-14 17:36:41"
"91563044638957568","Looking for a Director, Product Marketing in Columbia, MD http://bull.hn/l/2TEW/ #job","CareerProfiles","EN",0,1,"no url","2011-07-14 17:41:45"
"91580674229805056","back at Columbia College studio bout to track a live version of Burning Up!  hopefully we'll get to some of these new tunes too..#feelinfine","MatthewSantos","EN",0,3,"no url","2011-07-14 18:51:48"
"91584003597012992","Come and visit us! We are located behind Toys R Us at Columbia Shopping Village. http://migre.me/3RvHv","oyakamloops","EN",0,0,"no url","2011-07-14 19:05:02"
"91585261892419586","Sign petition for British Columbia man sentencd to six months in jail for growing food (http://is.gd/dCRdry) Petition: http://is.gd/4VDNCr","dohlink","EN",0,0,"no url","2011-07-14 19:10:02"
"91588273738219520","Dear cascadia subduction zone, please don't rupture now while i am here at the south jetty of the columbia river mouth. Thanks!","billlascher","EN",0,0,"no url","2011-07-14 19:22:00"
"91589477163737088","Chief Architect AT&T Consulting Washington D.C. - (Washington, District Of Columbia):  Description Don't miss ... http://bit.ly/oBYTvM","matttester22","EN",0,0,"no url","2011-07-14 19:26:47"
"91594636136693760","It's so hot . omg. Columbia pleaseeeeeeee","fanfavorite11","EN",0,1,"no url","2011-07-14 19:47:17"
"91605767853064193","Just added myself to the http://wefollow.com twitter directory under:  #vancouver_british_columbia #marketing #socialmediamarketing #unempl","staceyannecook","EN",0,0,"no url","2011-07-14 20:31:31"
"91605935604252672","Who wanna ride wit me out columbia","MzSpoil3dRott3n","EN",0,0,"no url","2011-07-14 20:32:11"
"91639821407227904","Hiring: Natural Adabas Developer/Programmer/Architect (direct Client) (Columbia , SC ): ************************... http://bit.ly/r44QrS","raleightechjobs","ES",0,0,"no url","2011-07-14 22:46:50"
"91665595371749376","Columbia and New Balance shoes, clothes, and more  up to 75% off http://bit.ly/cD3v3G thru Friday or while they last","MomsWhoSave","EN",0,2,"no url","2011-07-15 00:29:15"
"91752870000590850","Columbia SC I am in your city tonight at Apple Bottoms 826 Bush River Road. Come out for the Summer of Sum tour.","therealmr704","EN",0,1,"no url","2011-07-15 06:16:03"
"91817840214159361","Estoy de vuelta. Me fui después del preestreno del Amor de Tony y he llegado de vuelta para el de Cirkus Columbia. ¡¡Gracias @CinesRenoir!!","BSanse","ES",0,1,"no url","2011-07-15 10:34:13"
"91829454246125570","I'm at The ""Wellington"" Shuttle Bus (1850 Columbia Pike, s. Scott Street, Arlington) http://4sq.com/oLWMCG","Mykel701","EN",0,0,"no url","2011-07-15 11:20:22"
"91838249722576896","MySQL Database Administrator - District of Columbia United States #jobs  http://jobsurl.com/vlOC","ITJobsinUSA","EN",0,0,"no url","2011-07-15 11:55:19"
"91843807171186688","I'm at Cheverly Metro Station (5501 Columbia Park, Cheverly) w/ 2 others http://4sq.com/n1WcFr","dancerindc","EN",0,0,"no url","2011-07-15 12:17:24"
"91859531612700673","DC Investors: We Want To Be Your Preferred Hard Money Lender ...: District of Columbia. DC Investors: We Want To... http://bit.ly/r6hcYf","sacforeclosures","EN",0,0,"no url","2011-07-15 13:19:53"
"91861137934655488","Parkinson's-causing gene discovered at UBC: Scientists at the University of British Columbia have identified a g... http://bit.ly/pO04L9","canadacomHealth","EN",0,6,"no url","2011-07-15 13:26:16"
"91877349007695872","Columbia PD confirms Edward Taggart, 72, of Prairie Home and Gilbert Love, 73, of Auxvasse died in I-70 accident Thurs. /via @TheMattMoreno","KOMUnews","EN",0,0,"no url","2011-07-15 14:30:41"
"91900472222420992","I would def like to be on the high way to the district of columbia right now ..","SdotRogersNC","EN",0,0,"no url","2011-07-15 16:02:34"
"91900778402414593","2 day social media conference @TheSocialCrush is just over one month away in Columbia: http://bit.ly/qb8tfm","chrisabbotts","EN",0,1,"no url","2011-07-15 16:03:47"
"91921855623073792","Columbia Metro Airport is 81° right now. If it stays below 90° today, it'll be the first time since May 28th.","wis10","EN",0,10,"no url","2011-07-15 17:27:32"
"91923796725997568","Teen Driver Involved In Deadly Columbia County Accident Sentenced To Jail The teen charged in the deadly acciden... http://bit.ly/pjK4yt","SEARCHAUGUSTA","EN",0,0,"no url","2011-07-15 17:35:15"
"91933045178908672","#FF my homie hot 103.9 Columbia SC&gt; RT @hollywooddub: #FF @billi_on_airess","billi_on_airess","EN",0,0,"no url","2011-07-15 18:12:00"
"91936908137082880","Research reveals dynamics behind magical thinking and charismatic leadership: Research by Columbia Business Scho... http://bit.ly/nBVZMb","thikal","EN",0,0,"no url","2011-07-15 18:27:21"
"91939290501746688","Harbor-Front Hotel in Historic British Columbia..  http://geoflake.com/DLZc36a8a2 at #Halifax #groupon","GeoflakeHalifax","EN",0,0,"no url","2011-07-15 18:36:49"
"91941031150501888","#US Police ID two pedestrians killed on I-70 in Columbia: The driver of an SUV struck both ... http://bit.ly/nYeIqu #News #SouthCarolina","RFSCarolina","EN",0,0,"no url","2011-07-15 18:43:44"
"91948081771331586","@BossLady_iixiix i was going out columbia to get you. was seeing if you work. nevermind.","AnimatedDummy","EN",0,0,"no url","2011-07-15 19:11:45"
"91980235284824065","Now stuck in columbia's stupid traffic","KiraFnKat","EN",0,0,"no url","2011-07-15 21:19:31"
"91985507541725185","Colu reviews http://toolize.net/p/columbia-river-knife-and-tools-2013-razel-ss7-chisel-with-bellied-razor-and-veff-serrated-blade/B001EDIYM8","toolize","EN",0,0,"no url","2011-07-15 21:40:28"
"91990679097581568","Lookie there at @MMinSC, another Columbia cycling blog.","steepclimbs","EN",0,0,"no url","2011-07-15 22:01:01"
"92002687389937664","RT. “@9isabelle: RT @HaidaPrincess 17 Stunning 'Britsh Columbia' Canada Landscape #Photography by L Turnbull:  http://t.co/nWplUUN”","theresamax","EN",0,0,"no url","2011-07-15 22:48:44"
"92010379764441088","Richie Aldente performing at Columbia City Theater Thursday night, and Tea Garden on Friday night with @goodybag #grownupfolk","richiealdente","EN",0,0,"no url","2011-07-15 23:19:18"
"92038519337385984","@AlexMcCourt19 the guru is magical....minus his typos. Columbia and cessna...","Ian_McCourt","EN",0,0,"no url","2011-07-16 01:11:07"
"92046408823222273","What Lies Beyond?: We Want to Welcome Columbia, Turkey & Egypt to Our..... http://t.co/LMIqCr2","ResrchInstitute","EN",0,0,"no url","2011-07-16 01:42:28"
"92073822789971969","Accident of motor vehicles involving unknown injury at 190 COLUMBIA AV , Rochester City","monroe911","EN",0,0,"no url","2011-07-16 03:31:24"
"92081896846147584","$15 for $30 worth of Sperry, Sebago, Columbia and more footwear from BoatShoes.com, plus free shipping! http://dealcatch.com/deal/110959/t","dealcatch_det","EN",0,0,"no url","2011-07-16 04:03:29"
"92088406397554689","Career coach (Victoria – British Columbia): E-mail this Job Job Number: 5868206 Title: Career coach (Trade Emplo... http://bit.ly/o9Zx6v","1jobcentre","EN",0,0,"no url","2011-07-16 04:29:21"
"92107805057753089","Crazy #housemusic going on at @PLAYLOUNGENYC Dj Kriss Salaa from Columbia on set . http://lockerz.com/s/120619644","Fredulouss","EN",0,0,"no url","2011-07-16 05:46:26"
"92132299772133376","Apps help users skirt the law, critics say - Columbia Daily Tribune http://bit.ly/nL2DAZ #App #Apps","HotAppNews","EN",0,0,"no url","2011-07-16 07:23:46"
"92140180869349376","I'm at Fortune Sound Club (147 East Pender Street, btw Main & Columbia, Vancouver) w/ 2 others http://4sq.com/mRuHuF","craige13","EN",0,0,"no url","2011-07-16 07:55:05"
"92172896469917697","#jobs #career #job Senior Web Developer NSOC at Ukpeagvik Inupiat (Columbia, MD): help desk support and completi...  http://bit.ly/akijxT","webdevelopjobs","EN",0,0,"no url","2011-07-16 10:05:05"
"92215535747612672","Rush. Rush. Rush. Made it! On the 151 to Union Station, then MegaBus to Columbia, and car ride to Tipton. With luck, I'll be home in 13 hrs.","ChetK","EN",0,0,"no url","2011-07-16 12:54:31"
"92224838726463488","@cleancutcee I had a dream that I had Columbia 11s, and that I found some LeBron Samples for the low. Lol","RCH89","EN",0,0,"no url","2011-07-16 13:31:29"
"92228848476880896","Today is all about ESPN. Spurs vs Kaiser Chiefs, now. Arsenal vs Hangzhou, 18:15. Columbia vs Peru, 20:00. Argentina vs Uruguay, 23:15.","dom_campbell","EN",0,0,"no url","2011-07-16 13:47:25"
"92245248213921793","@T0mmy11 it's right outside of the city... The only one in the city is in Columbia Heights by HU","DanniTheKidd","EN",0,0,"no url","2011-07-16 14:52:35"
"92249740300910592","@shawnv1 &lt;~Cool. There are places here in Columbia that sell gyros too.","Valenique","EN",0,0,"no url","2011-07-16 15:10:26"
"92260960047341568","Ima b sittin columbia, SC for 2 hrs smhhh","slim_bmv13","EN",0,0,"no url","2011-07-16 15:55:01"
"92281394717392896","A journey from Colombia to Columbia: *http://love-find-a-home.love-find.net/a-journey-from-colombia-to-columbia.html - Bryndel...","DROID3TOTAL","EN",0,0,"no url","2011-07-16 17:16:13"
"92283537981575168","I'm at Jeep Rogers YMCA (900 Lake Carolina Dr, Kelly Mill, Columbia) http://4sq.com/oresLn","shalamajackson","EN",0,0,"no url","2011-07-16 17:24:44"
"92291511374458881","I'm at Macy's (201 N Stadium, Columbia) http://4sq.com/nlYYyr","SamSchwartzman","EN",0,0,"no url","2011-07-16 17:56:25"
"92292396372606976","@chanelbaby90 Lls mom! I've been in columbia..somewhere yu haven't!","pr3tty_Rhimmy","EN",0,0,"no url","2011-07-16 17:59:56"
"92297760887414784","What I learned from canvassing my community- Columbia Heights, D.C.,  and beyond.  http://t.co/oRwQBRv","ScottGoldstein","EN",0,0,"no url","2011-07-16 18:21:15"
"92304480149835776","@MadeInINDIA__ @JASONsipREDBULL You know its all Love. But stop playing with me for I be at Columbia Park homie.","YeaImChad","EN",0,0,"no url","2011-07-16 18:47:57"
