"tweet_id","text","author","language","likes","retweets","media","timestamp"
"95976199058227200","The Oxford Princeton Programme Announces 2011 North America Fall Course Catalog - PR Web (press release) http://t.co/kN2OqGs","paytonhecklerfi","EN",0,0,"no url","2011-07-26 21:58:03"
"95979541889171456","Y We Gt Streets Named Aftr Schools We Cant Afford && Shit. Yale, Princeton, Harvard ..University, Wat Is They On Wit Us?.! Lol","FerreroC_Rocher","EN",0,0,"no url","2011-07-26 22:11:20"
"96070868681240577","Hanging Without a Rope: Narrative Experience in Colonial and Postcolonial Karoland (Princeton Studies in Cultur... http://amzn.to/m7TFBr","NicoRenkafc","EN",0,0,"no url","2011-07-27 04:14:14"
"96127395307855872","Princeton Review Cracking the ACT with Sample Tests on Disk 1995-96 Edition Win Version: With Sample Tests on C... http://amzn.to/mOE3sP","KyougokuShaohy","EN",0,0,"no url","2011-07-27 07:58:51"
"96141312008527872","http://bit.ly/15gSni Community Rallies to Break Eden Autism 5k and Fun Run Fundraising Record: Princeton, NJ, Ju... http://bit.ly/nLTZkn","ARCMEMBERECI","EN",0,0,"no url","2011-07-27 08:54:09"
"96260778386141185","Looka all the bullshit we bern through...she done gave me them Princeton bluea","jtsokool","EN",0,0,"no url","2011-07-27 16:48:52"
"96303468003852288","@princetonnipple ohh wow princeton nipple sounds so wrong just saying it","mbnerdyswagg","EN",0,0,"no url","2011-07-27 19:38:30"
"96329615290806272","@Mindlessbhavior pleasse follow me I cnt wait to see you guyz at the #CTMD show here in NYC. #Princeton I loooooooooove you dayum your cute.","Skittlezz_123","EN",0,0,"no url","2011-07-27 21:22:24"
"96369515704745984","Common State Abortion Restrictions Spark Mixed Reviews: by Lydia Saad PRINCETON, NJ -- Large majorities of Ameri... http://bit.ly/pbOh89","LauraPhillips42","EN",0,0,"no url","2011-07-28 00:00:57"
"96437299876855808","princeton will you follow me plz and geton the mb chat we wanna talk to you  or dm me plzz","lilmrsprinceton","EN",0,0,"no url","2011-07-28 04:30:18"
"96452592288272385","Thanks.. What a nice town.. :) RT @PrincetonScoop: @mayamalahayati Nice photo. Welcome to Princeton.","mayamalahayati","EN",0,0,"no url","2011-07-28 05:31:04"
"96607336940044291","http://t.co/rP9B0sW PRINCETON: Area activities honor our independence","selenapolhemuw","EN",0,0,"no url","2011-07-28 15:45:58"
"96717819084931072","AND Princeton, Prod, Roc, Ray Ray, Dylan, Diggy was ... as usual uhh BEAUTIFUUUUUUL ;D","its_AnneLise","EN",0,1,"no url","2011-07-28 23:04:59"
"96734508233134080","PRINCETON: Voters to make consolidation call - Packet Online  Download Free Ebook","debtinfo4u","EN",0,0,"no url","2011-07-29 00:11:18"
"96821682668445696","Haha. Princeton! I thought you said you had something planned for NY!! What happened?! Haha : ) @MindlessBhavior","Musik_iss_ME","EN",0,0,"no url","2011-07-29 05:57:42"
"96831178572697600","Paramus Jobs: Market Research Assistant-PART TIME 10-25hr: Princeton Information - Paramus, NJ -... http://dlvr.it/d0vB0 #Jobs #Paramus","Paramus_Jobs","EN",0,0,"no url","2011-07-29 06:35:26"
"96879363630448640","position: Princeton University: Publication Manager, *Cambridge History of China* project http://t.co/8sDF1FJ","artsofchina","EN",0,1,"no url","2011-07-29 09:46:54"
"96909171643002880","I'm going to @MindlessBhavior's show @HOBBoston on 7/29 to see if I'm Mrs. Right! #MrsRightBOS Get your tix at http://t.co/GLiGggR Princeton","MBs_Beauty","EN",0,0,"no url","2011-07-29 11:45:21"
"97000309687197700","http://t.co/QVa1Au6 Princeton you have made me have a heart attack twice with this lol i just love you :) @MindlessBhavior","dmsbandnerd","EN",0,0,"no url","2011-07-29 17:47:30"
"97039757095354368","HELLO PRINCETON ITS JANETTE  (live at http://ustre.am/doS1)","janette_got_em","EN",0,0,"no url","2011-07-29 20:24:15"
"97074867635093504","I'm at Metalex Park (6475 LeSourdsville West Chester Road, Princeton Road, Liberty Township) http://4sq.com/nzMwt9","CincySoccer2307","EN",0,0,"no url","2011-07-29 22:43:46"
"97099102298447874","Princeton Tec Pilot LED Light - $3.25 - 67% off. http://bit.ly/cdsteepcheap","steepcheap","EN",0,0,"no url","2011-07-30 00:20:04"
"97133248928415744","Saturday night I'm hosting @Catch a Rising Star/Princeton! 8pm get ur tix! http://t.co/LMwVbZW","FunnyLaTice","EN",0,0,"no url","2011-07-30 02:35:45"
"97177732919734273","Sr Brand Attorney Job (Princeton, NJ, US): Auto req ID 4915BRTitle Sr Brand AttorneyJob Category LegalJob Descri... http://bit.ly/qqKisS","kvma","EN",0,0,"no url","2011-07-30 05:32:31"
"97277238613000193","http://ping.fm/Nx5E7 Princeton National Bancorp Inc Releases Second Quarter Results Marketwatch Press Release","madxnewscom","EN",0,0,"no url","2011-07-30 12:07:55"
"97355588207525888","@bashriba so glad u r enjoying! Writing 4 Cambridge Uni Press at the moment & after 4 Princeton UP. Details @ michaelcscott.com","drmichaelcscott","EN",1,0,"no url","2011-07-30 17:19:15"
"97375767008256002","The newest shirts say: ""Ray Ray's #1 Girl"", ""Prodigy's Mrs. Right"", ""Roc Royal's Mrs. Right"", & ""Princeton's #1 Girl""","MindlessChrissy","EN",0,2,"no url","2011-07-30 18:39:26"
"97397061464489984","who is your favorite @mindlessbhavior Memeber ? Mine is Prodiqy, Roc, Ray Ray && Princeton &lt;3","iWant_YourLove","EN",0,2,"no url","2011-07-30 20:04:03"
"97410176990191616","Princeton didn't perform his ""little moves"" at the Anaheim show cause his parents were there, lol x)","AlohaNelly","EN",1,8,"no url","2011-07-30 20:56:10"
"97411703796539392","@Lani_IsMindless gorrrrrrrrrrrrrrrl , Princeton. That's all I have to say.","Chelseas_Unique","EN",0,0,"no url","2011-07-30 21:02:14"
"97577693356359680","iReally Wouldd Go Withh Princeton Out Of @MindlessBhavior & @jacoblatimore  ( : Btw Yal Shouldd Follow Me","BeyonddBeauti","EN",0,0,"no url","2011-07-31 08:01:49"
"97745984318210048","#MBFact During the mall tour in Chicago,a fan bit Princeton's shoulder because she didn't want him to leave and a fan pulled Roc's ponytail.","ughhsad","EN",0,1,"no url","2011-07-31 19:10:33"
"97804580053721088","@williemacster Princeton Theo *Seminary* isn't the orthodox school it used to be. Doesn't seem that the labels help determine doctrine.","freddytaul","EN",0,0,"no url","2011-07-31 23:03:23"
"97851287827259392","Nice mini-vacay August 11-12 up in Princeton.  #teacherperks","ross_tcnj","EN",0,0,"no url","2011-08-01 02:08:59"
"97888191067070464","#MBmemories when princeton officaly got freaky 0.0","MindlessShayy","EN",0,1,"no url","2011-08-01 04:35:38"
"97931248013545472","Arrest Made In Princeton Football Player's Death http://t.co/rgdaeap","selenapolhemuw","EN",0,0,"no url","2011-08-01 07:26:43"
"97977033056989184","Job Alert- Print Premium Specialist Needed- print house or agency exp- F100 pharma-princeton-NJ- call 215 493 5900 x103 ask for Joe Robus","NoahRing","EN",0,1,"no url","2011-08-01 10:28:39"
"98079281799901184","#OhioU named No. 1 party school in Princeton Review, AP reports: http://bit.ly/pj1j3F","dansewell","EN",0,0,"no url","2011-08-01 17:14:57"
"98079575396974592","Princeton Review names Ohio University the nation's top party school. For some, this will be a reason in itself to throw another party.","Stainbrook419","EN",0,0,"no url","2011-08-01 17:16:07"
"98085195772731393","@InTheBleachers @LoyalSonBiscuit I kept my acceptance letter from Princeton, just to remember a time when I wasn't so dumb.","Andy_Staples","EN",0,0,"no url","2011-08-01 17:38:27"
"98132830474874880","So @syracuseu made the list of top 20 party schools from Princeton Review. Note the Mayfest picture leading the post: http://bit.ly/o330c8","MsLaurenRae","EN",0,1,"no url","2011-08-01 20:47:44"
"98145899921932289","""@VOTEthemusical creators went to Rice! LOL RT @RiceUniversity: Rice U ranked #1 for quality of life & happiest students by Princeton Review","tutshouston","EN",0,1,"no url","2011-08-01 21:39:40"
"98162706498076672","Marist named a best college by Princeton Review.  #5 in nation in study abroad ahead of a bunch of very good schools. http://bit.ly/o9SC7W","Marist","EN",1,25,"no url","2011-08-01 22:46:27"
"98182116973621248","@supreme_amber thx for the follow #TeamMindless. Yea, u're the girl who met the whole Conjuc fam like XX amount of times:) Wassup !","MB_TAKEOVER","EN",0,2,"no url","2011-08-02 00:03:35"
"98232344531578880","My alma mater Agnes Scott @agnesscott is one of Princeton Review's top ""sober"" schools. I'm sincerely very proud. :) http://ow.ly/5SJlc","sarafperalta","EN",0,0,"no url","2011-08-02 03:23:10"
"98255576773042176","me and princeton are brother and sister.","UrKindredSpirit","EN",0,0,"no url","2011-08-02 04:55:29"
"98282474848788480","#FreeLA : Free American Standard Bathtub (Pasadena): Model is Princeton. Left-hand drain with skirt (aka apron).... http://bit.ly/qxckKg","DailyFreeLA","EN",0,0,"no url","2011-08-02 06:42:22"
"98332227674443776","What's Up Today In Princeton NJ? National Nights out in Princeton, WW, East Windsor, and Plainsboro, and more: http://bit.ly/curevs","PrincetonDeals","EN",0,0,"no url","2011-08-02 10:00:04"
"98370429420445696","Chevrolet Avalanche 2011 Princeton:  			Price: $55068 , Engine: 5.3 ,Transmission: Not Specified , Miles: 0 , Se... http://bit.ly/oE4VXK","pickups_sales","EN",0,0,"no url","2011-08-02 12:31:52"
"98386866897829889","And The Hardest-Partying School Is...: The Princeton Review unveils its annual list of the hardest-partying scho... http://bit.ly/onoIkA","orlandoauto82","EN",0,0,"no url","2011-08-02 13:37:11"
"98402617461440512","Georgia Tech ranks first nationally for athletic facilities in Princeton Review: http://on.today.com/qFGW6i #gatech","DeanBuchan","EN",3,19,"no url","2011-08-02 14:39:46"
"98420236763660290","Top American Party Schools 2010-2011: Princeton Review Rankings | Suite101.com http://t.co/SSw0qcB Always nice to know who likes to #Pawty","shardle1","EN",0,0,"no url","2011-08-02 15:49:47"
"98421050471223296","Not sure how we got ranked #7 for ""students who pack stadiums."" Has Princeton Review been to an Ole miss football or basketball game?","blakekirbyreb","EN",0,0,"no url","2011-08-02 15:53:01"
"98421507654549504","Princeton breast cancer survivors 'Paddle for Pink' at dragon boat festival http://bit.ly/qQHb22","havebreastcance","EN",0,0,"no url","2011-08-02 15:54:50"
"98436801118748672","Princeton Review ranks Clemson #2 nationally for happiest students.......like we already didn't know that.  Rice was #1","ClemsonBuzzz","EN",0,30,"no url","2011-08-02 16:55:36"
"98450255397388291","Sat Small Group Instruction: Tue, Aug 02 2011 12:00 AM The Princeton Review Office Forest Hills in New_York... http://goo.gl/dBzC7 #Queens","BeOutQueens","EN",0,0,"no url","2011-08-02 17:49:04"
"98467818856644608","@jasonbornmama Ok! Ray is the with the LONG HAIR. Princeton is the afro. Prodigy is the mohawk. And Roc Royal is the ponytail. :) Got it?","xoErica_","EN",0,0,"no url","2011-08-02 18:58:52"
"98483212489207808","The Princeton Review just confirmed what we already know: UAB is among the best! http://bit.ly/nUGTFl","UABNews","EN",0,2,"no url","2011-08-02 20:00:02"
"98488125776605184","We are already looking forward to fall career fairs @harvard, @yale, @brownuniversity, Davidson, @barnardcollege, @dartmouth and Princeton!","CarneySandoe","EN",0,0,"no url","2011-08-02 20:19:33"
"98501950194200576","RT @rama_princeton: I hate this day","Maherajaya","EN",0,0,"no url","2011-08-02 21:14:29"
"98516757001678848","Ay Princeton lying, Prodigy dont have leftover food in his bunk x) Skip to 3:48 http://t.co/4lOvsbp Lol","ProdigysKylaa","EN",1,4,"no url","2011-08-02 22:13:19"
"98524985299181569","@LovingMB_ omg yes! we should (: haha i wanna see princeton grind in real life. like ive only seen videos, but i wanna see it forreal haha","PrincetonAFreak","EN",0,0,"no url","2011-08-02 22:46:01"
"98527787111038976","@PrincetonMB143x she sed she lov him bak n shes cryin i lov u princeton ma cuz is called Mylice k roc am Jaliah n ma sis is carla","princeton4evar","EN",0,0,"no url","2011-08-02 22:57:09"
"98528554660265984","According to Princeton Review Top Party School listing for 2012 we are no longer #1 like last year ...were #2 ! lol #BooOhioUni #YayUGA lol","Sydnee_Bush","EN",0,0,"no url","2011-08-02 23:00:12"
"98540709774237696","@MindlessBhavior http://twitpic.com/601oza - Lol somebody said he look like a mini princeton!!! ...,..But this pic is sooo cute!!!=)","ILove_RocRoyal","EN",0,0,"no url","2011-08-02 23:48:30"
"98701162840199168","Jersey City Jobs: Technical Support - Trading / Investment Banking: Princeton Information - Jersey... http://dlvr.it/dfp5b #Jobs #JerseyCity","Jersey_City_Job","EN",0,0,"no url","2011-08-03 10:26:05"
"98743772778729472","House Exclusive: Princeton-Plainsboro's New Dean of Medicine Will Be… [Major Spoiler Alert]! http://t.co/HTYiroe via @TVLineNews","DBoulard","EN",0,0,"no url","2011-08-03 13:15:24"
"98760248025821184","update CRM Launches Online Community for Life Sciences CRM - Newsblaze.com: PRINCETON, N.J. - (BUSINESS WIR... http://bit.ly/pMcqXl #CRM","CRMHourlyNews","EN",0,0,"no url","2011-08-03 14:20:52"
"98764714955386880","Princeton, N.J. to install #stainless #steel pool http://t.co/nchbf1l @princetonpacket","FFJournalUpdate","EN",0,0,"no url","2011-08-03 14:38:37"
"98765931320315904","@tmims50 good 4 u!!! I got Princeton n NYU on my resume and also hold 3 so ur point !! We follow each other on twitter n I read ur tweets","THIZDUDE_THINKZ","EN",0,0,"no url","2011-08-03 14:43:27"
"98773439107698688","My Alma Mater!!! FSC is the “Most Beautiful Campus” in the Nation - The Princeton Review: http://t.co/R2RIrfD via @AddThis","HeatherLynneS","EN",0,0,"no url","2011-08-03 15:13:17"
"98834906649600000","Prodigy,Double R,Princeton,Ray Ray Let Me Know Where We Comin From I LOVE This Song &lt;3","Naya_To_Pretty","EN",0,0,"no url","2011-08-03 19:17:32"
"98849788027613185","@OurSongForever this is Princeton Illinois :) old folks, sassy Tweens, farming an little else lol","Congo_Red_Jr","EN",0,0,"no url","2011-08-03 20:16:40"
"98852182950023168","AccessUVa Ranked First Among Public Universities in Princeton Review Guidebook, 'The Best 376 Colleges' http://t.co/hGBAV5j","AMCullop","EN",0,1,"no url","2011-08-03 20:26:11"
"98868855346184192","Several Local Colleges Make Princeton Review's List of ... - http://fwix.com/a/86_a35d7ec161","greensborowire","EN",0,0,"no url","2011-08-03 21:32:26"
"98882100949815296","@MindlessBhavior http://twitpic.com/60hrmt - Roc Royal-Blue   Ray Ray-Purple   Prod-Gold   Princeton-Red","mindless_keri","EN",0,0,"no url","2011-08-03 22:25:04"
"98890280257851392","RT @3DaTennakey_Way: #scitechmemories Ms. Boor chemistry class was like taking a graduate course at princeton","SadieOhBaby","EN",0,2,"no url","2011-08-03 22:57:34"
"98892540564094976","@princetonluver4 YESSS!!! LOL it was princeton:)","SattaMurrayy","EN",0,0,"no url","2011-08-03 23:06:33"
"99048614797651968","#NJ #NJjobs Residential Food Service Worker Whitman - Princeton, NJ Princeton University Thu, 04 Aug 2011 05:42:04 -... http://ow.ly/1e5MRM","NJ_Jobs","EN",1,0,"no url","2011-08-04 09:26:44"
"99111141011238912","The Princeton Review has named Morehouse College one of the best colleges in the Southeast in 2012!!!  #morehouse","Morehouse","EN",2,66,"no url","2011-08-04 13:35:12"
"99156133947785216","""@OfficialTeamEMU: Eastern Michigan University selected as one of ""Best in the Midwest"" by The Princeton Review lmao yea right","DoughboyBSmith","EN",0,2,"no url","2011-08-04 16:33:59"
"99165163697086466","RT If you love Princeton","xo_MyaarOcean","EN",0,36,"no url","2011-08-04 17:09:52"
"99189191119872000","One Month Of Unlimited Hot Yoga Classes At Bikram Yoga Princeton http://goo.gl/rpQJp #deal","bezdeals","EN",0,0,"no url","2011-08-04 18:45:20"
"99190176760332288","everybody who loves mindless behavior or needs a laugh go to youtube  n tipe in HAPPY BIRTHDAY PRINCETON part 1 or part 2","luvzz13","EN",1,0,"no url","2011-08-04 18:49:15"
"99200628974288896","Philly: Coating Manager - Precision Optics - Princeton, NJ -  (Princeton) http://bit.ly/pojj8d #eBC #Jobs","eBC_Jobs_NE","EN",0,0,"no url","2011-08-04 19:30:47"
"99203732767649792","@Tamia_Princeton its a private location. She's on tour wit the malibu rum station invasion.. I'm not sure the location tho","iLL_Will91","EN",0,0,"no url","2011-08-04 19:43:07"
"99219094313779200","4Boys SuperCute VeryTalented ChangedUrLife #TeamMindless SupportThem! Names:Prodigy RocRoyal RayRay Princeton (RT)","itskambenzo","EN",0,7,"no url","2011-08-04 20:44:10"
"99222288343367681","Ohio University Ranked Top Party School:  Ohio University was just named Top Party School in the Princeton Revie... http://bit.ly/nyqx4e","onlineessaywrit","EN",0,0,"no url","2011-08-04 20:56:51"
"99229745832660993","UAB not on this list. That's a good thing..right? RT@aldotcom: Princeton Review pegs Alabama, Auburn as ""jock schools"" http://t.co/SzWLrGd","SevanteMetcalf","EN",0,0,"no url","2011-08-04 21:26:29"
"99257071735808000","settled into my home for the next week: Mt Princeton campground in Buena Vista CO","andyapplegate","EN",0,0,"no url","2011-08-04 23:15:04"
"99263086355156994","I'm at Starbucks (3535 Rt. 1 Ste. 426, in Marketfair, Princeton) http://4sq.com/qb1atM","Lilpeps14","EN",0,0,"no url","2011-08-04 23:38:58"
"99281390297812992","Working Class Hussys has a show on 08/06/2011 at 08:00 PM @ Small ... in Princeton, NJ http://soc.li/kA5kh7a #concert","WCHussy","EN",0,0,"no url","2011-08-05 00:51:42"
"99442816480063488","Princeton Symphony Orchestra garners ASCAP award: By Ross Amico/For The Times of Trenton From left, composer Ste... http://bit.ly/n96o9f","Composer102","EN",0,0,"no url","2011-08-05 11:33:09"
"99557765550317568","I'm at Tri-County Mall (11700 Princeton Pike, E Kemper Rd, Springdale) http://4sq.com/nhoGss","Gr8GreekG8r","EN",0,0,"no url","2011-08-05 19:09:55"
"99560315682963456","Six Hudson Valley colleges named best northeastern schools in Princeton Review’s “Best 376 Colleges” list http://ow.ly/5WiJc","RhinebeckTweets","EN",0,0,"no url","2011-08-05 19:20:03"
"99576883221504000","10-Q: PRINCETON REVIEW INC: The Princeton Review is a leading provider of in-person, online and print education ... http://bit.ly/oPnStv","theiriseproject","EN",0,0,"no url","2011-08-05 20:25:53"
"99647632728797185","Ithaca Named One of 'Best 376 Colleges' by Princeton Review: Named #3 for college radio, Ithaca has two student-... http://bit.ly/otxFdL","MajorsCollege","EN",0,0,"no url","2011-08-06 01:07:01"
"99858023194959873","@MindlessBhavior Where's  Princeton :) I love tht boy !! Teehee 1-4-3 ;) Stay talented &lt;3 Love you guys","MindlessChicka7","EN",0,0,"no url","2011-08-06 15:03:02"
"99861303165861890","PRINCETON: Harry Potter camp coincides with release of last film http://t.co/Z9lnaqL","KirstenValineWi","EN",0,0,"no url","2011-08-06 15:16:04"
"99947324150779904","I'm at Still Water Community Church (8401 Princeton Road, Rowlett) http://4sq.com/pH0gXi","dugschmidt","EN",0,0,"no url","2011-08-06 20:57:53"
"100605662991618048","Un estudio de Princeton: las personas altas son más inteligentes, ya que desde la infancia han tenido un rol “superior”","marthadebayle","ES",10,58,"no url","2011-08-08 16:33:53"
