"tweet_id","text","author","language","likes","retweets","media","timestamp"
"208699511550382080","@DiosasDeClari_D Escuchaba lady gaga pero lo apague JAJA Me encanta tu nombre Beluu.. Yo Guada.. :D","ClaritayFefe_Fc","ES",0,0,"no url","2012-06-01 23:20:15"
"208708282234310658","What do Lady Gaga, Brad Pitt and Mike ""The Situation"" have in common? They were all strippers! Check THIS out:http://t.co/DFuPcsF9","UberFacts","EN",27,112,"no url","2012-06-01 23:55:06"
"208708655133114368","RT @UberFacts: What do Lady Gaga, Brad Pitt and Mike ""The Situation"" have in common? They were all strippers! ... http://t.co/F48qG1GO","uzyone","EN",0,0,"no url","2012-06-01 23:56:35"
"208713247203926016","Vote for Lady Gaga as Billboard's sexiest woman in Pop - http://t.co/BhHRLx1B","hausoframez","EN",7,37,"no url","2012-06-02 00:14:50"
"208715680583909376","Lady Gaga regresa con todo!  Aunque se encuentra de gira, la excéntrica artista ya ha comenzado a trabajar en... http://t.co/C2ghHWjs","gaga_alan","ES",0,0,"no url","2012-06-02 00:24:30"
"208717611654057985","lady gaga como Marilyn Monroe? No gracias, a menos que trate de parecerse a su cadáver descompuesto.","FaridXuffi","ES",0,2,"no url","2012-06-02 00:32:11"
"208720046866960385","RT! @worldrecordlbl: Lady Gaga: The most controversial American Pop singer =&gt; http://t.co/P6P2Jrzw","Renaldyy_","EN",0,0,"no url","2012-06-02 00:41:51"
"208723167429148672","Lady GaGa Sets New Twitter Record With 25 Million Followers! http://t.co/cQQWD3dH via @newspin","NewNewTweeter","EN",0,0,"no url","2012-06-02 00:54:15"
"208725757948731393","I think Lady Gaga just puts Glue on herself and rolls around in random items","AMRHANKYBEAT","EN",0,2,"no url","2012-06-02 01:04:33"
"208727307215568897","Adele and lady gaga!! I'm very happy both of us! SO Meny followers!  Ahahaha like it!","KenShiina","EN",0,0,"no url","2012-06-02 01:10:42"
"208730385822121984","@ladygaga Lady Gaga - Black Jesus † Amen Fashion (Audio) http://t.co/StdRgZPg","YourDearFriend_","EN",0,0,"no url","2012-06-02 01:22:56"
"208732176806719490","Lady Gaga llega los 25 millones de usuarios en Twitter. http://t.co/CMKifDUS","RobandoCamara","ES",0,0,"no url","2012-06-02 01:30:03"
"208734903095930882","8:52 PM : Así celebra Lady Gaga los 86 años que cumpliría hoy Marilyn Monroe: Así celebra Lady Gag... http://t.co/00MNZWcU #Noticias #DP","DatoPopular","ES",0,0,"no url","2012-06-02 01:40:53"
"208736341733810178","Vaya noticiario de CHV, madona y lady gaga por largos minutos. Voy al baño y vuelvo!","silviopoderes","ES",0,0,"no url","2012-06-02 01:46:36"
"208737162588463106","'Big Time Rush is Not Talented' I am Lady Gaga everyone. ;]","iWantedBigTime","EN",0,1,"no url","2012-06-02 01:49:52"
"208739919491903490","I liked a @YouTube video http://t.co/z3bBLWXs ""Edge of Glory"" Lady Gaga (Pentatonix Cover)","JodiPickens","EN",0,0,"no url","2012-06-02 02:00:49"
"208744977809940480","“@CaarmenCano “@Ranciosevillano Más peligro que Lady Gaga en Pichardo””","Jose_Sevilla9","ES",0,0,"no url","2012-06-02 02:20:55"
"208750883394166784","New post: Lady GaGa Passes 25 Million Followers On Twitter http://t.co/j6HDbZ10","gemhamma","EN",0,0,"no url","2012-06-02 02:44:23"
"208751722250776576","lets dance de lady gaga esto luego es...xddd","AraMoralesM","ES",0,0,"no url","2012-06-02 02:47:43"
"208751948759969792","#3 Poker Face - Lady GaGa","JackDaJew","EN",0,0,"no url","2012-06-02 02:48:37"
"208764292592439297","@Real_Liam_Payne Hola Liam :) Do you like Lady Gaga?? #askliam happy June for you and the guys ! Argentina loves you xx please follow me 15","peeacenloove","EN",0,0,"no url","2012-06-02 03:37:40"
"208764674248941570","@Real_Liam_Payne Hola Liam :) Do you like Lady Gaga?? #askliam happy June for you and the guys ! Argentina loves you xx please follow me 19","peeacenloove","EN",0,0,"no url","2012-06-02 03:39:11"
"208766221963898881","Lady Gaga - Scheiße http://t.co/JruQGlNk Cada vez me enamora mas esta canción :3","christianRe95","ES",0,0,"no url","2012-06-02 03:45:20"
"208768151394070528","Madonna continua su guerra contra Lady Gaga (parte 2)  Es irónico que entre estas cosas se encuentre el famoso... http://t.co/fEdYQ1hb","MonstersGT","ES",0,2,"no url","2012-06-02 03:53:00"
"208772932858691587","Lady Gaga and Nicki Minaj will collaborate on a album with the Title ""All You Basics Can Deal With This Shit""","KILLGohay","EN",1,0,"no url","2012-06-02 04:12:00"
"208773163516035072","All time favorite song by Lady GaGa is still Just Dance. I think it's because she resembles a normalish human being back then. #lovehertho","jess4tn","EN",0,0,"no url","2012-06-02 04:12:55"
"208773709488603137","Lady Gaga impone récord en Twitter; llega a 25 millones de seguidores. http://t.co/hRtZSD0X","AristeguiOnline","ES",6,43,"no url","2012-06-02 04:15:05"
"208781921243766785","“What you and I have Little Monsters, is not just for a moment. It’s for life.” - Lady Gaga","hausofwinn","EN",1,0,"no url","2012-06-02 04:47:43"
"208784564288626688","Simplemente estaba jugando!Con mucho sueño,bailando lady gaga ....la boludes esta a la orden del Dia! Los quieroo. Buenasnochesnochesbuenas","laliespos","ES",170,664,"no url","2012-06-02 04:58:13"
"208785872261353472","Solar Clothes from Lady Gaga's Stylist - EcoFriend - Solar Feeds http://t.co/yo7US2G3","EcoWanders","EN",0,0,"no url","2012-06-02 05:03:25"
"208792788882563073","Pues nada, ¿Se acuerdan cuando les dije que me cogí a Lady Gaga y resultó que no era mujer? Pues ahora resulta que tampoco era Lady Gaga.","Mr_Papawh","ES",10,4,"no url","2012-06-02 05:30:54"
"208795159297658880","#PalabrasQueCausanDolor Hijo, ya se que eres fan de Madonna y Lady Gaga, pero por qué no has tenido novia?","uIyanov","ES",1,12,"no url","2012-06-02 05:40:19"
"208802653701017600","@feliciablahbleh Keke~ but I don't like them .. I also don't like Lady Gaga :DD I Just love k-pop &lt;3 :'DD","SixBAPAliens","EN",0,0,"no url","2012-06-02 06:10:06"
"208819556750344193","""@MarlenRangel_LH: @Bebe9112 vente bebe estan los show's de jenny &amp; lady gaga"" sale. Jeje divierte mija","Bebe9112","ES",0,0,"no url","2012-06-02 07:17:16"
"208826548629938178","“Trust is like a mirror, you can fix it if it's broken, but you can still see the crack in that mother fucker's reflection.”  - Lady Gaga","prettystayer","EN",0,0,"no url","2012-06-02 07:45:03"
"208828008264507392","Lady Gaga ‘confused by bird’ on day off http://t.co/oQfjFzFk","misformusicnews","EN",0,0,"no url","2012-06-02 07:50:51"
"208835658679201793","When I finally go away I know you'll look for me one day  Read more: LADY GAGA - LET LOVE DOWN LYRIC","ryskadevi","EN",0,0,"no url","2012-06-02 08:21:15"
"208847591440527360","Cada vez que veo un Monster pienso en la canción de Lady Gaga. ¿Obsesionado? Prefiero llamarlo Little Monster.","chemimonsterr","ES",0,3,"no url","2012-06-02 09:08:40"
"208854826631708672","urban clothing: Konvict clothing line by Akon + Lady Gaga at #VMAs http://t.co/0bPQr1LI #popular_clothing_brand","cashcoming","EN",0,0,"no url","2012-06-02 09:37:25"
"208856709861609472","Let's trend: Lady Gaga Saved Pop Music #10 Fucking Perfect @ladygaga ;)","TheSwaagger","EN",0,0,"no url","2012-06-02 09:44:54"
"208857042486706176","Lady Gaga Saved Pop Music &lt;333","HausOfSophiee","EN",0,2,"no url","2012-06-02 09:46:13"
"208857288063205376","Lady Gaga Saved Pop Music . Not only Pop Music but thousands of lives.","MonstersTeeth","EN",1,5,"no url","2012-06-02 09:47:12"
"208857954672328704","#np Lady gaga - paparazzi xD","DearDiyana","ES",0,1,"no url","2012-06-02 09:49:51"
"208858052043087872","@ladygaga Lady Gaga Saved Pop Music thank you,bitch","hotradioGaGa","EN",0,0,"no url","2012-06-02 09:50:14"
"208858848981815296","'Lady Gaga Saved Pop Music' lmfao next joke.","RauhlMeBieber","EN",1,1,"no url","2012-06-02 09:53:24"
"208860023395323905","Lady Gaga Saved Pop Music ??? did it need to be saved ??","MjeedShehri","EN",0,0,"no url","2012-06-02 09:58:04"
"208860904186580993","Lady gaga saved pop music? LOOOOL um no o.o","Graffiti_Freakx","EN",0,0,"no url","2012-06-02 10:01:34"
"208861106532384768","""Lady Gaga Saved Pop Music? Wearing meat isn't saving Music"" -- Yes, because Gaga spent her whole 4-years career wearing meat, didn't she?","hausoframez","EN",5,30,"no url","2012-06-02 10:02:22"
"208861113901785088","Lady Gaga Saved Pop Music aparte, también me salvó a mi de la oscuridad.","MarinaGagaLee","ES",1,4,"no url","2012-06-02 10:02:24"
"208861713666277377","Lady Gaga saved pop music? *snorts* yeah, and the Jonas Brothers saved rock music.","Laura_Columbia","EN",0,0,"no url","2012-06-02 10:04:47"
"208863860256550912","Lady Gaga Saved Pop Music? RT for Yes, Favorite for No.","jamster83","EN",36,80,"no url","2012-06-02 10:13:19"
"208864522381950976","Lady Gaga Saved Pop Music with 3 Studio Albums, 208 Awards, Beautiful Voice, Her Uniqueness &amp; Little Monsters.  http://t.co/QeGjDQ45","CiasteeMONSTER","EN",1,21,"no url","2012-06-02 10:15:57"
"208864855208361984","Lady Gaga Saved Pop Music? From what?","MilanDrama","EN",0,0,"no url","2012-06-02 10:17:16"
"208865376774270976","#GagaIsAnItalian Lady Gaga Saved Pop Music #AskGaga","Gagalilmons","EN",0,3,"no url","2012-06-02 10:19:21"
"208865543065829377","Lady Gaga Saved Pop Music and changed it, sin ella Rihanna, Beyoncé, Nicki Minaj y Katy Perry seguirían teniendo un estilo propio.","MrMonsterBurton","ES",0,10,"no url","2012-06-02 10:20:00"
"208865839842197505","Lady Gaga Saved Pop Music - lol no.","_naivecunts","EN",0,0,"no url","2012-06-02 10:21:11"
"208867426308333568","@NicoMonsterRawr that I dislike lady gaga. I dont. I just dont think her music is pop and by saying she ruined it is because its not pop.","ausssniallfans","EN",0,0,"no url","2012-06-02 10:27:29"
"208867954815795200","Lady Gaga  Marry The Night (Official Video) - Marry The Night (Official Video) Artist: Lady Gaga Label: Interscope D... http://t.co/KBltPskC","redcarpetcafe","EN",0,0,"no url","2012-06-02 10:29:35"
"208868217773494273","'Lady Gaga Saved Pop Music' and 'Happy National Joke Day' are trending simultaneously.. Coincidence? I think not.","georgyy","EN",12,56,"no url","2012-06-02 10:30:38"
"208868789473906688","'Lady Gaga Saved Pop Music' &lt;-- seriously...no -_-","NatalieMLW","EN",0,0,"no url","2012-06-02 10:32:54"
"208869099848208384","Lady Gaga Saved Pop Music #Fact","Aboywithdreams","EN",0,0,"no url","2012-06-02 10:34:08"
"208869903426519040","Lady Gaga Saved Pop Music; She made dance music relevant again, many pop stars are influenced by her and she's only 4 years into her career.","gagamonster96","EN",9,50,"no url","2012-06-02 10:37:20"
"208871297663500289","Lady Gaga didn't save shit, especially not pop music.","connieopstad","EN",0,0,"no url","2012-06-02 10:42:52"
"208872554952269826","""Lady Gaga Saved Pop Music"" Aw. Happy National Joke Day.","itsourkidrauhl","EN",5,119,"no url","2012-06-02 10:47:52"
"208873264800473088","Lady GaGa Saved Pop Music :)","GaGaHoje","EN",0,0,"no url","2012-06-02 10:50:41"
"208874195914993665","@nmcgivney I thought the audience were the stars of the first half. Got the feeling he wussed out of the Lady Gaga joke entirely…","cmcgovern","EN",0,0,"no url","2012-06-02 10:54:23"
"208875661136375809","''Lady Gaga Saved Pop Music'' Sorry. You spelled ''Michael Jackson'' wrong.","itsourkidrauhl","EN",25,178,"no url","2012-06-02 11:00:12"
"208876308871131137","""Lady Gaga Saved Pop Music"" Like a genre of music can some how die :L?","JennaTeamSats","EN",0,1,"no url","2012-06-02 11:02:47"
"208877730702426112","""Lady Gaga Saved Pop Music"" and ""Happy National Joke Day"" are both trending.. coincidence?","pippaaaa","EN",52,456,"no url","2012-06-02 11:08:26"
"208882156720750594","Lady Gaga Saved Pop Music sin duda, the Queen...","gsuscg","EN",0,0,"no url","2012-06-02 11:26:01"
"208882240623620096","También versionaron Grease, Lady Gaga o Beyoncé #ídolos #Milloverde http://t.co/raAyAcii","8Coraline8","ES",0,0,"no url","2012-06-02 11:26:21"
"208882953646915586","#DemiIsTheMostBeautifulWoma #JustinAtCapitalSTB #TextsThatGetNoReply Our Justin Is Definition Of Perfection Lady Gaga Saved Pop Music","RahmatManguleta","EN",0,0,"no url","2012-06-02 11:29:11"
"208886989485916161","Nicki Minaj: Pink Hair, Katy Perry: Blue Hair, Rihanna: Red Hair &amp; Lady Gaga: Green Hair. Guess who's back, the Power Rangers.","DaKidrauhlCrew","EN",9,41,"no url","2012-06-02 11:45:13"
"208887242419220480","He soñado con @andreavives34 @MartaGomis5 y Lady Gaga, ha sido curioso","claraanton","ES",0,0,"no url","2012-06-02 11:46:14"
"208887634465013760","""Lady Gaga Saved Pop Music"" I strongly disagree. She's a total bitch.","TheDisagreer","EN",0,0,"no url","2012-06-02 11:47:47"
"208890176238395393","Stop saying ""Lady Gaga Saved Pop Music, It's National Joke Day"" like 98109832 of you said that already. Can't even think of a good comeback?","monstersophia","EN",0,4,"no url","2012-06-02 11:57:53"
"208891660996837376","14. Lady Gaga: Marry the night","loveainsworth","EN",0,0,"no url","2012-06-02 12:03:47"
"208897243628044288","Lady GaGa Saved Pop Music; Happy National Joke Day :')","chantelle095","EN",0,0,"no url","2012-06-02 12:25:58"
"208899726677000194","One Direction, Greyson Chance, Justin Bieber, Cody Simpson, Lady Gaga, Madonna, Katy Perry, Miley Cyrus. I just waiting for our The Wanted.","YeahTheWanted","EN",0,0,"no url","2012-06-02 12:35:50"
"208899953131659264","Yo no me explico por qué coño la gente se sorprende del aspecto de Lady Gaga si ya teníamos a Marilyn Manson.","Cresle07","ES",0,0,"no url","2012-06-02 12:36:44"
"208900490015158272","RT if you kiss your Lady Gaga posters.","LadyGagaRTs","EN",1,5,"no url","2012-06-02 12:38:52"
"208901312094552065","@CherylZumba hmm SOO many suggestions... Pitbull-Pause or shut it down, Lady Gaga, JLo-Dame  I have many more, we will  discuss Sun :)","SarahCole00","EN",0,0,"no url","2012-06-02 12:42:08"
"208904193577189376","#np marry the night - lady gaga","Grace_Clinton","EN",0,0,"no url","2012-06-02 12:53:35"
"208904759837605891","Lady Gaga :) http://t.co/Gd5uVajI","TeoLovesCookies","EN",0,0,"https://pbs.twimg.com/media/AuYtxbJCQAAH2o3.jpg","2012-06-02 12:55:51"
"208905039031451648","How can Lady Gaga sneak into the airport without being seen by her little monsters? She must still be in Singapore.","spinorbinmusic","EN",0,17,"no url","2012-06-02 12:56:57"
"208906013926113281","#YouKnowGodIsPunishingYou when lady Gaga is madly inlove with you","chillonyia","EN",0,0,"no url","2012-06-02 13:00:49"
"208910069822271489","[#People] Lady Gaga pas top en Marilyn Monroe (Staragora) http://t.co/cLnLIle4","Valaudran","ES",0,0,"no url","2012-06-02 13:16:56"
"208911273583329280","Bloody mary - lady gaga","cynthia_tasya","ES",0,0,"no url","2012-06-02 13:21:43"
"208924770866171905","Oh cool, Madonna is in concert again... Move over Lady Gaga here comes Lady Grandma!","kdiggs2","EN",0,1,"no url","2012-06-02 14:15:21"
"208925613883527169","@ladygaga I love Lady Gaga. Bkk","FAM_Ponson","EN",0,0,"no url","2012-06-02 14:18:42"
"208927929755901952","""You and me could write a bad romance!"" Sorry Lady Gaga, looks like Stephenie Meyer beat you to it....","HarryPotterful","EN",11,31,"no url","2012-06-02 14:27:54"
"208930873544933378","Lady Gaga - Yoü And I - http://t.co/0mkMBGlT","allmusicnews","EN",0,0,"no url","2012-06-02 14:39:36"
"208935004959555584","Lady Gaga Twitter Record: First to Reach 25 Million Followers - Christian Post: Christian PostLady Gaga Twitter ... http://t.co/xlPg1Urq","ladygagamyfans","EN",0,0,"no url","2012-06-02 14:56:01"
"208937553712254976","¿Sabéis que Lady Gaga al revés es Agag Ydal y que en en alemán no significa nada? Inquietante, ¿verdad?","Juanmasaurus","ES",5,70,"no url","2012-06-02 15:06:09"
"208939769697288192","I think they should make whole new branch of Twitter for JB and 1D and Lady Gaga fans only. They so annoying","MlyesJ","EN",0,0,"no url","2012-06-02 15:14:57"
"208942072370180096","Lady Gaga - Alejandro +  [ Lyrics on Screen ] - HQ/HD: http://t.co/UBZMgxhI via @youtube","Calvinwiratamaa","ES",0,0,"no url","2012-06-02 15:24:06"
"208942571479773184","Yes. YES. RT @YesItsBeth My hate for lady gaga goes beyond words","PerlaRahmeh","EN",1,1,"no url","2012-06-02 15:26:05"
"208947149432565761","9.- Que piensas sobre Lady Gaga? Que canta bien y que es genial que apoye a todas las personas sin importar como son ;)","BellaSchmidt1D","ES",0,0,"no url","2012-06-02 15:44:17"
"208949143933173762","Lady Gaga pays tribute to Marilyn Monroe: Lady Gaga has paid tribute to Marilyn Monroe, on what woul have been t... http://t.co/M7RFh56V","MalwareBeGone","EN",0,0,"no url","2012-06-02 15:52:12"
"208949840183443457","@Fiona_Kamikazi here you can get 25 millions followers nka lady gaga","ikaneza","EN",0,0,"no url","2012-06-02 15:54:58"
"208952063181332480","#LadyGaga Lady Gaga pays tribute to Marilyn Monroe http://t.co/kwH7OgMd","LadyGagaHotNewz","EN",0,0,"no url","2012-06-02 16:03:48"
"208953426346913792","Marqué un video de @YouTube como Me gusta http://t.co/YZZWkIvJ Lady GaGa Live in Hong Kong final show","MaLiMonster20","ES",0,0,"no url","2012-06-02 16:09:13"
"208956261662863360","Lady Gaga, primera tuitera que supera los 25 millones de seguidores","cristopherbray1","ES",0,0,"no url","2012-06-02 16:20:29"
"208957738087219200","I love the way Lady Gaga sometimes updates fb with totes boring everyday things like what movie she's currently watching-SHE'S JUST LIKE ME.","samantharcher","EN",0,0,"no url","2012-06-02 16:26:21"
"208961181610811395","Lady Gaga Likes It Hot http://t.co/hnh3vINC #LadyGaga","GagaNewsFirst","EN",0,0,"no url","2012-06-02 16:40:02"
"208961701708701696","and before anyone does a Lady Gaga on Bigbang for Monster MV, read the lyrics first so you'll get what the concept is about.","gorgeousubbie","EN",0,0,"no url","2012-06-02 16:42:06"
"208967015887679488","Elton John esta muy preocupado por Lady Gaga.  En una nueva entrevista con el legendario cantante Elton John, ha... http://t.co/mNaxkiDx","EspirituGaga","ES",0,0,"no url","2012-06-02 17:03:13"
"208970333754105857","Ni Michael Jackson, ni Madonna, ni Lady Gaga, ni The Beatles... Sólo mi ídolo agotó las entradas del MSG en 30 Segundos .","bealwaysself","ES",4,32,"no url","2012-06-02 17:16:24"
"208975224379686913","No offense, but I prefer the old lady gaga!!! like the one back in 2008 :( I find her really weird now...","NaomiNeo_","EN",4,76,"no url","2012-06-02 17:35:50"
"208976515956879360","I added a video to a @YouTube playlist http://t.co/tKOpOZYJ Lady Gaga - Hair (Audio)","follow_vid","EN",0,0,"no url","2012-06-02 17:40:58"
"208976515977842688","I added a video to a @YouTube playlist http://t.co/HUusKP5G Lady Gaga - Scheiße","follow_vid","EN",0,0,"no url","2012-06-02 17:40:58"
"208976515977850882","I added a video to a @YouTube playlist http://t.co/jvHc7swF Lady Gaga - Paparazzi","follow_vid","EN",0,0,"no url","2012-06-02 17:40:58"
"208976515982032900","I added a video to a @YouTube playlist http://t.co/8gnZv7Eg Lady Gaga - The Fame Monster Best Buy In-Store","follow_vid","EN",0,0,"no url","2012-06-02 17:40:58"
"208976515982041090","I added a video to a @YouTube playlist http://t.co/wjrZNw2U Lady Gaga - Eh, Eh (Nothing Else I Can Say)","follow_vid","EN",0,0,"no url","2012-06-02 17:40:58"
"208976515982045188","I added a video to a @YouTube playlist http://t.co/KCtvB1e1 Lady Gaga - I like it rough (lyrics)","follow_vid","EN",0,0,"no url","2012-06-02 17:40:58"
"208976515982049280","I added a video to a @YouTube playlist http://t.co/woSfzhTs Wale - Chillin (Behind the Scenes) ft. Lady Gaga","follow_vid","EN",0,0,"no url","2012-06-02 17:40:58"
"208976515982049281","I added a video to a @YouTube playlist http://t.co/9ULZYGTA Lady GaGa - ""CHRISTMAS TREE"" WORLD PREMIERE XMAS","follow_vid","EN",0,0,"no url","2012-06-02 17:40:58"
"208976515986231296","I added a video to a @YouTube playlist http://t.co/2082nM7M Lady Gaga - Poker Face","follow_vid","EN",0,0,"no url","2012-06-02 17:40:58"
"208976515986231298","I added a video to a @YouTube playlist http://t.co/mNLbbCyQ Lady Gaga - Bad Romance","follow_vid","EN",0,0,"no url","2012-06-02 17:40:58"
"208976515986239489","I added a video to a @YouTube playlist http://t.co/UgXVlt9O Lady Gaga - Orange Colored Sky (Audio)","follow_vid","EN",0,0,"no url","2012-06-02 17:40:58"
"208976515990425600","I added a video to a @YouTube playlist http://t.co/jtwFpmvt Lady Gaga - Highway Unicorn (Road To Love)","follow_vid","EN",0,0,"no url","2012-06-02 17:40:58"
"208976515990425601","I added a video to a @YouTube playlist http://t.co/a0f8D6kx Lady Gaga - Bloody Mary","follow_vid","EN",0,0,"no url","2012-06-02 17:40:58"
"208976515990437889","I added a video to a @YouTube playlist http://t.co/cxWCD8MO Lady Gaga - Americano","follow_vid","EN",0,0,"no url","2012-06-02 17:40:58"
"208976515990437890","I added a video to a @YouTube playlist http://t.co/3ROLLKqm Lady Gaga - Dance in the Dark - Music Video (HD)","follow_vid","EN",0,0,"no url","2012-06-02 17:40:58"
"208976515994615808","I added a video to a @YouTube playlist http://t.co/PbYG6ksB Brown Eyes - Lady GaGa Lyrics","follow_vid","EN",0,0,"no url","2012-06-02 17:40:58"
"208976515994619904","I added a video to a @YouTube playlist http://t.co/cjsFA5Aq Lady GaGa - Paper Gangsta","follow_vid","EN",0,0,"no url","2012-06-02 17:40:58"
"208983189107118080","@ladygaga how are you Lady Gaga? Hope you're fine! :)","ryokochan1995","EN",0,0,"no url","2012-06-02 18:07:29"
"208983268790517760","iCant help it.. But sometimes iThink Lady Gaga just puts glue on herself and rolls around on random things ...","Pixey_09","EN",0,0,"no url","2012-06-02 18:07:48"
"208984963314499584","@emilyjane333 U're like Lady Gaga with ur avatars, u keep changing with every tweet. Those Internet rumours of u havin a hairy belly r wrong","Manc_Marvin","EN",0,0,"no url","2012-06-02 18:14:32"
"208988654285238273","Lady Gaga - Telephone ft. Beyoncé http://t.co/mvWw6dck","lgagaperu","EN",1,0,"no url","2012-06-02 18:29:12"
"208989485634027522","Did you catch the score? @joycemeyer 30 / Lady Gaga 1: http://t.co/7UUVItmt","stevenfurtick","EN",29,157,"no url","2012-06-02 18:32:30"
"208989505745727488","Lady Gaga, reina del Twitter http://t.co/L5H0OZRL vía @sharethis","JhoennyGutierre","ES",0,0,"no url","2012-06-02 18:32:35"
"208994937344241665","Born This Way - Lady GaGa","cVraiRadio","EN",0,0,"no url","2012-06-02 18:54:10"
"208995402937139200","Madonna: ""Lady Gaga no es como yo"" / Inicio de su gira http://t.co/lTsx9jxc vía @europapress_es","J_A_O_C","ES",0,0,"no url","2012-06-02 18:56:01"
"208997323899019264","Lmao! Mines Born this way! RT @Ayahembah: Judas RT @Ebukar: What is Your LEAST favourite Lady gaga song?","Ebukar","EN",0,0,"no url","2012-06-02 19:03:39"
"208997760123420672","if u hate lady gaga the u have no purpose to keep living","tupacrauhl","EN",0,0,"no url","2012-06-02 19:05:23"
"209001832046014464","Reassuring to know that right now, in a parallel Universe, I'm a Jewish tangerine eating napkins off of Lady Gaga's foyer.","SamGrittner","EN",12,2,"no url","2012-06-02 19:21:34"
"209001956549734401","Lady Gaga Gets Ready to Unveil Little Monsters Social Network. Record labels should pay attention: engage not enrage! http://t.co/CF6mtGYi","gleonhard","EN",2,10,"no url","2012-06-02 19:22:04"
"209003539865935873","A ver si Quadri con sus eternas simpatizaciones no sale del clóset o se lo encuentran vestido de Lady Gaga y así.","DeEspejel","ES",0,0,"no url","2012-06-02 19:28:21"
"209003812491505664","Cool, Lady Gaga Gets Ready to Unveil Little Monsters Social Network http://t.co/ACjxbmfH","Hessda","EN",0,0,"no url","2012-06-02 19:29:26"
"209006430630580225","I think lady gaga should make a movie considering all of her music videos are like grade a.","ImaFucknMermaid","EN",0,0,"no url","2012-06-02 19:39:50"
"209011676807303169","Trying her with 'One more cup of coffee', Dylan &amp; Baez http://t.co/k8dWprp2 - She wants some Lady Gaga  instead :(","PDarigan","EN",0,0,"no url","2012-06-02 20:00:41"
"209021789312000000","CHARICE MIMICS The voices of Justin Bieber, Rhiana, Lady Gaga, Britney S...: http://t.co/wv11Jgox via @youtube","Aihleeness","EN",1,1,"no url","2012-06-02 20:40:52"
"209022397465112576","Desayunando: Hermano Yo quisiera ir a ver a Lady Gaga Yo:Yo moriría en el concierto de One direction Mamá: Yo quiero ir a ver a Madonna","CookingMajo","ES",0,0,"no url","2012-06-02 20:43:17"
"209024519774539776","So i read #oomf's tweet and think of lady gaga. And he's very hetero. #yeahimsleepy.","MickeyDeLaRouge","EN",0,0,"no url","2012-06-02 20:51:43"
"209027144830033920","Lady Gaga's new album will be 'insane' http://t.co/Nvtd3epm","NewstalkZB","EN",0,1,"no url","2012-06-02 21:02:09"
"209031020970901504","Hillarious! RT @bren_69 3-Way (The Golden Rule) (feat. Justin Timberlake &amp; Lady Gaga) http://t.co/kX3qQmhw via @youtube","19luara","EN",0,0,"no url","2012-06-02 21:17:33"
"209039791256379394","Lady gaga la Mujer que trae mas Rating ? En el gran estreno de el episodio ""Lisa Goes Gaga"" el Rating de Fox... http://t.co/0g6ibeQU","miligermanotta","ES",0,0,"no url","2012-06-02 21:52:24"
"209040802498887680","Vota por Lady Gaga como la mujer mas sexy en la industria musical http://t.co/OsZG5xFM.","LadyGagaVzla","ES",0,6,"no url","2012-06-02 21:56:25"
"209045071880929280","Lady Gaga Without Make Up http://t.co/ndVQEilm","heavycildo","EN",0,0,"no url","2012-06-02 22:13:23"
"209047479411421187","Lady GaGa obviously uses hacks to get 24 million followers #buysthem","rakeemislam_","EN",0,0,"no url","2012-06-02 22:22:57"
"209048146309939200","RT @StevenSEMI: ¡IMPACTANTE! foto de Lady Gaga y Madonna juntas, al parecer para grabar ... http://t.co/WZRbkjaA","Adriantiksoul","ES",0,0,"no url","2012-06-02 22:25:36"
