"tweet_id","text","author","language","likes","retweets","media","timestamp"
"112429413450260480","Another great show by Ray LaMontagne @ Greek Ampitheatre Berkeley http://t.co/Ca2Hex1","chuck415","EN",0,0,"no url","2011-09-10 07:37:15"
"112599119188602880","@jennakozel duuuude - yes! I have to be in Berkeley by 5, but otherwise i could play this afternoon.","Phillyberg","EN",0,0,"no url","2011-09-10 18:51:36"
"112699185433817088","seeing @fleetfoxes tonight at the Greek Theatre in Berkeley with @mimigee and @emigrannis :) what's everyone else up to tonight?","kinagrannis","EN",5,3,"no url","2011-09-11 01:29:14"
"112702093558689793","@Anna_Berkeley Of course! #Red","MorganBNeal","EN",0,0,"no url","2011-09-11 01:40:47"
"112709207068901376","#btownshit im from south berkeley hoe","papascoob","EN",0,2,"no url","2011-09-11 02:09:03"
"112726680547770368","@guidorosso Dying to hear how that goes, dude. I hate my AT&T DSL with an unbridled burning passion. Wonder if I can get it in Berkeley…","trevorchilds","EN",0,0,"no url","2011-09-11 03:18:29"
"112738126828539904","I'm at University of California, Berkeley (108 Martin Luther King Student Union, at Bancroft Way, Berkeley) http://t.co/CWdWIYP","e_saputRa_eS","EN",0,0,"no url","2011-09-11 04:03:58"
"112766375465975808","Hannah K.'s Review of Top Dog - Berkeley (4/5) on Yelp: Damn, that write a review button is… http://t.co/oV9NB72","groupbuyon","EN",0,0,"no url","2011-09-11 05:56:13"
"112768887824723968","So, what was good? ""@metu_berkeley: Hehehe! No oh, abeg ""@Claspie: What? Sex? ""@metu_berkeley It felt gud""""""","Claspie","EN",0,0,"no url","2011-09-11 06:06:12"
"112774701138460672","Tomorrow night, 5pm, all ages! @ Gilman In Berkeley! BOATS! Emily's army & The Vibrators!","BOATSSAC","EN",0,2,"no url","2011-09-11 06:29:18"
"112795622343577600","Thank you Jesus haha. These guys and harmonizing, are even better live. Yes. RT @fleetfoxes BERKELEY! The Best!!!!! Fuck!","cyndylove","EN",0,0,"no url","2011-09-11 07:52:26"
"84661573158842370","http://yfrog.com/h8jg4kpj  Gonz at my old house in Berkeley. We lived in the basement where Longview video was shot. Thanks steve!","BJAofficial","EN",858,877,"no url","2011-06-25 16:37:46"
"86543293571280897","Record number of students choose UC Berkeley http://bit.ly/lwy4M1","UCBerkeleyNews","EN",0,9,"no url","2011-06-30 21:15:03"
"86598079226187776","@100aocs @saignee Vintage Berkeley Elmwood just got in a couple of Landron wines today, but no Amphibolite.","jaylatham","EN",0,0,"no url","2011-07-01 00:52:45"
"86605750616596480","Looking for answers after a #Berkeley car accident? Want to know your best course of action to protect your rights? http://dld.bz/abqpb","OaklandAcc","EN",0,0,"no url","2011-07-01 01:23:14"
"86627590344941568","Senior Power: The Experience of Dying. Category: Columns from The Berkeley Daily Planet http://ow.ly/5tU3k","MVIsystems","EN",0,0,"no url","2011-07-01 02:50:01"
"86745643246297088","Just registered on the Stanley University, completed my first course wahoo!","Sandrews105","EN",0,0,"no url","2011-07-01 10:39:07"
"86749632025214976","1020 Route 9, Berkeley Township, NJ, 08721 - Residential (land ... http://bit.ly/mPTZgq","RonFurmanANP","EN",0,0,"no url","2011-07-01 10:54:58"
"86816912864067584","how to increase heap size of java cache memory: I'm using berkeley db java edition (Base api) to insert 5 lack r... http://bit.ly/lyjORf","caveoverflow","EN",0,0,"no url","2011-07-01 15:22:19"
"86823753778073601","I'm at TOMS Shoes (3025 Olympic Blvd, Berkeley, Los Angeles) w/ 2 others http://4sq.com/iKEqBT","movieguyjon","EN",0,0,"no url","2011-07-01 15:49:30"
"86850899292602368","Tiene siglos que no escucho Berkeley Girl... Perfecta para días lluviosos.","Karindie","ES",0,0,"no url","2011-07-01 17:37:22"
"86886659932684290","Berkeley Council tries to stop ICE audit of local factory, arguing they are a sanctuary city. O_o http://t.co/HKDXz5y *grabs popcorn*","Tracker_Corp","EN",0,0,"no url","2011-07-01 19:59:28"
"86901973324017665","Shout Out to UCSD Students - Take a Look at Some Amazing Sustainability Projects for UC Berkeley's TGIF Grants 2011! http://ht.ly/5rHaM","SustainUCSD","EN",0,0,"no url","2011-07-01 21:00:19"
"86907518219071488","I'm at Berkeley College Garret Mountain Campus (44 Rifle Camp Road, Woodland Park) http://4sq.com/kfFDlM","VonNeumanMusic","EN",0,0,"no url","2011-07-01 21:22:21"
"86929709656571904","New Dates: ""Metamorphosis"" @ Aurora Theatre (Berkeley, CA) http://bit.ly/iY1fHg","GoldstarSF","EN",0,1,"no url","2011-07-01 22:50:32"
"87046685213204480","@_PublicEnemy_01 I go 2 Morgan State University and where's Western School of....located lol","Man_What","EN",0,0,"no url","2011-07-02 06:35:21"
"87066004198408192","Wif u bah...RT @metu_berkeley: I'm sure sumfin went down last nyt #hoekaybye RT @Oyindamolar: @Miniodus @Miniodus @Miniodus Where art thou??","Oyindamolar","EN",0,0,"no url","2011-07-02 07:52:07"
"87245147544371200","Large thunderstorm on the Williamsburg/Berkeley Co. line drifting slowly SW toward Lake Moultrie. #chswx #SCWX","WCIVWX","EN",0,1,"no url","2011-07-02 19:43:58"
"87259885888208898","Writing at Peet's in Berkeley. Keith and Ken, Buddhists at the next table, asked me to come chant with them tonight. #buddhistpickuplines?","TaraLeighCobble","EN",0,0,"no url","2011-07-02 20:42:32"
"87307705127149568","come celebrate the 4th of july @ the berkeley marina 12-9:30, there will be #fireworks, & #crepelicious #crepes, made by la crepe a moi","lacrepeamoi","EN",0,0,"no url","2011-07-02 23:52:33"
"87338545848664064","just posted a pic: (@ Downtown Berkeley BART) http://picplz.com/BvV4","YoungGun821","EN",0,0,"no url","2011-07-03 01:55:06"
"87351032321028097","@PollyBart in Berkeley? But of course :)","GreenSmith","EN",0,0,"no url","2011-07-03 02:44:43"
"87368065356005376","Leaving Berkeley to head back into the city. Good to be out today.","Kcecelia","EN",0,0,"no url","2011-07-03 03:52:24"
"87384146330128385","I'm at Spenger's Fresh Fish Grotto (1919 4th St, btw Hearst & University, Berkeley) http://4sq.com/jxEk22","Neatnique","EN",0,0,"no url","2011-07-03 04:56:18"
"87457445999415296","“@glynmoody: Loss of the UC Berkeley Podcasts - http://t.co/pGUNZcR and why? ""unable to migrate out of a proprietary format""","SUCopyright","EN",0,0,"no url","2011-07-03 09:47:34"
"87471916348223488","12:00 Private Passions: Michael Berkeley's guest is comedian Alex Horne. http://bbc.in/lx9ce3","onradio3now","EN",0,0,"no url","2011-07-03 10:45:04"
"87554338611937280","berkeley! I remember @hoffm raving about @local123, so headed there to do some work.","evilchili","EN",0,0,"no url","2011-07-03 16:12:35"
"87573949969469440","4th of July at the Berkeley Marina - an all day event with fireworks when it gets dark. http://fb.me/18PbyXaIl","dwntwnberkeley","EN",0,2,"no url","2011-07-03 17:30:31"
"87636232397533184","Stella Paul: Jewish U Presidents who fail to protect Jewish Students.  At UC Berkeley it's risky to support #Israel http://ning.it/kfobjo","roovik","EN",0,0,"no url","2011-07-03 21:38:00"
"87675302314123264","Lisa H.'s Review of UC Electronics - Berkeley (1/5) on Yelp: My friend had a bad experience… http://goo.gl/fb/6W87q","groupbuyon","EN",0,0,"no url","2011-07-04 00:13:15"
"87677038793732096","I think I just seen a dude from Berkeley just chillin on a stoop. Thought I was in tampa for a second.","therealAmBam","EN",0,0,"no url","2011-07-04 00:20:09"
"87823105430523904",":P photography 40th Anniversary Extravaganza  Tent Event Set for Looking Glass Photo of Berkeley http://t.co/WEccVsR","lionlinf","EN",0,0,"no url","2011-07-04 10:00:34"
"87904838129680384","OBIA DJ'S|STUDIOS x @SDEPROMO x @StreetDreamaz invite u to #OneMicMondays @ Twilight 10210 Berkeley Place Dr. 9p 7/4/11","DonP_SDE","EN",0,3,"no url","2011-07-04 15:25:21"
"87950880690810880","$69 Spacious Serenity Near UC Berkeley (North Berkeley): San Francisco | San-Francisco-Area | San Francisco | In... http://bit.ly/jIwr0X","reiunab","EN",0,0,"no url","2011-07-04 18:28:18"
"88105331741294592","Secure Computing | Intel Labs: Intel Science And Technology Center At UC Berkeley http://dlvr.it/YyjDt","CathyWKnight","EN",0,0,"no url","2011-07-05 04:42:02"
"88167537468129280","Berkeley Research Proves Use of Magnetic Memory and Logic in Computers Saves ... http://bit.ly/kXD1Vs","juliecute","EN",0,0,"no url","2011-07-05 08:49:13"
"88219337944600577","From strategy+business: Henry Chesbrough exec dir of the Prog for Open Innovation at UC Berkeley on services #innovation http://ow.ly/5mPvO","BoozCompany","EN",1,4,"no url","2011-07-05 12:15:03"
"88299351834755072","The Berkeley Blog: Technology & toys in Tokyo http://bit.ly/j1eez3","UCBerkeley","EN",0,0,"no url","2011-07-05 17:33:00"
"88329294987792384","Berkeley, CA Foreclosure List – Bank Owned Properties  http://t.co/Mhqze3l via @craigbosse","CraigBosse","EN",0,0,"no url","2011-07-05 19:31:59"
"88340766400851970","@NikeSbFresh2 Can u PLS Support by #fallowme View, RT & commenting on my latest video http://t.co/THrVfIF #BERKELEY","FamousFi","EN",0,0,"no url","2011-07-05 20:17:34"
"88360265720143874","Severe Thunderstorm Warning for Berkeley County in SC until 6:30pm EDT. #scwx","severewarn","EN",0,0,"no url","2011-07-05 21:35:03"
"88365191921795072","Sanctuary Berkeley Church Info! - http://eepurl.com/duWfz","sanctuaryberk","EN",0,3,"no url","2011-07-05 21:54:38"
"88377319751815168","Published a new blog post: Martin Berkeley 4-pc Combo Black base w/ White Top, Tray Lamp and Drafting Ht. RED Chair... http://bit.ly/mVqSQJ","bedlamps","EN",0,0,"no url","2011-07-05 22:42:49"
"88500196115349504","@KiaSymone  Can u PLS Support by #Followme View, RT & commenting on my latest video http://t.co/THrVfIF #BERKELEY","FamousFi","EN",0,0,"no url","2011-07-06 06:51:05"
"88522748858605568","James Baldwin: Witty, Fiery in Berkeley, 1979 [video] -@OpenCulture http://j.mp/qdEzE3","akwala","EN",0,0,"no url","2011-07-06 08:20:42"
"88621842226618368","@Scentsy will be adding #PennState, Univ. of Cal Berkeley, #Stanford , & #Fresno State to the Campus Collection lineup as of 8/1!","scentsifiedchat","EN",0,4,"no url","2011-07-06 14:54:28"
"88646438912929792","Dear city of Berkeley, try staggering the renewal periods for the different zones to avoid a city wide run on parking permits every july.","mattgrothman","EN",0,0,"no url","2011-07-06 16:32:12"
"88647982387441664","Berkeley Lab researchers apply NMR/MRI to microfluidic chromatography http://bit.ly/mY7RgD","BerkeleyLab","EN",0,3,"no url","2011-07-06 16:38:20"
"88686091846164480","Just had a massage by sorrel sand at rudramandir center in berkeley. I feel amazing!","ShaunLowecki","EN",0,0,"no url","2011-07-06 19:09:46"
"88710431413239809","@LangeAlexandra @javierest and closely related to my Berkeley upbringing. I still won't wear Birkenstocks. crugly is a special breed of ugly","loudpaper","EN",0,0,"no url","2011-07-06 20:46:29"
"88780455301746689","RT @enlightphoto: @DrMarm getting above the fog in the Berkeley Hills can also be real nice; see: http://t.co/HfBqjfP That is gorgeous!","DrMarm","EN",0,0,"no url","2011-07-07 01:24:44"
"88797840704405505","Tecnicart Homes Starts Construction @ Primrose in Harding Township, NJ $1,600,000, - Berkeley Heights, NJ Patch http://t.co/w7lJHVD","NJEstates","EN",0,0,"no url","2011-07-07 02:33:49"
"88862596555481088","@OMGitsSha I'm 15minutes away so its easy for me. I miss Berkeley.. I'm going to handle my business and move back somewhere n the hills","RealRonDeuce","EN",0,0,"no url","2011-07-07 06:51:08"
"88927784411475968","Oh, Oh - does the children's book 'The Bunyip of Berkeley's Creek' count as Australian mythology? I LOVED that book as a child! #spbkchat","callyjackson","EN",0,0,"no url","2011-07-07 11:10:10"
"89002027794968578","@Cal #Berkeley Asst. Prof. discusses the impact of a state bill requiring public schools to teach #lgbt history http://ow.ly/5yIE7","KQEDnews","EN",1,0,"no url","2011-07-07 16:05:11"
"89005416805175298","Your mom is so Berkeley she uses crystals for everything-- decoration, jewelry, healing, deodorant...#YMISB","yourmomissoberk","EN",0,0,"no url","2011-07-07 16:18:39"
"89018649842683904","Headed to Cafe Yesterday in Berkeley! #fb","TylerHudg","EN",0,0,"no url","2011-07-07 17:11:14"
"89057421972078592","Lmao remembering when @StephRami8 told @papa_imrich ""If you get into UC Berkeley I'm going to cut your face off and put it on mine""","zeniabenia","EN",0,0,"no url","2011-07-07 19:45:18"
"89069107286261760","Beautiful day for Broker Tour in the Oakland - Piedmont - Berkeley area! | http://t.co/tWur0yH","anthonyriggins","EN",0,0,"no url","2011-07-07 20:31:44"
"89131078123663360","RT @DrPostALot: CHECK CHECK IT OUT!!! @NettaBrielle's New site http://t.co/bQNzCbD #BayArea #Berkeley #LosAngeles #NewYork","NettaBrielle","EN",0,1,"no url","2011-07-08 00:37:59"
"89141165449940992","ahem...Go Bears....UC Berkeley, Stanford among top universities in the world according to report | abc7news.com http://bit.ly/nhfDzL","BeeNCeedotcom","EN",0,2,"no url","2011-07-08 01:18:04"
"89168088699908096","New Gig announced in Berkeley, CA at Chesters on 7/10/2011 http://bit.ly/qWyuSD","CatapultFusxion","EN",0,0,"no url","2011-07-08 03:05:03"
"89185916681326592","UC Berkeley among top universities in the world according to report. Go Bears! | abc7news.com http://bit.ly/nhfDzL","chriswitmer","EN",2,15,"no url","2011-07-08 04:15:54"
"89210354692927488",".. Busby Berkeley routine  http://www.youtube.com/watch?v=OapAHXIym7s&feature=related","myhoope","EN",0,0,"no url","2011-07-08 05:53:00"
"89341380559769600","A nightingale sang in Berkeley Square. Thankfully #Jedward weren't when I saw them out shopping there in matching outfits. #onlyinlondon","JimMurgatroyd","EN",0,0,"no url","2011-07-08 14:33:39"
"89349668470915072","#openhome_berkeley 1221 HOPKINS ST BERKELEY (Sat Jul 09 02:00 PM to 04:30 PM) Listed by NANCY TAUSSIG: http://goo.gl/r73vf","homesopentoday","EN",0,0,"no url","2011-07-08 15:06:35"
"89358391809552384","Feast of Our Lady of Mt Carmel,  July 13 - 16 in Berkeley Heights, has a website this year http://t.co/Jq8k4Gh","BHPLibrarian","EN",0,1,"no url","2011-07-08 15:41:15"
"89398318207213569","Ask, and you shall receive another reason why Toyota of Berkeley is Decidedly Different: you can order your parts... http://fb.me/AT3gUCle","ToyotaBerkeley","EN",0,0,"no url","2011-07-08 18:19:54"
"89436017857277952","Definitely  @ Berkeley Hat Co. http://gowal.la/p/g93F #photo","Aavarnum","EN",0,1,"no url","2011-07-08 20:49:42"
"89441192391094272","Berkeley Grads Break into Green Business with ‘Shrooms-in-a-Box http://bit.ly/oROg0X","GreenSkoopr","EN",0,0,"no url","2011-07-08 21:10:16"
"89599933216337920","Local Univerisities Attempt To Catch A Quake: Researchers at Stanford and UC Berkeley are placing sensors in Bay... http://bit.ly/o5mELj","KTVU","EN",0,2,"no url","2011-07-09 07:41:03"
"89802699473829889","So I'll be in Berkeley between Sep 10-17. What should I do in the Bay Area? (Already planning to go to the Computer History Museum :3 )","ilovecomputers","EN",0,0,"no url","2011-07-09 21:06:46"
"89813629817470976","Enjoying the weather in Berkeley right now. :)","TMGorospe","EN",0,0,"no url","2011-07-09 21:50:12"
"89814082806484992","Berkeley Baby! with nugget and @susannochka (@ Biofuel Oasis) [pic]: http://4sq.com/oXiJxn: Berkeley Baby! with ... http://bit.ly/nT0r2I","algaebiofuels","EN",0,0,"no url","2011-07-09 21:52:00"
"89849398850355200","Bingo. Kiffin connection at Berkeley too much. Peat goes elsewhere RT @Alexi_G: @ThaRinger Agholor for Peat? USC is feeling good about Peat","ThaRinger","EN",0,0,"no url","2011-07-10 00:12:20"
"89873021145321472","Take the pizza, leave the cannoli http://pegd.at/100t36ddv @ Gioia Pizzeria (1586 Hopkins Street - Berkeley, CA)","serkes","EN",0,0,"no url","2011-07-10 01:46:12"
"89986088021663745","Stolen porcelain back on display at Berkeley Castle: Two pieces of antique porcelain are to be put back on displ... http://bit.ly/rt1SYK","Limoges_Pottery","EN",0,1,"no url","2011-07-10 09:15:29"
"90089921217441792","WOW! @villaumbrosia, you rock guy! Wish I could be there :-) RT @edithyeung: Excited to speaking @Berkeley on July 25 for @netday_sv","patriciaaraque","EN",0,0,"no url","2011-07-10 16:08:05"
"90108325798215680","Dan Plonsey's New Monsters playing in Berkeley this Wed., featuring our own Steve Horowitz on bass... http://fb.me/19rZB2BCn","sensitivemag","EN",0,0,"no url","2011-07-10 17:21:13"
"90126436798709761","@liverach HAHA you still have to email MEEE with all this ""new husband"" info ehem! jk, jk. haha i am happy, full of berkeley love now.","lolol_tara","EN",0,0,"no url","2011-07-10 18:33:11"
"90147810984468480","I'm at The Back Bay Hotel (350 Stuart St, at Berkeley St, Boston) http://4sq.com/roqyw8","carlosmelia","EN",0,0,"no url","2011-07-10 19:58:07"
"90183861035732992","Frontier to Frontier on the freeway - m4w (berkeley): I form was coming  from Tahoe and met you after Sa... http://bit.ly/pWiNTC #misdme","SFM4W","EN",0,0,"no url","2011-07-10 22:21:22"
"90241701976879104","i blame it the model broad with the Hollywood smile, stripper booty with a rack like wow... brain lik Berkeley","loveme_CP","EN",0,1,"no url","2011-07-11 02:11:13"
"90446093388742656","@Portisheadinfo playing the Greek (Berkeley) on Fri, 10/21.  Hell yes!  http://t.co/tsghe0s","tommygunnsf","EN",0,0,"no url","2011-07-11 15:43:23"
"90483908948402176","Wow-- serious stats from UC Berkeley on black unemployment (pdf):  bit.ly/pmmzI7 Thanks to @NAACPecon  for pointing it out.","mrandolphdc","EN",1,0,"no url","2011-07-11 18:13:39"
"90487180513906688","Awesome tower #ucb #california #berkeley #university http://instagr.am/p/Hc3xj/","lucas_salcedo","EN",0,0,"no url","2011-07-11 18:26:39"
"90579153228795904","Now making appointments for the UC Berkeley rep visit on 7/19/11.","octransfer","EN",0,0,"no url","2011-07-12 00:32:07"
"90602079273492482","Police arrest suspect wanted in weekend abduction in Berkeley County http://bit.ly/qxv8JB #chsnews","News4Producer","EN",0,0,"no url","2011-07-12 02:03:13"
"90607431197007873","A Tin Djinn has a show coming up on 07/13/2011 at 08:00 PM @ Berkeley Cafe in Raleigh, NC http://soc.li/qJOoT5N","atindjinn","EN",0,0,"no url","2011-07-12 02:24:29"
"90840445747347456","Started a new, upscale home site located in the community of Berkeley Heights, #NJ.http://t.co/j5YMRgk","NJEstates1","EN",0,0,"no url","2011-07-12 17:50:24"
"90925011325558784","@HyphyMamaAlex yesh. I will mission to Berkeley :)","lil_krispy93","EN",0,0,"no url","2011-07-12 23:26:26"
"90932594614616064","The Berkeley Wire: 07.12.11... http://berkeleyside.com/?p=44826","berkeleyside","EN",0,0,"no url","2011-07-12 23:56:34"
"91084542353481728","UC Berkeley student senator arrested in immigration rally: By Matt O'Brien A UC Berkeley student... http://bit.ly/oXNFh5 #tcot #tlot #p2","TennTina","EN",0,1,"no url","2011-07-13 10:00:21"
"91141101859250176","Today in 1677, Sir William Berkeley is buried at Twickenham, Middlesex, England. http://bit.ly/9ajiBi","TodayInVa","EN",0,0,"no url","2011-07-13 13:45:06"
"91164053107519488","City Of Berkeley Housing Inspection Part 2 http://dlvr.it/b2drb","Bowldh","EN",0,0,"no url","2011-07-13 15:16:18"
"91184185020121088","Oh no..don't blame Lil B on the Bay. He's from Berkeley..I cant vouch for them.","SimplyCecilia","EN",0,1,"no url","2011-07-13 16:36:18"
"91184598796603392","Correx: Baby Boom philosopher Theodore Roszak, who named the ""counterculture,"" dies in Berkeley [via @shambhalasun] http://t.co/1XwTPc3","stevesilberman","EN",0,4,"no url","2011-07-13 16:37:57"
"91184684888895489","Going to explore Berkeley, Ca! #lovesummer","Claudia_doesPR","EN",0,0,"no url","2011-07-13 16:38:17"
"91186391945457664","UC Berkeley and CPV Consortium Release Study on Environmental Impact of Concentrator Photovoltaic Technology http://dlvr.it/b36xf","BW_Education","EN",0,0,"no url","2011-07-13 16:45:04"
"91221808644239360","@Djdsharp @ twitter been trippin...good looks on bumping tribe them brl movie starts on berkeley friday.","philthydrummond","EN",0,0,"no url","2011-07-13 19:05:48"
"91225109586657281","The storm that prompted the Severe Thunderstorm Warning in Berkeley County has weakend but another very strong... http://fb.me/RYfBX1HP","StormTeam2WCBD","EN",0,0,"no url","2011-07-13 19:18:55"
"91226826004893697","US RELEASE UPDATE (4):  Aug 19 (cont): The Embarcadero in San Fran, the Shattuck in Berkeley, The Angelika in Dallas....","SENNAmovie","EN",3,13,"no url","2011-07-13 19:25:44"
"91262917026127872","UC Berkeley student senator released after arrest at immigration rally: A UC Berkeley student senator and six ot... http://bit.ly/o5zAcV","myoaklandhomes","EN",0,0,"no url","2011-07-13 21:49:09"
"91266004025479168","We use 2 b REAL ROUTY all Thru #TheTown  #EASTOakland #WestOakland #NorthOakland even thru #Berkeley then cross that Bridge 2 #TheCity ! &lt;3","TrinaBaby_","EN",0,0,"no url","2011-07-13 22:01:25"
"91301232014139392","Berkeley Lab preps 100 Gbps prototype network • The Register: http://t.co/caiMbgt","ESnetUpdates","EN",0,0,"no url","2011-07-14 00:21:24"
"91307477307633664","New blog post : UC Berkeley and CPV Consortium Release Study on Environmental Impact of Concentrator Photovoltaic Technology http://bit.ly/n","dianafrank57","EN",0,0,"no url","2011-07-14 00:46:13"
"91542626796453888","Power lift chair recliner store near berkeley california manual wheel chair, barber chair theo-a-kochs, west elm... http://bit.ly/rdEVgh","jeromesteve82","EN",0,0,"no url","2011-07-14 16:20:37"
"91544195445174273","Luxury New Homes Started/ Starting Construction 2011 Warren, Watchung, Berkeley Hts, NJ  http://t.co/EdfJBGw","NJEstates4","EN",0,0,"no url","2011-07-14 16:26:51"
"91596687172313089","""it tastes like real, real, real vegetables!"" support the Berkeley Youth Alternatives Garden Program | http://t.co/DHgfMRS #foodjustice","vanlenning","EN",0,0,"no url","2011-07-14 19:55:26"
"91619231560503296","New at the Berkeley Blog: So much for #California’s anti-sprawl law, continued http://bit.ly/np1ngQ #SB375","UCBerkeley","EN",0,0,"no url","2011-07-14 21:25:01"
"91620124951457792","I just became the mayor of Pepe's Pizza Buffet Berkeley on @foursquare! http://4sq.com/l92Pjq","Fonziie","EN",0,0,"no url","2011-07-14 21:28:34"
"91632259077115904","@cleesf Thanks for the #SFAMA support. I am going to look at a house in Berkeley tonight. We may be neighbors -- woo hoo","GoldenAshby","EN",0,0,"no url","2011-07-14 22:16:47"
"91678569448734720","Theodore Roszak Dead: Scholar Of 1960s Counterculture Dies At 77: BERKELEY, Calif. -- Theodore Roszak, the auth... http://huff.to/pRm8nY","LittaBird","EN",0,1,"no url","2011-07-15 01:20:48"
"91756884427677696","Scientific Approaches to Consciousness video lectures by UC Berkeley: ... http://bit.ly/rkQ5zt #OnlineCourses","video_lectures","ES",0,0,"no url","2011-07-15 06:32:00"
"91875042161467392","Went to cheer Cedric & Marg on in the choir. They sand A Nightingale Sang in Berkeley Square which made me think of @steveread","linerlovers","EN",0,0,"no url","2011-07-15 14:21:31"
"92082941219446784","Chancellor's Professor of Public Policy, University of California at Berkeley; Author, 'Aftershock'","AudryGranstaffT","EN",0,0,"no url","2011-07-16 04:07:38"
"92185835251826688","A 3.4 magnitude earthquake occurred 1.24 mi ESE of Berkeley, CA. Details: http://eqbot.com/WHm Map: http://eqbot.com/W2B","earthquakesSF","EN",8,41,"no url","2011-07-16 10:56:30"
"92188956434763776","RT @pdxsays: RT @feedia: “@hrheingold: August 29-31 Berkeley, International Synthetic Biology Workshop http://t.co/nbCf09S” cc @caseorganic","Socrates_Logos","EN",0,1,"no url","2011-07-16 11:08:54"
"92192731014766592","Did you feel it? A preliminary 3.4 earthquake struck at 3:51 a.m. in Berkeley, near the UC Berkeley campus.","abc7newsBayArea","EN",3,28,"no url","2011-07-16 11:23:54"
"92256803072647168","Magnitude 3.3 quake hits Berkeley early Saturday morning... http://berkeleyside.com/?p=45295","berkeleyside","EN",0,6,"no url","2011-07-16 15:38:30"
"92270460175257600","Gonna scour Berkeley today for survivors of last night's earthquake. Get a support group started. We shouldn't have to go thru this alone.","danasitar","EN",0,0,"no url","2011-07-16 16:32:46"
"92299618964078592","I'm at Lawrence Hall of Science (1 Centennial Dr, at UC Berkeley, Berkeley) w/ 2 others http://4sq.com/nMvHmL","RoArgento","EN",0,0,"no url","2011-07-16 18:28:38"
"92322528231563264","Seat of Power  @ Berkeley City Hall http://instagr.am/p/HzvKw/","davidescalante","EN",0,0,"no url","2011-07-16 19:59:40"
"92376878052147200","There's a comic book shop in Berkeley that gives ""long, dark tunnel"" a whole new meaning.","CaseyBrienza","EN",0,0,"no url","2011-07-16 23:35:38"
"92394917745270786","Really want ramen now. Berkeley, why are your ramen offerings so meager/mediocre?","debaoki","EN",0,0,"no url","2011-07-17 00:47:19"
"92476257865965568","@berkeley_eagle Yer I know. It's rivalry round in the #NRL, however it's the rivalry not between the teams, but between the fans and refs","azsportza","EN",0,0,"no url","2011-07-17 06:10:32"
"92541013742202880","Department of Architecture - UC Berkeley - Welcome to the ...: http://bit.ly/nNhWBc #architecture","omphteliba","EN",0,0,"no url","2011-07-17 10:27:51"
"92554758493192193","I favorited a @YouTube video http://youtu.be/WcM0ruq28dc?a Berkeley Bionics: Introducing eLEGS","lucio_ashihara","EN",0,0,"no url","2011-07-17 11:22:28"
"92602787430547456","Date night! #roughlifeinap @ Dauphin Grille at the Berkeley http://instagr.am/p/H4C6H/","shanesieg","EN",0,0,"no url","2011-07-17 14:33:19"
"92632327930388480","Enviously checking next week's forecast for Berkeley, CA, where wife & I used to live: high 60s (vs. low 100s for DC).","thinking_reed","EN",0,0,"no url","2011-07-17 16:30:42"
